"","CollectionSite","DataUpload?(Initial)","ProcessedBy","DatePlanted","PlanterType","CollectionDate","Species","TagID","Condition","Mass(g)","Width(mm)","totallength(cm)","plumulelength(cm)","hypocotyllength(cm)","HypocotylColor","Roots(Y/N)","Float(Y/N)","NOTES","PartofSomething(C=CommunityEvent,N=nothing,E=experiment,MIC=mangrovesintheclassroomorstormstrongplant)","PlantName","CollectionDateParsed","CollectionYear","CollectionMonth","CollectionDay","Island","Lat","Long"
"1","Altona Lagoon","DIRECT UPLOAD","AJH","7/20/2023","3""TP","07/12/2023","RHMA","4307","H",19.57,"11.6","29","1.4","27.6","G","Y","N",NA,"N",NA,2023-07-12,"2023","07","12","St. Croix",17.751485,-64.680133
"2","Altona Lagoon","DIRECT UPLOAD","AJH","7/20/2023","3""TP","07/12/2023","RHMA","4310","H",20.68,"12.1","27.3","1.3","26","G","Y","N",NA,"N",NA,2023-07-12,"2023","07","12","St. Croix",17.751485,-64.680133
"3","Altona Lagoon","DIRECT UPLOAD","AJH","7/20/2023","3""TP","07/12/2023","RHMA","4311","H",21.55,"11.8","28.7","1.4","27.3","B","Y","N",NA,"N",NA,2023-07-12,"2023","07","12","St. Croix",17.751485,-64.680133
"4","Altona Lagoon","DIRECT INPUT","KH/AD",NA,"3"" TP","02/22/2023","RHMA","3470","H",29.04,"11.3","34.7","0.2","34.5","G","Y","N","PLUM CURVED, 1 LEAF DEVELOPED","N",NA,2023-02-22,"2023","02","22","St. Croix",17.751485,-64.680133
"5","Altona Lagoon","DIRECT UPLOAD","AJH","7/20/2023","3""TP","07/12/2023","RHMA","4308","H",15.8,"11.8","22.9","1.5","21.4","G","Y","N",NA,"N",NA,2023-07-12,"2023","07","12","St. Croix",17.751485,-64.680133
"6","Altona Lagoon","DIRECT INPUT","KH/AD",NA,"3"" TP","02/22/2023","RHMA","3510","H",10.49,"8.8","21.7","1.4","20.3","G","N","N","PLUM BLACK","N",NA,2023-02-22,"2023","02","22","St. Croix",17.751485,-64.680133
"7","Altona Lagoon","DIRECT INPUT","KH/AD",NA,"3"" TP","02/22/2023","RHMA","3469","H",13.78,"10.3","20.4","1.2","19.2","G","Y","Y",NA,"N",NA,2023-02-22,"2023","02","22","St. Croix",17.751485,-64.680133
"8","Altona Lagoon","DIRECT UPLOAD","AJH","7/20/2023","3""TP","07/12/2023","RHMA","4309","H",20.26,"10.4","33.4","1.2","32.2","G","Y","N",NA,"N",NA,2023-07-12,"2023","07","12","St. Croix",17.751485,-64.680133
"9","Altona Lagoon","DIRECT UPLOAD","AJH","7/20/2023","3""TP","07/12/2023","RHMA","4306","H",18.53,"12.1","26.5","1","25.5","G","Y","N",NA,"N",NA,2023-07-12,"2023","07","12","St. Croix",17.751485,-64.680133
"10","Altona Lagoon","DIRECT UPLOAD","KH, DG","7/21/2023","3"" TP","07/12/2023","RHMA","4344","H",18.17,"12.5","24.9","1.2","23.7","G","Y","Y",NA,"N",NA,2023-07-12,"2023","07","12","St. Croix",17.751485,-64.680133
"11","Altona Lagoon","DIRECT UPLOAD","KH, DG","7/21/2023","3"" TP","07/12/2023","RHMA","4347","H",6.08,"8.7","16.6","1.3","15.3","G","Y","N",NA,"N",NA,2023-07-12,"2023","07","12","St. Croix",17.751485,-64.680133
"12","Altona Lagoon","DIRECT UPLOAD","AJH","7/20/2023","3""TP","07/12/2023","RHMA","4305","H",11.83,"9.3","22.5","1.4","21.1","G","Y","N","NICKS","N",NA,2023-07-12,"2023","07","12","St. Croix",17.751485,-64.680133
"13","Altona Lagoon","DIRECT INPUT","KH/AD",NA,"3"" TP","02/22/2023","RHMA","3472","H",25.6,"10.1","35.6","0.3","35.3","G","Y","N",NA,"N",NA,2023-02-22,"2023","02","22","St. Croix",17.751485,-64.680133
"14","Altona Lagoon","DIRECT INPUT","KH/AD",NA,"3"" TP","02/22/2023","RHMA","3473","H",15.73,"9.3","28.2","1.1","27.1","G","Y","N","PLUM BLACK","N",NA,2023-02-22,"2023","02","22","St. Croix",17.751485,-64.680133
"15","Altona Lagoon","DIRECT INPUT","KH/AD",NA,"3"" TP","02/22/2023","RHMA","3465","H",19.34,"11.3","27.3","1.4","25.9","G","Y","Y","ACCIDENTLY BROKE OFF PLUM","N",NA,2023-02-22,"2023","02","22","St. Croix",17.751485,-64.680133
"16","Altona Lagoon","DIRECT INPUT","KH/AD",NA,"3"" TP","02/22/2023","RHMA","3471","H",18.52,"11.4","27.8","0","27.8","G","N","N","PLUM DEAD","N",NA,2023-02-22,"2023","02","22","St. Croix",17.751485,-64.680133
"17","Altona Lagoon","DIRECT UPLOAD","AJH","7/20/2023","3""TP","07/12/2023","RHMA","4304","H",24.52,"11.6","30.4","1","29.4","G","Y","N",NA,"N",NA,2023-07-12,"2023","07","12","St. Croix",17.751485,-64.680133
"18","Altona Lagoon","DIRECT INPUT","KH/AD",NA,"3"" TP","02/22/2023","RHMA","3506","H",17.64,"1.6","21.4","1.2","20.2","G","N","N","PLUM BLACK","N",NA,2023-02-22,"2023","02","22","St. Croix",17.751485,-64.680133
"19","Altona Lagoon","DIRECT UPLOAD","KH, DG","7/21/2023","3"" TP","07/12/2023","RHMA","4346","H",6.39,"8.7","16.8","0.9","15.9","G","Y","N",NA,"N",NA,2023-07-12,"2023","07","12","St. Croix",17.751485,-64.680133
"20","Altona Lagoon","DIRECT INPUT","KH/AD",NA,"3"" TP","02/22/2023","RHMA","3466","H",16,"10.4","23.8","0","23.8","G","Y","Y","PLUM DEAD","N",NA,2023-02-22,"2023","02","22","St. Croix",17.751485,-64.680133
"21","Altona Lagoon","DIRECT INPUT","KH/AD",NA,"3"" TP","02/22/2023","RHMA","3468","H",19.78,"10.7","24.7","0.1","24.6","G","Y","Y",NA,"N",NA,2023-02-22,"2023","02","22","St. Croix",17.751485,-64.680133
"22","Altona Lagoon","DIRECT INPUT","KH/AD",NA,"3"" TP","02/22/2023","RHMA","3509","H",16.77,"11.2","22.1","0","22.1","G","N","N",NA,"N",NA,2023-02-22,"2023","02","22","St. Croix",17.751485,-64.680133
"23","Altona Lagoon","DIRECT INPUT","KH/AD",NA,"3"" TP","02/22/2023","RHMA","3489","H",15.86,"9.5","28.6","1.2","27.4","G","N","N","GREAT PROP!!!","N",NA,2023-02-22,"2023","02","22","St. Croix",17.751485,-64.680133
"24","Altona Lagoon","DIRECT INPUT","KH/AD",NA,"3"" TP","02/22/2023","RHMA","3487","H",13.96,"9.9","26.7","1.4","25.3","GB","N","N",NA,"N",NA,2023-02-22,"2023","02","22","St. Croix",17.751485,-64.680133
"25","Altona Lagoon","DIRECT UPLOAD","AJH","7/20/2023","3""TP","07/12/2023","RHMA","4312","H",18.43,"11.9","23.9","1.1","22.8","B","Y","N",NA,"N",NA,2023-07-12,"2023","07","12","St. Croix",17.751485,-64.680133
"26","Altona Lagoon","DIRECT INPUT","KH/AD",NA,"3"" TP","02/22/2023","RHMA","3488","H",11.39,"9.8","22.3","1.2","21.1","G","Y","N",NA,"N",NA,2023-02-22,"2023","02","22","St. Croix",17.751485,-64.680133
"27","Altona Lagoon","DIRECT INPUT","KH/AD",NA,"3"" TP","02/22/2023","RHMA","3505","H",13.6,"9.5","22.5","0","22.5","G","N","N","PLUM DEAD","N",NA,2023-02-22,"2023","02","22","St. Croix",17.751485,-64.680133
"28","Altona Lagoon","DIRECT INPUT","KH/AD",NA,"3"" TP","02/22/2023","RHMA","3494","H",5.47,"6.8","16.8","0.3","16.5","G","N","N","PLUM BLACK","N",NA,2023-02-22,"2023","02","22","St. Croix",17.751485,-64.680133
"29","Altona Lagoon","DIRECT INPUT","KH/AD",NA,"3"" TP","02/22/2023","RHMA","3495","H",19.81,"10.7","30.1","1.4","28.7","G","N","N",NA,"N",NA,2023-02-22,"2023","02","22","St. Croix",17.751485,-64.680133
"30","Altona Lagoon","DIRECT UPLOAD","AJH","7/20/2023","3""TP","07/12/2023","RHMA","4303","H",27.9,"11.5","37.1","1.8","35.3","G","Y","N",NA,"N",NA,2023-07-12,"2023","07","12","St. Croix",17.751485,-64.680133
"31","Altona Lagoon","DIRECT INPUT","KH/AD",NA,"3"" TP","02/22/2023","RHMA","3508","H",16.41,"10.7","23.4","0","23.4","B","N","N","PLUM BROKEN","N",NA,2023-02-22,"2023","02","22","St. Croix",17.751485,-64.680133
"32","Altona Lagoon","DIRECT INPUT","KH/AD",NA,"3"" TP","02/22/2023","RHMA","3482","H",21.84,"10.9","29.2","0.1","29.1","G","N","N",NA,"N",NA,2023-02-22,"2023","02","22","St. Croix",17.751485,-64.680133
"33","Altona Lagoon","DIRECT UPLOAD","KH, DG","7/21/2023","3"" TP","07/12/2023","RHMA","4345","H",16.71,"12.6","21.5","1.3","20.2","G","Y","Y",NA,"N",NA,2023-07-12,"2023","07","12","St. Croix",17.751485,-64.680133
"34","Altona Lagoon","DIRECT INPUT","KH/AD",NA,"3"" TP","02/22/2023","RHMA","3467","H",16.59,"10.4","25","0.1","24.9","G","Y","Y",NA,"N",NA,2023-02-22,"2023","02","22","St. Croix",17.751485,-64.680133
"35","Altona Lagoon","DIRECT UPLOAD","AJH","7/20/2023","3""TP","07/12/2023","RHMA","4298","H",24.51,"12.4","32.4","1.2","31.2","G","Y","N",NA,"N",NA,2023-07-12,"2023","07","12","St. Croix",17.751485,-64.680133
"36","Altona Lagoon","DIRECT UPLOAD","AJH","7/20/2023","3""TP","07/12/2023","RHMA","4299","H",13,"10.2","21.5","1.4","20.1","G","Y","N",NA,"N",NA,2023-07-12,"2023","07","12","St. Croix",17.751485,-64.680133
"37","Altona Lagoon","DIRECT INPUT","KH/AD",NA,"3"" TP","02/22/2023","RHMA","3490","H",10.08,"8.8","21.7","1.4","20.3","G","N","N",NA,"N",NA,2023-02-22,"2023","02","22","St. Croix",17.751485,-64.680133
"38","Altona Lagoon","DIRECT INPUT","KH/AD",NA,"3"" TP","02/22/2023","RHMA","3486","H",15,"10.2","25.6","1.4","24.2","G","Y","N",NA,"N",NA,2023-02-22,"2023","02","22","St. Croix",17.751485,-64.680133
"39","Altona Lagoon","DIRECT UPLOAD","AJH","7/20/2023","3""TP","07/12/2023","RHMA","4302","H",13.55,"9.6","26.1","1.1","25","G","Y","N",NA,"N",NA,2023-07-12,"2023","07","12","St. Croix",17.751485,-64.680133
"40","Altona Lagoon","DIRECT INPUT","KH/AD",NA,"3"" TP","02/22/2023","RHMA","3463","H",26.53,"11.7","33.2","0.7","32.5","G","Y","N",NA,"N",NA,2023-02-22,"2023","02","22","St. Croix",17.751485,-64.680133
"41","Altona Lagoon","DIRECT INPUT","KH/AD",NA,"3"" TP","02/22/2023","RHMA","3464","H",19.79,"11.5","23","0","23","G","Y","Y","PLUM BROKEN OFF, LIITTLE HERB","N",NA,2023-02-22,"2023","02","22","St. Croix",17.751485,-64.680133
"42","Altona Lagoon","DIRECT INPUT","KH/AD",NA,"3"" TP","02/22/2023","RHMA","3479","H",15.54,"9","24.3","0","24.3","G","Y","N","PLUM BROKEN","N",NA,2023-02-22,"2023","02","22","St. Croix",17.751485,-64.680133
"43","Altona Lagoon","DIRECT INPUT","KH/AD",NA,"3"" TP","02/22/2023","RHMA","3480","H",15.33,"10.2","24.2","1","23.2","G","Y","N",NA,"N",NA,2023-02-22,"2023","02","22","St. Croix",17.751485,-64.680133
"44","Altona Lagoon","DIRECT INPUT","KH/AD",NA,"3"" TP","02/22/2023","RHMA","3507","H",10.85,"10","17.1","0","17.1","G","N","Y","PLUM BROKEN","N",NA,2023-02-22,"2023","02","22","St. Croix",17.751485,-64.680133
"45","Altona Lagoon","DIRECT INPUT","KH/AD",NA,"3"" TP","02/22/2023","RHMA","3497","H",9.48,"9.2","16.4","1","15.4","G","N","Y",NA,"N",NA,2023-02-22,"2023","02","22","St. Croix",17.751485,-64.680133
"46","Altona Lagoon","DIRECT INPUT","KH/AD",NA,"3"" TP","02/22/2023","RHMA","3485","H",23.68,"12.4","27.2","0.7","26.5","G","Y","N","1 LEAF DEVELOPED","N",NA,2023-02-22,"2023","02","22","St. Croix",17.751485,-64.680133
"47","Altona Lagoon","DIRECT INPUT","KH/AD",NA,"3"" TP","02/22/2023","RHMA","3484","H",14.19,"9.5","25.2","0.7","24.5","G","N","N",NA,"N",NA,2023-02-22,"2023","02","22","St. Croix",17.751485,-64.680133
"48","Altona Lagoon","DIRECT UPLOAD","AJH","7/20/2023","3""TP","07/12/2023","RHMA","4297","H",6.63,"9.2","17.4","1","16.4","G","Y","Y",NA,"N",NA,2023-07-12,"2023","07","12","St. Croix",17.751485,-64.680133
"49","Altona Lagoon","DIRECT INPUT","KH/AD",NA,"3"" TP","02/22/2023","RHMA","3458","H",19.84,"11.4","25.9","1.4","24.5","G","N","N",NA,"N",NA,2023-02-22,"2023","02","22","St. Croix",17.751485,-64.680133
"50","Altona Lagoon","DIRECT INPUT","KH/AD",NA,"3"" TP","02/22/2023","RHMA","3474","H",23.84,"10.7","31","1.5","29.5","G","N","N",NA,"N",NA,2023-02-22,"2023","02","22","St. Croix",17.751485,-64.680133
"51","Altona Lagoon","DIRECT INPUT","KH/AD",NA,"3"" TP","02/22/2023","RHMA","3491","H",14.2,"10.9","21.7","0.8","20.9","G","N","N","PLUM BLACK","N",NA,2023-02-22,"2023","02","22","St. Croix",17.751485,-64.680133
"52","Altona Lagoon","DIRECT INPUT","KH/AD",NA,"3"" TP","02/22/2023","RHMA","3476","H",6.66,"8.7","17.1","1","16.1","G","N","N",NA,"N",NA,2023-02-22,"2023","02","22","St. Croix",17.751485,-64.680133
"53","Altona Lagoon","DIRECT INPUT","KH/AD",NA,"3"" TP","02/22/2023","RHMA","3477","H",13.09,"9.3","21.6","0","21.6","G","Y","N","PLUM DEAD","N",NA,2023-02-22,"2023","02","22","St. Croix",17.751485,-64.680133
"54","Altona Lagoon","DIRECT INPUT","KH/AD",NA,"3"" TP","02/22/2023","RHMA","3478","H",30.25,"12.5","33.9","0.7","33.2","GB","N","N",NA,"N",NA,2023-02-22,"2023","02","22","St. Croix",17.751485,-64.680133
"55","Altona Lagoon","DIRECT INPUT","KH/AD",NA,"3"" TP","02/22/2023","RHMA","3493","H",5.47,"7","17.6","0.2","17.4","G","N","N","PLUM BLACK","N",NA,2023-02-22,"2023","02","22","St. Croix",17.751485,-64.680133
"56","Altona Lagoon","KH, DG","KH, DG","7/27/2023","3"" TP","07/12/2023","RHMA","4353","H",17.87,"12","28.1","1.6","26.5","GB","Y","N",NA,"N",NA,2023-07-12,"2023","07","12","St. Croix",17.751485,-64.680133
"57","Altona Lagoon","DIRECT INPUT","KH/AD",NA,"3"" TP","02/22/2023","RHMA","3481","H",20.88,"12.7","22.2","1.6","20.6","G","Y","N","CURVED","N",NA,2023-02-22,"2023","02","22","St. Croix",17.751485,-64.680133
"58","Altona Lagoon","DIRECT INPUT","KH/AD",NA,"3"" TP","02/22/2023","RHMA","3499","P",16.88,"10.3","25.4","1.2","24.2","G","Y","N","HERB","N",NA,2023-02-22,"2023","02","22","St. Croix",17.751485,-64.680133
"59","Altona Lagoon","DIRECT INPUT","KH/AD",NA,"3"" TP","02/22/2023","RHMA","3483","H",23.43,"12.5","25.6","0.5","25.1","G","N","N","HERB","N",NA,2023-02-22,"2023","02","22","St. Croix",17.751485,-64.680133
"60","Altona Lagoon","DIRECT UPLOAD","AJH","7/20/2023","3""TP","07/12/2023","RHMA","4300","H",17.78,"10.7","30.6","1.3","29.3","G","Y","N",NA,"N",NA,2023-07-12,"2023","07","12","St. Croix",17.751485,-64.680133
"61","Altona Lagoon","DIRECT UPLOAD","AJH","7/20/2023","3""TP","07/12/2023","RHMA","4301","H",13.11,"10.3","23.5","1.5","22","G","Y","N",NA,"N",NA,2023-07-12,"2023","07","12","St. Croix",17.751485,-64.680133
"62","Altona Lagoon","DIRECT INPUT","KH/AD",NA,"3"" TP","02/22/2023","RHMA","3462","H",21.08,"10.3","29.2","0.5","28.7","G","Y","N",NA,"N",NA,2023-02-22,"2023","02","22","St. Croix",17.751485,-64.680133
"63","Altona Lagoon","DIRECT INPUT","KH/AD",NA,"3"" TP","02/22/2023","RHMA","3500","H",13.81,"10.5","24","0.1","23.9","G","N","Y",NA,"N",NA,2023-02-22,"2023","02","22","St. Croix",17.751485,-64.680133
"64","Altona Lagoon","DIRECT INPUT","KH/AD",NA,"3"" TP","02/22/2023","RHMA","3504","H",8.53,"8.8","17.8","1.3","16.5","G","N","N",NA,"N",NA,2023-02-22,"2023","02","22","St. Croix",17.751485,-64.680133
"65","Altona Lagoon","DIRECT INPUT","KH/AD",NA,"3"" TP","02/22/2023","RHMA","3459","H",18.53,"12","23.7","1.3","22.4","G","N","N",NA,"N",NA,2023-02-22,"2023","02","22","St. Croix",17.751485,-64.680133
"66","Altona Lagoon","DIRECT INPUT","KH/AD",NA,"3"" TP","02/22/2023","RHMA","3496","P",24.22,"12.3","26.1","0","26.1","G","N","N","HERB, PLUM DEAD","N",NA,2023-02-22,"2023","02","22","St. Croix",17.751485,-64.680133
"67","Altona Lagoon","DIRECT INPUT","KH/AD",NA,"3"" TP","02/22/2023","RHMA","3492","H",12,"9.9","19.3","0","19.3","G","Y","N","PLUM BROKEN","N",NA,2023-02-22,"2023","02","22","St. Croix",17.751485,-64.680133
"68","Altona Lagoon","DIRECT INPUT","KH/AD",NA,"3"" TP","02/22/2023","RHMA","3457","H",18.28,"10.3","30.4","1.8","28.6","G","N","N",NA,"N",NA,2023-02-22,"2023","02","22","St. Croix",17.751485,-64.680133
"69","Altona Lagoon","KH, DG","KH, DG","7/27/2023","3"" TP","07/12/2023","RHMA","4352","H",23.95,"13.3","27.7","1","26.7","GB","Y","N",NA,"N",NA,2023-07-12,"2023","07","12","St. Croix",17.751485,-64.680133
"70","Altona Lagoon","DIRECT INPUT","KH/AD",NA,"3"" TP","02/22/2023","RHMA","3475","H",27.6,"10","34.3","0.6","33.7","G","Y","N","PLUM BLACK","N",NA,2023-02-22,"2023","02","22","St. Croix",17.751485,-64.680133
"71","Altona Lagoon","DIRECT INPUT","KH/AD",NA,"3"" TP","02/22/2023","RHMA","3498","H",12.32,"9.9","22.1","1.4","20.7","GB","Y","N",NA,"N",NA,2023-02-22,"2023","02","22","St. Croix",17.751485,-64.680133
"72","Altona Lagoon","DIRECT INPUT","KH/AD",NA,"3"" TP","02/22/2023","RHMA","3503","H",25.48,"12","25.8","0.8","25","G","N","N","CURVED","N",NA,2023-02-22,"2023","02","22","St. Croix",17.751485,-64.680133
"73","Altona Lagoon","DIRECT INPUT","KH/AD",NA,"3"" TP","02/22/2023","RHMA","3456","H",11.25,"9.1","23.1","1.4","21.7","G","N","N",NA,"N",NA,2023-02-22,"2023","02","22","St. Croix",17.751485,-64.680133
"74","Altona Lagoon","DIRECT INPUT","KH/AD",NA,"3"" TP","02/22/2023","RHMA","3502","H",16.2,"10.5","26.7","1.4","25.3","GB","N","N",NA,"N",NA,2023-02-22,"2023","02","22","St. Croix",17.751485,-64.680133
"75","Altona Lagoon","KH, DG","KH, DG","7/27/2023","3"" TP","07/12/2023","RHMA","4350","H",11.58,"11","23.3","1.1","22.2","G","Y","N",NA,"N",NA,2023-07-12,"2023","07","12","St. Croix",17.751485,-64.680133
"76","Altona Lagoon","DIRECT INPUT","KH/AD",NA,"3"" TP","02/22/2023","RHMA","3461","H",24.48,"12","27.1","0.9","26.2","G","Y","N","2 NEW LEAVES","N",NA,2023-02-22,"2023","02","22","St. Croix",17.751485,-64.680133
"77","Altona Lagoon","KH, DG","KH, DG","7/27/2023","3"" TP","07/12/2023","RHMA","4351","H",11.3,"11","17.7","1.2","16.5","G","Y","N",NA,"N",NA,2023-07-12,"2023","07","12","St. Croix",17.751485,-64.680133
"78","Altona Lagoon","KH, DG","KH, DG","7/27/2023","3"" TP","07/12/2023","RHMA","4354","H",6.45,"9.2","14.7","0.8","13.9","G","N","N",NA,"N",NA,2023-07-12,"2023","07","12","St. Croix",17.751485,-64.680133
"79","Altona Lagoon","DIRECT INPUT","KH/AD",NA,"3"" TP","02/22/2023","RHMA","3460","H",15.57,"8.7","26","1.5","24.5","G","N","N",NA,"N",NA,2023-02-22,"2023","02","22","St. Croix",17.751485,-64.680133
"80","Altona Lagoon","DIRECT INPUT","KH/AD",NA,"3"" TP","02/22/2023","RHMA","3501","H",10,"9.7","20.2","0.3","19.9","G","Y","N",NA,"N",NA,2023-02-22,"2023","02","22","St. Croix",17.751485,-64.680133
"81","Annaberg Bay","DG","DG","5/19/2023","CC",NA,"RHMA","3761B","H",7.22,NA,NA,NA,"16",NA,NA,NA,"EARTH DAY COMMUNITY OUTREACH STJ","C","BELLE",NA,NA,NA,NA,"St. John",18.363707,-64.731214
"82","Annaberg Bay","AJH","LU, KH, LP","4/21/2023","CC",NA,"RHMA","3744B","H",13.48,NA,NA,NA,NA,NA,NA,NA,"EARTH DAY COMMUNITY OUTREACH STJ","C",NA,NA,NA,NA,NA,"St. John",18.363707,-64.731214
"83","Annaberg Bay","AJH","LU, KH, LP","4/21/2023","CC",NA,"RHMA","3750B","H",12.49,NA,NA,NA,NA,NA,NA,NA,"EARTH DAY COMMUNITY OUTREACH STJ","C",NA,NA,NA,NA,NA,"St. John",18.363707,-64.731214
"84","Annaberg Bay","DG","DG","5/20/2023","CC",NA,"RHMA","3763B","H",11.01,NA,NA,NA,"20.5",NA,NA,NA,"EARTH DAY COMMUNITY OUTREACH STJ","C","NOOR",NA,NA,NA,NA,"St. John",18.363707,-64.731214
"85","Annaberg Bay","AJH","LU, KH, LP","4/21/2023","CC",NA,"RHMA","3742B","H",13.33,NA,NA,NA,NA,NA,NA,NA,"EARTH DAY COMMUNITY OUTREACH STJ","C",NA,NA,NA,NA,NA,"St. John",18.363707,-64.731214
"86","Annaberg Bay","DG","DG","5/17/2023","CC",NA,"RHMA","3757B","H",10.42,NA,NA,NA,"23.3",NA,NA,NA,"EARTH DAY COMMUNITY OUTREACH STJ","C","MANGROVE",NA,NA,NA,NA,"St. John",18.363707,-64.731214
"87","Annaberg Bay","DG","DG","5/18/2023","CC",NA,"RHMA","3759B","H",9.66,NA,NA,NA,"20.5",NA,NA,NA,"EARTH DAY COMMUNITY OUTREACH STJ","C","BELLA",NA,NA,NA,NA,"St. John",18.363707,-64.731214
"88","Annaberg Bay","AJH","LU, KH, LP","4/21/2023","CC",NA,"RHMA","3748B","H",7.69,NA,NA,NA,NA,NA,NA,NA,"EARTH DAY COMMUNITY OUTREACH STJ","C",NA,NA,NA,NA,NA,"St. John",18.363707,-64.731214
"89","Annaberg Bay","DG","DG","5/21/2023","CC",NA,"RHMA","3765B","H",9,NA,NA,NA,"25",NA,NA,NA,"EARTH DAY COMMUNITY OUTREACH STJ","C","CHICKEN NUGGETS",NA,NA,NA,NA,"St. John",18.363707,-64.731214
"90","Annaberg Bay","DG","DG","5/22/2023","CC",NA,"RHMA","3767B","H",10.91,NA,NA,NA,"24.2",NA,NA,NA,"EARTH DAY COMMUNITY OUTREACH STJ","C","FELICIA",NA,NA,NA,NA,"St. John",18.363707,-64.731214
"91","Annaberg Bay","DG","DG","5/16/2023","CC",NA,"RHMA","3755B","H",11.05,NA,NA,NA,"21",NA,NA,NA,"EARTH DAY COMMUNITY OUTREACH STJ","C","ELLA",NA,NA,NA,NA,"St. John",18.363707,-64.731214
"92","Annaberg Bay","AND","JC","28/02/2023","CC","21/02/2023","RHMA","E2-77","H",12.45,"9.5","27","1.5","25.5","G","N",NA,NA,"MIC","Clapazz",2023-02-21,"2023","02","21","St. John",18.363707,-64.731214
"93","Annaberg Bay","AND",NA,"28/02/2023","CC","21/02/2023","RHMA","E2-64","H",11.06,"8.2","25","0","25","G","N",NA,NA,"MIC","EEZY P",2023-02-21,"2023","02","21","St. John",18.363707,-64.731214
"94","Annaberg Bay","AND",NA,"28/02/2023","CC","21/02/2023","RHMA","E2-67","H",26.48,"14.6","24","2.5","21.5","G","Y",NA,NA,"MIC","Yggdrasil",2023-02-21,"2023","02","21","St. John",18.363707,-64.731214
"95","Annaberg Bay","AJH","LU, KH, LP","4/21/2023","CC",NA,"RHMA","3746B","H",15.22,NA,NA,NA,NA,NA,NA,NA,"EARTH DAY COMMUNITY OUTREACH STJ","C",NA,NA,NA,NA,NA,"St. John",18.363707,-64.731214
"96","Annaberg Bay","AND","JD","28/02/2023","CC","21/02/2023","RHMA","E2-68","H",11.42,"11.1","27","2","25","G","N",NA,NA,"MIC","Morty",2023-02-21,"2023","02","21","St. John",18.363707,-64.731214
"97","Annaberg Bay","AND","KH","28/02/2023","CC","21/02/2023","RHMA","E2-40","H",25.3,"11.5","36","1","35","G","N",NA,NA,"MIC","Terry Flenory",2023-02-21,"2023","02","21","St. John",18.363707,-64.731214
"98","Annaberg Bay","AND",NA,"28/02/2023","CC","21/02/2023","RHMA","E2-65","H",8.27,"6","20","0","20","G","N",NA,NA,"MIC","Jalepeno",2023-02-21,"2023","02","21","St. John",18.363707,-64.731214
"99","Annaberg Bay","AND",NA,"28/02/2023","CC","21/02/2023","RHMA","E2-66","H",15.72,"9.7","24","0.5","23.5","B","Y",NA,NA,"MIC","Mighty Boots",2023-02-21,"2023","02","21","St. John",18.363707,-64.731214
"100","Annaberg Bay","DG","DG","5/24/2023","CC",NA,"RHMA","3771B","H",5.62,NA,NA,NA,"14.7","G",NA,NA,"EARTH DAY COMMUNITY OUTREACH STJ","C","TOBINYA",NA,NA,NA,NA,"St. John",18.363707,-64.731214
"101","Annaberg Bay","AND",NA,"28/02/2023","CC","21/02/2023","RHMA","E2-72","H",8.22,"7.7","13.6","1.6","12","B","Y",NA,NA,"MIC","Mandy",2023-02-21,"2023","02","21","St. John",18.363707,-64.731214
"102","Annaberg Bay","AND","JD","28/02/2023","CC","21/02/2023","RHMA","E2-69","H",11.69,"8.2","21","2","19","G","Y",NA,NA,"MIC","Rick",2023-02-21,"2023","02","21","St. John",18.363707,-64.731214
"103","Annaberg Bay","DG","DG","5/23/2023","CC",NA,"RHMA","3769B","H",7.05,NA,NA,NA,"16.2",NA,NA,NA,"EARTH DAY COMMUNITY OUTREACH STJ","C","JIMMY",NA,NA,NA,NA,"St. John",18.363707,-64.731214
"104","Annaberg Bay","DG","DG","5/15/2023","CC",NA,"RHMA","3753B","H",11.03,NA,NA,NA,"21",NA,NA,NA,"EARTH DAY COMMUNITY OUTREACH STJ","C","NATURE",NA,NA,NA,NA,"St. John",18.363707,-64.731214
"105","Annaberg Bay","DG","DG","5/14/2023","CC",NA,"RHMA","3751B","H",15.37,NA,NA,NA,"24",NA,NA,NA,"EARTH DAY COMMUNITY OUTREACH STJ","C","RAINBOW TOWN",NA,NA,NA,NA,"St. John",18.363707,-64.731214
"106","Annaberg Bay","DG","DG","4/21/2023","CC",NA,"RHMA","3689","H",23.61,NA,NA,NA,"23.8",NA,NA,NA,"EARTH DAY COMMUNITY OUTREACH STJ","C","DAISY",NA,NA,NA,NA,"St. John",18.363707,-64.731214
"107","Annaberg Bay","DG","DG","4/21/2023","CC",NA,"RHMA","3701","H",11.4,NA,NA,NA,"22.8",NA,NA,NA,"EARTH DAY COMMUNITY OUTREACH STJ","C","SMELTY",NA,NA,NA,NA,"St. John",18.363707,-64.731214
"108","Annaberg Bay","DG","DG","4/21/2023","CC",NA,"RHMA","3703","H",12.34,NA,NA,NA,"24",NA,NA,NA,"EARTH DAY COMMUNITY OUTREACH STJ","C","GLAM",NA,NA,NA,NA,"St. John",18.363707,-64.731214
"109","Annaberg Bay","DG","DG","4/21/2023","CC",NA,"RHMA","3733B","H",18.46,NA,NA,NA,"22",NA,NA,NA,"EARTH DAY COMMUNITY OUTREACH STJ","C","LILY",NA,NA,NA,NA,"St. John",18.363707,-64.731214
"110","Annaberg Bay","DG","DG","4/21/2023","CC",NA,"RHMA","3735B","H",16.09,NA,NA,NA,"27",NA,NA,NA,"EARTH DAY COMMUNITY OUTREACH STJ","C","HEAVEN",NA,NA,NA,NA,"St. John",18.363707,-64.731214
"111","Annaberg Bay","AND","SH","28/02/2023","CC","21/02/2023","RHMA","E2-81","H",21.3,"12","29.5","0","29.5","G","Y",NA,NA,"MIC","Lana",2023-02-21,"2023","02","21","St. John",18.363707,-64.731214
"112","Annaberg Bay","AND","JP","28/02/2023","CC","21/02/2023","RHMA","E2-70","H",17.69,"11.8","26","2","24","G","Y",NA,NA,"MIC","Khai",2023-02-21,"2023","02","21","St. John",18.363707,-64.731214
"113","Annaberg Bay","AND","JP","28/02/2023","CC","21/02/2023","RHMA","E2-71","H",17.39,"12.1","23","1","22","G","Y",NA,NA,"MIC","Jai",2023-02-21,"2023","02","21","St. John",18.363707,-64.731214
"114","Annaberg Bay","AND","JE","28/02/2023","CC","21/02/2023","RHMA","E2-1","H",19.61,"12.3","30","2","28","G","Y",NA,NA,"MIC","Bob",2023-02-21,"2023","02","21","St. John",18.363707,-64.731214
"115","Annaberg Bay","AND",NA,"28/02/2023","CC","21/02/2023","RHMA","E2-73","H",7.39,"6","15","0.5","14.5","G","N",NA,NA,"MIC","Max",2023-02-21,"2023","02","21","St. John",18.363707,-64.731214
"116","Annaberg Bay","AND","SB","28/02/2023","CC","21/02/2023","RHMA","E2-74","H",18.63,"11.2","31","2","29","G","N",NA,NA,"MIC","Indigo",2023-02-21,"2023","02","21","St. John",18.363707,-64.731214
"117","Annaberg Bay","AND","SB","28/02/2023","CC","21/02/2023","RHMA","E2-75","H",13.76,"10.45","27","0","27","G","Y",NA,NA,"MIC","Moon",2023-02-21,"2023","02","21","St. John",18.363707,-64.731214
"118","Annaberg Bay","AND","JC","28/02/2023","CC","21/02/2023","RHMA","E2-76","H",16.6,"11","27.5","2.5","25","G","Y",NA,NA,"MIC","Kiwi",2023-02-21,"2023","02","21","St. John",18.363707,-64.731214
"119","Annaberg Bay","DG","DG","5/13/2023","CC",NA,"RHMA","3749B","H",11,NA,NA,NA,"23",NA,NA,NA,"EARTH DAY COMMUNITY OUTREACH STJ","C","MAYLEEN",NA,NA,NA,NA,"St. John",18.363707,-64.731214
"120","Annaberg Bay","DG","DG","4/21/2023","CC",NA,"RHMA","3727B","H",14.55,NA,NA,NA,"31.4",NA,NA,NA,"EARTH DAY COMMUNITY OUTREACH STJ","C","CUTIE PIE",NA,NA,NA,NA,"St. John",18.363707,-64.731214
"121","Annaberg Bay","DG","DG","4/21/2023","CC",NA,"RHMA","3729B","H",5.62,NA,NA,NA,"15",NA,NA,NA,"EARTH DAY COMMUNITY OUTREACH STJ","C","TAZZ",NA,NA,NA,NA,"St. John",18.363707,-64.731214
"122","Annaberg Bay","DG","DG","4/21/2023","CC",NA,"RHMA","3731B","H",16.28,NA,NA,NA,"27",NA,NA,NA,"EARTH DAY COMMUNITY OUTREACH STJ","C","KAYLA",NA,NA,NA,NA,"St. John",18.363707,-64.731214
"123","Annaberg Bay","AND","NW","28/02/2023","CC","21/02/2023","RHMA","E2-23","H",13.29,"18.5","24.8","1.1","23.7","G","N",NA,NA,"MIC","Baldy",2023-02-21,"2023","02","21","St. John",18.363707,-64.731214
"124","Annaberg Bay","AND","NW","28/02/2023","CC","21/02/2023","RHMA","E2-24","H",17.61,"19.4","24","1.2","22.8","G","Y",NA,NA,"MIC","Dreads",2023-02-21,"2023","02","21","St. John",18.363707,-64.731214
"125","Annaberg Bay","DG","DG","4/21/2023","CC",NA,"RHMA","3737B","H",15.77,NA,NA,NA,"29.8",NA,NA,NA,"EARTH DAY COMMUNITY OUTREACH STJ","C","ISHA",NA,NA,NA,NA,"St. John",18.363707,-64.731214
"126","Annaberg Bay","AJH","LU, KH, LP","4/21/2023","CC",NA,"RHMA","3738B","H",8.5,NA,NA,NA,NA,NA,NA,NA,"EARTH DAY COMMUNITY OUTREACH STJ","C",NA,NA,NA,NA,NA,"St. John",18.363707,-64.731214
"127","Annaberg Bay","AJH","LU, KH, LP","4/21/2023","CC",NA,"RHMA","3740B","H",22.47,NA,NA,NA,NA,NA,NA,NA,"EARTH DAY COMMUNITY OUTREACH STJ","C",NA,NA,NA,NA,NA,"St. John",18.363707,-64.731214
"128","Annaberg Bay","AR","AR, EA","9/17/24","CC","9/13/2024","RHMA","6159","H",26.75,"12.2","42.7","1.9","41","G","N","N",NA,"N",NA,2024-09-13,"2024","09","13","St. John",18.363707,-64.731214
"129","Annaberg Bay","SA","MH,TB","9/17/24","CC","9/13/2024","RHMA","6160","H",20.34,"11.4","33.5","2","31.5","G","N","Y",NA,NA,NA,2024-09-13,"2024","09","13","St. John",18.363707,-64.731214
"130","Annaberg Bay","SA","MH,TB","9/17/24","CC","9/13/2024","RHMA","6161","H",31.26,"11.8","32.2","1.4","30.8","G","N","Y",NA,NA,NA,2024-09-13,"2024","09","13","St. John",18.363707,-64.731214
"131","Annaberg Bay","DG","DG","05/12/2023","CC",NA,"RHMA","3747B","H",7,NA,NA,NA,"16.9",NA,NA,NA,"EARTH DAY COMMUNITY OUTREACH STJ","C","BOB",NA,NA,NA,NA,"St. John",18.363707,-64.731214
"132","Annaberg Bay","SA","MH,TB","9/17/24","CC","9/13/2024","RHMA","6163","H",25.08,"13.1","36.5","1.5","35","G","N","N",NA,NA,NA,2024-09-13,"2024","09","13","St. John",18.363707,-64.731214
"133","Annaberg Bay","AJH","LU, KH, LP","4/21/2023","CC",NA,"RHMA","3752B","H",14.2,NA,NA,NA,NA,NA,NA,NA,"EARTH DAY COMMUNITY OUTREACH STJ","C",NA,NA,NA,NA,NA,"St. John",18.363707,-64.731214
"134","Annaberg Bay","AJH","LU, KH, LP","4/21/2023","CC",NA,"RHMA","3754B","H",18.09,NA,NA,NA,NA,NA,NA,NA,"EARTH DAY COMMUNITY OUTREACH STJ","C",NA,NA,NA,NA,NA,"St. John",18.363707,-64.731214
"135","Annaberg Bay","AND","MJ","28/02/2023","CC","21/02/2023","RHMA","E2-78","H",15.21,"10.4","28","0","28","G","N",NA,NA,"MIC","Leggo",2023-02-21,"2023","02","21","St. John",18.363707,-64.731214
"136","Annaberg Bay","AND","MJ","28/02/2023","CC","21/02/2023","RHMA","E2-79","H",16.03,"11.7","29.5","0.5","29","G","Y",NA,NA,"MIC","Deh Jakes",2023-02-21,"2023","02","21","St. John",18.363707,-64.731214
"137","Annaberg Bay","AND","SH","28/02/2023","CC","21/02/2023","RHMA","E2-80","H",16.49,"12.3","17.5","0","17.5","G","Y",NA,NA,"MIC","Rose",2023-02-21,"2023","02","21","St. John",18.363707,-64.731214
"138","Annaberg Bay","DG","DG","4/21/2023","CC",NA,"RHMA","3677B","H",19.7,NA,NA,NA,"33.1",NA,NA,NA,"EARTH DAY COMMUNITY OUTREACH STJ","C","DAMIEN",NA,NA,NA,NA,"St. John",18.363707,-64.731214
"139","Annaberg Bay","DG","DG","4/21/2023","CC",NA,"RHMA","3678B","H",11.06,NA,NA,NA,"24",NA,NA,NA,"EARTH DAY COMMUNITY OUTREACH STJ","C","ORANGE",NA,NA,NA,NA,"St. John",18.363707,-64.731214
"140","Annaberg Bay","DG","DG","4/21/2023","CC",NA,"RHMA","3679B","H",10.6,NA,NA,NA,"23",NA,NA,NA,"EARTH DAY COMMUNITY OUTREACH STJ","C","MANGO",NA,NA,NA,NA,"St. John",18.363707,-64.731214
"141","Annaberg Bay","DG","DG","4/21/2023","CC",NA,"RHMA","3680B","H",11,NA,NA,NA,"21",NA,NA,NA,"EARTH DAY COMMUNITY OUTREACH STJ","C","FRIENDS",NA,NA,NA,NA,"St. John",18.363707,-64.731214
"142","Annaberg Bay","AND","JE","28/02/2023","CC","21/02/2023","RHMA","E2-2","H",10.8,"12.3","15","1","14","G","Y",NA,NA,"MIC","Jen",2023-02-21,"2023","02","21","St. John",18.363707,-64.731214
"143","Annaberg Bay","AND","ML","28/02/2023","CC","21/02/2023","RHMA","E2-3","H",9.83,"10","22.1","1.1","21","G","N",NA,NA,"MIC","JJ",2023-02-21,"2023","02","21","St. John",18.363707,-64.731214
"144","Annaberg Bay","SA","MH,TB","9/17/24","CC","9/13/2024","RHMA","6162","H",16.91,"11.2","29.5","1.5","28","G","N","Y",NA,NA,NA,2024-09-13,"2024","09","13","St. John",18.363707,-64.731214
"145","Annaberg Bay","AND","LA","28/02/2023","CC","21/02/2023","RHMA","E2-5","H",18.13,"11.1","31","1","30","G","N",NA,NA,"MIC","Haley",2023-02-21,"2023","02","21","St. John",18.363707,-64.731214
"146","Annaberg Bay","AND","LA","28/02/2023","CC","21/02/2023","RHMA","E2-6","H",15.54,"12","25","1","24","G","Y",NA,NA,"MIC","Patricia",2023-02-21,"2023","02","21","St. John",18.363707,-64.731214
"147","Annaberg Bay","AND","AM","28/02/2023","CC","21/02/2023","RHMA","E2-7","H",14,"10.3","29.5","0.5","29","G","Y",NA,NA,"MIC","Chico",2023-02-21,"2023","02","21","St. John",18.363707,-64.731214
"148","Annaberg Bay","AND","AM","28/02/2023","CC","21/02/2023","RHMA","E2-8","H",20.07,"10.8","35","1","34","G","Y",NA,NA,"MIC","Paco",2023-02-21,"2023","02","21","St. John",18.363707,-64.731214
"149","Annaberg Bay","DG","DG","05/03/2023","CC",NA,"RHMA","3797B","H",7.81,NA,NA,NA,"20.2",NA,NA,NA,"EARTH DAY COMMUNITY OUTREACH STJ","C","BOB THE 2ND",NA,NA,NA,NA,"St. John",18.363707,-64.731214
"150","Annaberg Bay","0","DG","05/04/2023","CC",NA,"RHMA","3799B","H",5.31,NA,NA,NA,"15.7",NA,NA,NA,"EARTH DAY COMMUNITY OUTREACH STJ","C","BOB THE 2ND",NA,NA,NA,NA,"St. John",18.363707,-64.731214
"151","Annaberg Bay","DG","DG","05/05/2023","CC",NA,"RHMA","3801B","H",5.42,NA,NA,NA,"18.3",NA,NA,NA,"EARTH DAY COMMUNITY OUTREACH STJ","C","BOB THE 2ND",NA,NA,NA,NA,"St. John",18.363707,-64.731214
"152","Annaberg Bay","DG","DG","05/06/2023","CC",NA,"RHMA","3803B","H",6,NA,NA,NA,"15.3",NA,NA,NA,"EARTH DAY COMMUNITY OUTREACH STJ","C","BOB THE 2ND",NA,NA,NA,NA,"St. John",18.363707,-64.731214
"153","Annaberg Bay","DG","DG","05/07/2023","CC",NA,"RHMA","3805B","H",6.2,NA,NA,NA,"17",NA,NA,NA,"EARTH DAY COMMUNITY OUTREACH STJ","C","BOB THE 2ND",NA,NA,NA,NA,"St. John",18.363707,-64.731214
"154","Annaberg Bay","DG","DG","05/08/2023","CC",NA,"RHMA","3739B","H",17.78,NA,NA,NA,"26.3",NA,NA,NA,"EARTH DAY COMMUNITY OUTREACH STJ","C","BUDDY",NA,NA,NA,NA,"St. John",18.363707,-64.731214
"155","Annaberg Bay","DG","DG","05/09/2023","CC",NA,"RHMA","3741B","H",8,NA,NA,NA,"15.8",NA,NA,NA,"EARTH DAY COMMUNITY OUTREACH STJ","C","JEFF",NA,NA,NA,NA,"St. John",18.363707,-64.731214
"156","Annaberg Bay","DG","DG","05/10/2023","CC",NA,"RHMA","3743B","H",15.08,NA,NA,NA,"28.6",NA,NA,NA,"EARTH DAY COMMUNITY OUTREACH STJ","C","CHACKRE",NA,NA,NA,NA,"St. John",18.363707,-64.731214
"157","Annaberg Bay","DG","DG","05/11/2023","CC",NA,"RHMA","3745B","H",15.34,NA,NA,NA,"26",NA,NA,NA,"EARTH DAY COMMUNITY OUTREACH STJ","C","WILFRED",NA,NA,NA,NA,"St. John",18.363707,-64.731214
"158","Annaberg Bay","AND","JB","28/02/2023","CC","21/02/2023","RHMA","E2-18","H",26,"12.7","27.5","1.3","26.2","G","Y",NA,NA,"MIC","Sugar Plum",2023-02-21,"2023","02","21","St. John",18.363707,-64.731214
"159","Annaberg Bay","AND","DV","28/02/2023","CC","21/02/2023","RHMA","E2-19","H",21.77,"12.9","29.4","1.4","28","G","Y",NA,NA,"MIC","Bad",2023-02-21,"2023","02","21","St. John",18.363707,-64.731214
"160","Annaberg Bay","AND","DV","28/02/2023","CC","21/02/2023","RHMA","E2-20","H",22.45,"11.1","30.6","0","30.6","G","Y",NA,NA,"MIC","Good",2023-02-21,"2023","02","21","St. John",18.363707,-64.731214
"161","Annaberg Bay","AND","SKA","28/02/2023","CC","21/02/2023","RHMA","E2-21","H",16.62,"11.1","27","1.2","25.8","G","N",NA,NA,"MIC","Bluely",2023-02-21,"2023","02","21","St. John",18.363707,-64.731214
"162","Annaberg Bay","AND","SKA","28/02/2023","CC","21/02/2023","RHMA","E2-22","H",17.67,"9","25.7","1.2","24.5","G","N",NA,NA,"MIC","Strawberry",2023-02-21,"2023","02","21","St. John",18.363707,-64.731214
"163","Annaberg Bay","AND",NA,"28/02/2023","CC","21/02/2023","RHMA","E2-63","H",13.56,"8.1","27","1","26","G","Y",NA,NA,"MIC","Raga Man",2023-02-21,"2023","02","21","St. John",18.363707,-64.731214
"164","Annaberg Bay",NA,"TT, DN","10/09/2024","CC","9/13/2024","RHMA","6395","H",18.34,"11","35.1","3.1","32","G","Y","N",NA,NA,NA,2024-09-13,"2024","09","13","St. John",18.363707,-64.731214
"165","Annaberg Bay","AND","NG","28/02/2023","CC","21/02/2023","RHMA","E2-25","H",16.85,"10.8","20.5","1.5","19","G","N",NA,NA,"MIC","Georgie",2023-02-21,"2023","02","21","St. John",18.363707,-64.731214
"166","Annaberg Bay","AND","NG","28/02/2023","CC","21/02/2023","RHMA","E2-26","H",9.77,"10.4","20","1.5","18.5","G","N",NA,NA,"MIC","Mavis",2023-02-21,"2023","02","21","St. John",18.363707,-64.731214
"167","Annaberg Bay","AND","MY","28/02/2023","CC","21/02/2023","RHMA","E2-27","H",24.58,"12.9","32.5","1.5","31","G","Y",NA,NA,"MIC","Franchesha",2023-02-21,"2023","02","21","St. John",18.363707,-64.731214
"168","Annaberg Bay","AND","MY","28/02/2023","CC","21/02/2023","RHMA","E2-28","H",14.44,"9.3","31.5","1.2","30.3","G","Y",NA,NA,"MIC","Natasha",2023-02-21,"2023","02","21","St. John",18.363707,-64.731214
"169","Annaberg Bay","AND","JE","28/02/2023","CC","21/02/2023","RHMA","E2-29","H",16.62,"11.3","32.5","1.5","31","G","Y",NA,NA,"MIC","England",2023-02-21,"2023","02","21","St. John",18.363707,-64.731214
"170","Annaberg Bay","AND","JE","28/02/2023","CC","21/02/2023","RHMA","E2-30","H",20.27,"11.9","28.5","1","27.5","G","Y",NA,NA,"MIC","London",2023-02-21,"2023","02","21","St. John",18.363707,-64.731214
"171","Annaberg Bay","AND","CO","28/02/2023","CC","21/02/2023","RHMA","E2-31","H",20.11,"10.9","32.5","2","30.5","G","Y",NA,NA,"MIC","Edward",2023-02-21,"2023","02","21","St. John",18.363707,-64.731214
"172","Annaberg Bay","AND","CO","28/02/2023","CC","21/02/2023","RHMA","E2-32","H",13.79,"10.2","23.5","1","22.5","G","N",NA,NA,"MIC","Quandale Dingle III",2023-02-21,"2023","02","21","St. John",18.363707,-64.731214
"173","Annaberg Bay","AND","DR","28/02/2023","CC","21/02/2023","RHMA","E2-33","H",18.36,"11","28.5","0.5","28","G","Y",NA,NA,"MIC","Mango Man 2",2023-02-21,"2023","02","21","St. John",18.363707,-64.731214
"174","Annaberg Bay","AND","DR","28/02/2023","CC","21/02/2023","RHMA","E2-34","H",22.14,"11.7","30","0.5","29.5","G","Y",NA,NA,"MIC","Mango Man",2023-02-21,"2023","02","21","St. John",18.363707,-64.731214
"175","Annaberg Bay","AND","NR","28/02/2023","CC","21/02/2023","RHMA","E2-35","H",15.92,"10.3","25.5","2","23.5","G","Y",NA,NA,"MIC","Ukraine",2023-02-21,"2023","02","21","St. John",18.363707,-64.731214
"176","Annaberg Bay","AND","NR","28/02/2023","CC","21/02/2023","RHMA","E2-36","H",16.17,"10.1","31","1","30","G","Y",NA,NA,"MIC","Russia",2023-02-21,"2023","02","21","St. John",18.363707,-64.731214
"177","Annaberg Bay","DG","DG","4/21/2023","CC",NA,"RHMA","3676B","H",9.97,NA,NA,NA,"26.7",NA,NA,NA,"EARTH DAY COMMUNITY OUTREACH STJ","C","DANIEL",NA,NA,NA,NA,"St. John",18.363707,-64.731214
"178","Annaberg Bay","AJH","LU, KH, LP","4/21/2023","CC",NA,"RHMA","3760B","H",12.32,NA,NA,NA,NA,NA,NA,NA,"EARTH DAY COMMUNITY OUTREACH STJ","C",NA,NA,NA,NA,NA,"St. John",18.363707,-64.731214
"179","Annaberg Bay","AJH","LU, KH, LP","4/21/2023","CC",NA,"RHMA","3762B","H",20.7,NA,NA,NA,NA,NA,NA,NA,"EARTH DAY COMMUNITY OUTREACH STJ","C",NA,NA,NA,NA,NA,"St. John",18.363707,-64.731214
"180","Annaberg Bay","AND","CM","28/02/2023","CC","21/02/2023","RHMA","E2-82","H",14.95,"11.6","23.5","1.5","22","G","Y",NA,NA,"MIC","Jingle",2023-02-21,"2023","02","21","St. John",18.363707,-64.731214
"181","Annaberg Bay","AND","CM","28/02/2023","CC","21/02/2023","RHMA","E2-83","H",17.79,"12","28","0.5","27.5","G","Y",NA,NA,"MIC","Jam",2023-02-21,"2023","02","21","St. John",18.363707,-64.731214
"182","Annaberg Bay","AND","KSG","28/02/2023","CC","21/02/2023","RHMA","E2-84","H",18.56,"11","29.5","1","28.5","G","Y",NA,NA,"MIC","Clapsam",2023-02-21,"2023","02","21","St. John",18.363707,-64.731214
"183","Annaberg Bay","AND","KSG","28/02/2023","CC","21/02/2023","RHMA","E2-85","H",18.22,"12","24","0","24","G","Y",NA,NA,"MIC","Fat Cat",2023-02-21,"2023","02","21","St. John",18.363707,-64.731214
"184","Annaberg Bay","AND","ML","28/02/2023","CC","21/02/2023","RHMA","E2-4","H",25.85,"13.7","33.4","1","32.4","B","Y",NA,NA,"MIC","Kiara",2023-02-21,"2023","02","21","St. John",18.363707,-64.731214
"185","Annaberg Bay","DG","DG","4/26/2023","CC",NA,"RHMA","3783B","H",7.8,NA,NA,NA,"20.5",NA,NA,NA,"EARTH DAY COMMUNITY OUTREACH STJ","C","KITTY",NA,NA,NA,NA,"St. John",18.363707,-64.731214
"186","Annaberg Bay","DG","DG","4/27/2023","CC",NA,"RHMA","3785B","H",7.14,NA,NA,NA,"21.5",NA,NA,NA,"EARTH DAY COMMUNITY OUTREACH STJ","C","STREAM",NA,NA,NA,NA,"St. John",18.363707,-64.731214
"187","Annaberg Bay","DG","DG","4/28/2023","CC",NA,"RHMA","3787B","H",10.22,NA,NA,NA,"22.5",NA,NA,NA,"EARTH DAY COMMUNITY OUTREACH STJ","C","BOB",NA,NA,NA,NA,"St. John",18.363707,-64.731214
"188","Annaberg Bay","DG","DG","4/29/2023","CC",NA,"RHMA","3789B","H",7.7,NA,NA,NA,"18.7",NA,NA,NA,"EARTH DAY COMMUNITY OUTREACH STJ","C","BOB",NA,NA,NA,NA,"St. John",18.363707,-64.731214
"189","Annaberg Bay","AND","TM, JM, DH, DL","28/02/2023","CC","21/02/2023","RHMA","E2-9","H",16,"8","32","0.1","31.9","G","N",NA,NA,"MIC","Guy",2023-02-21,"2023","02","21","St. John",18.363707,-64.731214
"190","Annaberg Bay","AND","TM, JM, DH, DL","28/02/2023","CC","21/02/2023","RHMA","E2-10","H",23,"9","30","0.1","29.9","G","Y",NA,NA,"MIC","Duli",2023-02-21,"2023","02","21","St. John",18.363707,-64.731214
"191","Annaberg Bay","AND","TM, JM, DH, DL","28/02/2023","CC","21/02/2023","RHMA","E2-11","H",16.84,"11.5","32","4.4","27.6","G","Y",NA,NA,"MIC","Green dot",2023-02-21,"2023","02","21","St. John",18.363707,-64.731214
"192","Annaberg Bay","AND","TM, JM, DH, DL","28/02/2023","CC","21/02/2023","RHMA","E2-12","H",22.63,"12.4","31.5","1.2","30.3","G","N",NA,NA,"MIC","Snake",2023-02-21,"2023","02","21","St. John",18.363707,-64.731214
"193","Annaberg Bay","AND","TM, JM, DH, DL","28/02/2023","CC","21/02/2023","RHMA","E2-13","H",15,"11.7","31.2","4.2","27","G","N",NA,NA,"MIC","Beatrice",2023-02-21,"2023","02","21","St. John",18.363707,-64.731214
"194","Annaberg Bay","AND","TM, JM, DH, DL","28/02/2023","CC","21/02/2023","RHMA","E2-14","H",26,"12.2","39","9.2","29.8","G","N",NA,NA,"MIC","Cory",2023-02-21,"2023","02","21","St. John",18.363707,-64.731214
"195","Annaberg Bay","AND","TM, JM, DH, DL","28/02/2023","CC","21/02/2023","RHMA","E2-15","H",21.41,"9","34","2.1","31.9","G","N",NA,NA,"MIC","Bobby",2023-02-21,"2023","02","21","St. John",18.363707,-64.731214
"196","Annaberg Bay","AND","TM, JM, DH, DL","28/02/2023","CC","21/02/2023","RHMA","E2-16","H",13.55,"9","25","0.7","24.3","G","Y",NA,NA,"MIC","Sammy",2023-02-21,"2023","02","21","St. John",18.363707,-64.731214
"197","Annaberg Bay","AND","JB","28/02/2023","CC","21/02/2023","RHMA","E2-17","H",17.11,"18.6","29.8","1.3","28.5","G","N",NA,NA,"MIC","Orange",2023-02-21,"2023","02","21","St. John",18.363707,-64.731214
"198","Annaberg Bay","AND","TJ","28/02/2023","CC","21/02/2023","RHMA","E2-58","H",15.67,"11.1","27","1","26","G","Y",NA,NA,"MIC","Zac",2023-02-21,"2023","02","21","St. John",18.363707,-64.731214
"199","Annaberg Bay","AND","TJ","28/02/2023","CC","21/02/2023","RHMA","E2-59","H",19.6,"8.8","29","2","27","G","Y",NA,NA,"MIC","Kel",2023-02-21,"2023","02","21","St. John",18.363707,-64.731214
"200","Annaberg Bay","AND","SP","28/02/2023","CC","21/02/2023","RHMA","E2-60","H",13.92,"10.3","22.5","1","21.5","G","Y",NA,NA,"MIC","Luna",2023-02-21,"2023","02","21","St. John",18.363707,-64.731214
"201","Annaberg Bay","AND","SP","28/02/2023","CC","21/02/2023","RHMA","E2-61","H",8.05,"6.7","26","2.5","23.5","G","N",NA,NA,"MIC","Aurora",2023-02-21,"2023","02","21","St. John",18.363707,-64.731214
"202","Annaberg Bay","AND",NA,"28/02/2023","CC","21/02/2023","RHMA","E2-62","H",19.94,"10","28","1","27","B","N",NA,NA,"MIC","Bob",2023-02-21,"2023","02","21","St. John",18.363707,-64.731214
"203","Annaberg Bay","DG","DG","4/24/2023","CC",NA,"RHMA","3779B","H",8.72,NA,NA,NA,"20",NA,NA,NA,"EARTH DAY COMMUNITY OUTREACH STJ","C","HER",NA,NA,NA,NA,"St. John",18.363707,-64.731214
"204","Annaberg Bay","DG","DG","4/25/2023","CC",NA,"RHMA","3781B","H",8.49,NA,NA,NA,"25.5",NA,NA,NA,"EARTH DAY COMMUNITY OUTREACH STJ","C","JOHN",NA,NA,NA,NA,"St. John",18.363707,-64.731214
"205","Annaberg Bay",NA,"TT, DN","10/09/2024","CC","9/13/2024","RHMA","6396","H",15.3,"10.1","29.6","2.2","27.4","G","Y","N",NA,NA,NA,2024-09-13,"2024","09","13","St. John",18.363707,-64.731214
"206","Annaberg Bay",NA,"TT, DN","10/09/2024","CC","9/13/2024","RHMA","6397","H",17.7,"11.5","28.6","0","28.6","G","Y","Y","DECAP",NA,NA,2024-09-13,"2024","09","13","St. John",18.363707,-64.731214
"207","Annaberg Bay",NA,"TT, DN","10/09/2024","CC","9/13/2024","RHMA","6398","H",20.41,"11","34","2","32","G","Y","N",NA,NA,NA,2024-09-13,"2024","09","13","St. John",18.363707,-64.731214
"208","Annaberg Bay",NA,"TT, DN","10/09/2024","CC","9/13/2024","RHMA","6399","H",17.34,"11","29.5","1.5","28","G","Y","Y",NA,NA,NA,2024-09-13,"2024","09","13","St. John",18.363707,-64.731214
"209","Annaberg Bay",NA,"TT, DN","10/09/2024","CC","9/13/2024","RHMA","6400","H",21.29,"11.7","31.7","1","30.7","G","Y","Y",NA,NA,NA,2024-09-13,"2024","09","13","St. John",18.363707,-64.731214
"210","Annaberg Bay",NA,"TT, DN","10/09/2024","CC","9/13/2024","RHMA","6401","H",17.47,"11.1","32.2","2.1","30.1","G","Y","N",NA,NA,NA,2024-09-13,"2024","09","13","St. John",18.363707,-64.731214
"211","Annaberg Bay",NA,"TT, DN","10/09/2024","CC","9/13/2024","RHMA","6402","H",13.41,"9.8","32","2.2","29.8","G","Y","N",NA,NA,NA,2024-09-13,"2024","09","13","St. John",18.363707,-64.731214
"212","Annaberg Bay",NA,"TT, DN","10/09/2024","CC","9/13/2024","RHMA","6403","H",22.15,"11.5","38.2","3.2","35","G","Y","N",NA,NA,NA,2024-09-13,"2024","09","13","St. John",18.363707,-64.731214
"213","Annaberg Bay",NA,"TT, DN","10/09/2024","CC","9/13/2024","RHMA","6404","H",19.25,"11.9","32","2.2","29.8","G","Y","N",NA,NA,NA,2024-09-13,"2024","09","13","St. John",18.363707,-64.731214
"214","Annaberg Bay",NA,"TT, DN","10/09/2024","CC","9/13/2024","RHMA","6405","H",26.38,"13","32","2.1","29.9","G","Y","N",NA,NA,NA,2024-09-13,"2024","09","13","St. John",18.363707,-64.731214
"215","Annaberg Bay",NA,"TT,DN","10/09/2024","CC","9/13/2024","RHMA","6406","H",21.2,"10.8","35.7","2.9","32.8","G","Y","N","has two leaves, one dead plumule",NA,NA,2024-09-13,"2024","09","13","St. John",18.363707,-64.731214
"216","Annaberg Bay","AJH","LU, KH, LP","4/21/2023","CC",NA,"RHMA","3756B","H",6.34,NA,NA,NA,NA,NA,NA,NA,"EARTH DAY COMMUNITY OUTREACH STJ","C",NA,NA,NA,NA,NA,"St. John",18.363707,-64.731214
"217","Annaberg Bay","AJH","LU, KH, LP","4/21/2023","CC",NA,"RHMA","3758B","H",11.59,NA,NA,NA,NA,NA,NA,NA,"EARTH DAY COMMUNITY OUTREACH STJ","C",NA,NA,NA,NA,NA,"St. John",18.363707,-64.731214
"218","Annaberg Bay","SH","ES, SH","10/11/2024","3""","9/13/2024","RHMA","6449",NA,19.9,"12.2","31","2.5","28.5","G","Y","Y",NA,NA,NA,2024-09-13,"2024","09","13","St. John",18.363707,-64.731214
"219","Annaberg Bay","SH","ES, SH","10/11/2024","3""","9/13/2024","RHMA","6450",NA,20.6,"11.4","34","3","31","G","Y","Y","LCP",NA,NA,2024-09-13,"2024","09","13","St. John",18.363707,-64.731214
"220","Annaberg Bay","DN","ES, DN","10/15/24","CC","9/13/2024","RHMA","6451","H",19.81,"11.7","29.1","1.5","27.6","G","Y","Y",NA,NA,NA,2024-09-13,"2024","09","13","St. John",18.363707,-64.731214
"221","Annaberg Bay","DN","ES, DN","10/15/24","CC","9/13/2024","RHMA","6452","H",20.37,"11.7","32.8","3.3","29.5","G","Y","Y",NA,NA,NA,2024-09-13,"2024","09","13","St. John",18.363707,-64.731214
"222","Annaberg Bay","DN","ES, DN","10/15/24","CC","9/13/2024","RHMA","6453","H",19.88,"11.6","31.7","0","31.7","GB","Y","N",NA,NA,NA,2024-09-13,"2024","09","13","St. John",18.363707,-64.731214
"223","Annaberg Bay","DN","ES, DN","10/15/24","CC","9/13/2024","RHMA","6454","H",20.59,"11.4","32.7","2.1","30.6","GB","Y","Y",NA,NA,NA,2024-09-13,"2024","09","13","St. John",18.363707,-64.731214
"224","Annaberg Bay","DN","ES, DN","10/15/24","CC","9/13/2024","RHMA","6455","H",16.55,"10.9","31.3","1.8","29.5","GB","Y","Y",NA,NA,NA,2024-09-13,"2024","09","13","St. John",18.363707,-64.731214
"225","Annaberg Bay","DN","ES, DN","10/15/24","CC","9/13/2024","RHMA","6456","H",14.84,"14.8","32.4","1.4","31","GB","Y","Y",NA,NA,NA,2024-09-13,"2024","09","13","St. John",18.363707,-64.731214
"226","Annaberg Bay","DN","ES, DN","10/15/24","CC","9/13/2024","RHMA","6457","H",13.88,"10.3","27.3","1.7","25.6","GB","Y","Y",NA,NA,NA,2024-09-13,"2024","09","13","St. John",18.363707,-64.731214
"227","Annaberg Bay","DN","ES, DN","10/15/24","CC","9/13/2024","RHMA","6458","H",21.78,"11.3","35.8","3.8","32","GB","Y","Y",NA,NA,NA,2024-09-13,"2024","09","13","St. John",18.363707,-64.731214
"228","Annaberg Bay","DN","ES, DN","10/15/24","CC","9/13/2024","RHMA","6459","H",14.9,"10.4","22.8","1.3","21.5","GB","Y","Y",NA,NA,NA,2024-09-13,"2024","09","13","St. John",18.363707,-64.731214
"229","Annaberg Bay","DG","DG","4/30/2023","CC",NA,"RHMA","3791B","H",7.52,NA,NA,NA,"18.5",NA,NA,NA,"EARTH DAY COMMUNITY OUTREACH STJ","C","BOB",NA,NA,NA,NA,"St. John",18.363707,-64.731214
"230","Annaberg Bay","DG","DG","05/01/2023","CC",NA,"RHMA","3793B","H",6.59,NA,NA,NA,"16.5",NA,NA,NA,"EARTH DAY COMMUNITY OUTREACH STJ","C","BOB THE 2ND",NA,NA,NA,NA,"St. John",18.363707,-64.731214
"231","Annaberg Bay","DG","DG","05/02/2023","CC",NA,"RHMA","3795B","H",5.76,NA,NA,NA,"15",NA,NA,NA,"EARTH DAY COMMUNITY OUTREACH STJ","C","BOB THE 2ND",NA,NA,NA,NA,"St. John",18.363707,-64.731214
"232","Annaberg Bay","AND","SA","28/02/2023","CC","21/02/2023","RHMA","E2-52","H",12.09,"11.1","24.1","1.7","22.4","G","Y",NA,NA,"MIC","Mang",2023-02-21,"2023","02","21","St. John",18.363707,-64.731214
"233","Annaberg Bay","AND","SA","28/02/2023","CC","21/02/2023","RHMA","E2-53","H",14.33,"11.7","20.1","0.8","19.3","G","Y",NA,NA,"MIC","Koya",2023-02-21,"2023","02","21","St. John",18.363707,-64.731214
"234","Annaberg Bay","AND","AMKA","28/02/2023","CC","21/02/2023","RHMA","E2-54","H",15.06,"11","26.2","1.2","25","G","N",NA,NA,"MIC","Athena",2023-02-21,"2023","02","21","St. John",18.363707,-64.731214
"235","Annaberg Bay","AND","AMKA","28/02/2023","CC","21/02/2023","RHMA","E2-55","H",18.37,"12.3","25.6","2","23.6","G","Y",NA,NA,"MIC","Yoru",2023-02-21,"2023","02","21","St. John",18.363707,-64.731214
"236","Annaberg Bay","AND","TM, JM, DH, DL","28/02/2023","CC","21/02/2023","RHMA","E2-56","H",14.19,"11.2","27.5","1.5","26","G","Y",NA,NA,"MIC","Ryu",2023-02-21,"2023","02","21","St. John",18.363707,-64.731214
"237","Annaberg Bay","AND","TM, JM, DH, DL","28/02/2023","CC","21/02/2023","RHMA","E2-57","H",14.59,"11.1","28.5","1.2","27.3","G","Y",NA,NA,"MIC","Fern",2023-02-21,"2023","02","21","St. John",18.363707,-64.731214
"238","Annaberg Bay","MA","MA, SA","10/15/24","CC","9/24/2024","RHMA","6481","H",17.32,"11.6","26.7","N/A","26.7","GB","N","Y","MISSING PLUMULE",NA,NA,2024-09-24,"2024","09","24","St. John",18.363707,-64.731214
"239","Annaberg Bay","MA","MA, SA","10/15/24","CC","9/24/2024","RHMA","6482","H",15.07,"9.9","30.2","1.3","28.9","G","Y","N",NA,NA,NA,2024-09-24,"2024","09","24","St. John",18.363707,-64.731214
"240","Annaberg Bay","MA","MA, SA","10/15/24","CC","9/24/2024","RHMA","6483","H",19.92,"12.2","29.4","1.4","28","G","Y","Y",NA,NA,NA,2024-09-24,"2024","09","24","St. John",18.363707,-64.731214
"241","Annaberg Bay","MA","MA, SA","10/15/24","CC","9/24/2024","RHMA","6484","H",9.36,"10.2","20.3","0.9","19.4","G","N","Y",NA,NA,NA,2024-09-24,"2024","09","24","St. John",18.363707,-64.731214
"242","Annaberg Bay","MA","MA, SA","10/15/24","CC","9/24/2024","RHMA","6485","H",17.84,"11.5","30.3","1.7","28.6","GB","N","Y","PLUMULE IS DYING",NA,NA,2024-09-24,"2024","09","24","St. John",18.363707,-64.731214
"243","Annaberg Bay","MA","MA, SA","10/15/24","CC","9/24/2024","RHMA","6486","H",20.73,"11.5","34.1","1.8","32.3","GB","Y","Y",NA,NA,NA,2024-09-24,"2024","09","24","St. John",18.363707,-64.731214
"244","Annaberg Bay","MA","MA, SA","10/15/24","CC","9/24/2024","RHMA","6487","H",16.8,"10.9","28.9","2","26.9","GB","Y","Y",NA,NA,NA,2024-09-24,"2024","09","24","St. John",18.363707,-64.731214
"245","Annaberg Bay","MA","MA, SA","10/15/24","CC","9/24/2024","RHMA","6488","H",17.37,"10.8","28","N/A","28","G","Y","Y","MISSING PLUMULE",NA,NA,2024-09-24,"2024","09","24","St. John",18.363707,-64.731214
"246","Annaberg Bay","MA","MA, SA","10/15/24","CC","9/24/2024","RHMA","6489","H",14.73,"10.1","26.9","N/A","26.9","GB","N","Y","MISSING PLUMULE",NA,NA,2024-09-24,"2024","09","24","St. John",18.363707,-64.731214
"247","Annaberg Bay","MA","MA, SA","10/15/24","CC","9/24/2024","RHMA","6490","H",15.55,"10.7","27.8","1.6","26.2","GB","Y","Y",NA,NA,NA,2024-09-24,"2024","09","24","St. John",18.363707,-64.731214
"248","Annaberg Bay",NA,"MG,KR","10/15/24","CC","9/24/2024","RHMA","6460","H",15.67,"10","26.6","0.8","25.8","G","Y","Y",NA,NA,NA,2024-09-24,"2024","09","24","St. John",18.363707,-64.731214
"249","Annaberg Bay",NA,"MG,KR","10/15/24","CC","9/24/2024","RHMA","6461","H",12.16,"10.6","24.8","1.8","23","G","N","Y",NA,NA,NA,2024-09-24,"2024","09","24","St. John",18.363707,-64.731214
"250","Annaberg Bay",NA,"MG,KR","10/15/24","CC","9/24/2024","RHMA","6462","H",13.43,"10.5","26.5","1.5","25","G","Y","Y",NA,NA,NA,2024-09-24,"2024","09","24","St. John",18.363707,-64.731214
"251","Annaberg Bay",NA,"MG,KR","10/15/24","CC","9/24/2024","RHMA","6463","H",17.17,"9.9","30.9","2.7","28.2","G","Y","Y","LCP",NA,NA,2024-09-24,"2024","09","24","St. John",18.363707,-64.731214
"252","Annaberg Bay",NA,"MG,KR","10/15/24","CC","9/24/2024","RHMA","6464","H",14.37,"8.9","26.9","1.4","25.5","G","Y","Y",NA,NA,NA,2024-09-24,"2024","09","24","St. John",18.363707,-64.731214
"253","Annaberg Bay",NA,"MG,KR","10/15/24","CC","9/24/2024","RHMA","6465","H",23.61,"10.4","36.5","0","36.5","G","Y","N",NA,NA,NA,2024-09-24,"2024","09","24","St. John",18.363707,-64.731214
"254","Annaberg Bay",NA,"MG,KR","10/15/24","CC","9/24/2024","RHMA","6466","H",15.51,"9.6","28.8","1.5","27.3","G","Y","Y",NA,NA,NA,2024-09-24,"2024","09","24","St. John",18.363707,-64.731214
"255","Annaberg Bay",NA,"MG,KR","10/15/24","CC","9/24/2024","RHMA","6467","H",17.22,"10.7","29.4","1.8","27.6","G","Y","Y",NA,NA,NA,2024-09-24,"2024","09","24","St. John",18.363707,-64.731214
"256","Annaberg Bay",NA,"MG,KR","10/15/24","CC","9/24/2024","RHMA","6468","H",15,"9.9","29.8","1.1","28.7","G","Y","Y",NA,NA,NA,2024-09-24,"2024","09","24","St. John",18.363707,-64.731214
"257","Annaberg Bay",NA,"MG,KR","10/15/24","CC","9/24/2024","RHMA","6469","H",11.28,"8.5","27.4","1.4","26","G","Y","Y",NA,NA,NA,2024-09-24,"2024","09","24","St. John",18.363707,-64.731214
"258","Annaberg Bay","AND","KW","28/02/2023","CC","21/02/2023","RHMA","E2-37","H",21.5,"12.3","29","1","28","G","Y",NA,NA,"MIC","Dope Boy",2023-02-21,"2023","02","21","St. John",18.363707,-64.731214
"259","Annaberg Bay","AND","KW","28/02/2023","CC","21/02/2023","RHMA","E2-38","H",24.47,"12.4","34","0.5","33.5","G","N",NA,NA,"MIC","Dope Boy 2",2023-02-21,"2023","02","21","St. John",18.363707,-64.731214
"260","Annaberg Bay","AND","KH","28/02/2023","CC","21/02/2023","RHMA","E2-39","H",18.69,"10.5","32","1.5","30.5","G","N",NA,NA,"MIC","Demetrius Flenory",2023-02-21,"2023","02","21","St. John",18.363707,-64.731214
"261","Annaberg Bay",NA,"MG,KR","10/15/24","CC","9/24/2024","RHMA","6492","H",21.86,"11.6","26.5","0.8","25.7","G","Y","Y",NA,NA,NA,2024-09-24,"2024","09","24","St. John",18.363707,-64.731214
"262","Annaberg Bay","AND","KH","28/02/2023","CC","21/02/2023","RHMA","E2-41","H",15.88,"8","36","2","34","G","N",NA,NA,"MIC","Never Broke Again",2023-02-21,"2023","02","21","St. John",18.363707,-64.731214
"263","Annaberg Bay","AND","NP","28/02/2023","CC","21/02/2023","RHMA","E2-42","H",10.49,"12.8","27.5","1","26.5","G","Y",NA,NA,"MIC","Westbrick",2023-02-21,"2023","02","21","St. John",18.363707,-64.731214
"264","Annaberg Bay","AND","NP","28/02/2023","CC","21/02/2023","RHMA","E2-43","H",11.55,"13.7","22","1","21","G","Y",NA,NA,"MIC","The King",2023-02-21,"2023","02","21","St. John",18.363707,-64.731214
"265","Annaberg Bay","AND","NP","28/02/2023","CC","21/02/2023","RHMA","E2-44","H",16.03,"11.9","28","1","27","G","Y",NA,NA,"MIC","PG-13",2023-02-21,"2023","02","21","St. John",18.363707,-64.731214
"266","Annaberg Bay","AND","ZR","28/02/2023","CC","21/02/2023","RHMA","E2-45","H",22.74,"13","41","11","30","G","Y",NA,NA,"MIC","Heidy",2023-02-21,"2023","02","21","St. John",18.363707,-64.731214
"267","Annaberg Bay","AND","ZR","28/02/2023","CC","21/02/2023","RHMA","E2-46","H",18.98,"10","31","2","29","G","N",NA,NA,"MIC","Ja Morrent",2023-02-21,"2023","02","21","St. John",18.363707,-64.731214
"268","Annaberg Bay","AND","ZR","28/02/2023","CC","21/02/2023","RHMA","E2-47","H",14.5,"9","31","4","27","G","Y",NA,NA,"MIC","Zari Rich",2023-02-21,"2023","02","21","St. John",18.363707,-64.731214
"269","Annaberg Bay","MA","MA, SA","10/15/24","CC","9/24/2024","RHMA","6472","H",24.88,"13.8","30.3","1.6","28.7","GB","Y","Y",NA,NA,NA,2024-09-24,"2024","09","24","St. John",18.363707,-64.731214
"270","Annaberg Bay","MA","MA, SA","10/15/24","CC","9/24/2024","RHMA","6473","H",18.85,"11.3","33.3","1.4","31.9","G","Y","N",NA,NA,NA,2024-09-24,"2024","09","24","St. John",18.363707,-64.731214
"271","Annaberg Bay","MA","MA, SA","10/15/24","CC","9/24/2024","RHMA","6474","H",31.86,"14.1","34.3","1.3","33","G","Y","N",NA,NA,NA,2024-09-24,"2024","09","24","St. John",18.363707,-64.731214
"272","Annaberg Bay","MA","MA, SA","10/15/24","CC","9/24/2024","RHMA","6475","H",15.45,"10.2","29.6","1.1","28.5","G","Y","Y",NA,NA,NA,2024-09-24,"2024","09","24","St. John",18.363707,-64.731214
"273","Annaberg Bay","MA","MA, SA","10/15/24","CC","9/24/2024","RHMA","6476","H",16.51,"11","29.8","1.9","27.9","GB","Y","Y",NA,NA,NA,2024-09-24,"2024","09","24","St. John",18.363707,-64.731214
"274","Annaberg Bay","MA","MA, SA","10/15/24","CC","9/24/2024","RHMA","6477","H",15.45,"11.3","26.3","1.4","24.9","G","Y","Y",NA,NA,NA,2024-09-24,"2024","09","24","St. John",18.363707,-64.731214
"275","Annaberg Bay","MA","MA, SA","10/15/24","CC","9/24/2024","RHMA","6478","H",20,"12.1","27.8","1.9","25.9","GB","Y","Y",NA,NA,NA,2024-09-24,"2024","09","24","St. John",18.363707,-64.731214
"276","Annaberg Bay","MA","MA, SA","10/15/24","CC","9/24/2024","RHMA","6479","H",17.77,"10.7","33","1.6","31.4","G","Y","Y",NA,NA,NA,2024-09-24,"2024","09","24","St. John",18.363707,-64.731214
"277","Annaberg Bay","MA","MA, SA","10/15/24","CC","9/24/2024","RHMA","6480","H",15.59,"10.4","30","1.2","28.8","GB","Y","Y",NA,NA,NA,2024-09-24,"2024","09","24","St. John",18.363707,-64.731214
"278","Annaberg Bay","DG","DG","4/21/2023","CC",NA,"RHMA","3715B","H",15.05,NA,NA,NA,"25",NA,NA,NA,"EARTH DAY COMMUNITY OUTREACH STJ","C","NEIL",NA,NA,NA,NA,"St. John",18.363707,-64.731214
"279","Annaberg Bay","DG","DG","4/21/2023","CC",NA,"RHMA","3717B","H",16.46,NA,NA,NA,"25",NA,NA,NA,"EARTH DAY COMMUNITY OUTREACH STJ","C","BANKS",NA,NA,NA,NA,"St. John",18.363707,-64.731214
"280","Annaberg Bay","DG","DG","4/21/2023","CC",NA,"RHMA","3719B","H",12.58,NA,NA,NA,"23.4",NA,NA,NA,"EARTH DAY COMMUNITY OUTREACH STJ","C","NEYATREE",NA,NA,NA,NA,"St. John",18.363707,-64.731214
"281","Annaberg Bay","DG","DG","4/21/2023","CC",NA,"RHMA","3721B","H",14.69,NA,NA,NA,"30.5",NA,NA,NA,"EARTH DAY COMMUNITY OUTREACH STJ","C","PETER PARKER",NA,NA,NA,NA,"St. John",18.363707,-64.731214
"282","Annaberg Bay","DG","DG","4/21/2023","CC",NA,"RHMA","3723B","H",14.77,NA,NA,NA,"29.2",NA,NA,NA,"EARTH DAY COMMUNITY OUTREACH STJ","C","TIA",NA,NA,NA,NA,"St. John",18.363707,-64.731214
"283","Annaberg Bay","DG","DG","4/21/2023","CC",NA,"RHMA","3725B","H",9.48,NA,NA,NA,"22",NA,NA,NA,"EARTH DAY COMMUNITY OUTREACH STJ","C","MATAES",NA,NA,NA,NA,"St. John",18.363707,-64.731214
"284","Annaberg Bay","DG","DG","4/22/2023","CC",NA,"RHMA","3775B","H",8.79,NA,NA,NA,"20.6",NA,NA,NA,"EARTH DAY COMMUNITY OUTREACH STJ","C","JOHNNY",NA,NA,NA,NA,"St. John",18.363707,-64.731214
"285","Annaberg Bay","DG","DG","4/23/2023","CC",NA,"RHMA","3777B","H",7.21,NA,NA,NA,"19",NA,NA,NA,"EARTH DAY COMMUNITY OUTREACH STJ","C","HIM",NA,NA,NA,NA,"St. John",18.363707,-64.731214
"286","Annaberg Bay","ST","ST,DG","10/11/2024","3""","9/13/2024","RHMA","6436","H",13.71,"10","28.4","1.9","26.5","G","Y","Y",NA,NA,NA,2024-09-13,"2024","09","13","St. John",18.363707,-64.731214
"287","Annaberg Bay","ST","ST,DG","10/11/2024","3""","9/13/2024","RHMA","6437","H",14.83,"10.2","29.9","1.6","28.3","G","Y","Y",NA,NA,NA,2024-09-13,"2024","09","13","St. John",18.363707,-64.731214
"288","Annaberg Bay","ST","ST,DG","10/11/2024","3""","9/13/2024","RHMA","6438","H",22.6,"11.8","33.7","0","33.7","G","Y","Y","no plumule",NA,NA,2024-09-13,"2024","09","13","St. John",18.363707,-64.731214
"289","Annaberg Bay","SH","ES, SH","10/11/2024","3""","9/13/2024","RHMA","6439","H",16.14,"11.8","28.5","3","25.5","G","Y","Y",NA,NA,NA,2024-09-13,"2024","09","13","St. John",18.363707,-64.731214
"290","Annaberg Bay","SH","ES, SH","10/11/2024","3""","9/13/2024","RHMA","6440","H",15.84,"11.2","29","2.5","26.5","G","Y","Y",NA,NA,NA,2024-09-13,"2024","09","13","St. John",18.363707,-64.731214
"291","Annaberg Bay","SH","ES, SH","10/11/2024","3""","9/13/2024","RHMA","6441","H",27.32,"12.5","39.8","3.3","36.5","G","Y","Y","2 leaves",NA,NA,2024-09-13,"2024","09","13","St. John",18.363707,-64.731214
"292","Annaberg Bay","SH","ES, SH","10/11/2024","3""","9/13/2024","RHMA","6442","H",16.29,"11.1","31","3.7","27.3","G","Y","Y","2 leaves",NA,NA,2024-09-13,"2024","09","13","St. John",18.363707,-64.731214
"293","Annaberg Bay","SH","ES, SH","10/11/2024","3""","9/13/2024","RHMA","6443",NA,13.44,"9.7","33.1","3.2","29.9","G","Y","Y","1 leaf",NA,NA,2024-09-13,"2024","09","13","St. John",18.363707,-64.731214
"294","Annaberg Bay","SH","ES, SH","10/11/2024","3""","9/13/2024","RHMA","6444",NA,21.97,"11.2","36","0","36","G","Y","Y","no plumule",NA,NA,2024-09-13,"2024","09","13","St. John",18.363707,-64.731214
"295","Annaberg Bay","SH","ES, SH","10/11/2024","3""","9/13/2024","RHMA","6445",NA,24.5,"13","33.7","4.3","29.4","G","Y","Y","2 leaves",NA,NA,2024-09-13,"2024","09","13","St. John",18.363707,-64.731214
"296","Annaberg Bay","SH","ES, SH","10/11/2024","3""","9/13/2024","RHMA","6446",NA,24.11,"13.1","29.5","2.5","27","G","N","Y","1 leaf",NA,NA,2024-09-13,"2024","09","13","St. John",18.363707,-64.731214
"297","Annaberg Bay",NA,"TT, DN","10/09/2024","CC","9/13/2024","RHMA","6407","H",22.75,"11.9","38.5","3.4","35.1","G","Y","N",NA,NA,NA,2024-09-13,"2024","09","13","St. John",18.363707,-64.731214
"298","Annaberg Bay",NA,"TT, DN","10/09/2024","CC","9/13/2024","RHMA","6408","H",22,"10.3","37.8","2","35.8","G","Y","N","has two leaves",NA,NA,2024-09-13,"2024","09","13","St. John",18.363707,-64.731214
"299","Annaberg Bay",NA,"TT, DN","10/09/2024","CC","9/13/2024","RHMA","6409","H",20.62,"11.1","35.9","2.9","33","G","Y","N",NA,NA,NA,2024-09-13,"2024","09","13","St. John",18.363707,-64.731214
"300","Annaberg Bay",NA,"TT, DN","10/09/2024","CC","9/13/2024","RHMA","6410","H",19.53,"12","29.1","1.2","27.9","G","Y","N","plumule dead",NA,NA,2024-09-13,"2024","09","13","St. John",18.363707,-64.731214
"301","Annaberg Bay","AJH","LU, KH, LP","4/21/2023","CC",NA,"RHMA","3764B","H",13,NA,NA,NA,NA,NA,NA,NA,"EARTH DAY COMMUNITY OUTREACH STJ","C",NA,NA,NA,NA,NA,"St. John",18.363707,-64.731214
"302","Annaberg Bay","AJH","LU, KH, LP","4/21/2023","CC",NA,"RHMA","3766B","H",10.04,NA,NA,NA,NA,NA,NA,NA,"EARTH DAY COMMUNITY OUTREACH STJ","C",NA,NA,NA,NA,NA,"St. John",18.363707,-64.731214
"303","Annaberg Bay","AJH","LU, KH, LP","4/21/2023","CC",NA,"RHMA","3768B","H",14.77,NA,NA,NA,NA,NA,NA,NA,"EARTH DAY COMMUNITY OUTREACH STJ","C",NA,NA,NA,NA,NA,"St. John",18.363707,-64.731214
"304","Annaberg Bay","AJH","LU, KH, LP","4/21/2023","CC",NA,"RHMA","3770B","H",11.64,NA,NA,NA,NA,NA,NA,NA,"EARTH DAY COMMUNITY OUTREACH STJ","C",NA,NA,NA,NA,NA,"St. John",18.363707,-64.731214
"305","Annaberg Bay","AJH","TT, LU, KH, MK, LB","4/21/2023","CC",NA,"RHMA","3772B","H",8.87,NA,NA,NA,"19",NA,NA,NA,"EARTH DAY","C","FRIDAY",NA,NA,NA,NA,"St. John",18.363707,-64.731214
"306","Annaberg Bay","DG","DG","4/21/2023","CC",NA,"RHMA","3773B","H",4.76,NA,NA,NA,"16.5",NA,NA,NA,"EARTH DAY COMMUNITY OUTREACH STJ","C","SAM",NA,NA,NA,NA,"St. John",18.363707,-64.731214
"307","Annaberg Bay","AJH","TT, LU, KH, MK, LB","4/21/2023","CC",NA,"RHMA","3774B","H",6,NA,NA,NA,"13.4",NA,NA,NA,"EARTH DAY","C","JERRY",NA,NA,NA,NA,"St. John",18.363707,-64.731214
"308","Annaberg Bay","AJH","TT, LU, KH, MK, LB","4/21/2023","CC",NA,"RHMA","3776B","H",7.6,NA,NA,NA,"16",NA,NA,NA,"EARTH DAY","C","ORA",NA,NA,NA,NA,"St. John",18.363707,-64.731214
"309","Annaberg Bay","AND","NR","28/02/2023","CC","21/02/2023","RHMA","E2-48","H",19.18,"9","29","2","27","G","Y",NA,NA,"MIC","Semira",2023-02-21,"2023","02","21","St. John",18.363707,-64.731214
"310","Annaberg Bay","AND","NR","28/02/2023","CC","21/02/2023","RHMA","E2-49","H",21.8,"9","30.5","0.5","30","G","Y",NA,NA,"MIC","Alanis",2023-02-21,"2023","02","21","St. John",18.363707,-64.731214
"311","Annaberg Bay","AND","ZM","28/02/2023","CC","21/02/2023","RHMA","E2-50","H",25.03,"12.4","30","2","28","G","Y",NA,NA,"MIC","Dior",2023-02-21,"2023","02","21","St. John",18.363707,-64.731214
"312","Annaberg Bay","AND","ZM","28/02/2023","CC","21/02/2023","RHMA","E2-51","H",18.15,"9","30","2","28","G","Y",NA,NA,"MIC","Gucci",2023-02-21,"2023","02","21","St. John",18.363707,-64.731214
"313","Annaberg Bay","DG","DG","4/21/2023","CC",NA,"RHMA","3705B","H",21.79,NA,NA,NA,"35.5",NA,NA,NA,NA,"C","UGLEIQH",NA,NA,NA,NA,"St. John",18.363707,-64.731214
"314","Annaberg Bay","DG","DG","4/21/2023","CC",NA,"RHMA","3707B","H",21.07,NA,NA,NA,"36.2",NA,NA,NA,"EARTH DAY COMMUNITY OUTREACH STJ","C","HEATHER",NA,NA,NA,NA,"St. John",18.363707,-64.731214
"315","Annaberg Bay","DG","DG","4/21/2023","CC",NA,"RHMA","3709B","H",12.68,NA,NA,NA,"31.8",NA,NA,NA,"EARTH DAY COMMUNITY OUTREACH STJ","C","HARBOR",NA,NA,NA,NA,"St. John",18.363707,-64.731214
"316","Annaberg Bay","DG","DG","4/21/2023","CC",NA,"RHMA","3711B","H",15.63,NA,NA,NA,"32",NA,NA,NA,"EARTH DAY COMMUNITY OUTREACH STJ","C","HARBOR#2",NA,NA,NA,NA,"St. John",18.363707,-64.731214
"317","Annaberg Bay","DG","DG","4/21/2023","CC",NA,"RHMA","3713B","H",14.01,NA,NA,NA,"24",NA,NA,NA,"EARTH DAY COMMUNITY OUTREACH STJ","C","LELE",NA,NA,NA,NA,"St. John",18.363707,-64.731214
"318","Annaberg Bay","AJH","TT, LU, KH, MK, LB","4/21/2023","CC",NA,"RHMA","3794B","H",7.75,NA,NA,NA,"16.5",NA,NA,NA,"EARTH DAY","C","BEAN",NA,NA,NA,NA,"St. John",18.363707,-64.731214
"319","Annaberg Bay","AJH","TT, LU, KH, MK, LB","4/21/2023","CC",NA,"RHMA","3796B","H",8.92,NA,NA,NA,"17.5",NA,NA,NA,"EARTH DAY","C",NA,NA,NA,NA,NA,"St. John",18.363707,-64.731214
"320","Annaberg Bay","AJH","TT, LU, KH, MK, LB","4/21/2023","CC",NA,"RHMA","3798B","H",5.16,NA,NA,NA,"16.5",NA,NA,NA,"EARTH DAY","C",NA,NA,NA,NA,NA,"St. John",18.363707,-64.731214
"321","Annaberg Bay","AJH","TT, LU, KH, MK, LB","4/21/2023","CC",NA,"RHMA","3800B","H",6.95,NA,NA,NA,"17.1",NA,NA,NA,"EARTH DAY","C",NA,NA,NA,NA,NA,"St. John",18.363707,-64.731214
"322","Annaberg Bay","AJH","TT, LU, KH, MK, LB","4/21/2023","CC",NA,"RHMA","3802B","H",5.66,NA,NA,NA,"17.5",NA,NA,NA,"EARTH DAY","C",NA,NA,NA,NA,NA,"St. John",18.363707,-64.731214
"323","Annaberg Bay","AJH","TT, LU, KH, MK, LB","4/21/2023","CC",NA,"RHMA","3804B","H",7.76,NA,NA,NA,"18",NA,NA,NA,"EARTH DAY","C",NA,NA,NA,NA,NA,"St. John",18.363707,-64.731214
"324","Annaberg Bay","ST","ST,DG","10/11/2024","3""","9/13/2024","RHMA","6433","H",11.81,"8.4","26.5","1.5","25","G","Y","Y",NA,NA,NA,2024-09-13,"2024","09","13","St. John",18.363707,-64.731214
"325","Annaberg Bay","ST","ST,DG","10/11/2024","3""","9/13/2024","RHMA","6434","H",24.85,"9.6","31.9","1.5","30.4","G","Y","Y",NA,NA,NA,2024-09-13,"2024","09","13","St. John",18.363707,-64.731214
"326","Annaberg Bay","ST","ST,DG","10/11/2024","3""","9/13/2024","RHMA","6435","H",16.7,"10.6","24.5","1.5","23","G","Y","Y",NA,NA,NA,2024-09-13,"2024","09","13","St. John",18.363707,-64.731214
"327","Annaberg Bay",NA,"MG,KR","10/15/24","CC","9/24/2024","RHMA","6471","H",12.37,"8.9","29","1","28","G","Y","Y",NA,NA,NA,2024-09-24,"2024","09","24","St. John",18.363707,-64.731214
"328","Annaberg Bay",NA,"MG,KR","10/15/24","CC","9/24/2024","RHMA","6491","H",17.54,"9.9","33.3","2.2","31.1","G","Y","N","LCP",NA,NA,2024-09-24,"2024","09","24","St. John",18.363707,-64.731214
"329","Annaberg Bay",NA,"TT,DN","10/09/2024","CC","9/13/2024","RHMA","6411","H",27.61,"12.8","44.5","4.4","40.1","G","Y","N",NA,NA,NA,2024-09-13,"2024","09","13","St. John",18.363707,-64.731214
"330","Annaberg Bay",NA,"MG,KR","10/15/24","CC","9/24/2024","RHMA","6493","H",17.71,"9","30.2","1.1","29.1","G","Y","Y",NA,NA,NA,2024-09-24,"2024","09","24","St. John",18.363707,-64.731214
"331","Annaberg Bay",NA,"MG,KR","10/15/24","CC","9/24/2024","RHMA","6494","H",15.17,"9.1","30.9","1.9","29","G","Y","Y",NA,NA,NA,2024-09-24,"2024","09","24","St. John",18.363707,-64.731214
"332","Annaberg Bay","DG","DG","4/21/2023","CC",NA,"RHMA","3681B","H",9.2,NA,NA,NA,"23.3",NA,NA,NA,"EARTH DAY COMMUNITY OUTREACH STJ","C","PLUGLEYO",NA,NA,NA,NA,"St. John",18.363707,-64.731214
"333","Annaberg Bay","DG","DG","4/21/2023","CC",NA,"RHMA","3683B","H",18.8,NA,NA,NA,"28",NA,NA,NA,"EARTH DAY COMMUNITY OUTREACH STJ","C","BUTTTERFLTLY",NA,NA,NA,NA,"St. John",18.363707,-64.731214
"334","Annaberg Bay","DG","DG","4/21/2023","CC",NA,"RHMA","3685B","H",12.39,NA,NA,NA,"24.5",NA,NA,NA,"EARTH DAY COMMUNITY OUTREACH STJ","C","FIFI",NA,NA,NA,NA,"St. John",18.363707,-64.731214
"335","Annaberg Bay","DG","DG","4/21/2023","CC",NA,"RHMA","3687B","H",15.12,NA,NA,NA,"28.5",NA,NA,NA,"EARTH DAY COMMUNITY OUTREACH STJ","C","FIFI#2",NA,NA,NA,NA,"St. John",18.363707,-64.731214
"336","Annaberg Bay","DG","DG","4/21/2023","CC",NA,"RHMA","3691B","H",11.36,NA,NA,NA,"23.2",NA,NA,NA,"EARTH DAY COMMUNITY OUTREACH STJ","C","SLICER",NA,NA,NA,NA,"St. John",18.363707,-64.731214
"337","Annaberg Bay","SH","ES, SH","10/11/2024","3""","9/13/2024","RHMA","6447",NA,18.38,"11.4","31","0","31","G","Y","Y","no plumule",NA,NA,2024-09-13,"2024","09","13","St. John",18.363707,-64.731214
"338","Annaberg Bay","SH","ES, SH","10/11/2024","3""","9/13/2024","RHMA","6448",NA,18.28,"10.3","34.3","2.6","31.7","G","Y","Y","plumule brown",NA,NA,2024-09-13,"2024","09","13","St. John",18.363707,-64.731214
"339","Annaberg Bay",NA,"MG,KR","10/15/24","CC","9/24/2024","RHMA","6470","H",15.15,"9.7","27.6","0.9","26.7","G","Y","Y",NA,NA,NA,2024-09-24,"2024","09","24","St. John",18.363707,-64.731214
"340","Annaberg Bay","DG","DG","4/21/2023","CC",NA,"RHMA","3699B","H",20.03,NA,NA,NA,"29.4",NA,NA,NA,"EARTH DAY COMMUNITY OUTREACH STJ","C","ROSE",NA,NA,NA,NA,"St. John",18.363707,-64.731214
"341","Annaberg Bay","ST","ST,DG","10/11/2024","3""","9/13/2024","RHMA","6423","H",17,"8.3","33.9","1.9","32","G","Y","Y",NA,NA,NA,2024-09-13,"2024","09","13","St. John",18.363707,-64.731214
"342","Annaberg Bay","ST","ST,DG","10/11/2024","3""","9/13/2024","RHMA","6424","H",24.47,"10.7","34.6","1.8","32.8","G","Y","Y",NA,NA,NA,2024-09-13,"2024","09","13","St. John",18.363707,-64.731214
"343","Annaberg Bay","ST","ST,DG","10/11/2024","3""","9/13/2024","RHMA","6425","H",20.52,"9.7","34.2","3.6","30.6","G","Y","Y",NA,NA,NA,2024-09-13,"2024","09","13","St. John",18.363707,-64.731214
"344","Annaberg Bay","ST","ST,DG","10/11/2024","3""","9/13/2024","RHMA","6426","H",23.34,"10.7","31.5","1.9","29.6","G","Y","Y",NA,NA,NA,2024-09-13,"2024","09","13","St. John",18.363707,-64.731214
"345","Annaberg Bay","ST","ST,DG","10/11/2024","3""","9/13/2024","RHMA","6427","H",20.57,"12.6","36.9","3.2","33.7","G","Y","Y",NA,NA,NA,2024-09-13,"2024","09","13","St. John",18.363707,-64.731214
"346","Annaberg Bay","ST","ST,DG","10/11/2024","3""","9/13/2024","RHMA","6428","H",22.65,"12.7","29.9","1.5","28.4","G","Y","Y",NA,NA,NA,2024-09-13,"2024","09","13","St. John",18.363707,-64.731214
"347","Annaberg Bay","ST","ST,DG","10/11/2024","3""","9/13/2024","RHMA","6429","H",25.39,"11.8","33.3","2.4","30.9","G","Y","Y",NA,NA,NA,2024-09-13,"2024","09","13","St. John",18.363707,-64.731214
"348","Annaberg Bay","ST","ST,DG","10/11/2024","3""","9/13/2024","RHMA","6430","H",15.94,"10.3","27.4","1.9","25.5","G","Y","Y",NA,NA,NA,2024-09-13,"2024","09","13","St. John",18.363707,-64.731214
"349","Annaberg Bay","ST","ST,DG","10/11/2024","3""","9/13/2024","RHMA","6431","H",17.65,"9.1","30.3","1.5","28.8","G","Y","Y",NA,NA,NA,2024-09-13,"2024","09","13","St. John",18.363707,-64.731214
"350","Annaberg Bay","DG","DG","4/21/2023","CC",NA,"RHMA","3693B","H",13.57,NA,NA,NA,"23",NA,NA,NA,"EARTH DAY COMMUNITY OUTREACH STJ","C","FLASH",NA,NA,NA,NA,"St. John",18.363707,-64.731214
"351","Annaberg Bay","DG","DG","4/21/2023","CC",NA,"RHMA","3695B","H",21.78,NA,NA,NA,"31",NA,NA,NA,"EARTH DAY COMMUNITY OUTREACH STJ","C","LAI",NA,NA,NA,NA,"St. John",18.363707,-64.731214
"352","Annaberg Bay","DG","DG","4/21/2023","CC",NA,"RHMA","3697B","H",18.42,NA,NA,NA,"27.5",NA,NA,NA,"EARTH DAY COMMUNITY OUTREACH STJ","C","JACKIE",NA,NA,NA,NA,"St. John",18.363707,-64.731214
"353","Annaberg Bay","SA","MH,TB","9/17/24","CC","9/13/2024","RHMA","6165","H",16.75,"9.3","30.3","1.5","28.7","G","N","N",NA,NA,NA,2024-09-13,"2024","09","13","St. John",18.363707,-64.731214
"354","Annaberg Bay","SA","MH,TB","9/17/24","CC","9/13/2024","RHMA","6166","H",21.75,"11.7","34","2","32","G","N","N",NA,NA,NA,2024-09-13,"2024","09","13","St. John",18.363707,-64.731214
"355","Annaberg Bay","SA","MH,TB","9/17/24","CC","9/13/2024","RHMA","6167","H",14.08,"10.1","28","1.6","26.6","G","N","Y",NA,NA,NA,2024-09-13,"2024","09","13","St. John",18.363707,-64.731214
"356","Annaberg Bay","AJH","TT, LU, KH, MK, LB","4/21/2023","CC",NA,"RHMA","3782B","H",6.76,NA,NA,NA,"20.1",NA,NA,NA,"EARTH DAY","C","FIYAH",NA,NA,NA,NA,"St. John",18.363707,-64.731214
"357","Annaberg Bay",NA,"TT, DN","10/09/2024","CC","9/13/2024","RHMA","6412","H",30.97,"12.8","40.5","2.5","38","G","Y","N",NA,NA,NA,2024-09-13,"2024","09","13","St. John",18.363707,-64.731214
"358","Annaberg Bay",NA,"TT, DN","10/09/2024","CC","9/13/2024","RHMA","6413","H",20.14,"10.5","36.4","3.5","32.9","G","Y","N",NA,NA,NA,2024-09-13,"2024","09","13","St. John",18.363707,-64.731214
"359","Annaberg Bay",NA,"TT, DN","10/09/2024","CC","9/13/2024","RHMA","6414","H",26.17,"11.8","40.9","3.9","37","G","Y","N","leaves",NA,NA,2024-09-13,"2024","09","13","St. John",18.363707,-64.731214
"360","Annaberg Bay",NA,"TT, DN","10/09/2024","CC","9/13/2024","RHMA","6415","H",25.7,"13.6","32.4","2.4","30","G","Y","N",NA,NA,NA,2024-09-13,"2024","09","13","St. John",18.363707,-64.731214
"361","Annaberg Bay",NA,"TT,DN","10/09/2024","CC","9/13/2024","RHMA","6416","H",22.28,"11.6","40.5","4.5","36","G","Y","N","leaves",NA,NA,2024-09-13,"2024","09","13","St. John",18.363707,-64.731214
"362","Annaberg Bay",NA,"TT, DN","10/09/2024","CC","9/13/2024","RHMA","6417","H",25.09,"11.8","38.6","0","38.6","G","Y","N","decap",NA,NA,2024-09-13,"2024","09","13","St. John",18.363707,-64.731214
"363","Annaberg Bay","ST","ST,DG","10/11/2024","3""","9/13/2024","RHMA","6432","H",28.61,"12.9","32.7","2.1","30.6","G","Y","Y",NA,NA,NA,2024-09-13,"2024","09","13","St. John",18.363707,-64.731214
"364","Annaberg Bay",NA,"TT, DN","10/09/2024","CC","9/13/2024","RHMA","6419","H",15.42,"10.2","31.4","1.9","29.5","G","Y","N",NA,NA,NA,2024-09-13,"2024","09","13","St. John",18.363707,-64.731214
"365","Annaberg Bay","SA","MH,TB","9/17/24","CC","9/13/2024","RHMA","6164","H",18.33,"11.2","32.4","1.7","30.7","G","N","N",NA,NA,NA,2024-09-13,"2024","09","13","St. John",18.363707,-64.731214
"366","Annaberg Bay","ST","ST,DG","10/11/2024","3""","9/13/2024","RHMA","6421","H",27.94,"12.5","33.1","1.6","31.5","G","Y","Y",NA,NA,NA,2024-09-13,"2024","09","13","St. John",18.363707,-64.731214
"367","Annaberg Bay","ST","ST,DG","10/11/2024","3""","9/13/2024","RHMA","6422","H",18.42,"9.7","32.8","3.1","29.7","G","Y","Y",NA,NA,NA,2024-09-13,"2024","09","13","St. John",18.363707,-64.731214
"368","Annaberg Bay","AJH","TT, LU, KH, MK, LB","4/21/2023","CC",NA,"RHMA","3780B","H",11.95,NA,NA,NA,"23.2",NA,NA,NA,"EARTH DAY","C","COCONUT",NA,NA,NA,NA,"St. John",18.363707,-64.731214
"369","Annaberg Bay","AJH","TT, LU, KH, MK, LB","4/21/2023","CC",NA,"RHMA","3790B","H",5.39,NA,NA,NA,"15.5",NA,NA,NA,"EARTH DAY","C","VANNA",NA,NA,NA,NA,"St. John",18.363707,-64.731214
"370","Annaberg Bay","AJH","TT, LU, KH, MK, LB","4/21/2023","CC",NA,"RHMA","3784B","H",8.87,NA,NA,NA,"21",NA,NA,NA,"EARTH DAY","C","SWAMPER",NA,NA,NA,NA,"St. John",18.363707,-64.731214
"371","Annaberg Bay","AJH","TT, LU, KH, MK, LB","4/21/2023","CC",NA,"RHMA","3786B","H",9.89,NA,NA,NA,"20",NA,NA,NA,"EARTH DAY","C","ROBERT",NA,NA,NA,NA,"St. John",18.363707,-64.731214
"372","Annaberg Bay","AJH","TT, LU, KH, MK, LB","4/21/2023","CC",NA,"RHMA","3788B","H",5.71,NA,NA,NA,"15.6",NA,NA,NA,"EARTH DAY","C","OCTAVIOUS",NA,NA,NA,NA,"St. John",18.363707,-64.731214
"373","Annaberg Bay","EA","EA.ES","9/18/24","CC","9/13/2024","RHMA","6174","H",15.1,"11.1","27.3","1.2","27","GB","N","Y",NA,NA,NA,2024-09-13,"2024","09","13","St. John",18.363707,-64.731214
"374","Annaberg Bay","AJH","TT, LU, KH, MK, LB","4/21/2023","CC",NA,"RHMA","3792B","H",7.1,NA,NA,NA,"18.5",NA,NA,NA,"EARTH DAY","C","BOB",NA,NA,NA,NA,"St. John",18.363707,-64.731214
"375","Annaberg Bay","EA","EA.ES","9/18/24","CC","9/13/2024","RHMA","6172","H",17.65,"10.8","31.3","1.3","29.8","GB","N","Y",NA,NA,NA,2024-09-13,"2024","09","13","St. John",18.363707,-64.731214
"376","Annaberg Bay",NA,"TT, DN","10/09/2024","CC","9/13/2024","RHMA","6418","H",19.69,"11.2","34.1","1.5","32.6","G","N","N",NA,NA,NA,2024-09-13,"2024","09","13","St. John",18.363707,-64.731214
"377","Annaberg Bay","AJH","TT, LU, KH, MK, LB","4/21/2023","CC",NA,"RHMA","3778B","H",9,NA,NA,NA,"20.4",NA,NA,NA,"EARTH DAY","C","COCONUT",NA,NA,NA,NA,"St. John",18.363707,-64.731214
"378","Annaberg Bay",NA,"TT, DN","10/09/2024","CC","9/13/2024","RHMA","6420","H",26.07,"12.3","38.6","2.2","36.4","G","Y","N",NA,NA,NA,2024-09-13,"2024","09","13","St. John",18.363707,-64.731214
"379","Annaberg Bay","EA","EA.ES","9/18/24","CC","9/13/2024","RHMA","6176","H",19.56,"11.2","33","1.6","31","GB","N","Y",NA,NA,NA,2024-09-13,"2024","09","13","St. John",18.363707,-64.731214
"380","Annaberg Bay","EA","EA.ES","9/18/24","CC","9/13/2024","RHMA","6177","H",29.65,"13.9","37.3","2","35.3","GB","N","Y",NA,NA,NA,2024-09-13,"2024","09","13","St. John",18.363707,-64.731214
"381","Annaberg Bay","SA","MH,TB","9/17/24","CC","9/13/2024","RHMA","6169","H",24.54,"12.2","37.5","1","35.5","G","N","N",NA,NA,NA,2024-09-13,"2024","09","13","St. John",18.363707,-64.731214
"382","Annaberg Bay","SA","MH,TB","9/17/24","CC","9/13/2024","RHMA","6170","H",21.54,"11.8","34.4","1.8","32.6","G","N","N",NA,NA,NA,2024-09-13,"2024","09","13","St. John",18.363707,-64.731214
"383","Annaberg Bay","SA","MH,TB","9/17/24","CC","9/13/2024","RHMA","6171","H",36.57,"14.4","38","2.2","35.8","G","N","N",NA,NA,NA,2024-09-13,"2024","09","13","St. John",18.363707,-64.731214
"384","Annaberg Bay","SA","MH,TB","9/17/24","CC","9/13/2024","RHMA","6168","H",17.35,NA,"31.2","1.2","30","G","N","Y",NA,NA,NA,2024-09-13,"2024","09","13","St. John",18.363707,-64.731214
"385","Annaberg Bay","EA","EA.ES","9/18/24","CC","9/13/2024","RHMA","6173","H",20.89,"11","37.1","2","35","GB","N","Y",NA,NA,NA,2024-09-13,"2024","09","13","St. John",18.363707,-64.731214
"386","Annaberg Bay","EA","EA.ES","9/18/24","CC","9/13/2024","RHMA","6175","H",24.48,"13.2","34","1.7","32","GB","Y","N",NA,NA,NA,2024-09-13,"2024","09","13","St. John",18.363707,-64.731214
"387","Compass Point",NA,"LU","6/24/2024","CC","06/11/2024","RHMA","5965","H",12.54,NA,NA,NA,"29","G","N",NA,"FVINP SKIP","C",NA,2024-06-11,"2024","06","11","St. Thomas",18.319231,-64.865114
"388","Compass Point","ZDB","AJH, AND, KWG",NA,"3""","09/02/2022","RHMA","2170","H",22,"12","32.3","1.7","30.6","G","Y","N",NA,"N",NA,2022-09-02,"2022","09","02","St. Thomas",18.319231,-64.865114
"389","Compass Point","DIRECT INPUT","KWG, AJH",NA,"3"" TP","2/17/2023","RHMA","3267","H",17.35,"8","20.9","0.9","20","G","Y","Y",NA,"N",NA,2023-02-17,"2023","02","17","St. Thomas",18.319231,-64.865114
"390","Compass Point","DIRECT INPUT","KWG, AJH",NA,"3""TP","02/09/2023","RHMA","3267","H",43.06,"14.3","41.3","2","39.3","G","Y","N",NA,"N",NA,2023-02-09,"2023","02","09","St. Thomas",18.319231,-64.865114
"391","Compass Point","DIRECT INPUT","KWG, AJH",NA,"3""TP","02/09/2023","RHMA","3266","H",21.84,"12.2","30.7","1.4","29.3","G","Y","N",NA,"N",NA,2023-02-09,"2023","02","09","St. Thomas",18.319231,-64.865114
"392","Compass Point","ZDB","AJH, AND, KWG",NA,"3""","09/02/2022","RHMA","2171","H",26.9,"12.8","32.4","2","30.4","G","Y","N",NA,"N",NA,2022-09-02,"2022","09","02","St. Thomas",18.319231,-64.865114
"393","Compass Point","DIRECT INPUT","KWG, AJH",NA,"3"" TP","2/17/2023","RHMA","3266","H",24.97,"9.1","26","0","26","G","Y","Y",NA,"N",NA,2023-02-17,"2023","02","17","St. Thomas",18.319231,-64.865114
"394","Compass Point","DIRECT INPUT","KWG, AJH",NA,"3"" TP","2/17/2023","RHMA","3264","H",24.47,"10.2","21.7","0.5","21.2","GB","Y","N",NA,"N",NA,2023-02-17,"2023","02","17","St. Thomas",18.319231,-64.865114
"395","Compass Point","DIRECT INPUT","KWG, AJH",NA,"3""TP","02/09/2023","RHMA","3260","H",12.26,"10.2","24.2","1.2","23","G","Y","Y",NA,"N",NA,2023-02-09,"2023","02","09","St. Thomas",18.319231,-64.865114
"396","Compass Point","ZDB","AJH, AND, KWG",NA,"3""","09/02/2022","RHMA","2169","H",22,"11.9","31.4","1.7","29.7","G","Y","N",NA,"N",NA,2022-09-02,"2022","09","02","St. Thomas",18.319231,-64.865114
"397","Compass Point",NA,"LU","6/24/2024","CC","06/11/2024","RHMA","5966","H",6.58,NA,NA,NA,"20","G","N",NA,"FVINP SKIP","C",NA,2024-06-11,"2024","06","11","St. Thomas",18.319231,-64.865114
"398","Compass Point",NA,"LU","6/24/2024","CC","06/11/2024","RHMA","5967","H",10.08,NA,NA,NA,"22.3","G","N",NA,"FVINP SKIP","C",NA,2024-06-11,"2024","06","11","St. Thomas",18.319231,-64.865114
"399","Compass Point","DIRECT INPUT","KWG, AJH",NA,"3""TP","02/09/2023","RHMA","3269","P",11.37,"10.1","22.9","1.4","21.5","G","Y","N",NA,"N",NA,2023-02-09,"2023","02","09","St. Thomas",18.319231,-64.865114
"400","Compass Point","DIRECT INPUT","KWG, AJH",NA,"3"" TP","2/17/2023","RHMA","3260","H",22.52,"9.1","25.3","1.1","24.2","G","Y","Y",NA,"N",NA,2023-02-17,"2023","02","17","St. Thomas",18.319231,-64.865114
"401","Compass Point","DIRECT INPUT","KWG, AJH",NA,"3""TP","02/09/2023","RHMA","3268","H",20,"10.5","33","1.4","31.6","G","Y","N",NA,"N",NA,2023-02-09,"2023","02","09","St. Thomas",18.319231,-64.865114
"402","Compass Point","DIRECT INPUT","KWG, AJH",NA,"3""TP","02/09/2023","RHMA","3265","H",23.63,"11.3","33.4","1.8","31.6","G","Y","N",NA,"N",NA,2023-02-09,"2023","02","09","St. Thomas",18.319231,-64.865114
"403","Compass Point",NA,"LU","6/24/2024","CC","06/11/2024","RHMA","5964","H",17.7,NA,NA,NA,"22.5","G","N",NA,"FVINP SKIP","C",NA,2024-06-11,"2024","06","11","St. Thomas",18.319231,-64.865114
"404","Compass Point","DIRECT INPUT","KWG, AJH",NA,"3"" TP","2/17/2023","RHMA","3265","H",26.62,"9.1","27.3","0","27.3","G","Y","N","TOP LOOKS DEAD","N",NA,2023-02-17,"2023","02","17","St. Thomas",18.319231,-64.865114
"405","Compass Point","DIRECT INPUT","KWG, AJH",NA,"3"" TP","2/23/2023","RHMA","3281","H",13.35,"11.1","24.2","1","23.2","G","Y","Y",NA,"N",NA,2023-02-23,"2023","02","23","St. Thomas",18.319231,-64.865114
"406","Compass Point","DIRECT INPUT","AJH",NA,"3"" TP","2/21/2023","RHMA","3337","H",37.47,"14","33","0","33","G","Y","N",NA,"N",NA,2023-02-21,"2023","02","21","St. Thomas",18.319231,-64.865114
"407","Compass Point","DIRECT INPUT","AJH",NA,"3"" TP","2/21/2023","RHMA","3338","H",20.22,"12.7","26.4","0","26.4","G","Y","N","CURVED","N",NA,2023-02-21,"2023","02","21","St. Thomas",18.319231,-64.865114
"408","Compass Point","DIRECT INPUT","AJH",NA,"3"" TP","2/22/2023","RHMA","3339","H",16.19,"8.1","21.2","1.2","20","G","Y","Y",NA,"N",NA,2023-02-22,"2023","02","22","St. Thomas",18.319231,-64.865114
"409","Compass Point","DIRECT INPUT","AJH",NA,"3"" TP","2/22/2023","RHMA","3340","H",18.43,"9.2","24.1","0.4","23.7","G","Y","N",NA,"N",NA,2023-02-22,"2023","02","22","St. Thomas",18.319231,-64.865114
"410","Compass Point","DIRECT INPUT","AJH",NA,"3"" TP","2/22/2023","RHMA","3341","H",14.9,"9.1","23.6","1.6","22","G","N","N",NA,"N",NA,2023-02-22,"2023","02","22","St. Thomas",18.319231,-64.865114
"411","Compass Point","DIRECT INPUT","KWG, AJH",NA,"3"" TP","2/17/2023","RHMA","3268","H",34.38,"9.2","32","1.2","30.8","G","Y","N",NA,"N",NA,2023-02-17,"2023","02","17","St. Thomas",18.319231,-64.865114
"412","Compass Point","DIRECT INPUT","AJH",NA,"3"" TP","2/22/2023","RHMA","3343","H",16.59,"9.1","20","0","20","G","Y","N","CURVED","N",NA,2023-02-22,"2023","02","22","St. Thomas",18.319231,-64.865114
"413","Compass Point","DIRECT INPUT","KWG, AJH",NA,"3"" TP","2/17/2023","RHMA","3269","H",28.31,"9.1","27.5","2.5","25","G","Y","N","ACCIDENTLY BROKE OFF PLUMULE LOL","N",NA,2023-02-17,"2023","02","17","St. Thomas",18.319231,-64.865114
"414","Compass Point","DIRECT INPUT","KWG, AJH",NA,"3"" TP","2/23/2023","RHMA","3292","H",10.72,"10","19.5","0.9","18.6","G","Y","N",NA,"N",NA,2023-02-23,"2023","02","23","St. Thomas",18.319231,-64.865114
"415","Compass Point","DIRECT INPUT","KWG, AJH",NA,"3"" TP","2/23/2023","RHMA","3293","H",11.65,"10","21.7","1.1","20.6","G","Y","N",NA,"N",NA,2023-02-23,"2023","02","23","St. Thomas",18.319231,-64.865114
"416","Compass Point","DIRECT INPUT","KWG, AJH",NA,"3"" TP","2/23/2023","RHMA","3294","H",11.49,"9.8","20.2","0.3","19.9","G","Y","N","PLUM DEAD","N",NA,2023-02-23,"2023","02","23","St. Thomas",18.319231,-64.865114
"417","Compass Point","DIRECT INPUT","KWG, AJH",NA,"3"" TP","2/23/2023","RHMA","3295","H",6.84,"9.4","16.9","0.9","16","G","Y","N",NA,"N",NA,2023-02-23,"2023","02","23","St. Thomas",18.319231,-64.865114
"418","Compass Point","DIRECT INPUT","KWG, AJH",NA,"3""TP","02/09/2023","RHMA","3264","H",17.15,"12.2","25.2","1.3","23.9","G","Y","N",NA,"N",NA,2023-02-09,"2023","02","09","St. Thomas",18.319231,-64.865114
"419","Compass Point","DIRECT INPUT","KWG, AJH",NA,"3""TP","02/09/2023","RHMA","3258","H",11.97,"10.4","23.9","1.5","22.4","G",NA,"N",NA,"N",NA,2023-02-09,"2023","02","09","St. Thomas",18.319231,-64.865114
"420","Compass Point","DIRECT INPUT","KWG, AJH",NA,"3"" TP","2/17/2023","RHMA","3258","H",18.12,"8","26.2","0.2","26","G","Y","Y",NA,"N",NA,2023-02-17,"2023","02","17","St. Thomas",18.319231,-64.865114
"421","Compass Point","DIRECT INPUT","KWG, AJH",NA,"3""TP","02/09/2023","RHMA","3259","H",9.52,"8.8","24.6","1.1","23.5","G","Y","Y",NA,"N",NA,2023-02-09,"2023","02","09","St. Thomas",18.319231,-64.865114
"422","Compass Point","DIRECT INPUT","KWG, AJH",NA,"3"" TP","2/17/2023","RHMA","3259","H",20.92,"9.1","21.3","0.6","20.7","G","Y","N",NA,"N",NA,2023-02-17,"2023","02","17","St. Thomas",18.319231,-64.865114
"423","Compass Point","HH","HH, KR","10/09/2024","CC","09/05/2024","RHMA","6380","H",6.58,"9.9","16.2","1","15.2","G","N","Y",NA,NA,NA,2024-09-05,"2024","09","05","St. Thomas",18.319231,-64.865114
"424","Compass Point","DIRECT INPUT","AJH",NA,"3"" TP","2/22/2023","RHMA","3342","H",13.93,"9.9","23.3","1.4","21.9","G","N","N",NA,"N",NA,2023-02-22,"2023","02","22","St. Thomas",18.319231,-64.865114
"425","Compass Point","DIRECT INPUT","KWG, AJH",NA,"3"" TP","2/17/2023","RHMA","3261","H",17.93,"8","22.7","1.4","21.3","G","Y","N",NA,"N",NA,2023-02-17,"2023","02","17","St. Thomas",18.319231,-64.865114
"426","Compass Point","DIRECT INPUT","KWG, AJH",NA,"3"" TP","2/23/2023","RHMA","3291","H",10.57,"11.2","16.9","1.1","15.8","G","Y","N",NA,"N",NA,2023-02-23,"2023","02","23","St. Thomas",18.319231,-64.865114
"427","Compass Point","DIRECT INPUT","AJH",NA,"3"" TP","2/22/2023","RHMA","3345","H",15.11,"9.9","31.1","1.3","29.8","G","Y","N",NA,"N",NA,2023-02-22,"2023","02","22","St. Thomas",18.319231,-64.865114
"428","Compass Point","DIRECT INPUT","KWG, AJH",NA,"3""TP","02/09/2023","RHMA","3270","H",12.36,"10.3","23.3","1.3","22","G","Y","N",NA,"N",NA,2023-02-09,"2023","02","09","St. Thomas",18.319231,-64.865114
"429","Compass Point","DIRECT INPUT","KWG, AJH",NA,"3""TP","02/09/2023","RHMA","3263","P",16.15,"9.2","32.2","1.6","30.6","G","Y","N",NA,"N",NA,2023-02-09,"2023","02","09","St. Thomas",18.319231,-64.865114
"430","Compass Point","DIRECT INPUT","KWG, AJH",NA,"3"" TP","2/23/2023","RHMA","3280","H",12.1,"10.2","22.2","0","22.2","G","Y","Y","PLUM GONE","N",NA,2023-02-23,"2023","02","23","St. Thomas",18.319231,-64.865114
"431","Compass Point","DIRECT INPUT","AJH",NA,"3"" TP","2/22/2023","RHMA","3348","H",22.18,"9.1","29.1","0","29.1","G","Y","N",NA,"N",NA,2023-02-22,"2023","02","22","St. Thomas",18.319231,-64.865114
"432","Compass Point","HH","HH, KR","10/09/2024","CC","09/05/2024","RHMA","6389","H",11.69,"11.3","23.3","1.5","21.8","G","N","Y",NA,NA,NA,2024-09-05,"2024","09","05","St. Thomas",18.319231,-64.865114
"433","Compass Point","HH","HH, KR","10/09/2024","CC","09/05/2024","RHMA","6390","H",13.04,"10.8","26.1","1.5","24.6","G","N","Y",NA,NA,NA,2024-09-05,"2024","09","05","St. Thomas",18.319231,-64.865114
"434","Compass Point","HH","HH, KR","10/09/2024","CC","09/05/2024","RHMA","6391","H",7.85,"8.9","21.1","0.6","20.5","G","N","Y",NA,NA,NA,2024-09-05,"2024","09","05","St. Thomas",18.319231,-64.865114
"435","Compass Point","HH","HH, KR","10/09/2024","CC","09/05/2024","RHMA","6392","H",11.92,"9.7","24.6","1.5","23.1","G","N","N",NA,NA,NA,2024-09-05,"2024","09","05","St. Thomas",18.319231,-64.865114
"436","Compass Point","HH","HH, KR","10/09/2024","CC","09/05/2024","RHMA","6393","H",12.19,"10.4","22.9","0","22.9","GB","N","Y","DECAP",NA,NA,2024-09-05,"2024","09","05","St. Thomas",18.319231,-64.865114
"437","Compass Point","DIRECT INPUT","KWG, AJH",NA,"3""TP","02/09/2023","RHMA","3261","H",10.59,"8.6","23.3","1.4","21.9","G","Y","Y",NA,"N",NA,2023-02-09,"2023","02","09","St. Thomas",18.319231,-64.865114
"438","Compass Point","Direct Input","LU","11/07/2024","CC","10/27/2024","RHMA","6585","H",14.44,"11.3","24","1.5","22.5","GB","Y","N",NA,NA,NA,2024-10-27,"2024","10","27","St. Thomas",18.319231,-64.865114
"439","Compass Point","DIRECT INPUT","AJH",NA,"3"" TP","2/22/2023","RHMA","3344","H",19.3,"9.1","24.1","1.9","22.2","G","N","N","CURVED","N",NA,2023-02-22,"2023","02","22","St. Thomas",18.319231,-64.865114
"440","Compass Point","DIRECT INPUT","KWG, AJH",NA,"3""TP","02/09/2023","RHMA","3262","H",10.24,"10.9","19.7","1","18.7","G","Y","N",NA,"N",NA,2023-02-09,"2023","02","09","St. Thomas",18.319231,-64.865114
"441","Compass Point","DIRECT INPUT","KWG, AJH",NA,"3"" TP","2/17/2023","RHMA","3262","H",20.9,"9.1","22.9","0","22.9","G","Y","N","TOP LOOKS DEAD","N",NA,2023-02-17,"2023","02","17","St. Thomas",18.319231,-64.865114
"442","Compass Point","DIRECT INPUT","AJH",NA,"3"" TP","2/22/2023","RHMA","3346","H",19.17,"9.1","25.1","0","25.1","G","Y","Y",NA,"N",NA,2023-02-22,"2023","02","22","St. Thomas",18.319231,-64.865114
"443","Compass Point","DIRECT INPUT","KWG, AJH",NA,"3"" TP","2/17/2023","RHMA","3263","H",18.31,"9","21.2","0.9","20.3","B","Y","N",NA,"N",NA,2023-02-17,"2023","02","17","St. Thomas",18.319231,-64.865114
"444","Compass Point","Direct Input","LU","11/07/2024","CC","10/27/2024","RHMA","6604","H",22.22,"12.4","26.8","1.8","25","G","N","N",NA,NA,NA,2024-10-27,"2024","10","27","St. Thomas",18.319231,-64.865114
"445","Compass Point","Direct Input","LU","11/07/2024","CC","10/27/2024","RHMA","6605","H",22.63,"11.1","37.2","1.9","35.3","G","Y","N",NA,NA,NA,2024-10-27,"2024","10","27","St. Thomas",18.319231,-64.865114
"446","Compass Point","Direct Input","KR/MF","11/13/24","CC","10/26/2024","RHMA","6606","H",20.43,"11.8","31.2","1.9","29.3","G","N","Y",NA,NA,NA,2024-10-26,"2024","10","26","St. Thomas",18.319231,-64.865114
"447","Compass Point","Direct Input","KR/MF","11/13/24","CC","10/26/2024","RHMA","6607","H",20.24,"10.4","30.5","2.1","28.4","G","N","N",NA,NA,NA,2024-10-26,"2024","10","26","St. Thomas",18.319231,-64.865114
"448","Compass Point","Direct Input","KR/MF","11/13/24","CC","10/26/2024","RHMA","6608","H",14.61,"9.8","28","1.7","26.3","G","Y","Y",NA,NA,NA,2024-10-26,"2024","10","26","St. Thomas",18.319231,-64.865114
"449","Compass Point","Direct Input","KR/MF","11/13/24","CC","10/27/2024","RHMA","6609","H",22.2,"11.8","34.2","2.3","31.9","G","Y","N",NA,NA,NA,2024-10-27,"2024","10","27","St. Thomas",18.319231,-64.865114
"450","Compass Point","HH","HH, KR","10/09/2024","CC","09/05/2024","RHMA","6394","H",7,"7.2","22.5","1.2","21.3","GB","N","N",NA,NA,NA,2024-09-05,"2024","09","05","St. Thomas",18.319231,-64.865114
"451","Compass Point","HH","HH, KR","10/09/2024","CC","09/05/2024","RHMA","6381","H",6.96,"9.4","17.6","1.1","16.5","G","N","Y",NA,NA,NA,2024-09-05,"2024","09","05","St. Thomas",18.319231,-64.865114
"452","Compass Point","Direct Input","LU","11/07/2024","CC","10/27/2024","RHMA","6586","H",16.24,"11","26.2","0","26.2","G","Y","N",NA,NA,NA,2024-10-27,"2024","10","27","St. Thomas",18.319231,-64.865114
"453","Compass Point","Direct Input","LU","11/07/2024","CC","10/27/2024","RHMA","6587","H",23.82,"12.6","31.9","1.4","30.5","GB","Y","N",NA,NA,NA,2024-10-27,"2024","10","27","St. Thomas",18.319231,-64.865114
"454","Compass Point","Direct Input","LU","11/07/2024","CC","10/27/2024","RHMA","6588","H",21.67,"12.3","30.6","1.7","28.9","G","Y","N",NA,NA,NA,2024-10-27,"2024","10","27","St. Thomas",18.319231,-64.865114
"455","Compass Point","KH","GA","3/22/2023","3""TP","3/17/23","RHMA","3653","H",12.8,"10.8","20.7","1.2","19.5","B","N","N",NA,"C",NA,2023-03-17,"2023","03","17","St. Thomas",18.319231,-64.865114
"456","Compass Point","DIRECT INPUT","AJH",NA,"3"" TP","2/22/2023","RHMA","3347","H",13.25,"9","19.8","0.1","19.7","G","Y","Y",NA,"N",NA,2023-02-22,"2023","02","22","St. Thomas",18.319231,-64.865114
"457","Compass Point","KH","GA","3/22/2023","3""TP","3/17/23","RHMA","3655","H",13.6,"10.5","25.7","1.2","24.5","G","Y","N",NA,"C",NA,2023-03-17,"2023","03","17","St. Thomas",18.319231,-64.865114
"458","Compass Point","KH","TF","3/22/2023","3""TP","3/17/23","RHMA","3656","H",11.79,"10","18.7","1.2","17.5","GB","Y","N",NA,"C",NA,2023-03-17,"2023","03","17","St. Thomas",18.319231,-64.865114
"459","Compass Point","KH","JA","3/22/2023","3""TP","3/17/23","RHMA","3657","H",7,"0.78","17.5","1","16.5","GB","Y","N",NA,"C",NA,2023-03-17,"2023","03","17","St. Thomas",18.319231,-64.865114
"460","Compass Point","DIRECT INPUT","KWG, AJH",NA,"3"" TP","2/23/2023","RHMA","3296","H",14.88,"11","25.7","1.5","24.2","BG","Y","N","PLANT HAS 2 LEAVES!","N",NA,2023-02-23,"2023","02","23","St. Thomas",18.319231,-64.865114
"461","Compass Point","DIRECT INPUT","KWG, AJH",NA,"3"" TP","2/23/2023","RHMA","3297","H",9.13,"10.3","17.8","0.9","16.9","G","Y","N","HERB","N",NA,2023-02-23,"2023","02","23","St. Thomas",18.319231,-64.865114
"462","Compass Point","DIRECT INPUT","KWG, AJH",NA,"3"" TP","2/23/2023","RHMA","3298","H",8.75,"10.1","17.5","1.2","16.3","G","Y","N","PLUM SLIGHTLY BROWN","N",NA,2023-02-23,"2023","02","23","St. Thomas",18.319231,-64.865114
"463","Compass Point","Direct Input","KR/MF","11/13/24","CC","10/27/2024","RHMA","6610","H",21.16,"11.1","33","2.5","30.5","G","Y","N",NA,NA,NA,2024-10-27,"2024","10","27","St. Thomas",18.319231,-64.865114
"464","Compass Point","DIRECT INPUT","KWG, AJH",NA,"3"" TP","2/23/2023","RHMA","3300","H",13.78,"11.9","21.5","2","19.5","G","Y","N","OTS OF ROOTS, PLUM BROWN","N",NA,2023-02-23,"2023","02","23","St. Thomas",18.319231,-64.865114
"465","Compass Point","HH","HH, KR","10/09/2024","CC","09/05/2024","RHMA","6382","H",13.77,"11.1","24.3","1.4","22.9","G","N","N",NA,NA,NA,2024-09-05,"2024","09","05","St. Thomas",18.319231,-64.865114
"466","Compass Point","HH","HH, KR","10/09/2024","CC","09/05/2024","RHMA","6383","H",18.22,"11.3","30.7","0.1","30.6","G","Y","Y",NA,NA,NA,2024-09-05,"2024","09","05","St. Thomas",18.319231,-64.865114
"467","Compass Point","DIRECT INPUT","KWG, AJH",NA,"3"" TP","2/23/2023","RHMA","3290","H",5.84,"9.4","14","0.8","13.2","G","Y","N",NA,"N",NA,2023-02-23,"2023","02","23","St. Thomas",18.319231,-64.865114
"468","Compass Point","DIRECT INPUT","KWG, AJH",NA,"3"" TP","2/23/2023","RHMA","3304","H",12.12,"10.4","20.4","1.3","19.1","G","Y","N",NA,"N",NA,2023-02-23,"2023","02","23","St. Thomas",18.319231,-64.865114
"469","Compass Point","KH","TF","3/22/2023","3""TP","3/17/23","RHMA","3654","H",15.64,"11.6","21.7","1.2","20.5","B","Y","N",NA,"C",NA,2023-03-17,"2023","03","17","St. Thomas",18.319231,-64.865114
"470","Compass Point","Direct Input","LU","11/07/2024","CC","10/27/2024","RHMA","6590","H",27.84,"12.5","36.5","2","34.5","G","Y","N",NA,NA,NA,2024-10-27,"2024","10","27","St. Thomas",18.319231,-64.865114
"471","Compass Point","Direct Input","LU","11/07/2024","CC","10/27/2024","RHMA","6591","H",23.34,"12.1","35","1.9","33.1","G","N","N",NA,NA,NA,2024-10-27,"2024","10","27","St. Thomas",18.319231,-64.865114
"472","Compass Point","DIRECT INPUT","AJH",NA,"3"" TP","2/22/2023","RHMA","3349","H",10.51,"8.9","18.5","0.6","17.9","G","Y","Y",NA,"N",NA,2023-02-22,"2023","02","22","St. Thomas",18.319231,-64.865114
"473","Compass Point","DIRECT INPUT","AJH",NA,"3"" TP","2/22/2023","RHMA","3350","H",19.27,"8","28.3","1","27.3","GB","Y","N",NA,"N",NA,2023-02-22,"2023","02","22","St. Thomas",18.319231,-64.865114
"474","Compass Point","DIRECT INPUT","AJH",NA,"3"" TP","2/22/2023","RHMA","3351","H",11.91,"8.9","21.4","1.3","20.1","GB","N","N",NA,"N",NA,2023-02-22,"2023","02","22","St. Thomas",18.319231,-64.865114
"475","Compass Point","DIRECT INPUT","AJH",NA,"3"" TP","2/22/2023","RHMA","3352","H",23.66,"9.1","30","0.8","29.2","G","N","N",NA,"N",NA,2023-02-22,"2023","02","22","St. Thomas",18.319231,-64.865114
"476","Compass Point","DIRECT INPUT","KWG, AJH",NA,"3"" TP","2/23/2023","RHMA","3299","H",5.75,"9.4","14.8","0.8","14","G","Y","N",NA,"N",NA,2023-02-23,"2023","02","23","St. Thomas",18.319231,-64.865114
"477","Compass Point","DIRECT INPUT","KWG, AJH",NA,"3"" TP","2/20/2023","RHMA","3273","H",26.62,"9","27.5","0","27.5","G","Y","Y","PLUMULE LOOKS DEAD","N",NA,2023-02-20,"2023","02","20","St. Thomas",18.319231,-64.865114
"478","Compass Point","DIRECT INPUT","KWG, AJH",NA,"3"" TP","2/23/2023","RHMA","3301","H",7.58,"8.5","17.1","1.1","16","G","Y","N",NA,"N",NA,2023-02-23,"2023","02","23","St. Thomas",18.319231,-64.865114
"479","Compass Point","DIRECT INPUT","KWG, AJH",NA,"3"" TP","2/23/2023","RHMA","3302","H",6.55,"8.2","15.2","0.9","14.3","G","Y","N",NA,"N",NA,2023-02-23,"2023","02","23","St. Thomas",18.319231,-64.865114
"480","Compass Point","DIRECT INPUT","KWG, AJH",NA,"3"" TP","2/23/2023","RHMA","3303","H",12.57,"10.9","22.8","1.4","21.4","G","Y","N",NA,"N",NA,2023-02-23,"2023","02","23","St. Thomas",18.319231,-64.865114
"481","Compass Point",NA,"LU","6/24/2024","CC","06/11/2024","RHMA","5961","H",22.86,NA,NA,NA,"14.36","G","N",NA,"FVINP SKIP","C",NA,2024-06-11,"2024","06","11","St. Thomas",18.319231,-64.865114
"482","Compass Point","Direct Input","LU","11/07/2024","CC","10/27/2024","RHMA","6589","H",27.68,"12.8","36.4","1.9","34.5","G","Y","N",NA,NA,NA,2024-10-27,"2024","10","27","St. Thomas",18.319231,-64.865114
"483","Compass Point",NA,"LU","6/24/2024","CC","06/11/2024","RHMA","5963","H",13.59,NA,NA,NA,"24.13","G","N",NA,"FVINP SKIP","C",NA,2024-06-11,"2024","06","11","St. Thomas",18.319231,-64.865114
"484","Compass Point","DIRECT INPUT","KWG, AJH",NA,"3"" TP","2/21/2023","RHMA","3320","H",10.36,"10.5","20.8","1.3","19.5","G","Y","N",NA,"N",NA,2023-02-21,"2023","02","21","St. Thomas",18.319231,-64.865114
"485","Compass Point","DIRECT INPUT","KWG, AJH",NA,"3"" TP","2/21/2023","RHMA","3321","H",34.67,"15.6","28","0","28","G","Y","N","PLUM GONE, SNAIL EGGS","N",NA,2023-02-21,"2023","02","21","St. Thomas",18.319231,-64.865114
"486","Compass Point","DIRECT INPUT","AJH",NA,"3"" TP","2/21/2023","RHMA","3322","H",31.63,"14.5","29.2","1","28.2","G","Y","N","SNAIL EGGS, CURVED, PLUM DEAD","N",NA,2023-02-21,"2023","02","21","St. Thomas",18.319231,-64.865114
"487","Compass Point","DIRECT INPUT","AJH",NA,"3"" TP","2/21/2023","RHMA","3323","H",15.56,"11.8","22.3","1.3","21","G","Y","N","SNAIL EGGS","N",NA,2023-02-21,"2023","02","21","St. Thomas",18.319231,-64.865114
"488","Compass Point","DIRECT INPUT","AJH",NA,"3"" TP","2/21/2023","RHMA","3324","H",12.31,"10.4","22.2","1","21.2","G","Y","N",NA,"N",NA,2023-02-21,"2023","02","21","St. Thomas",18.319231,-64.865114
"489","Compass Point","DIRECT INPUT","AJH",NA,"3"" TP","2/21/2023","RHMA","3325","H",21.64,"13.3","25.9","1.4","24.5","G","Y","N",NA,"N",NA,2023-02-21,"2023","02","21","St. Thomas",18.319231,-64.865114
"490","Compass Point","DIRECT INPUT","AJH",NA,"3"" TP","2/21/2023","RHMA","3326","H",9.54,"9.2","19.2","1.1","18.1","B","Y","N",NA,"N",NA,2023-02-21,"2023","02","21","St. Thomas",18.319231,-64.865114
"491","Compass Point","DIRECT INPUT","AJH",NA,"3"" TP","2/21/2023","RHMA","3327","H",25.21,"12.5","30.4","1.3","29.1","G","Y","N",NA,"N",NA,2023-02-21,"2023","02","21","St. Thomas",18.319231,-64.865114
"492","Compass Point","DIRECT INPUT","AJH",NA,"3"" TP","2/21/2023","RHMA","3328","H",19.09,"12.3","25.8","1.3","24.5","G","Y","N",NA,"N",NA,2023-02-21,"2023","02","21","St. Thomas",18.319231,-64.865114
"493","Compass Point","DIRECT INPUT","AJH",NA,"3"" TP","2/21/2023","RHMA","3329","H",17.13,"11","29","1.5","27.5","G","Y","N","PLUM HALF BROWN","N",NA,2023-02-21,"2023","02","21","St. Thomas",18.319231,-64.865114
"494","Compass Point","DIRECT INPUT","AJH",NA,"3"" TP","2/21/2023","RHMA","3330","H",12.75,"10.4","20.8","1.3","19.5","G","Y","N",NA,"N",NA,2023-02-21,"2023","02","21","St. Thomas",18.319231,-64.865114
"495","Compass Point","DIRECT INPUT","AJH",NA,"3"" TP","2/21/2023","RHMA","3331","H",14.66,"11.5","23.6","1.6","22","G","Y","N",NA,"N",NA,2023-02-21,"2023","02","21","St. Thomas",18.319231,-64.865114
"496","Compass Point","DIRECT INPUT","AJH",NA,"3"" TP","2/21/2023","RHMA","3332","H",19.41,"11.4","25.1","0.1","25","G","Y","N","SNAIL EGGS","N",NA,2023-02-21,"2023","02","21","St. Thomas",18.319231,-64.865114
"497","Compass Point","DIRECT INPUT","AJH",NA,"3"" TP","2/21/2023","RHMA","3333","H",24.51,"12","30","0","30","G","Y","N","SNAIL EGGS, NO PLUM","N",NA,2023-02-21,"2023","02","21","St. Thomas",18.319231,-64.865114
"498","Compass Point","DIRECT INPUT","AJH",NA,"3"" TP","2/21/2023","RHMA","3334","H",18.49,"12.1","23.3","1.2","22.1","G","Y","N",NA,"N",NA,2023-02-21,"2023","02","21","St. Thomas",18.319231,-64.865114
"499","Compass Point","DIRECT INPUT","AJH",NA,"3"" TP","2/21/2023","RHMA","3335","H",21.53,"12.2","25.7","0","25.7","G","Y","N","CURVED, NO PLUM","N",NA,2023-02-21,"2023","02","21","St. Thomas",18.319231,-64.865114
"500","Compass Point","DIRECT INPUT","AJH",NA,"3"" TP","2/21/2023","RHMA","3336","H",24.64,"13.5","30.6","1.5","29.1","G","Y","N",NA,"N",NA,2023-02-21,"2023","02","21","St. Thomas",18.319231,-64.865114
"501","Compass Point","DIRECT INPUT","AJH",NA,"3"" TP","02/09/2023","RHMA","3231","S",25.64,"11.2","33.6","1.6","32","G","Y","Y",NA,"N",NA,2023-02-09,"2023","02","09","St. Thomas",18.319231,-64.865114
"502","Compass Point","DIRECT INPUT","AJH",NA,"3""TP","02/09/2023","RHMA","3232","H",13.78,"10.2","25.3","1.7","23.6","G","N","N","DECAP ON BOTTOM","N",NA,2023-02-09,"2023","02","09","St. Thomas",18.319231,-64.865114
"503","Compass Point","DIRECT INPUT","AJH",NA,"3"" TP","02/09/2023","RHMA","3233","H",23.06,"11","32","1.1","34.2","G","Y","Y",NA,"N",NA,2023-02-09,"2023","02","09","St. Thomas",18.319231,-64.865114
"504","Compass Point","DIRECT INPUT","AJH",NA,"3""TP","02/09/2023","RHMA","3234","H",27.47,"12","40.3","1.8","38.5","G",NA,"N",NA,"N",NA,2023-02-09,"2023","02","09","St. Thomas",18.319231,-64.865114
"505","Compass Point","DIRECT INPUT","AJH",NA,"3"" TP","02/09/2023","RHMA","3235","H",19.8,"10.9","27.3","1.3","26","G","Y","N",NA,"N",NA,2023-02-09,"2023","02","09","St. Thomas",18.319231,-64.865114
"506","Compass Point","DIRECT INPUT","AJH",NA,"3""TP","02/09/2023","RHMA","3236","H",18.9,"12.1","27","1.2","25.8","G",NA,"N",NA,"N",NA,2023-02-09,"2023","02","09","St. Thomas",18.319231,-64.865114
"507","Compass Point","DIRECT INPUT","AJH",NA,"3"" TP","02/09/2023","RHMA","3237","H",9.91,"8.1","13.8","0.8","13","G","N","N",NA,"N",NA,2023-02-09,"2023","02","09","St. Thomas",18.319231,-64.865114
"508","Compass Point","DIRECT INPUT","AJH",NA,"3""TP","02/09/2023","RHMA","3238","H",18.41,"11.5","28.2","1.2","27","G",NA,"N",NA,"N",NA,2023-02-09,"2023","02","09","St. Thomas",18.319231,-64.865114
"509","Compass Point","DIRECT INPUT","AJH",NA,"3"" TP","02/09/2023","RHMA","3239","H",8.17,"9.3","19.1","1","18.1","G","Y","N","TIP IS BLACK","N",NA,2023-02-09,"2023","02","09","St. Thomas",18.319231,-64.865114
"510","Compass Point","DIRECT INPUT","AJH",NA,"3""TP","02/09/2023","RHMA","3240","H",14.08,"10","29","1.4","27.6","G",NA,"N",NA,"N",NA,2023-02-09,"2023","02","09","St. Thomas",18.319231,-64.865114
"511","Compass Point","DIRECT INPUT","AJH",NA,"3"" TP","02/09/2023","RHMA","3241","H",17.88,"11.5","28.4","1.1","27.3","GB","N","Y",NA,"N",NA,2023-02-09,"2023","02","09","St. Thomas",18.319231,-64.865114
"512","Compass Point","DIRECT INPUT","KWG, AJH",NA,"3"" TP","2/17/2023","RHMA","3270","H",27.67,"10.2","25.9","0","25.9","G","Y","Y",NA,"N",NA,2023-02-17,"2023","02","17","St. Thomas",18.319231,-64.865114
"513","Compass Point","DIRECT INPUT","KWG, AJH",NA,"3""TP","02/09/2023","RHMA","3271","H",15.51,"11.2","22.9","1","21.9","G","Y","N",NA,"N",NA,2023-02-09,"2023","02","09","St. Thomas",18.319231,-64.865114
"514","Compass Point","DIRECT INPUT","KWG, AJH",NA,"3"" TP","2/18/2023","RHMA","3271","H",19,"9.1","18.3","0.3","18","BG","Y","N",NA,"N",NA,2023-02-18,"2023","02","18","St. Thomas",18.319231,-64.865114
"515","Compass Point","DIRECT INPUT","KWG, AJH",NA,"3""TP","02/09/2023","RHMA","3272","H",16.86,"10.5","23.8","0.9","22.9","G","Y","N",NA,"N",NA,2023-02-09,"2023","02","09","St. Thomas",18.319231,-64.865114
"516","Compass Point","DIRECT INPUT","AJH",NA,"3"" TP","2/22/2023","RHMA","3353","H",16.18,"8.9","29.2","1.2","28","G","N","N",NA,"N",NA,2023-02-22,"2023","02","22","St. Thomas",18.319231,-64.865114
"517","Compass Point","DIRECT INPUT","AJH",NA,"3"" TP","2/22/2023","RHMA","3354","H",16.71,"8","25.4","0","25.4","GB","N","N",NA,"N",NA,2023-02-22,"2023","02","22","St. Thomas",18.319231,-64.865114
"518","Compass Point","DIRECT INPUT","KWG, AJH",NA,"3"" TP","2/21/2023","RHMA","3274","H",20.39,"9.1","16.9","0.9","16","G","Y","N",NA,"N",NA,2023-02-21,"2023","02","21","St. Thomas",18.319231,-64.865114
"519","Compass Point","DIRECT INPUT","KWG, AJH",NA,"3"" TP","2/22/2023","RHMA","3275","H",21.75,"9.1","21.9","0.9","21","G","Y","Y",NA,"N",NA,2023-02-22,"2023","02","22","St. Thomas",18.319231,-64.865114
"520","Compass Point","DIRECT INPUT","KWG, AJH",NA,"3"" TP","2/23/2023","RHMA","3276","H",18.8,"9.1","17.4","0","17.4","G","Y","Y",NA,"N",NA,2023-02-23,"2023","02","23","St. Thomas",18.319231,-64.865114
"521","Compass Point","DIRECT INPUT","KWG, AJH",NA,"3"" TP","2/24/2023","RHMA","3277","H",27.48,"9.1","24.7","0","24.7","G","Y","Y",NA,"N",NA,2023-02-24,"2023","02","24","St. Thomas",18.319231,-64.865114
"522","Compass Point","DIRECT INPUT","KWG, AJH",NA,"3"" TP","2/23/2023","RHMA","3278","H",8.13,"9","23.5","1.4","22.1","G","Y","Y",NA,"N",NA,2023-02-23,"2023","02","23","St. Thomas",18.319231,-64.865114
"523","Compass Point",NA,"LU","6/24/2024","CC","06/11/2024","RHMA","5962","H",15.97,NA,NA,NA,"28.58","G","N",NA,"FVINP SKIP","C",NA,2024-06-11,"2024","06","11","St. Thomas",18.319231,-64.865114
"524","Compass Point","DIRECT INPUT","KWG, AJH",NA,"3""TP","02/09/2023","RHMA","3254","H",20.7,"12","29.3","1.8","27.5","G",NA,"N",NA,"N",NA,2023-02-09,"2023","02","09","St. Thomas",18.319231,-64.865114
"525","Compass Point","DIRECT INPUT","KWG, AJH",NA,"3"" TP","02/09/2023","RHMA","3255","H",9.56,"10.3","19.7","1.3","18.4","G","Y","Y",NA,"N",NA,2023-02-09,"2023","02","09","St. Thomas",18.319231,-64.865114
"526","Compass Point","DIRECT INPUT","KWG, AJH",NA,"3""TP","02/09/2023","RHMA","3256","H",17.51,"12","26.3","1.5","24.8","G",NA,"N",NA,"N",NA,2023-02-09,"2023","02","09","St. Thomas",18.319231,-64.865114
"527","Compass Point","DIRECT INPUT","KWG, AJH",NA,"3"" TP","02/09/2023","RHMA","3257","H",9.59,"8.8","23.2","1.2","22","G","Y","Y",NA,"N",NA,2023-02-09,"2023","02","09","St. Thomas",18.319231,-64.865114
"528","Compass Point","HH","HH, KR","10/09/2024","CC","09/05/2024","RHMA","6377","H",7.82,"9.4","21.6","1.4","20.2","G","N","Y",NA,NA,NA,2024-09-05,"2024","09","05","St. Thomas",18.319231,-64.865114
"529","Compass Point","HH","HH, KR","10/09/2024","CC","09/05/2024","RHMA","6378","H",9.62,"9.5","19.3","1","18.3","G","N","Y",NA,NA,NA,2024-09-05,"2024","09","05","St. Thomas",18.319231,-64.865114
"530","Compass Point","HH","HH, KR","10/09/2024","CC","09/05/2024","RHMA","6379","H",8.25,"8.9","17.5","0","17.5","GB","N","N","DECAP",NA,NA,2024-09-05,"2024","09","05","St. Thomas",18.319231,-64.865114
"531","Compass Point","DIRECT INPUT","AJH",NA,"3"" TP","2/22/2023","RHMA","3366","H",14.19,"9.1","24.3","0","24.3","G","Y","Y",NA,"N",NA,2023-02-22,"2023","02","22","St. Thomas",18.319231,-64.865114
"532","Compass Point","DIRECT INPUT","AJH",NA,"3"" TP","2/22/2023","RHMA","3367","H",28.33,"10.2","31.6","1.2","30.4","GB","Y","N","HERB, 2 SET OF LEAVES FORMED","N",NA,2023-02-22,"2023","02","22","St. Thomas",18.319231,-64.865114
"533","Compass Point","DIRECT INPUT","AJH",NA,"3"" TP","2/22/2023","RHMA","3368","H",19.31,"10.2","20.3","0","20.3","G","Y","Y",NA,"N",NA,2023-02-22,"2023","02","22","St. Thomas",18.319231,-64.865114
"534","Compass Point","DIRECT INPUT","AJH",NA,"3"" TP","2/22/2023","RHMA","3369","H",14.7,"9.1","20.7","1.4","19.3","G","Y","Y",NA,"N",NA,2023-02-22,"2023","02","22","St. Thomas",18.319231,-64.865114
"535","Compass Point","HH","HH, KR","10/09/2024","CC","09/05/2024","RHMA","6384","H",10.56,"9.8","24.5","1.5","23","G","N","Y",NA,NA,NA,2024-09-05,"2024","09","05","St. Thomas",18.319231,-64.865114
"536","Compass Point","HH","HH, KR","10/09/2024","CC","09/05/2024","RHMA","6385","H",8.36,"9.6","19.5","1.2","18.3","G","N","Y",NA,NA,NA,2024-09-05,"2024","09","05","St. Thomas",18.319231,-64.865114
"537","Compass Point","HH","HH, KR","10/09/2024","CC","09/05/2024","RHMA","6386","H",8.75,"9.2","24.1","1.3","22.8","B","N","Y",NA,NA,NA,2024-09-05,"2024","09","05","St. Thomas",18.319231,-64.865114
"538","Compass Point","HH","HH, KR","10/09/2024","CC","09/05/2024","RHMA","6387","H",7.5,"8.3","20.1","0.4","19.7","G","N","Y",NA,NA,NA,2024-09-05,"2024","09","05","St. Thomas",18.319231,-64.865114
"539","Compass Point","HH","HH, KR","10/09/2024","CC","09/05/2024","RHMA","6388","H",16.14,"10.3","25.8","1.6","24.2","G","N","N",NA,NA,NA,2024-09-05,"2024","09","05","St. Thomas",18.319231,-64.865114
"540","Compass Point","ZDB","AJH, AND, KWG",NA,"3""","09/02/2022","RHMA","2167","H",32.79,"13.3","37.3","1.7","35.6","G","Y","Y",NA,"N",NA,2022-09-02,"2022","09","02","St. Thomas",18.319231,-64.865114
"541","Compass Point","ZDB","AJH, AND, KWG",NA,"3""","09/02/2022","RHMA","2168","H",14.32,"11","24.8","1.4","23.4","G","Y","Y","BITE","N",NA,2022-09-02,"2022","09","02","St. Thomas",18.319231,-64.865114
"542","Compass Point","Direct Input","LU","11/07/2024","CC","10/27/2024","RHMA","6581","H",39.21,"14.5","35.6","0.5","35.1","G","Y","N",NA,NA,NA,2024-10-27,"2024","10","27","St. Thomas",18.319231,-64.865114
"543","Compass Point","Direct Input","LU","11/07/2024","CC","10/27/2024","RHMA","6582","H",20.26,"13.1","28.1","1.1","27","G","Y","Y",NA,NA,NA,2024-10-27,"2024","10","27","St. Thomas",18.319231,-64.865114
"544","Compass Point","Direct Input","LU","11/07/2024","CC","10/27/2024","RHMA","6583","H",12.62,"9.8","27.1","1.1","26","G","Y","Y",NA,NA,NA,2024-10-27,"2024","10","27","St. Thomas",18.319231,-64.865114
"545","Compass Point","Direct Input","LU","11/07/2024","CC","10/27/2024","RHMA","6584","H",21.84,"13.4","27.9","2.1","25.8","G","Y","N",NA,NA,NA,2024-10-27,"2024","10","27","St. Thomas",18.319231,-64.865114
"546","Compass Point","DIRECT INPUT","AJH",NA,"3"" TP","2/22/2023","RHMA","3380","H",10.79,"6.8","26","1.6","24.4","G","N","N",NA,"N",NA,2023-02-22,"2023","02","22","St. Thomas",18.319231,-64.865114
"547","Compass Point","DIRECT INPUT","AJH",NA,"3"" TP","2/22/2023","RHMA","3381","H",19.04,"9.1","29.9","1.5","28.4","G","N","N",NA,"N",NA,2023-02-22,"2023","02","22","St. Thomas",18.319231,-64.865114
"548","Compass Point","DIRECT INPUT","AJH",NA,"3"" TP","2/21/2023","RHMA","3382","H",17.47,"13.5","21.8","1.3","20.5","G","Y","N",NA,"N",NA,2023-02-21,"2023","02","21","St. Thomas",18.319231,-64.865114
"549","Compass Point","DIRECT INPUT","KWG, AJH",NA,"3""TP","3/25/23","RHMA","3627","H",10.78,"10","23","0.7","22.3","G","Y","N",NA,NA,NA,2023-03-25,"2023","03","25","St. Thomas",18.319231,-64.865114
"550","Compass Point","DIRECT INPUT","KWG, AJH",NA,"3""TP","3/25/23","RHMA","3628","H",11,"8.6","24.8","0.8","24","G","Y","N",NA,NA,NA,2023-03-25,"2023","03","25","St. Thomas",18.319231,-64.865114
"551","Compass Point","DIRECT INPUT","KWG, AJH",NA,"3""TP","3/25/23","RHMA","3629","H",20.68,"11.6","32","1","31","G","Y","N",NA,NA,NA,2023-03-25,"2023","03","25","St. Thomas",18.319231,-64.865114
"552","Compass Point","DIRECT INPUT","KWG, AJH",NA,"3""TP","02/09/2023","RHMA","3242","H",21.32,"11.2","32.8","0","32.8","G",NA,"N","DECAP","N",NA,2023-02-09,"2023","02","09","St. Thomas",18.319231,-64.865114
"553","Compass Point","DIRECT INPUT","KWG, AJH",NA,"3"" TP","02/09/2023","RHMA","3243","H",19.67,"12.2","26.9","1","25.9","GB","Y","Y",NA,"N",NA,2023-02-09,"2023","02","09","St. Thomas",18.319231,-64.865114
"554","Compass Point","DIRECT INPUT","KWG, AJH",NA,"3""TP","02/09/2023","RHMA","3244","S",23.22,"11.5","37","1.5","35.5","G",NA,"N",NA,"N",NA,2023-02-09,"2023","02","09","St. Thomas",18.319231,-64.865114
"555","Compass Point","DIRECT INPUT","KWG, AJH",NA,"3"" TP","02/09/2023","RHMA","3245","H",17.45,"10.8","28.5","1.1","27.4","GB","Y","Y",NA,"N",NA,2023-02-09,"2023","02","09","St. Thomas",18.319231,-64.865114
"556","Compass Point","DIRECT INPUT","KWG, AJH",NA,"3"" TP","2/19/2023","RHMA","3272","H",25.25,"9.1","25.1","0.1","25","GB","Y","Y",NA,"N",NA,2023-02-19,"2023","02","19","St. Thomas",18.319231,-64.865114
"557","Compass Point","DIRECT INPUT","KWG, AJH",NA,"3""TP","02/09/2023","RHMA","3273","H",23.09,"12.2","29.3","1.3","28","GB","Y","N",NA,"N",NA,2023-02-09,"2023","02","09","St. Thomas",18.319231,-64.865114
"558","Compass Point","DIRECT INPUT","KWG, AJH",NA,"3""TP","3/25/23","RHMA","3638","H",13.5,"11","25.6","1.7","23.9","G","Y","N",NA,NA,NA,2023-03-25,"2023","03","25","St. Thomas",18.319231,-64.865114
"559","Compass Point","DIRECT INPUT","KWG, AJH",NA,"3""TP","3/25/23","RHMA","3639","H",17.41,"11.8","26.6","1.3","25.3","G","Y","N",NA,NA,NA,2023-03-25,"2023","03","25","St. Thomas",18.319231,-64.865114
"560","Compass Point","DIRECT INPUT","KWG, AJH",NA,"3""TP","3/25/23","RHMA","3640","H",12.63,"10.4","27.5","0.9","26.6","P","Y","N","PINNK!!!!!!!!",NA,"ITS BRITTANY BEOTCH.",2023-03-25,"2023","03","25","St. Thomas",18.319231,-64.865114
"561","Compass Point","KH","KWG, AJH",NA,"3""TP","3/17/23","RHMA","3641","H",20.9,"11.6","29.7","1.2","28.5","G","Y","N","ALL SAINTS CATHEDRAL SCHOOL","C",NA,2023-03-17,"2023","03","17","St. Thomas",18.319231,-64.865114
"562","Compass Point","KH","KWG, AJH",NA,"3""TP","3/17/23","RHMA","3642","H",14.55,"12","22","1","21","G","Y","Y",NA,"C",NA,2023-03-17,"2023","03","17","St. Thomas",18.319231,-64.865114
"563","Compass Point","KH","KWG, AJH",NA,"3""TP","3/17/23","RHMA","3643","H",14.38,"11.1","23.7","1.5","22.2","G","Y","N",NA,"C",NA,2023-03-17,"2023","03","17","St. Thomas",18.319231,-64.865114
"564","Compass Point","Direct Input","LU","11/07/2024","CC","10/27/2024","RHMA","6603","H",21.86,"12.6","28.8","1.9","26.9","G","Y","N",NA,NA,NA,2024-10-27,"2024","10","27","St. Thomas",18.319231,-64.865114
"565","Compass Point","LG","LG, AJH","10/04/2023","3"" TP","09/28/2023","RHMA","4726","H",14.82,"9.3","21.8","1.3","20.5","G","Y","N",NA,"N",NA,2023-09-28,"2023","09","28","St. Thomas",18.319231,-64.865114
"566","Compass Point","DIRECT INPUT","KWG, AJH",NA,"3"" TP","2/23/2023","RHMA","3279","H",7,"10","16","1.1","14.9","G","Y","Y",NA,"N",NA,2023-02-23,"2023","02","23","St. Thomas",18.319231,-64.865114
"567","Compass Point","LG","LG, AJH","10/04/2023","3"" TP","09/28/2023","RHMA","4727","H",26.78,"11.2","35.8","2","33.8","G","Y","N",NA,"N",NA,2023-09-28,"2023","09","28","St. Thomas",18.319231,-64.865114
"568","Compass Point","ES","ES","8/29/2024","CC","06/11/2024","RHMA","6092","H",13.68,"9.8","31.2","5.4","25.8","G/B","Y","Y",NA,"N",NA,2024-06-11,"2024","06","11","St. Thomas",18.319231,-64.865114
"569","Compass Point","DIRECT INPUT","KWG, AJH",NA,"3"" TP","2/23/2023","RHMA","3282","H",8.23,"10.2","17.2","1.2","16","G","Y","Y",NA,"N",NA,2023-02-23,"2023","02","23","St. Thomas",18.319231,-64.865114
"570","Compass Point","DIRECT INPUT","KWG, AJH",NA,"3"" TP","2/23/2023","RHMA","3283","H",19.2,"12.5","24","0","24","G","Y","Y","PLUM GONE","N",NA,2023-02-23,"2023","02","23","St. Thomas",18.319231,-64.865114
"571","Compass Point","DIRECT INPUT","KWG, AJH",NA,"3"" TP","2/23/2023","RHMA","3284","H",8.2,"8.7","19","1","18","GB","Y","Y",NA,"N",NA,2023-02-23,"2023","02","23","St. Thomas",18.319231,-64.865114
"572","Compass Point","Direct Input","KR/MF","11/13/24","CC","10/27/2024","RHMA","6611","H",23.78,"10.4","36.2","2.6","33.6","G","Y","N",NA,NA,NA,2024-10-27,"2024","10","27","St. Thomas",18.319231,-64.865114
"573","Compass Point",NA,"LU","6/24/2024","CC","06/11/2024","RHMA","5968","H",8.14,NA,NA,NA,"27","G","N",NA,"FVINP SKIP","C",NA,2024-06-11,"2024","06","11","St. Thomas",18.319231,-64.865114
"574","Compass Point",NA,"LU","6/24/2024","CC","06/11/2024","RHMA","5969","H",14.38,NA,NA,NA,"26","G","N",NA,"FVINP SKIP","C",NA,2024-06-11,"2024","06","11","St. Thomas",18.319231,-64.865114
"575","Compass Point",NA,"LU","6/24/2024","CC","06/11/2024","RHMA","5970","H",12.47,NA,NA,NA,"21.4","G","N",NA,"FVINP SKIP","C",NA,2024-06-11,"2024","06","11","St. Thomas",18.319231,-64.865114
"576","Compass Point",NA,"LU","6/24/2024","CC","06/11/2024","RHMA","5971","H",10.82,NA,NA,NA,"22.7","G","N",NA,"FVINP SKIP","C",NA,2024-06-11,"2024","06","11","St. Thomas",18.319231,-64.865114
"577","Compass Point",NA,"LU","6/24/2024","CC","06/11/2024","RHMA","5972","H",15.73,NA,NA,NA,"28","G","N",NA,"FVINP SKIP","C",NA,2024-06-11,"2024","06","11","St. Thomas",18.319231,-64.865114
"578","Compass Point",NA,"LU","6/24/2024","CC","06/11/2024","RHMA","5973","H",10.31,NA,NA,NA,"22","G","N",NA,"FVINP SKIP","C",NA,2024-06-11,"2024","06","11","St. Thomas",18.319231,-64.865114
"579","Compass Point",NA,"LU","6/24/2024","CC","06/11/2024","RHMA","5974","H",13.5,NA,NA,NA,"26","G","N",NA,"FVINP SKIP","C",NA,2024-06-11,"2024","06","11","St. Thomas",18.319231,-64.865114
"580","Compass Point",NA,"LU","6/24/2024","CC","06/11/2024","RHMA","5975","H",11.58,NA,NA,NA,"20.5","G","N",NA,"FVINP SKIP","C",NA,2024-06-11,"2024","06","11","St. Thomas",18.319231,-64.865114
"581","Compass Point","KH","DB","3/22/2023","3""TP","3/17/23","RHMA","3658","H",5.46,"0.76","15.5","1","14.5","GB","N","Y","PLUM DECAP","C",NA,2023-03-17,"2023","03","17","St. Thomas",18.319231,-64.865114
"582","Compass Point","KH","LV","3/22/2023","3""TP","3/17/23","RHMA","3659","H",6.01,"0.89","19.7","0.8","18.9","G","N","Y",NA,"C",NA,2023-03-17,"2023","03","17","St. Thomas",18.319231,-64.865114
"583","Compass Point","KH","CP","3/22/2023","3""TP","3/17/23","RHMA","3660","H",12.33,"8.2","22.5","1","21.5","GB","Y","Y",NA,"C",NA,2023-03-17,"2023","03","17","St. Thomas",18.319231,-64.865114
"584","Compass Point","KH","LW","3/22/2023","3""TP","3/17/23","RHMA","3661","H",9.31,"7.3","23","1","22","GB","Y","N",NA,"C",NA,2023-03-17,"2023","03","17","St. Thomas",18.319231,-64.865114
"585","Compass Point","KH","LW","3/22/2023","3""TP","3/17/23","RHMA","3662","H",9.32,"6.7","20.6","1.1","19.5","GB","Y","N",NA,"C",NA,2023-03-17,"2023","03","17","St. Thomas",18.319231,-64.865114
"586","Compass Point","KH","CD","3/22/2023","3""TP","3/17/23","RHMA","3663","H",6.79,"7.4","14","0.5","13.5","GB","Y","N",NA,"C",NA,2023-03-17,"2023","03","17","St. Thomas",18.319231,-64.865114
"587","Compass Point","KH","JR","3/22/2023","3""TP","3/17/23","RHMA","3664","H",8.46,"6.6","20","1","19","GB","Y","Y",NA,"C",NA,2023-03-17,"2023","03","17","St. Thomas",18.319231,-64.865114
"588","Compass Point","KH","TS","3/22/2023","3""TP","3/17/23","RHMA","3665","H",6.61,"6.6","19.8","1","18.8","GB","Y","Y",NA,"C",NA,2023-03-17,"2023","03","17","St. Thomas",18.319231,-64.865114
"589","Compass Point","KH","KA","3/22/2023","3""TP","3/17/23","RHMA","3666","H",17.4,"11.5","21.6","1.3","20.3","B","Y","N",NA,"C",NA,2023-03-17,"2023","03","17","St. Thomas",18.319231,-64.865114
"590","Compass Point","KH","KA","3/22/2023","3""TP","3/17/23","RHMA","3667","H",8.89,"8.5","19.1","0.9","18.2","GB","N","N",NA,"C",NA,2023-03-17,"2023","03","17","St. Thomas",18.319231,-64.865114
"591","Compass Point","DIRECT INPUT","KWG, AJH",NA,"3"" TP","2/23/2023","RHMA","3305","H",6.39,"9.2","15","0.9","14.1","G","Y","N",NA,"N",NA,2023-02-23,"2023","02","23","St. Thomas",18.319231,-64.865114
"592","Compass Point","DIRECT INPUT","KWG, AJH",NA,"3""TP","3/25/23","RHMA","3630","H",11.94,"9.5","25.2","1.2","24","G","Y","N",NA,NA,NA,2023-03-25,"2023","03","25","St. Thomas",18.319231,-64.865114
"593","Compass Point","Direct Input","LU","11/07/2024","CC","10/27/2024","RHMA","6592","H",20.63,"10.5","34","1.6","32.4","G","Y","Y",NA,NA,NA,2024-10-27,"2024","10","27","St. Thomas",18.319231,-64.865114
"594","Compass Point","Direct Input","LU","11/07/2024","CC","10/27/2024","RHMA","6593","H",16.58,"11.9","24.9","1.7","23.2","G","Y","Y",NA,NA,NA,2024-10-27,"2024","10","27","St. Thomas",18.319231,-64.865114
"595","Compass Point","Direct Input","LU","11/07/2024","CC","10/27/2024","RHMA","6594","H",34.11,"14.6","34.8","1.7","33.1","GB","Y","N",NA,NA,NA,2024-10-27,"2024","10","27","St. Thomas",18.319231,-64.865114
"596","Compass Point","DIRECT INPUT","KWG, AJH",NA,"3""TP","02/09/2023","RHMA","3246","H",19.43,"12.3","26.9","1.6","25.3","B",NA,"N",NA,"N",NA,2023-02-09,"2023","02","09","St. Thomas",18.319231,-64.865114
"597","Compass Point","DIRECT INPUT","KWG, AJH",NA,"3"" TP","02/09/2023","RHMA","3247","H",17.31,"11.6","24.2","1.2","23","GB","Y","Y",NA,"N",NA,2023-02-09,"2023","02","09","St. Thomas",18.319231,-64.865114
"598","Compass Point","DIRECT INPUT","KWG, AJH",NA,"3""TP","02/09/2023","RHMA","3248","H",24.82,"11.8","34.9","1.8","33.1","G",NA,"N",NA,"N",NA,2023-02-09,"2023","02","09","St. Thomas",18.319231,-64.865114
"599","Compass Point","DIRECT INPUT","KWG, AJH",NA,"3"" TP","02/09/2023","RHMA","3249","H",3.92,"7.9","13.2","0.4","12.8","G","N","Y","TIP IS DEAD","N",NA,2023-02-09,"2023","02","09","St. Thomas",18.319231,-64.865114
"600","Compass Point","DIRECT INPUT","KWG, AJH",NA,"3""TP","02/09/2023","RHMA","3250","H",16.75,"10.2","31.1","1.4","29.7","G",NA,"N",NA,"N",NA,2023-02-09,"2023","02","09","St. Thomas",18.319231,-64.865114
"601","Compass Point","DIRECT INPUT","KWG, AJH",NA,"3"" TP","02/09/2023","RHMA","3251","H",8.5,"9","19.5","1","18.5","G","N","Y",NA,"N",NA,2023-02-09,"2023","02","09","St. Thomas",18.319231,-64.865114
"602","Compass Point","DIRECT INPUT","KWG, AJH",NA,"3""TP","02/09/2023","RHMA","3252","H",18.26,"11.2","29.2","1.5","27.7","G",NA,"N",NA,"N",NA,2023-02-09,"2023","02","09","St. Thomas",18.319231,-64.865114
"603","Compass Point","DIRECT INPUT","KWG, AJH",NA,"3"" TP","02/09/2023","RHMA","3253","P",32.13,"14","36.2","0.7","35.5","G","Y","Y",NA,"N",NA,2023-02-09,"2023","02","09","St. Thomas",18.319231,-64.865114
"604","Compass Point","DIRECT INPUT","KWG, AJH",NA,"3"" TP","2/21/2023","RHMA","3318","H",11.39,"9.5","20","1","19","G","Y","N","PLUM BROWN","N",NA,2023-02-21,"2023","02","21","St. Thomas",18.319231,-64.865114
"605","Compass Point","DIRECT INPUT","KWG, AJH",NA,"3"" TP","2/21/2023","RHMA","3319","H",13.38,"9.3","25","1","24","G","Y","N","SNAIL EGGS","N",NA,2023-02-21,"2023","02","21","St. Thomas",18.319231,-64.865114
"606","Compass Point","DG","DG,NK","07/01/2024","CC","06/11/2024","RHMA","5823","H",15.8,"10.1","27.7","1.2","26.5","G","Y","Y",NA,"N",NA,2024-06-11,"2024","06","11","St. Thomas",18.319231,-64.865114
"607","Compass Point","DG","DG,NK","07/01/2024","CC","06/11/2024","RHMA","5824","H",8.9,"9.2","22.2","1","21.2","G","N","Y",NA,"N",NA,2024-06-11,"2024","06","11","St. Thomas",18.319231,-64.865114
"608","Compass Point","DG","DG,NK","07/01/2024","CC","06/11/2024","RHMA","5825","H",18.1,"10.8","29","1.3","27.7","G","Y","N",NA,"N",NA,2024-06-11,"2024","06","11","St. Thomas",18.319231,-64.865114
"609","Compass Point","DG","DG,NK","07/01/2024","CC","06/11/2024","RHMA","5826","H",11.5,"9.6","24.5","0.7","23.8","G","Y","Y",NA,"N",NA,2024-06-11,"2024","06","11","St. Thomas",18.319231,-64.865114
"610","Compass Point","DG","DG,NK","07/01/2024","CC","06/11/2024","RHMA","5827","H",16.3,"10.7","26.1","1.4","24.7","G","Y","N",NA,"N",NA,2024-06-11,"2024","06","11","St. Thomas",18.319231,-64.865114
"611","Compass Point","DG","DG,NK","07/01/2024","CC","06/11/2024","RHMA","5828","H",21.6,"11.3","32","1.5","30.5","G","Y","N",NA,"N",NA,2024-06-11,"2024","06","11","St. Thomas",18.319231,-64.865114
"612","Compass Point","DG","DG,NK","07/01/2024","CC","06/11/2024","RHMA","5829","H",15.3,"10.4","29.6","1.4","28.2","G","Y","N",NA,"N",NA,2024-06-11,"2024","06","11","St. Thomas",18.319231,-64.865114
"613","Compass Point","DG","DG,NK","07/01/2024","CC","06/11/2024","RHMA","5830","H",9.7,"9.3","22.8","1","21.8","G","N","Y",NA,"N",NA,2024-06-11,"2024","06","11","St. Thomas",18.319231,-64.865114
"614","Compass Point","DG","DG,NK","07/01/2024","CC","06/11/2024","RHMA","5831","H",13.8,"9.3","27.3","1.7","25.6","G","N","N",NA,"N",NA,2024-06-11,"2024","06","11","St. Thomas",18.319231,-64.865114
"615","Compass Point","DG","DG,NK","07/01/2024","CC","06/11/2024","RHMA","5832","H",20.3,"12.4","27.7","1.8","25.9","G","N","Y",NA,"N",NA,2024-06-11,"2024","06","11","St. Thomas",18.319231,-64.865114
"616","Compass Point","DG","DG,NK","07/01/2024","CC","06/11/2024","RHMA","5833","H",9.7,"10.4","21.3","1.3","20","G","N","Y",NA,"N",NA,2024-06-11,"2024","06","11","St. Thomas",18.319231,-64.865114
"617","Compass Point","DG","DG,NK","07/01/2024","CC","06/11/2024","RHMA","5834","H",26.6,"11.2","34.9","1.9","33","G","N","Y",NA,"N",NA,2024-06-11,"2024","06","11","St. Thomas",18.319231,-64.865114
"618","Compass Point","DG","DG,NK","07/01/2024","CC","06/11/2024","RHMA","5835","H",7.9,"8.6","18.8","0.9","17.9","G","N","Y",NA,"N",NA,2024-06-11,"2024","06","11","St. Thomas",18.319231,-64.865114
"619","Compass Point","DG","DG,NK","07/01/2024","CC","06/11/2024","RHMA","5836","H",13.6,"10.6","25.8","1.4","24.4","G","N","N",NA,"N",NA,2024-06-11,"2024","06","11","St. Thomas",18.319231,-64.865114
"620","Compass Point","DG","DG,NK","07/01/2024","CC","06/11/2024","RHMA","5837","H",7.3,"9.5","17.6","1.2","16.4","G","N","Y",NA,"N",NA,2024-06-11,"2024","06","11","St. Thomas",18.319231,-64.865114
"621","Compass Point","DG","DG,NK","07/01/2024","CC","06/11/2024","RHMA","5838","H",8.8,"8.3","20.9","1.4","19.5","G","Y","Y",NA,"N",NA,2024-06-11,"2024","06","11","St. Thomas",18.319231,-64.865114
"622","Compass Point","DG","DG,NK","07/01/2024","CC","06/11/2024","RHMA","5839","H",14.2,"10.5","24.2","1.1","23.1","G","Y","N",NA,"N",NA,2024-06-11,"2024","06","11","St. Thomas",18.319231,-64.865114
"623","Compass Point","DG","DG,NK","07/01/2024","CC","06/11/2024","RHMA","5840","H",4.8,"7.9","14.6","0.5","14.1","G","N","Y",NA,"N",NA,2024-06-11,"2024","06","11","St. Thomas",18.319231,-64.865114
"624","Compass Point","DG","DG,NK","07/01/2024","CC","06/11/2024","RHMA","5841","H",9.9,"9.5","22.4","1.4","21","G","Y","Y",NA,"N",NA,2024-06-11,"2024","06","11","St. Thomas",18.319231,-64.865114
"625","Compass Point","DG","DG,NK","07/01/2024","CC","06/11/2024","RHMA","5842","H",12,"9.2","27.4","1.3","26.1","G","Y","Y",NA,"N",NA,2024-06-11,"2024","06","11","St. Thomas",18.319231,-64.865114
"626","Compass Point","DG","DG,NK","07/01/2024","CC","06/11/2024","RHMA","5843","H",15.8,"10.7","28.5","1.5","27","G","Y","N",NA,"N",NA,2024-06-11,"2024","06","11","St. Thomas",18.319231,-64.865114
"627","Compass Point","DG","DG,NK","07/01/2024","CC","06/11/2024","RHMA","5844","H",11.6,"10.5","20.5","1.2","19.3","G","Y","N",NA,"N",NA,2024-06-11,"2024","06","11","St. Thomas",18.319231,-64.865114
"628","Compass Point","DG","DG,NK","07/01/2024","CC","06/11/2024","RHMA","5845","H",15.6,"10.6","27.4","1.6","25.8","G","Y","Y",NA,"N",NA,2024-06-11,"2024","06","11","St. Thomas",18.319231,-64.865114
"629","Compass Point","DG","DG,NK","07/01/2024","CC","06/11/2024","RHMA","5846","H",19.5,"10.8","32.2","1.6","30.6","G","Y","N",NA,"N",NA,2024-06-11,"2024","06","11","St. Thomas",18.319231,-64.865114
"630","Compass Point","DG","DG,NK","07/01/2024","CC","06/11/2024","RHMA","5847","H",9.2,"8.9","20.2","1.1","19.1","G","N","N",NA,"N",NA,2024-06-11,"2024","06","11","St. Thomas",18.319231,-64.865114
"631","Compass Point","DG","DG,NK","07/01/2024","CC","06/11/2024","RHMA","5848","H",8.3,"8.6","20","0.9","19.1","G","Y","N",NA,"N",NA,2024-06-11,"2024","06","11","St. Thomas",18.319231,-64.865114
"632","Compass Point","DG","DG,NK","07/01/2024","CC","06/11/2024","RHMA","5849","H",8.1,"9.1","18.3","0.9","17.4","G","Y","N",NA,"N",NA,2024-06-11,"2024","06","11","St. Thomas",18.319231,-64.865114
"633","Compass Point","DG","DG,NK","07/01/2024","CC","06/11/2024","RHMA","5850","H",16.8,"10.7","29.2","1.3","27.9","G","Y","N",NA,"N",NA,2024-06-11,"2024","06","11","St. Thomas",18.319231,-64.865114
"634","Compass Point","DG","DG,NK","07/01/2024","CC","06/11/2024","RHMA","5851","H",14.3,"10.4","27","1.3","25.7","G","Y","Y",NA,"N",NA,2024-06-11,"2024","06","11","St. Thomas",18.319231,-64.865114
"635","Compass Point","DG","DG,NK","07/01/2024","CC","06/11/2024","RHMA","5852","H",11.8,"10.9","21.7","1.4","20.3","G","Y","Y",NA,"N",NA,2024-06-11,"2024","06","11","St. Thomas",18.319231,-64.865114
"636","Compass Point","Direct Input","LU","11/07/2024","CC","10/27/2024","RHMA","6595","H",16.45,"10.4","28.3","1.4","26.9","G","N","N",NA,NA,NA,2024-10-27,"2024","10","27","St. Thomas",18.319231,-64.865114
"637","Compass Point","Direct Input","LU","11/07/2024","CC","10/27/2024","RHMA","6596","H",16.48,"11.7","24.6","1.8","22.8","G","Y","N",NA,NA,NA,2024-10-27,"2024","10","27","St. Thomas",18.319231,-64.865114
"638","Compass Point","Direct Input","LU","11/07/2024","CC","10/27/2024","RHMA","6597","H",20.03,"12.1","27.7","1.4","26.3","G","Y","N",NA,NA,NA,2024-10-27,"2024","10","27","St. Thomas",18.319231,-64.865114
"639","Compass Point","Direct Input","LU","11/07/2024","CC","10/27/2024","RHMA","6598","H",19.1,"11.9","27.9","1.7","26.2","G","Y","N",NA,NA,NA,2024-10-27,"2024","10","27","St. Thomas",18.319231,-64.865114
"640","Compass Point","Direct Input","LU","11/07/2024","CC","10/27/2024","RHMA","6599","H",14.74,"10.6","24.1","1.8","22.3","G","N","N",NA,NA,NA,2024-10-27,"2024","10","27","St. Thomas",18.319231,-64.865114
"641","Compass Point","Direct Input","LU","11/07/2024","CC","10/27/2024","RHMA","6600","H",14.96,"11.4","24.5","1.7","22.8","G","N","N",NA,NA,NA,2024-10-27,"2024","10","27","St. Thomas",18.319231,-64.865114
"642","Compass Point","Direct Input","LU","11/07/2024","CC","10/27/2024","RHMA","6601","H",17.53,"11.1","31.7","1.5","30.2","G","N","N",NA,NA,NA,2024-10-27,"2024","10","27","St. Thomas",18.319231,-64.865114
"643","Compass Point","Direct Input","LU","11/07/2024","CC","10/27/2024","RHMA","6602","H",18.46,"11.6","29.3","1.7","27.6","G","Y","N",NA,NA,NA,2024-10-27,"2024","10","27","St. Thomas",18.319231,-64.865114
"644","Compass Point","DIRECT INPUT","AJH",NA,"3"" TP","2/22/2023","RHMA","3358","H",8.86,"8","18.4","1.2","17.2","G","N","Y",NA,"N",NA,2023-02-22,"2023","02","22","St. Thomas",18.319231,-64.865114
"645","Compass Point","DIRECT INPUT","AJH",NA,"3"" TP","2/22/2023","RHMA","3359","H",17.3,"8.9","26.1","0","26.1","G","Y","N",NA,"N",NA,2023-02-22,"2023","02","22","St. Thomas",18.319231,-64.865114
"646","Compass Point","DIRECT INPUT","AJH",NA,"3"" TP","2/22/2023","RHMA","3360","H",15.06,"8","24","1.8","22.2","GB","N","N",NA,"N",NA,2023-02-22,"2023","02","22","St. Thomas",18.319231,-64.865114
"647","Compass Point","DIRECT INPUT","AJH",NA,"3"" TP","2/22/2023","RHMA","3361","H",20.65,"9","29.2","1.2","28","G","Y","N",NA,"N",NA,2023-02-22,"2023","02","22","St. Thomas",18.319231,-64.865114
"648","Compass Point","DIRECT INPUT","AJH",NA,"3"" TP","2/22/2023","RHMA","3362","H",34.48,"10.3","34.7","1.8","32.9","G","Y","N",NA,"N",NA,2023-02-22,"2023","02","22","St. Thomas",18.319231,-64.865114
"649","Compass Point","DIRECT INPUT","AJH",NA,"3"" TP","2/22/2023","RHMA","3363","H",24.26,"10.2","28.2","1.4","26.8","GB","Y","N",NA,"N",NA,2023-02-22,"2023","02","22","St. Thomas",18.319231,-64.865114
"650","Compass Point","DIRECT INPUT","AJH",NA,"3"" TP","2/22/2023","RHMA","3364","H",19.76,"9.1","22.2","1.3","20.9","G","Y","Y","CURVED, 1ST AND 2ND SET OF LEAVES DEVELOPING","N",NA,2023-02-22,"2023","02","22","St. Thomas",18.319231,-64.865114
"651","Compass Point","DIRECT INPUT","AJH",NA,"3"" TP","2/22/2023","RHMA","3365","H",21.17,"9.1","31.3","1.2","30.1","G","Y","N",NA,"N",NA,2023-02-22,"2023","02","22","St. Thomas",18.319231,-64.865114
"652","Compass Point","DG","DG,NK","07/01/2024","CC","06/11/2024","RHMA","5868","H",12,"10.3","22.3","1.6","20.7","G","N","N",NA,"N",NA,2024-06-11,"2024","06","11","St. Thomas",18.319231,-64.865114
"653","Compass Point","DG","DG,NK","07/01/2024","CC","06/11/2024","RHMA","5869","H",15.7,"10.7","26.3","1.4","24.9","G","N","Y",NA,"N",NA,2024-06-11,"2024","06","11","St. Thomas",18.319231,-64.865114
"654","Compass Point","DG","DG,NK","07/01/2024","CC","06/11/2024","RHMA","5870","H",11.8,"9.8","22.7","1.2","21.5","G","N","N",NA,"N",NA,2024-06-11,"2024","06","11","St. Thomas",18.319231,-64.865114
"655","Compass Point","DG","DG,NK","07/01/2024","CC","06/11/2024","RHMA","5871","H",12.7,"10.5","21.9","1.1","20.8","G","Y","Y",NA,"N",NA,2024-06-11,"2024","06","11","St. Thomas",18.319231,-64.865114
"656","Compass Point","DG","DG,NK","07/01/2024","CC","06/11/2024","RHMA","5872","H",14.8,"10.8","24.9","1.6","23.3","G","N","Y",NA,"N",NA,2024-06-11,"2024","06","11","St. Thomas",18.319231,-64.865114
"657","Compass Point","DIRECT INPUT","AJH",NA,"3"" TP","2/22/2023","RHMA","3370","H",8.43,"8.9","20.9","1.4","19.5","G","N","N",NA,"N",NA,2023-02-22,"2023","02","22","St. Thomas",18.319231,-64.865114
"658","Compass Point","DIRECT INPUT","AJH",NA,"3"" TP","2/22/2023","RHMA","3371","H",6.63,"6.8","16","1.2","14.8","G","N","Y",NA,"N",NA,2023-02-22,"2023","02","22","St. Thomas",18.319231,-64.865114
"659","Compass Point","DIRECT INPUT","AJH",NA,"3"" TP","2/22/2023","RHMA","3372","H",6.26,"6.8","16.1","0.9","15.2","G","N","N",NA,"N",NA,2023-02-22,"2023","02","22","St. Thomas",18.319231,-64.865114
"660","Compass Point","DIRECT INPUT","AJH",NA,"3"" TP","2/22/2023","RHMA","3373","H",25.33,"10.2","30.9","1.9","29","G","Y","N","CURVED","N",NA,2023-02-22,"2023","02","22","St. Thomas",18.319231,-64.865114
"661","Compass Point","DIRECT INPUT","AJH",NA,"3"" TP","2/22/2023","RHMA","3374","H",15.51,"8.9","27.2","0","27.2","GB","N","N",NA,"N",NA,2023-02-22,"2023","02","22","St. Thomas",18.319231,-64.865114
"662","Compass Point","DIRECT INPUT","AJH",NA,"3"" TP","2/22/2023","RHMA","3375","H",9,"8.9","17.2","0.9","16.3","G","N","N",NA,"N",NA,2023-02-22,"2023","02","22","St. Thomas",18.319231,-64.865114
"663","Compass Point","DIRECT INPUT","AJH",NA,"3"" TP","2/22/2023","RHMA","3376","H",20.88,"9.2","26.7","0","26.7","G","Y","N","CURVED","N",NA,2023-02-22,"2023","02","22","St. Thomas",18.319231,-64.865114
"664","Compass Point","DIRECT INPUT","AJH",NA,"3"" TP","2/22/2023","RHMA","3377","H",13.59,"8.9","20.6","1","19.6","G","N","N","CURVED","N",NA,2023-02-22,"2023","02","22","St. Thomas",18.319231,-64.865114
"665","Compass Point","DIRECT INPUT","AJH",NA,"3"" TP","2/22/2023","RHMA","3378","H",16.37,"9.1","22.3","1.1","21.2","G","N","N",NA,"N",NA,2023-02-22,"2023","02","22","St. Thomas",18.319231,-64.865114
"666","Compass Point","DIRECT INPUT","AJH",NA,"3"" TP","2/22/2023","RHMA","3379","H",34.18,"10.3","33.7","0","33.7","G","Y","N",NA,"N",NA,2023-02-22,"2023","02","22","St. Thomas",18.319231,-64.865114
"667","Compass Point","ST","SH","9/13/24","CC","06/11/2024","RHMA","6149","H",12.9,"11","17.8","0","17","G","Y","Y","PLUMULE BROKEN",NA,NA,2024-06-11,"2024","06","11","St. Thomas",18.319231,-64.865114
"668","Compass Point","ST","SH","9/13/24","CC","06/11/2024","RHMA","6151","H",13.63,"11.4","22","1","21","G","Y","Y",NA,NA,NA,2024-06-11,"2024","06","11","St. Thomas",18.319231,-64.865114
"669","Compass Point","ST","SH","9/13/24","3""","06/11/2024","RHMA","6150","H",13.92,"11.3","23","1.7","21.5","G","Y","Y","2 LEAVES",NA,NA,2024-06-11,"2024","06","11","St. Thomas",18.319231,-64.865114
"670","Compass Point","AND","JDA","03/03/2023","CC","09/02/2023","RHMA","E2-126","H",13,"10.3","23.5","1.4","22.1","G","Y",NA,NA,"MIC","Bob the 2nd",2023-09-02,"2023","09","02","St. Thomas",18.319231,-64.865114
"671","Compass Point","AND","JC","03/03/2023","CC","09/02/2023","RHMA","E2-127","H",20.71,"12.2","27.1","0.9","26.2","G","Y",NA,NA,"MIC","Waylon",2023-09-02,"2023","09","02","St. Thomas",18.319231,-64.865114
"672","Compass Point","AND","A.B","03/03/2023","CC","09/02/2023","RHMA","E2-128","H",18.88,"10","33","8","25","B","Y",NA,NA,"MIC","Tyrone",2023-09-02,"2023","09","02","St. Thomas",18.319231,-64.865114
"673","Compass Point","DIRECT INPUT","KWG, AJH",NA,"3"" TP","2/23/2023","RHMA","3306","H",12.75,"10.5","23.8","0.5","23.3","G","Y","N",NA,"N",NA,2023-02-23,"2023","02","23","St. Thomas",18.319231,-64.865114
"674","Compass Point","DIRECT INPUT","KWG, AJH",NA,"3""TP","3/25/23","RHMA","3631","H",12.17,"10.3","25.7","1","24.7","G","N","N",NA,NA,NA,2023-03-25,"2023","03","25","St. Thomas",18.319231,-64.865114
"675","Compass Point","DIRECT INPUT","KWG, AJH",NA,"3""TP","3/25/23","RHMA","3632","H",18.79,"12.8","26.7","1.4","25.3","B","Y","N",NA,NA,"DRILL BIT",2023-03-25,"2023","03","25","St. Thomas",18.319231,-64.865114
"676","Compass Point","DG","DG,NK","07/01/2024","CC","06/11/2024","RHMA","5853","H",9.3,"9.2","21","1.1","19.9","G","N","N",NA,"N",NA,2024-06-11,"2024","06","11","St. Thomas",18.319231,-64.865114
"677","Compass Point","DG","DG,NK","07/01/2024","CC","06/11/2024","RHMA","5854","H",22.5,"10.2","22.9","1.2","21.7","G","Y","Y",NA,"N",NA,2024-06-11,"2024","06","11","St. Thomas",18.319231,-64.865114
"678","Compass Point","DG","DG,NK","07/01/2024","CC","06/11/2024","RHMA","5855","H",23,"10","12.2","0.9","11.3","G","N","N",NA,"N",NA,2024-06-11,"2024","06","11","St. Thomas",18.319231,-64.865114
"679","Compass Point","DG","DG,NK","07/01/2024","CC","06/11/2024","RHMA","5856","H",14,"10.2","27.4","1.7","25.7","G","N","N",NA,"N",NA,2024-06-11,"2024","06","11","St. Thomas",18.319231,-64.865114
"680","Compass Point","DG","DG,NK","07/01/2024","CC","06/11/2024","RHMA","5857","H",13.1,"10.3","25.5","1.1","24.4","G","N","N",NA,"N",NA,2024-06-11,"2024","06","11","St. Thomas",18.319231,-64.865114
"681","Compass Point","DIRECT INPUT","AJH",NA,"3"" TP","2/22/2023","RHMA","3355","H",19.53,"9.1","24","0.9","23.1","GB","Y","Y","CURVED, LITTLE SIGNS OF HERB","N",NA,2023-02-22,"2023","02","22","St. Thomas",18.319231,-64.865114
"682","Compass Point","DIRECT INPUT","AJH",NA,"3"" TP","2/22/2023","RHMA","3356","H",7.48,"7.9","18.1","1.1","17","G","N","N",NA,"N",NA,2023-02-22,"2023","02","22","St. Thomas",18.319231,-64.865114
"683","Compass Point","DIRECT INPUT","AJH",NA,"3"" TP","2/22/2023","RHMA","3357","H",17.25,"9","25.4","0.1","25.3","G","N","N",NA,"N",NA,2023-02-22,"2023","02","22","St. Thomas",18.319231,-64.865114
"684","Compass Point","LG","LG, AJH","10/04/2023","3"" TP","09/28/2023","RHMA","4724","H",12.6,"9.6","22.3","1.3","21","G","Y","N","PLUM TIP BROWN","N",NA,2023-09-28,"2023","09","28","St. Thomas",18.319231,-64.865114
"685","Compass Point","LG","LG, AJH","10/04/2023","3"" TP","09/28/2023","RHMA","4725","H",35.46,"12.5","39.8","2.1","37.7","G","Y","N",NA,"N",NA,2023-09-28,"2023","09","28","St. Thomas",18.319231,-64.865114
"686","Compass Point",NA,"LU","6/24/2024","CC","06/11/2024","RHMA","5960","H",18.29,NA,NA,NA,"26.5","G","N",NA,"FVINP SKIP","C",NA,2024-06-11,"2024","06","11","St. Thomas",18.319231,-64.865114
"687","Compass Point","ES","ES","8/29/2024","CC","06/11/2024","RHMA","6090","H",17.56,"12","25.8","1.4","24.4","G/B","Y","Y",NA,"N",NA,2024-06-11,"2024","06","11","St. Thomas",18.319231,-64.865114
"688","Compass Point","ES","ES","8/29/2024","CC","06/11/2024","RHMA","6091","H",12.5,"8.8","26.2","1.2","25","Y/B","Y","Y",NA,"N",NA,2024-06-11,"2024","06","11","St. Thomas",18.319231,-64.865114
"689","Compass Point","AND","Yarianna","20/03/2023","CC","17/03/2023","RHMA","E2-143","H",16.77,"11","28.5","1","27.5","G","N",NA,NA,"MIC","Kitty",2023-03-17,"2023","03","17","St. Thomas",18.319231,-64.865114
"690","Compass Point","ES","ES","8/29/2024","CC","06/11/2024","RHMA","6093","H",11.63,"10.4","22.7","1.1","21.6","G/B","Y","Y",NA,"N",NA,2024-06-11,"2024","06","11","St. Thomas",18.319231,-64.865114
"691","Compass Point","ES","ES","8/29/2024","CC","06/11/2024","RHMA","6094","H",13.39,"10.1","23.5","1.2","22.3","G/B","Y","Y",NA,"N",NA,2024-06-11,"2024","06","11","St. Thomas",18.319231,-64.865114
"692","Compass Point","ES","ES","8/29/2024","CC","06/11/2024","RHMA","6095","H",11,"10.3","22.2","1.5","20.7","G/B","N","Y",NA,"N",NA,2024-06-11,"2024","06","11","St. Thomas",18.319231,-64.865114
"693","Compass Point","AND","JDA","03/03/2023","CC","09/02/2023","RHMA","E2-107","H",24.56,"10.6","32.5","1.2","31.3","G","Y",NA,NA,"MIC","Bob the 2nd",2023-09-02,"2023","09","02","St. Thomas",18.319231,-64.865114
"694","Compass Point","DIRECT INPUT","KWG, AJH",NA,"3"" TP","2/23/2023","RHMA","3286","H",8.25,"7.8","20.1","0.2","19.9","GB","Y","Y",NA,"N",NA,2023-02-23,"2023","02","23","St. Thomas",18.319231,-64.865114
"695","Compass Point","DIRECT INPUT","KWG, AJH",NA,"3"" TP","2/23/2023","RHMA","3287","H",12.35,"11.5","22.3","1","21.3","G","Y","Y",NA,"N",NA,2023-02-23,"2023","02","23","St. Thomas",18.319231,-64.865114
"696","Compass Point","DIRECT INPUT","KWG, AJH",NA,"3"" TP","2/23/2023","RHMA","3288","H",18.66,"12.5","24.7","1.2","23.5","G","Y","N","PLUM BROWN","N",NA,2023-02-23,"2023","02","23","St. Thomas",18.319231,-64.865114
"697","Compass Point","DIRECT INPUT","KWG, AJH",NA,"3"" TP","2/23/2023","RHMA","3289","H",13.5,"11","21.5","1.2","20.3","G","Y","N",NA,"N",NA,2023-02-23,"2023","02","23","St. Thomas",18.319231,-64.865114
"698","Compass Point","AND","SRM","03/03/2023","CC","09/02/2023","RHMA","E2-113","H",9.58,"10.3","18.1","1.2","16.9","G","Y",NA,NA,"MIC",NA,2023-09-02,"2023","09","02","St. Thomas",18.319231,-64.865114
"699","Compass Point","AND","SRM","03/03/2023","CC","09/02/2023","RHMA","E2-114","H",11.36,"9.4","23.6","1.4","22.2","G","Y",NA,NA,"MIC",NA,2023-09-02,"2023","09","02","St. Thomas",18.319231,-64.865114
"700","Compass Point","AND","SRM","03/03/2023","CC","09/02/2023","RHMA","E2-115","H",18.06,"10.8","30.2","1.5","28.7","G","N",NA,NA,"MIC",NA,2023-09-02,"2023","09","02","St. Thomas",18.319231,-64.865114
"701","Compass Point","AND","S.K.W","03/03/2023","CC","09/02/2023","RHMA","E2-116","H",14.22,"10.5","23","1","22","G","Y",NA,NA,"MIC","Rainbow",2023-09-02,"2023","09","02","St. Thomas",18.319231,-64.865114
"702","Compass Point","AND","J.G","03/03/2023","CC","09/02/2023","RHMA","E2-117","H",16.53,"11.1","26","23","3","G","Y",NA,NA,"MIC","Dr. Doofmshmirtz",2023-09-02,"2023","09","02","St. Thomas",18.319231,-64.865114
"703","Compass Point","AND","A.B","03/03/2023","CC","09/02/2023","RHMA","E2-119","H",16.69,"12","24","16","8","B","Y",NA,NA,"MIC","ChristopherB",2023-09-02,"2023","09","02","St. Thomas",18.319231,-64.865114
"704","Compass Point","AND","Q.C","03/03/2023","CC","09/02/2023","RHMA","E2-120","H",24.56,"10.2","29.7","5.7","24","B","N",NA,NA,"MIC","Danerys",2023-09-02,"2023","09","02","St. Thomas",18.319231,-64.865114
"705","Compass Point","AND","LS","03/03/2023","CC","09/02/2023","RHMA","E2-121","H",16.12,"9.5","32","1.8","30.2","G","Y",NA,NA,"MIC","Hilleye",2023-09-02,"2023","09","02","St. Thomas",18.319231,-64.865114
"706","Compass Point","AND","A.S.B","03/03/2023","CC","09/02/2023","RHMA","E2-122","H",23.51,"12","27","4.5","22.5","B","Y",NA,NA,"MIC","Kanari",2023-09-02,"2023","09","02","St. Thomas",18.319231,-64.865114
"707","Compass Point","AND","J.I.G","03/03/2023","CC","09/02/2023","RHMA","E2-123","H",25.48,"11.8","25.5","2.5","23","G","Y",NA,NA,"MIC","Timonay",2023-09-02,"2023","09","02","St. Thomas",18.319231,-64.865114
"708","Compass Point","AND","J.S","03/03/2023","CC","09/02/2023","RHMA","E2-124","H",21.5,"12.4","28","1","27","B","Y",NA,NA,"MIC","Pastor Stewart",2023-09-02,"2023","09","02","St. Thomas",18.319231,-64.865114
"709","Compass Point","AND","Y.S","03/03/2023","CC","09/02/2023","RHMA","E2-125","H",17,"11.9","26.8","1.3","25.5","G","N",NA,NA,"MIC","Cornelious Jr.",2023-09-02,"2023","09","02","St. Thomas",18.319231,-64.865114
"710","Compass Point","DIRECT INPUT","DG, AJH","06/23/2023","4''TP","6/13/23","RHMA","4041","H",9.39,"8.7","20.1","1","19.1","G","Y","Y",NA,"N",NA,2023-06-13,"2023","06","13","St. Thomas",18.319231,-64.865114
"711","Compass Point","DIRECT INPUT","DG, AJH","06/23/2023","4''TP","6/13/23","RHMA","4042","H",7.72,"8.6","18.8","1","17.8","G","Y","N",NA,"N",NA,2023-06-13,"2023","06","13","St. Thomas",18.319231,-64.865114
"712","Compass Point","DIRECT INPUT","DG, AJH","06/23/2023","4''TP","6/13/23","RHMA","4043","H",9.57,"10","18.6","1.1","17.5","G","Y","N",NA,"N",NA,2023-06-13,"2023","06","13","St. Thomas",18.319231,-64.865114
"713","Compass Point","DIRECT INPUT","DG, AJH","06/23/2023","4''TP","6/13/23","RHMA","4044","H",26.27,"12.3","32.8","1.7","31.1","GB","Y","N","PlUM BROWN BUT LOOKS HEALHTY","N",NA,2023-06-13,"2023","06","13","St. Thomas",18.319231,-64.865114
"714","Compass Point","DIRECT INPUT","KWG, AJH",NA,"3"" TP","2/23/2023","RHMA","3307","H",11.36,"12.2","16.7","0.7","16","G","Y","N",NA,"N",NA,2023-02-23,"2023","02","23","St. Thomas",18.319231,-64.865114
"715","Compass Point","DIRECT INPUT","KWG, AJH",NA,"3"" TP","2/23/2023","RHMA","3308","H",6.96,"9.2","17.3","1.1","16.2","BG","Y","N",NA,"N",NA,2023-02-23,"2023","02","23","St. Thomas",18.319231,-64.865114
"716","Compass Point","DIRECT INPUT","KWG, AJH",NA,"3""TP","3/25/23","RHMA","3633","H",16.58,"11.8","23","1","22","G","Y","N",NA,NA,"DAVE &",2023-03-25,"2023","03","25","St. Thomas",18.319231,-64.865114
"717","Compass Point","DIRECT INPUT","KWG, AJH",NA,"3""TP","3/25/23","RHMA","3634","H",22.26,"12.3","32.3","1.7","30.6","G","Y","N",NA,NA,"BUSTER",2023-03-25,"2023","03","25","St. Thomas",18.319231,-64.865114
"718","Compass Point","DIRECT INPUT","KWG, AJH",NA,"3""TP","3/25/23","RHMA","3635","H",16.59,"11.7","25","1.4","23.6","G","Y","N",NA,NA,NA,2023-03-25,"2023","03","25","St. Thomas",18.319231,-64.865114
"719","Compass Point","DIRECT INPUT","KWG, AJH",NA,"3""TP","3/25/23","RHMA","3636","H",13,"11.4","22.4","1.1","21.3","G","Y","N","PLUM BENT",NA,NA,2023-03-25,"2023","03","25","St. Thomas",18.319231,-64.865114
"720","Compass Point","DIRECT INPUT","KWG, AJH",NA,"3""TP","3/25/23","RHMA","3637","H",14.97,"11","28.9","1.4","27.5","G","Y","N",NA,NA,NA,2023-03-25,"2023","03","25","St. Thomas",18.319231,-64.865114
"721","Compass Point",NA,"LU","6/24/2024","CC","06/11/2024","RHMA","5955","H",22.83,NA,NA,NA,"31.5","G","N",NA,"FVINP SKIP","C",NA,2024-06-11,"2024","06","11","St. Thomas",18.319231,-64.865114
"722","Compass Point",NA,"LU","6/24/2024","CC","06/11/2024","RHMA","5956","H",13.95,NA,NA,NA,"29","G","N",NA,"FVINP SKIP","C",NA,2024-06-11,"2024","06","11","St. Thomas",18.319231,-64.865114
"723","Compass Point","LG","LG, AJH","10/04/2023","3"" TP","09/28/2023","RHMA","4723","H",29.24,"11.6","35.6","2","33.6","G","Y","N",NA,"N",NA,2023-09-28,"2023","09","28","St. Thomas",18.319231,-64.865114
"724","Compass Point","DIRECT INPUT","KWG, AJH",NA,"3"" TP","2/21/2023","RHMA","3317","H",13.04,"10.7","23.9","1.4","22.5","G","Y","N","PLUM BROWN","N",NA,2023-02-21,"2023","02","21","St. Thomas",18.319231,-64.865114
"725","Compass Point","AND","Kayce","20/03/2023","CC","17/03/2023","RHMA","E2-139","H",12,"8.9","26.1","1.6","24.5","G","N",NA,NA,"MIC","Doodle Bob",2023-03-17,"2023","03","17","St. Thomas",18.319231,-64.865114
"726","Compass Point","AND","Dequoy","20/03/2023","CC","17/03/2023","RHMA","E2-140","H",17.81,"11.9","35.4","1.3","34.1","B","N",NA,NA,"MIC","Little Red Riding Tlood",2023-03-17,"2023","03","17","St. Thomas",18.319231,-64.865114
"727","Compass Point","AND","Dequoy","20/03/2023","CC","17/03/2023","RHMA","E2-141","H",14,"19.9","26","1.4","24.6","G","N",NA,NA,"MIC","Black Panter",2023-03-17,"2023","03","17","St. Thomas",18.319231,-64.865114
"728","Compass Point","AND","Kayce","20/03/2023","CC","17/03/2023","RHMA","E2-142","H",13.25,"9.8","26.6","1.1","25.5","G","N",NA,NA,"MIC","Mickey Mouse",2023-03-17,"2023","03","17","St. Thomas",18.319231,-64.865114
"729","Compass Point","DG","DG,NK","07/01/2024","CC","06/11/2024","RHMA","5864","H",12.8,"10.7","12.8","1.1","11.7","G","N","Y",NA,"N",NA,2024-06-11,"2024","06","11","St. Thomas",18.319231,-64.865114
"730","Compass Point","AND","Malachi","20/03/2023","CC","17/03/2023","RHMA","E2-144","H",21.43,"11.5","28.5","1","27.5","G","N",NA,NA,"MIC","Thor",2023-03-17,"2023","03","17","St. Thomas",18.319231,-64.865114
"731","Compass Point","AND","Areil Mathurin","20/03/2023","CC","17/03/2023","RHMA","E2-145","H",14.87,"10.5","29.8","1.5","28.3","G","N",NA,NA,"MIC","Star",2023-03-17,"2023","03","17","St. Thomas",18.319231,-64.865114
"732","Compass Point","AND","Shukoia Sprauve","20/03/2023","CC","17/03/2023","RHMA","E2-146","H",22.95,"10.5","34.3","1.8","32.5","B","N",NA,NA,"MIC","Chris Moriss",2023-03-17,"2023","03","17","St. Thomas",18.319231,-64.865114
"733","Compass Point","AND","Louriet Powell","20/03/2023","CC","17/03/2023","RHMA","E2-147","H",9.06,"8.7","24.3","1.3","23","G","N",NA,NA,"MIC","Edamame",2023-03-17,"2023","03","17","St. Thomas",18.319231,-64.865114
"734","Compass Point","AND","Jesse Jackson","20/03/2023","CC","17/03/2023","RHMA","E2-148","H",21.77,"11.1","34.5","1","33.5","B","N",NA,NA,"MIC","Jimbo the II",2023-03-17,"2023","03","17","St. Thomas",18.319231,-64.865114
"735","Compass Point","AND","Daines Francillon","20/03/2023","CC","17/03/2023","RHMA","E2-149","H",17.6,"10.9","31.1","1.6","29.5","B","N",NA,NA,"MIC","Bubble Guppies",2023-03-17,"2023","03","17","St. Thomas",18.319231,-64.865114
"736","Compass Point","AND","Jasmyn Prentide","20/03/2023","CC","17/03/2023","RHMA","E2-151","H",12.47,"0.9","26.3","0.9","25.4","B","N",NA,NA,"MIC","IKE",2023-03-17,"2023","03","17","St. Thomas",18.319231,-64.865114
"737","Compass Point","AND","Yammer Alrriche","20/03/2023","CC","17/03/2023","RHMA","E2-152","H",18.7,"1.2","26.5","0.5","26","B/G","N",NA,NA,"MIC","Ya",2023-03-17,"2023","03","17","St. Thomas",18.319231,-64.865114
"738","Compass Point","AND","Hanna Mercedes","20/03/2023","CC","17/03/2023","RHMA","E2-153","H",15.58,"1.2","21.5","1.5","20","G","N",NA,NA,"MIC","Anna",2023-03-17,"2023","03","17","St. Thomas",18.319231,-64.865114
"739","Compass Point","AND","Davidson Verdant","20/03/2023","CC","17/03/2023","RHMA","E2-154","H",15.61,"1","30.6","1.6","29","G","N",NA,NA,"MIC","Gibert Jr",2023-03-17,"2023","03","17","St. Thomas",18.319231,-64.865114
"740","Compass Point","AND","Marcus Jean","20/03/2023","CC","17/03/2023","RHMA","E2-155","H",16.62,"1.1","27.2","1.2","26","B/G","N",NA,NA,"MIC","Marqovus",2023-03-17,"2023","03","17","St. Thomas",18.319231,-64.865114
"741","Compass Point","AND","Delancy Gervilus","20/03/2023","CC","17/03/2023","RHMA","E2-155","H",16.59,"12.2","30.2","2.2","28","B","N",NA,NA,"MIC","Bamgus",2023-03-17,"2023","03","17","St. Thomas",18.319231,-64.865114
"742","Compass Point","AND","Team SS","20/03/2023","CC","17/03/2023","RHMA","E2-156","H",10.52,"9","25.5","0","25.5","G","N",NA,NA,"MIC","Harry",2023-03-17,"2023","03","17","St. Thomas",18.319231,-64.865114
"743","Compass Point","AND","Davidson Jules","20/03/2023","CC","17/03/2023","RHMA","E2-167","H",12.15,"9.5","25.2","1.2","24","G","N",NA,NA,"MIC","Tatool",2023-03-17,"2023","03","17","St. Thomas",18.319231,-64.865114
"744","Compass Point","AND","Wickland G.B","20/03/2023","CC","17/03/2023","RHMA","E2-168","H",17.39,"11.3","26","1.9","24.1","G","N",NA,NA,"MIC","Chedar",2023-03-17,"2023","03","17","St. Thomas",18.319231,-64.865114
"745","Compass Point","AND","Wander","20/03/2023","CC","17/03/2023","RHMA","E2-169","H",12.07,"10.2","23","1.2","21.8","G","N",NA,NA,"MIC","Many Junior",2023-03-17,"2023","03","17","St. Thomas",18.319231,-64.865114
"746","Compass Point","AND","Ashley 27","20/03/2023","CC","17/03/2023","RHMA","E2-170","H",14.88,"10.4","23.2","1.5","21.7","B","N",NA,NA,"MIC","Curella",2023-03-17,"2023","03","17","St. Thomas",18.319231,-64.865114
"747","Compass Point","AND","Kelan Brathwaite","20/03/2023","CC","17/03/2023","RHMA","E2-171","H",8.31,"8.9","20.5","1.5","19","G","N",NA,NA,"MIC","Daguavioh III",2023-03-17,"2023","03","17","St. Thomas",18.319231,-64.865114
"748","Compass Point","DIRECT INPUT","DG, AJH","06/23/2023","4''TP","6/13/23","RHMA","4039","H",5.82,"6.5","16.1","0.8","15.3","G","N","Y",NA,"N",NA,2023-06-13,"2023","06","13","St. Thomas",18.319231,-64.865114
"749","Compass Point","DIRECT INPUT","DG, AJH","06/23/2023","4''TP","6/13/23","RHMA","4040","H",12.05,"10.4","21.2","0.9","20.3","G","Y","Y",NA,"N",NA,2023-06-13,"2023","06","13","St. Thomas",18.319231,-64.865114
"750","Compass Point",NA,"LU","6/24/2024","CC","06/11/2024","RHMA","5982","H",22.05,NA,NA,NA,"32","G","N",NA,"FVINP SKIP","C",NA,2024-06-11,"2024","06","11","St. Thomas",18.319231,-64.865114
"751","Compass Point",NA,"LU","6/24/2024","CC","06/11/2024","RHMA","5983","H",13.46,NA,NA,NA,"27.94","G","N",NA,"FVINP SKIP","C",NA,2024-06-11,"2024","06","11","St. Thomas",18.319231,-64.865114
"752","Compass Point","Direct Input","KR/MF","11/13/24","CC","10/26/2024","RHMA","6628","H",30.2,"13.3","30.4","2.1","28.3","G","Y","N",NA,NA,NA,2024-10-26,"2024","10","26","St. Thomas",18.319231,-64.865114
"753","Compass Point","Direct Input","KR/MF","11/13/24","CC","10/26/2024","RHMA","6629","H",7.45,"7.1","17","2.5","14.5","G","Y","Y",NA,NA,NA,2024-10-26,"2024","10","26","St. Thomas",18.319231,-64.865114
"754","Compass Point","DIRECT INPUT","DG, AJH","06/23/2023","4''TP","6/13/23","RHMA","4045","H",25.72,"11.9","34.7","1.7","33","G","Y","N",NA,"N",NA,2023-06-13,"2023","06","13","St. Thomas",18.319231,-64.865114
"755","Compass Point","DIRECT INPUT","DG, AJH","06/23/2023","4''TP","6/13/23","RHMA","4046","H",19.19,"10","30.9","1.4","29.5","G","Y","N",NA,"N",NA,2023-06-13,"2023","06","13","St. Thomas",18.319231,-64.865114
"756","Compass Point","DIRECT INPUT","DG, AJH","06/23/2023","4''TP","6/13/23","RHMA","4047","H",15.64,"10.9","24","1.4","22.6","G","Y","N",NA,"N",NA,2023-06-13,"2023","06","13","St. Thomas",18.319231,-64.865114
"757","Compass Point","DIRECT INPUT","DG, AJH","06/23/2023","4''TP","6/13/23","RHMA","4048","H",19.56,"11.5","27.7","1.5","26.2","G","Y","N",NA,"N",NA,2023-06-13,"2023","06","13","St. Thomas",18.319231,-64.865114
"758","Compass Point","DIRECT INPUT","DG, AJH","06/23/2023","4''TP","6/13/23","RHMA","4049","H",15.33,"11.8","24.6","1.1","23.5","G","Y","N",NA,"N",NA,2023-06-13,"2023","06","13","St. Thomas",18.319231,-64.865114
"759","Compass Point","DIRECT INPUT","DG, AJH","06/23/2023","4''TP","6/13/23","RHMA","4050","H",10.12,"8.8","22.7","1.5","21.2","G","Y","N",NA,"N",NA,2023-06-13,"2023","06","13","St. Thomas",18.319231,-64.865114
"760","Compass Point","DIRECT INPUT","DG, AJH","06/23/2023","4''TP","6/13/23","RHMA","4051","H",8.08,"8.7","16.9","0.9","16","G","Y","N",NA,"N",NA,2023-06-13,"2023","06","13","St. Thomas",18.319231,-64.865114
"761","Compass Point","DIRECT INPUT","DG, AJH","06/23/2023","4''TP","6/13/23","RHMA","4052","H",8.47,"9","20.6","1.1","19.5","G","Y","N",NA,"N",NA,2023-06-13,"2023","06","13","St. Thomas",18.319231,-64.865114
"762","Compass Point","DIRECT INPUT","DG, AJH","06/23/2023","4''TP","6/13/23","RHMA","4053","H",9.16,"9.9","18.3","1","17.3","G","Y","N",NA,"N",NA,2023-06-13,"2023","06","13","St. Thomas",18.319231,-64.865114
"763","Compass Point","DG","DG,NK","07/01/2024","CC","06/11/2024","RHMA","5858","H",9.4,"9.3","19.5","1.1","18.4","G","N","N",NA,"N",NA,2024-06-11,"2024","06","11","St. Thomas",18.319231,-64.865114
"764","Compass Point","DG","DG,NK","07/01/2024","CC","06/11/2024","RHMA","5859","H",17.3,"11.1","28.7","1.5","27.2","G","N","N",NA,"N",NA,2024-06-11,"2024","06","11","St. Thomas",18.319231,-64.865114
"765","Compass Point","DG","DG,NK","07/01/2024","CC","06/11/2024","RHMA","5860","H",11.8,"9.8","22.9","1.2","21.7","G","Y","N",NA,"N",NA,2024-06-11,"2024","06","11","St. Thomas",18.319231,-64.865114
"766","Compass Point","DG","DG,NK","07/01/2024","CC","06/11/2024","RHMA","5861","H",12.6,"9.8","23","0.9","22.1","G","N","N",NA,"N",NA,2024-06-11,"2024","06","11","St. Thomas",18.319231,-64.865114
"767","Compass Point","DG","DG,NK","07/01/2024","CC","06/11/2024","RHMA","5862","H",15.7,"11.2","24.9","1.7","23.2","G","N","Y",NA,"N",NA,2024-06-11,"2024","06","11","St. Thomas",18.319231,-64.865114
"768","Compass Point","DG","DG,NK","07/01/2024","CC","06/11/2024","RHMA","5863","H",13.4,"9.3","22.3","1.6","20.7","G","N","N",NA,"N",NA,2024-06-11,"2024","06","11","St. Thomas",18.319231,-64.865114
"769","Compass Point","DG","DG,NK","07/01/2024","CC","06/11/2024","RHMA","5821","H",6,"8.7","16.1","0.9","15.2","G","N","Y",NA,"N",NA,2024-06-11,"2024","06","11","St. Thomas",18.319231,-64.865114
"770","Compass Point","DG","DG,NK","07/01/2024","CC","06/11/2024","RHMA","5865","H",10.2,"9","23.9","1.9","22","G","N","N",NA,"N",NA,2024-06-11,"2024","06","11","St. Thomas",18.319231,-64.865114
"771","Compass Point","DG","DG,NK","07/01/2024","CC","06/11/2024","RHMA","5866","H",6.7,"8.2","18.6","0.9","17.7","G","Y","Y",NA,"N",NA,2024-06-11,"2024","06","11","St. Thomas",18.319231,-64.865114
"772","Compass Point","DG","DG,NK","07/01/2024","CC","06/11/2024","RHMA","5867","H",5,"8","14.9","0.9","14","G","Y","Y",NA,"N",NA,2024-06-11,"2024","06","11","St. Thomas",18.319231,-64.865114
"773","Compass Point","AND","S.K.W","03/03/2023","CC","09/02/2023","RHMA","E2-106","H",14.28,"10.3","25.5","1.5","24","G","Y",NA,NA,"MIC","Star",2023-09-02,"2023","09","02","St. Thomas",18.319231,-64.865114
"774","Compass Point","KH","TB, TL","3/22/2023","3""TP","3/17/23","RHMA","3644","H",15.66,"11.8","22.4","1.2","21.2","G","Y","N",NA,"C",NA,2023-03-17,"2023","03","17","St. Thomas",18.319231,-64.865114
"775","Compass Point","AND","J.G","03/03/2023","CC","09/02/2023","RHMA","E2-108","H",16.99,"12","22","20","2","B","Y",NA,NA,"MIC","Perry the Platypus",2023-09-02,"2023","09","02","St. Thomas",18.319231,-64.865114
"776","Compass Point","Direct Input","KR/MF","11/13/24","CC","10/27/2024","RHMA","6612","H",24.67,"11.4","36.8","1.8","35","G","N","Y",NA,NA,NA,2024-10-27,"2024","10","27","St. Thomas",18.319231,-64.865114
"777","Compass Point","ST","SH","9/13/24","3""","06/11/2024","RHMA","6138","H",15.17,"10.9","29.9","7.7","22.1","G","Y","Y",NA,NA,NA,2024-06-11,"2024","06","11","St. Thomas",18.319231,-64.865114
"778","Compass Point","ST","SH","9/13/24","3""","06/11/2024","RHMA","6139","H",18,"11.6","31.3","8.4","23","G","Y","Y",NA,NA,NA,2024-06-11,"2024","06","11","St. Thomas",18.319231,-64.865114
"779","Compass Point","ST","SH","9/13/24","3""","06/11/2024","RHMA","6140","H",16.64,"11.2","30.8","6.5","24.1","G","Y","Y",NA,NA,NA,2024-06-11,"2024","06","11","St. Thomas",18.319231,-64.865114
"780","Compass Point","ST","SH","9/13/24","3""","06/11/2024","RHMA","6141","H",16.59,"11.8","25.5","3.5","22","G","Y","Y",NA,NA,NA,2024-06-11,"2024","06","11","St. Thomas",18.319231,-64.865114
"781","Compass Point","ST","SH","9/13/24","CC","06/11/2024","RHMA","6142","H",11.87,"9.1","31.1","5.9","25.4","G","Y","Y",NA,NA,NA,2024-06-11,"2024","06","11","St. Thomas",18.319231,-64.865114
"782","Compass Point","ST","SH","9/13/24","3""","06/11/2024","RHMA","6143","H",17.71,"11.6","32.2","7.7","25.1","G","Y","Y","4 leaves",NA,NA,2024-06-11,"2024","06","11","St. Thomas",18.319231,-64.865114
"783","Compass Point","ST","SH","9/13/24","CC","06/11/2024","RHMA","6144","H",12.54,"11.3","21.1","1","20.1","G","Y","Y",NA,NA,NA,2024-06-11,"2024","06","11","St. Thomas",18.319231,-64.865114
"784","Compass Point","ST","SH","9/13/24","3""","06/11/2024","RHMA","6145","H",14.27,"10.4","25","1.4","23.8","G","Y","Y","LCP",NA,NA,2024-06-11,"2024","06","11","St. Thomas",18.319231,-64.865114
"785","Compass Point","ST","SH","9/13/24","CC","06/11/2024","RHMA","6146","H",10.47,"11.1","19.2","1.2","18","G","Y","Y",NA,NA,NA,2024-06-11,"2024","06","11","St. Thomas",18.319231,-64.865114
"786","Compass Point","ST","SH","9/13/24","CC","06/11/2024","RHMA","6147","H",11.77,"11.1","21.5","1.5","20","G","Y","Y",NA,NA,NA,2024-06-11,"2024","06","11","St. Thomas",18.319231,-64.865114
"787","Compass Point","ST","SH","9/13/24","CC","06/11/2024","RHMA","6148","H",11.18,"10.7","22","1.5","20.6","G","Y","Y",NA,NA,NA,2024-06-11,"2024","06","11","St. Thomas",18.319231,-64.865114
"788","Compass Point",NA,"LU","6/24/2024","CC","06/11/2024","RHMA","5980","H",14.45,NA,NA,NA,"26.7","G","N",NA,"FVINP SKIP","C",NA,2024-06-11,"2024","06","11","St. Thomas",18.319231,-64.865114
"789","Compass Point",NA,"LU","6/24/2024","CC","06/11/2024","RHMA","5981","H",6.24,NA,NA,NA,"15.5","G","N",NA,"FVINP SKIP","C",NA,2024-06-11,"2024","06","11","St. Thomas",18.319231,-64.865114
"790","Compass Point","DG","DG,NK","07/01/2024","CC","06/11/2024","RHMA","5800","H",13,"9.3","25.6","1.3","24.3","G","Y","Y",NA,"N",NA,2024-06-11,"2024","06","11","St. Thomas",18.319231,-64.865114
"791","Compass Point","AND","Ke'Andre Scaliff","20/03/2023","CC","17/03/2023","RHMA","E2-172","H",7.49,"8.7","27","3.5","23.5","G","N",NA,NA,"MIC","Little Jay",2023-03-17,"2023","03","17","St. Thomas",18.319231,-64.865114
"792","Compass Point","AND","Jimena Saet","20/03/2023","CC","17/03/2023","RHMA","E2-176","H",6.24,"6.5","22.5","1","21.5","G","N",NA,NA,"MIC","Shenick",2023-03-17,"2023","03","17","St. Thomas",18.319231,-64.865114
"793","Compass Point","AND","Salmi Mchel","20/03/2023","CC","17/03/2023","RHMA","E2-177","H",12.76,"9.2","27.4","3.9","23.5","B","N",NA,NA,"MIC","Ivony",2023-03-17,"2023","03","17","St. Thomas",18.319231,-64.865114
"794","Compass Point","AND","Q.C","03/03/2023","CC","09/02/2023","RHMA","E2-129","H",24.91,"10.6","30","6.3","23.7","B","Y",NA,NA,"MIC","Augusto",2023-09-02,"2023","09","02","St. Thomas",18.319231,-64.865114
"795","Compass Point","AND","A.S.B","03/03/2023","CC","09/02/2023","RHMA","E2-130","H",10.07,"10","21.5","1","20.5","G","Y",NA,NA,"MIC","Kamari",2023-09-02,"2023","09","02","St. Thomas",18.319231,-64.865114
"796","Compass Point","AND","J.I.G","03/03/2023","CC","09/02/2023","RHMA","E2-131","H",11.67,"9","23","0","23","G","Y",NA,NA,"MIC","Timori",2023-09-02,"2023","09","02","St. Thomas",18.319231,-64.865114
"797","Compass Point","DIRECT INPUT","KWG, AJH",NA,"3"" TP","2/23/2023","RHMA","3309","H",14.58,"10.3","25.9","1.1","24.8","G","Y","N","PLUM HALF DEAD","N",NA,2023-02-23,"2023","02","23","St. Thomas",18.319231,-64.865114
"798","Compass Point","DIRECT INPUT","KWG, AJH",NA,"3"" TP","2/23/2023","RHMA","3310","H",14,"12.2","19.5","0.5","19","G","Y","N",NA,"N",NA,2023-02-23,"2023","02","23","St. Thomas",18.319231,-64.865114
"799","Compass Point","DIRECT INPUT","KWG, AJH",NA,"3"" TP","2/23/2023","RHMA","3311","H",20.35,"11.3","29","2.5","26.5","G","Y","N","PLUM HALF DEAD","N",NA,2023-02-23,"2023","02","23","St. Thomas",18.319231,-64.865114
"800","Compass Point","DIRECT INPUT","KWG, AJH",NA,"3"" TP","2/23/2023","RHMA","3312","H",18.4,"11.4","25.7","1.2","24.5","G","Y","N",NA,"N",NA,2023-02-23,"2023","02","23","St. Thomas",18.319231,-64.865114
"801","Compass Point","DIRECT INPUT","KWG, AJH",NA,"3"" TP","2/23/2023","RHMA","3313","H",12,"9.6","23.2","1.2","22","BG","Y","N","PLUM HALF DEAD","N",NA,2023-02-23,"2023","02","23","St. Thomas",18.319231,-64.865114
"802","Compass Point",NA,"LU","6/24/2024","CC","06/11/2024","RHMA","5954","H",14.12,NA,NA,NA,"31.3","G","N",NA,"FVINP SKIP","C",NA,2024-06-11,"2024","06","11","St. Thomas",18.319231,-64.865114
"803","Compass Point","DIRECT INPUT","KWG, AJH",NA,"3"" TP","2/21/2023","RHMA","3315","H",20,"12.1","24.5","1.3","23.2","G","Y","Y",NA,"N",NA,2023-02-21,"2023","02","21","St. Thomas",18.319231,-64.865114
"804","Compass Point",NA,"LU","6/24/2024","CC","06/11/2024","RHMA","5957","H",17.85,NA,NA,NA,"30","G","N",NA,"FVINP SKIP","C",NA,2024-06-11,"2024","06","11","St. Thomas",18.319231,-64.865114
"805","Compass Point",NA,"LU","6/24/2024","CC","06/11/2024","RHMA","5958","H",17.29,NA,NA,NA,"27.5","G","N",NA,"FVINP SKIP","C",NA,2024-06-11,"2024","06","11","St. Thomas",18.319231,-64.865114
"806","Compass Point",NA,"LU","6/24/2024","CC","06/11/2024","RHMA","5959","H",22.58,NA,NA,NA,"31.5","G","N",NA,"FVINP SKIP","C",NA,2024-06-11,"2024","06","11","St. Thomas",18.319231,-64.865114
"807","Compass Point","ES","ES","8/29/2024","CC","06/11/2024","RHMA","6089","H",12.55,"10.7","22.1","0.7","21.4","G/B","Y","Y",NA,"N",NA,2024-06-11,"2024","06","11","St. Thomas",18.319231,-64.865114
"808","Compass Point","DG","DG,NK","07/01/2024","CC","06/11/2024","RHMA","5820","H",6.4,"9.1","16.2","1","15.2","G","N","Y",NA,"N",NA,2024-06-11,"2024","06","11","St. Thomas",18.319231,-64.865114
"809","Compass Point","AND","De'Janae Brathwaite","20/03/2023","CC","17/03/2023","RHMA","E2-193","H",13.5,"6.6","26.3","1.3","25","G","N",NA,NA,"MIC","TJ",2023-03-17,"2023","03","17","St. Thomas",18.319231,-64.865114
"810","Compass Point","DG","DG,NK","07/01/2024","CC","06/11/2024","RHMA","5822","H",14.6,"9.9","28.2","1.8","26.4","G","N","Y",NA,"N",NA,2024-06-11,"2024","06","11","St. Thomas",18.319231,-64.865114
"811","Compass Point","AND","Malyk Jean Charles","20/03/2023","CC","17/03/2023","RHMA","E2-195","H",19.35,"9","29.5","1.5","28","B","N",NA,NA,"MIC","GnJ",2023-03-17,"2023","03","17","St. Thomas",18.319231,-64.865114
"812","Compass Point","AND","T.C","03/03/2023","CC","09/02/2023","RHMA","E2-105","H",20.29,"10.5","28.5","1.3","27.2","G","Y",NA,NA,"MIC","Timmah",2023-09-02,"2023","09","02","St. Thomas",18.319231,-64.865114
"813","Compass Point",NA,"LU","6/24/2024","CC","06/11/2024","RHMA","5978","H",12.51,NA,NA,NA,"23.7","G","N",NA,"FVINP SKIP","C",NA,2024-06-11,"2024","06","11","St. Thomas",18.319231,-64.865114
"814","Compass Point",NA,"LU","6/24/2024","CC","06/11/2024","RHMA","5979","H",20,NA,NA,NA,"33.8","G","N",NA,"FVINP SKIP","C",NA,2024-06-11,"2024","06","11","St. Thomas",18.319231,-64.865114
"815","Compass Point","Direct Input","KR/MF","11/13/24","CC","10/27/2024","RHMA","6623","H",12.5,"8.8","21","1.5","19.5","G","Y","Y",NA,NA,NA,2024-10-27,"2024","10","27","St. Thomas",18.319231,-64.865114
"816","Compass Point","KH","MH, KB","3/22/2023","3""TP","3/17/23","RHMA","3645","H",9.97,"10.3","21","1","20","GB","N","N",NA,"C",NA,2023-03-17,"2023","03","17","St. Thomas",18.319231,-64.865114
"817","Compass Point","Direct Input","KR/MF","11/13/24","CC","10/27/2024","RHMA","6613","H",26.93,"12.4","34.4","2.1","32.3","G","Y","N",NA,NA,NA,2024-10-27,"2024","10","27","St. Thomas",18.319231,-64.865114
"818","Compass Point","Direct Input","KR/MF","11/13/24","CC","10/27/2024","RHMA","6614","H",28.37,"12.3","39.6","2.5","37.1","G","Y","N",NA,NA,NA,2024-10-27,"2024","10","27","St. Thomas",18.319231,-64.865114
"819","Compass Point","Direct Input","KR/MF","11/13/24","CC","10/27/2024","RHMA","6615","H",22.42,"11.7","32.1","2.1","30","G","Y","N",NA,NA,NA,2024-10-27,"2024","10","27","St. Thomas",18.319231,-64.865114
"820","Compass Point","Direct Input","KR/MF","11/13/24","CC","10/27/2024","RHMA","6616","H",10,"9.4","17.5","1.2","16.3","G","Y","Y",NA,NA,NA,2024-10-27,"2024","10","27","St. Thomas",18.319231,-64.865114
"821","Compass Point","Direct Input","KR/MF","11/13/24","CC","10/27/2024","RHMA","6617","H",25.04,"12.9","23.4","1.3","22.1","G","Y","N",NA,NA,NA,2024-10-27,"2024","10","27","St. Thomas",18.319231,-64.865114
"822","Compass Point","Direct Input","KR/MF","11/13/24","CC","10/27/2024","RHMA","6618","H",27,"11.5","33.7","2.2","31.5","G","Y","N",NA,NA,NA,2024-10-27,"2024","10","27","St. Thomas",18.319231,-64.865114
"823","Compass Point","Direct Input","KR/MF","11/13/24","CC","10/27/2024","RHMA","6619","H",16.63,"10.9","28.5","1.9","26.6","G","Y","N",NA,NA,NA,2024-10-27,"2024","10","27","St. Thomas",18.319231,-64.865114
"824","Compass Point",NA,"LU","6/24/2024","CC","06/11/2024","RHMA","5976","H",17.79,NA,NA,NA,"30.4","G","N",NA,"FVINP SKIP","C",NA,2024-06-11,"2024","06","11","St. Thomas",18.319231,-64.865114
"825","Compass Point",NA,"LU","6/24/2024","CC","06/11/2024","RHMA","5977","H",11.57,NA,NA,NA,"25.3","G","N",NA,"FVINP SKIP","C",NA,2024-06-11,"2024","06","11","St. Thomas",18.319231,-64.865114
"826","Compass Point","AND","Shay","20/03/2023","CC","17/03/2023","RHMA","E2-183","H",14.95,"10.2","28.2","1.5","26.7","B","Y",NA,NA,"MIC","Rafal",2023-03-17,"2023","03","17","St. Thomas",18.319231,-64.865114
"827","Compass Point","AND","Iziane Penn","20/03/2023","CC","17/03/2023","RHMA","E2-184","H",17.47,"10.3","23.1","1","22.1","B","N",NA,NA,"MIC","Izzy Sweet Rose",2023-03-17,"2023","03","17","St. Thomas",18.319231,-64.865114
"828","Compass Point","AND","Zhy","20/03/2023","CC","17/03/2023","RHMA","E2-185","H",17.7,"9.9","26.8","0.8","26","G","N",NA,NA,"MIC","Jolene",2023-03-17,"2023","03","17","St. Thomas",18.319231,-64.865114
"829","Compass Point","DG","DG,NK","07/01/2024","CC","06/11/2024","RHMA","5799","H",9.8,"9","22.5","1.1","21.4","G","Y","Y",NA,"N",NA,2024-06-11,"2024","06","11","St. Thomas",18.319231,-64.865114
"830","Compass Point","AND","Everni","20/03/2023","CC","17/03/2023","RHMA","E2-187","H",11.86,"8","24.9","0.9","24","G","N",NA,NA,"MIC","Eva",2023-03-17,"2023","03","17","St. Thomas",18.319231,-64.865114
"831","Compass Point","DG","DG,NK","07/01/2024","CC","06/11/2024","RHMA","5801","H",3.8,"6.2","15.6","0.3","15.3","G","Y","Y",NA,"N",NA,2024-06-11,"2024","06","11","St. Thomas",18.319231,-64.865114
"832","Compass Point","DG","DG,NK","07/01/2024","CC","06/11/2024","RHMA","5802","H",10.2,"9.4","22.2","1","21.2","G","N","Y",NA,"N",NA,2024-06-11,"2024","06","11","St. Thomas",18.319231,-64.865114
"833","Compass Point","DG","DG,NK","07/01/2024","CC","06/11/2024","RHMA","5803","H",11.7,"10.3","22.5","1.3","21.2","G","Y","Y",NA,"N",NA,2024-06-11,"2024","06","11","St. Thomas",18.319231,-64.865114
"834","Compass Point","AND","Marisol Blyden","20/03/2023","CC","17/03/2023","RHMA","E2-178","H",9.15,"10.05","19","1.5","17.5","G","N",NA,NA,"MIC","Keke",2023-03-17,"2023","03","17","St. Thomas",18.319231,-64.865114
"835","Compass Point","AND","Rhea Hill","20/03/2023","CC","17/03/2023","RHMA","E2-179","H",6.88,"8.4","18.4","0.6","17.8","G","N",NA,NA,"MIC","Charm",2023-03-17,"2023","03","17","St. Thomas",18.319231,-64.865114
"836","Compass Point","AND","Eimy Mercedes","20/03/2023","CC","17/03/2023","RHMA","E2-180","H",9.82,"10.05","20.4","0.5","19.9","B","N",NA,NA,"MIC","Emeli",2023-03-17,"2023","03","17","St. Thomas",18.319231,-64.865114
"837","Compass Point","AND","Franchesca Reyes","20/03/2023","CC","17/03/2023","RHMA","E2-181","H",12.03,"9.4","22.5","1.3","21.2","G","N",NA,NA,"MIC","Summer",2023-03-17,"2023","03","17","St. Thomas",18.319231,-64.865114
"838","Compass Point","AND","Yemeiris Oyh","20/03/2023","CC","17/03/2023","RHMA","E2-182","H",20.06,"10.4","25","1.3","23.7","B","N",NA,NA,"MIC","Yeneyris",2023-03-17,"2023","03","17","St. Thomas",18.319231,-64.865114
"839","Compass Point","AND","Kahelya Alford","20/03/2023","CC","17/03/2023","RHMA","E2-196","H",14.41,"8.6","29.8","2.8","27","G","N",NA,NA,"MIC","Mixheal",2023-03-17,"2023","03","17","St. Thomas",18.319231,-64.865114
"840","Compass Point","Direct Input","KR/MF","11/13/24","CC","10/27/2024","RHMA","6621","H",20.88,"11.8","29.2","1.2","28","G","Y","Y",NA,NA,NA,2024-10-27,"2024","10","27","St. Thomas",18.319231,-64.865114
"841","Compass Point","Direct Input","KR/MF","11/13/24","CC","10/27/2024","RHMA","6622","H",14.43,"10.4","26.1","1.6","24.5","G","N","N",NA,NA,NA,2024-10-27,"2024","10","27","St. Thomas",18.319231,-64.865114
"842","Compass Point","DIRECT INPUT","KWG, AJH",NA,"3"" TP","2/23/2023","RHMA","3314","H",7.93,"10.3","17.4","0.9","16.5","G","Y","N",NA,"N",NA,2023-02-23,"2023","02","23","St. Thomas",18.319231,-64.865114
"843","Compass Point","DG","DG,NK","07/01/2024","CC","06/11/2024","RHMA","5798","H",9.3,"9.6","20.5","1.4","19.1","G","Y","Y",NA,"N",NA,2024-06-11,"2024","06","11","St. Thomas",18.319231,-64.865114
"844","Compass Point","DIRECT INPUT","KWG, AJH",NA,"3"" TP","2/21/2023","RHMA","3316","H",12.34,"10.7","20.4","1.4","19","G","Y","Y",NA,"N",NA,2023-02-21,"2023","02","21","St. Thomas",18.319231,-64.865114
"845","Compass Point","AND","Malachi","20/03/2023","CC","17/03/2023","RHMA","E2-138","H",23.2,"11.5","27.5","1.6","25.9","B","N",NA,NA,"MIC","Malachi Jr",2023-03-17,"2023","03","17","St. Thomas",18.319231,-64.865114
"846","Compass Point","DG","DG,NK","07/01/2024","CC","06/11/2024","RHMA","5818","H",16.6,"10.7","25.6","1.5","24.1","G","Y","Y",NA,"N",NA,2024-06-11,"2024","06","11","St. Thomas",18.319231,-64.865114
"847","Compass Point","DG","DG,NK","07/01/2024","CC","06/11/2024","RHMA","5819","H",19,"10.9","19.2","1.2","18","G","Y","Y",NA,"N",NA,2024-06-11,"2024","06","11","St. Thomas",18.319231,-64.865114
"848","Compass Point","AND","Amir Hodge","20/03/2023","CC","17/03/2023","RHMA","E2-192","H",13.54,"8","26","1","25","G","N",NA,NA,"MIC","Clemintine",2023-03-17,"2023","03","17","St. Thomas",18.319231,-64.865114
"849","Compass Point","DG","DG,NK","07/01/2024","CC","06/11/2024","RHMA","4597","H",8.5,"8.7","19.4","0.6","18.8","G","N","Y",NA,"N",NA,2024-06-11,"2024","06","11","St. Thomas",18.319231,-64.865114
"850","Compass Point","AND","Cameraon Hill","20/03/2023","CC","17/03/2023","RHMA","E2-194","H",19.71,"10","25.5","1.5","24","B","N",NA,NA,"MIC","Tito",2023-03-17,"2023","03","17","St. Thomas",18.319231,-64.865114
"851","Compass Point","DG","DG,NK","07/01/2024","CC","06/11/2024","RHMA","4603","H",11.8,"8.8","25.8","1","24.8","G","N","Y",NA,"N",NA,2024-06-11,"2024","06","11","St. Thomas",18.319231,-64.865114
"852","Compass Point","Direct Input","KR/MF","11/13/24","CC","10/27/2024","RHMA","6620","H",17.89,"11.2","27.1","1.5","25.6","G","Y","N",NA,NA,NA,2024-10-27,"2024","10","27","St. Thomas",18.319231,-64.865114
"853","Compass Point","AND","Y.S","03/03/2023","CC","09/02/2023","RHMA","E2-133","H",14,"11.7","25","1.6","23.4","G","Y",NA,NA,"MIC","Cornelious",2023-09-02,"2023","09","02","St. Thomas",18.319231,-64.865114
"854","Compass Point","AND","SRM","03/03/2023","CC","09/02/2023","RHMA","E2-134","H",9.26,"9.8","20.1","1.8","18.3","G","Y",NA,NA,"MIC",NA,2023-09-02,"2023","09","02","St. Thomas",18.319231,-64.865114
"855","Compass Point","DG","DG,NK","07/01/2024","CC","06/11/2024","RHMA","5797","H",11,"8.7","25.1","1","24.1","G","N","Y",NA,"N",NA,2024-06-11,"2024","06","11","St. Thomas",18.319231,-64.865114
"856","Compass Point","AND","Manuela L.S.","20/03/2023","CC","17/03/2023","RHMA","E2-186","H",11.18,"10.9","21.1","2.1","19","G","N",NA,NA,"MIC","Sebastian Maechalis",2023-03-17,"2023","03","17","St. Thomas",18.319231,-64.865114
"857","Compass Point","AND","JC","03/03/2023","CC","09/02/2023","RHMA","E2-109","H",21.52,"12.7","29.7","1.2","28.5","B","Y",NA,NA,"MIC","Liam",2023-09-02,"2023","09","02","St. Thomas",18.319231,-64.865114
"858","Compass Point","AND","T.C","03/03/2023","CC","09/02/2023","RHMA","E2-110","H",19.89,"10.2","25.2","1.7","23.5","G","Y",NA,NA,"MIC","Jimbo",2023-09-02,"2023","09","02","St. Thomas",18.319231,-64.865114
"859","Compass Point","AND","LS","03/03/2023","CC","09/02/2023","RHMA","E2-111","H",12.07,"10.1","21.2","1.5","19.7","G","Y",NA,NA,"MIC","Barnubous",2023-09-02,"2023","09","02","St. Thomas",18.319231,-64.865114
"860","Compass Point","AND","SRM","03/03/2023","CC","09/02/2023","RHMA","E2-112","H",15.16,"12.8","21.9","0.9","21","G","Y",NA,NA,"MIC",NA,2023-09-02,"2023","09","02","St. Thomas",18.319231,-64.865114
"861","Compass Point","KH","JN","3/22/2023","3""TP","3/17/23","RHMA","3652","H",8.7,"6.3","18.5","1","17.5","GB","N","N",NA,"C",NA,2023-03-17,"2023","03","17","St. Thomas",18.319231,-64.865114
"862","Compass Point","Direct Input","KR/MF","11/13/24","CC","10/26/2024","RHMA","6630","H",12.63,"10.2","20.9","1.6","19.3","G","Y","Y",NA,NA,NA,2024-10-26,"2024","10","26","St. Thomas",18.319231,-64.865114
"863","Compass Point","DG","DG,NK","07/01/2024","CC","06/11/2024","RHMA","4596","H",13.1,"11.1","22.3","1.4","20.9","G","Y","Y",NA,"N",NA,2024-06-11,"2024","06","11","St. Thomas",18.319231,-64.865114
"864","Compass Point","Direct Input","KR/MF","11/13/24","CC","10/26/2024","RHMA","6632","H",12.72,"8.2","24.9","1.7","23.2","G","Y","Y",NA,NA,NA,2024-10-26,"2024","10","26","St. Thomas",18.319231,-64.865114
"865","Compass Point","AND","J.S","03/03/2023","CC","09/02/2023","RHMA","E2-132","H",15.04,"13.3","19.1","0.6","18.5","G","Y",NA,NA,"MIC","Santana",2023-09-02,"2023","09","02","St. Thomas",18.319231,-64.865114
"866","Compass Point","KH","KA","3/22/2023","3""TP","3/17/23","RHMA","3668","H",10.58,"10.6","17","0.9","16.1","G","N","Y",NA,"C",NA,2023-03-17,"2023","03","17","St. Thomas",18.319231,-64.865114
"867","Compass Point","DG","DG,NK","07/01/2024","CC","06/11/2024","RHMA","5795","H",12.7,"9.5","47.9","1.2","46.7","G","Y","Y",NA,"N",NA,2024-06-11,"2024","06","11","St. Thomas",18.319231,-64.865114
"868","Compass Point","AND","8RM","03/03/2023","CC","09/02/2023","RHMA","E2-135","H",20.08,"11","30","1.5","28.5","G","Y",NA,NA,"MIC",NA,2023-09-02,"2023","09","02","St. Thomas",18.319231,-64.865114
"869","Compass Point","KH","KA","3/22/2023","3""TP","3/17/23","RHMA","3671","H",7,"7.9","14.1","0.7","13.4","G","N","Y",NA,"C",NA,2023-03-17,"2023","03","17","St. Thomas",18.319231,-64.865114
"870","Compass Point","AND","Juh'tti Jackson","20/03/2023","CC","17/03/2023","RHMA","E2-123","H",6.92,"6.5","25","0.6","24.4","G","N",NA,NA,"MIC","Demitri IV",2023-03-17,"2023","03","17","St. Thomas",18.319231,-64.865114
"871","Compass Point","AND","Olivel","20/03/2023","CC","17/03/2023","RHMA","E2-188","H",17.46,"10.7","30","1.5","28.5","G","Y",NA,NA,"MIC","Joey",2023-03-17,"2023","03","17","St. Thomas",18.319231,-64.865114
"872","Compass Point","AND","Johanver","20/03/2023","CC","17/03/2023","RHMA","E2-189","H",13.11,"10.3","25.7","1.2","24.5","G","N",NA,NA,"MIC","Bob",2023-03-17,"2023","03","17","St. Thomas",18.319231,-64.865114
"873","Compass Point","AND","Juli","20/03/2023","CC","17/03/2023","RHMA","E2-190","H",16.93,"9.1","26","1","25","G","N",NA,NA,"MIC","Olive",2023-03-17,"2023","03","17","St. Thomas",18.319231,-64.865114
"874","Compass Point","DG","DG,NK","07/01/2024","CC","06/11/2024","RHMA","5804","H",8.6,"9.1","20.6","1.1","19.5","G","N","Y",NA,"N",NA,2024-06-11,"2024","06","11","St. Thomas",18.319231,-64.865114
"875","Compass Point","KH","AW","3/22/2023","3""TP","3/17/23","RHMA","3649","H",11.12,"7.3","27","1","26","G","Y","N",NA,"C",NA,2023-03-17,"2023","03","17","St. Thomas",18.319231,-64.865114
"876","Compass Point","Direct Input","KR/MF","11/13/24","CC","10/26/2024","RHMA","6631","H",10.44,"8.2","21.5","1.2","20.3","G","Y","Y",NA,NA,NA,2024-10-26,"2024","10","26","St. Thomas",18.319231,-64.865114
"877","Compass Point","KH","KK, JN","3/22/2023","3""TP","3/17/23","RHMA","3651","H",10.4,"8.7","18","1","17","GB","N","Y",NA,"C",NA,2023-03-17,"2023","03","17","St. Thomas",18.319231,-64.865114
"878","Compass Point","DG","DG,NK","07/01/2024","CC","06/11/2024","RHMA","4595","H",17.8,"12","22.7","1.4","21.3","G","Y","Y",NA,"N",NA,2024-06-11,"2024","06","11","St. Thomas",18.319231,-64.865114
"879","Compass Point","AND","Kalijah Simon","20/03/2023","CC","17/03/2023","RHMA","E2-129","H",11.87,"9","25.5","4.5","21","G","N",NA,NA,"MIC","Donjour Johnson",2023-03-17,"2023","03","17","St. Thomas",18.319231,-64.865114
"880","Compass Point","KH","KA","3/22/2023","3""TP","3/17/23","RHMA","3669","H",8.62,"9.3","15.4","0.4","15","G","N","Y",NA,"C",NA,2023-03-17,"2023","03","17","St. Thomas",18.319231,-64.865114
"881","Compass Point","DG","DG,NK","07/01/2024","CC","06/11/2024","RHMA","5796","H",8.4,"8.7","20.9","1.1","19.8","G","Y","Y",NA,"N",NA,2024-06-11,"2024","06","11","St. Thomas",18.319231,-64.865114
"882","Compass Point","DIRECT INPUT","KWG, AJH",NA,"3"" TP","2/23/2023","RHMA","3285","H",8.83,"9.3","19.6","0","19.6","G","Y","Y","PLUM GONE","N",NA,2023-02-23,"2023","02","23","St. Thomas",18.319231,-64.865114
"883","Compass Point","AND","Charles","20/03/2023","CC","17/03/2023","RHMA","E2-191","H",11.7,"11.5","16.9","1.2","15.7","G","N",NA,NA,"MIC","I don't like children",2023-03-17,"2023","03","17","St. Thomas",18.319231,-64.865114
"884","Compass Point","DG","DG,NK","07/01/2024","CC","06/11/2024","RHMA","5812","H",14,"11.2","23","1","22","G","Y","Y",NA,"N",NA,2024-06-11,"2024","06","11","St. Thomas",18.319231,-64.865114
"885","Compass Point","KH","MH, KB","3/22/2023","3""TP","3/17/23","RHMA","3646","H",5.97,"0.96","19","1","18","GB","N","Y",NA,"C",NA,2023-03-17,"2023","03","17","St. Thomas",18.319231,-64.865114
"886","Compass Point","DG","DG,NK","07/01/2024","CC","06/11/2024","RHMA","5805","H",10.4,"9.4","20.5","1.4","19.1","G","N","Y",NA,"N",NA,2024-06-11,"2024","06","11","St. Thomas",18.319231,-64.865114
"887","Compass Point","DG","DG,NK","07/01/2024","CC","06/11/2024","RHMA","5806","H",8,"8.4","20.8","0.7","20.1","G","N","Y",NA,"N",NA,2024-06-11,"2024","06","11","St. Thomas",18.319231,-64.865114
"888","Compass Point","ES","ES","8/29/2024","CC","06/11/2024","RHMA","6088","H",15.62,"10.7","31.2","6","25.2","G/B","Y","Y",NA,"N",NA,2024-06-11,"2024","06","11","St. Thomas",18.319231,-64.865114
"889","Compass Point","KH","ST","3/22/2023","3""TP","3/17/23","RHMA","3650","H",10.7,"9","20","1","19","B","N","N",NA,"C",NA,2023-03-17,"2023","03","17","St. Thomas",18.319231,-64.865114
"890","Compass Point","KH","KA","3/22/2023","3""TP","3/17/23","RHMA","3670","H",5.81,"7.7","11.7","0.3","11.4","G","N","Y",NA,"C",NA,2023-03-17,"2023","03","17","St. Thomas",18.319231,-64.865114
"891","Compass Point","ES","ES","8/29/2024","CC","06/11/2024","RHMA","6086","H",12.62,"9.6","35","2.6","32.4","G/B","Y","Y",NA,"N",NA,2024-06-11,"2024","06","11","St. Thomas",18.319231,-64.865114
"892","Compass Point","DG","DG,NK","07/01/2024","CC","06/11/2024","RHMA","5807","H",10.3,"9.3","23.5","1","22.5","G","N","Y",NA,"N",NA,2024-06-11,"2024","06","11","St. Thomas",18.319231,-64.865114
"893","Compass Point","KH","KA","3/22/2023","3""TP","3/17/23","RHMA","3672","H",7.3,"7","17.2","0.7","16.5","G","N","N",NA,"C",NA,2023-03-17,"2023","03","17","St. Thomas",18.319231,-64.865114
"894","Compass Point","AND","Heavenly Bertrond","20/03/2023","CC","17/03/2023","RHMA","E2-136","H",16.68,"1.15","26.7","1.6","25.1","B","N",NA,NA,"MIC","Heaven",2023-03-17,"2023","03","17","St. Thomas",18.319231,-64.865114
"895","Compass Point","Direct Input","KR/MF","11/13/24","CC","10/26/2024","RHMA","6637","H",13.92,"9.3","22.7","2.4","20.3","G","Y","N",NA,NA,NA,2024-10-26,"2024","10","26","St. Thomas",18.319231,-64.865114
"896","Compass Point","KH","ST","3/22/2023","3""TP","3/17/23","RHMA","3648","H",15.1,"9,5","22.1","1.1","21","GB","Y","N",NA,"C",NA,2023-03-17,"2023","03","17","St. Thomas",18.319231,-64.865114
"897","Compass Point","DG","DG,NK","07/01/2024","CC","06/11/2024","RHMA","5817","H",16.5,"12","24.5","1.5","23","G","Y","Y",NA,"N",NA,2024-06-11,"2024","06","11","St. Thomas",18.319231,-64.865114
"898","Compass Point","KH","AW","3/22/2023","3""TP","3/17/23","RHMA","3647","H",16,"9.3","24.5","1","23.5","GB","Y","N",NA,"C",NA,2023-03-17,"2023","03","17","St. Thomas",18.319231,-64.865114
"899","Compass Point","Direct Input","KR/MF","11/13/24","CC","10/26/2024","RHMA","6634","H",13.94,"9.6","24.7","2.2","22.5","G","Y","N",NA,NA,NA,2024-10-26,"2024","10","26","St. Thomas",18.319231,-64.865114
"900","Compass Point","DG","DG,NK","07/01/2024","CC","06/11/2024","RHMA","5811","H",14.1,"10","25.9","1","24.9","G","Y","Y",NA,"N",NA,2024-06-11,"2024","06","11","St. Thomas",18.319231,-64.865114
"901","Compass Point","ES","ES","8/29/2024","CC","06/11/2024","RHMA","6087","H",16.9,"10.5","30.5","1","29.5","G/B","Y","Y",NA,"N",NA,2024-06-11,"2024","06","11","St. Thomas",18.319231,-64.865114
"902","Compass Point","DG","DG,NK","07/01/2024","CC","06/11/2024","RHMA","5814","H",11.6,"8.8","26.5","1.3","25.2","G","Y","Y",NA,"N",NA,2024-06-11,"2024","06","11","St. Thomas",18.319231,-64.865114
"903","Compass Point","Direct Input","KR/MF","11/13/24","CC","10/26/2024","RHMA","6638","H",22.2,"12","26.3","2.5","23.8","G","Y","N",NA,NA,NA,2024-10-26,"2024","10","26","St. Thomas",18.319231,-64.865114
"904","Compass Point","DG","DG,NK","07/01/2024","CC","06/11/2024","RHMA","5813","H",11.2,"9.8","20.5","1","19.5","G","N","Y",NA,"N",NA,2024-06-11,"2024","06","11","St. Thomas",18.319231,-64.865114
"905","Compass Point","DG","DG,NK","07/01/2024","CC","06/11/2024","RHMA","5808","H",9.8,"9.9","23.3","1","22.3","G","Y","Y",NA,"N",NA,2024-06-11,"2024","06","11","St. Thomas",18.319231,-64.865114
"906","Compass Point","AND","Julia","20/03/2023","CC","17/03/2023","RHMA","E2-137","H",10.83,"9.1","26","1","25","G","N",NA,NA,"MIC","Love",2023-03-17,"2023","03","17","St. Thomas",18.319231,-64.865114
"907","Compass Point","DG","DG,NK","07/01/2024","CC","06/11/2024","RHMA","5809","H",17.4,"11.5","26.2","1.5","24.7","G","Y","Y",NA,"N",NA,2024-06-11,"2024","06","11","St. Thomas",18.319231,-64.865114
"908","Compass Point","DG","DG,NK","07/01/2024","CC","06/11/2024","RHMA","5810","H",13.5,"10.3","27.2","1.5","25.7","G","Y","Y",NA,"N",NA,2024-06-11,"2024","06","11","St. Thomas",18.319231,-64.865114
"909","Compass Point","Direct Input","KR/MF","11/13/24","CC","10/26/2024","RHMA","6636","H",11.43,"9.2","21.2","1.7","19.5","G","Y","Y",NA,NA,NA,2024-10-26,"2024","10","26","St. Thomas",18.319231,-64.865114
"910","Compass Point","Direct Input","KR/MF","11/13/24","CC","10/26/2024","RHMA","6635","H",17.07,"9.4","25","2.1","22.9","G","Y","Y",NA,NA,NA,2024-10-26,"2024","10","26","St. Thomas",18.319231,-64.865114
"911","Compass Point","Direct Input","KR/MF","11/13/24","CC","10/26/2024","RHMA","6633","H",11.53,"8.3","23.6","2","21.6","G","Y","N",NA,NA,NA,2024-10-26,"2024","10","26","St. Thomas",18.319231,-64.865114
"912","Compass Point","DG","DG,NK","07/01/2024","CC","06/11/2024","RHMA","5815","H",15.1,"10.4","26.8","1.5","25.3","G","N","Y",NA,"N",NA,2024-06-11,"2024","06","11","St. Thomas",18.319231,-64.865114
"913","Magens Bay","AJH, HH","AJH, HH","11/07/2023","3""TP","10/11/2023","RHMA","5003","H",12.66,"9.7","19.5","1.5","18","G","Y","N",NA,"N",NA,2023-10-11,"2023","10","11","St. Thomas",18.3614,-64.92155
"914","Magens Bay","AJH, HH","AJH, HH","11/07/2023","3""TP","10/11/2023","RHMA","5004","H",8.88,"9.2","18.2","1.5","16.7","G","N","N",NA,"N",NA,2023-10-11,"2023","10","11","St. Thomas",18.3614,-64.92155
"915","Magens Bay","AR","AR,ET","11/02/2023","3"" TP","10/11/2023","RHMA","4991","H",15.97,"10.7","22.7","1.3","21.4","G","Y","N",NA,"N",NA,2023-10-11,"2023","10","11","St. Thomas",18.3614,-64.92155
"916","Magens Bay","AR","AR,ET","11/02/2023","3"" TP","10/11/2023","RHMA","4980","H",17.32,"12","24.7","1.5","23.2","G","Y","N",NA,"N",NA,2023-10-11,"2023","10","11","St. Thomas",18.3614,-64.92155
"917","Magens Bay","AR","AR,ET","11/02/2023","4"" TP","10/11/2023","RHMA","4981","H",20.03,"12.2","26.5","1.5","25","G","N","N",NA,"N",NA,2023-10-11,"2023","10","11","St. Thomas",18.3614,-64.92155
"918","Magens Bay","AR","AR,ET","11/02/2023","3"" TP","10/11/2023","RHMA","4982","H",21.08,"12.2","29.1","1.8","27.3","G","Y","N",NA,"N",NA,2023-10-11,"2023","10","11","St. Thomas",18.3614,-64.92155
"919","Magens Bay","AR","AR,ET","11/02/2023","3"" TP","10/11/2023","RHMA","4979","H",18.12,"11.7","24.7","1.5","23.2","G","N","N",NA,"N",NA,2023-10-11,"2023","10","11","St. Thomas",18.3614,-64.92155
"920","Magens Bay","AR","AR,ET","11/02/2023","3"" TP","10/11/2023","RHMA","4984","H",13.11,"11.4","20.5","1.2","19.3","G","N","N",NA,"N",NA,2023-10-11,"2023","10","11","St. Thomas",18.3614,-64.92155
"921","Magens Bay","AR","AR,ET","11/02/2023","3"" TP","10/11/2023","RHMA","4985","H",13.54,"11.6","21.7","1.5","20.2","G","N","Y",NA,"N",NA,2023-10-11,"2023","10","11","St. Thomas",18.3614,-64.92155
"922","Magens Bay","AR","AR,ET","11/02/2023","3"" TP","10/11/2023","RHMA","4986","H",22.78,"12.1","30.2","1.4","28.8","G","N","N",NA,"N",NA,2023-10-11,"2023","10","11","St. Thomas",18.3614,-64.92155
"923","Magens Bay","AR","AR,ET","11/02/2023","3"" TP","10/11/2023","RHMA","4983","H",15.26,"11.6","22.6","1.5","21.1","G","N","Y",NA,"N",NA,2023-10-11,"2023","10","11","St. Thomas",18.3614,-64.92155
"924","Magens Bay","AR","AR,ET","11/02/2023","3"" TP","10/11/2023","RHMA","4988","H",11.31,"10.3","20.8","1.3","19.5","G","N","Y",NA,"N",NA,2023-10-11,"2023","10","11","St. Thomas",18.3614,-64.92155
"925","Magens Bay","AR","AR,ET","11/02/2023","3"" TP","10/11/2023","RHMA","4989","H",19.4,"12.2","24.4","1.4","23","G","N","N",NA,"N",NA,2023-10-11,"2023","10","11","St. Thomas",18.3614,-64.92155
"926","Magens Bay","AR","AR,ET","11/02/2023","3"" TP","10/11/2023","RHMA","4990","H",9.15,"9.4","19.1","0.9","18.2","G","N","N",NA,"N",NA,2023-10-11,"2023","10","11","St. Thomas",18.3614,-64.92155
"927","Magens Bay","AR","AR","11/02/2023","3"" TP","10/11/2023","RHMA","4995","H",12.41,"10","19.8","1.2","18.6","G","N","N",NA,"N",NA,2023-10-11,"2023","10","11","St. Thomas",18.3614,-64.92155
"928","Magens Bay","AR","AR,ET","11/02/2023","3"" TP","10/11/2023","RHMA","4992","H",18.08,"10.9","24.1","1.6","22.5","G","N","N",NA,"N",NA,2023-10-11,"2023","10","11","St. Thomas",18.3614,-64.92155
"929","Magens Bay","AR","AR,ET","11/02/2023","3"" TP","10/11/2023","RHMA","4993","H",14.04,"10.1","23.1","1.5","21.6","G","N","N",NA,"N",NA,2023-10-11,"2023","10","11","St. Thomas",18.3614,-64.92155
"930","Magens Bay","AR","AR","11/02/2023","3"" TP","10/11/2023","RHMA","4994","H",10.88,"10","17.2","1.1","16.1","G","N","N",NA,"N",NA,2023-10-11,"2023","10","11","St. Thomas",18.3614,-64.92155
"931","Magens Bay","AR","AR","11/02/2023","3"" TP","10/11/2023","RHMA","4999","H",9.08,"10","15.1","1","14.1","G","N","N",NA,"N",NA,2023-10-11,"2023","10","11","St. Thomas",18.3614,-64.92155
"932","Magens Bay","AR","AR","11/02/2023","3"" TP","10/11/2023","RHMA","4996","H",11,"10","20.3","1.3","19","G","N","N",NA,"N",NA,2023-10-11,"2023","10","11","St. Thomas",18.3614,-64.92155
"933","Magens Bay","AR","AR","11/02/2023","3"" TP","10/11/2023","RHMA","4997","H",9.44,"10","18.9","1.3","17.6","G","N","Y",NA,"N",NA,2023-10-11,"2023","10","11","St. Thomas",18.3614,-64.92155
"934","Magens Bay","AR","AR","11/02/2023","3"" TP","10/11/2023","RHMA","4998","H",15.06,"10.4","21.9","1.4","20.5","G","N","N",NA,"N",NA,2023-10-11,"2023","10","11","St. Thomas",18.3614,-64.92155
"935","Magens Bay","AR","AR,ET","11/02/2023","3"" TP","10/11/2023","RHMA","4987","H",17.88,"12.1","24.8","1.5","23.3","G","N","Y",NA,"N",NA,2023-10-11,"2023","10","11","St. Thomas",18.3614,-64.92155
"936","Magens Bay","AJH, HH","AJH, HH","11/07/2023","3""TP","10/11/2023","RHMA","5001","H",20.59,"11.5","26.7","1.7","25","G","Y","N",NA,"N",NA,2023-10-11,"2023","10","11","St. Thomas",18.3614,-64.92155
"937","Magens Bay","AJH, HH","AJH, HH","11/07/2023","3""TP","10/11/2023","RHMA","5002","H",13.78,"10","21.2","1.6","19.6","G","N","N",NA,"N",NA,2023-10-11,"2023","10","11","St. Thomas",18.3614,-64.92155
"938","Magens Bay","AR","AR","11/02/2023","3"" TP","10/11/2023","RHMA","5000","H",8.63,"10","16.2","1","15.2","G","N","N",NA,"N",NA,2023-10-11,"2023","10","11","St. Thomas",18.3614,-64.92155
"939","Mandahl Bay","AND","AND","8/14/2023","3""TP","08/01/2023","RHMA","4530","H",8.64,"10.3","19.5","1.3","18.2","G","Y","Y",NA,"N",NA,2023-08-01,"2023","08","01","St. Thomas",18.35886,-64.8932
"940","Mandahl Bay","ES","ES","8/29/2024","CC","8/24/2024","RHMA","6085","H",5.8,"8.4","16.5","1.1","15.4","G/B","N","Y",NA,"N",NA,2024-08-24,"2024","08","24","St. Thomas",18.35886,-64.8932
"941","Mandahl Bay","ES","ES","8/29/2024","CC","8/24/2024","RHMA","6079","H",5.7,"7.5","16.8","0.8","16","G/B","N","Y",NA,"N",NA,2024-08-24,"2024","08","24","St. Thomas",18.35886,-64.8932
"942","Mandahl Bay","ES","ES","8/29/2024","CC","8/24/2024","RHMA","6073","H",4.97,"7.5","15","0.8","14.2","G","N","N",NA,"N",NA,2024-08-24,"2024","08","24","St. Thomas",18.35886,-64.8932
"943","Mandahl Bay","ES","ES","8/29/2024","CC","8/24/2024","RHMA","6080","H",17,"13.5","23","1.1","21.9","G/B","N","Y",NA,"N",NA,2024-08-24,"2024","08","24","St. Thomas",18.35886,-64.8932
"944","Mandahl Bay","ES","ES","8/29/2024","CC","8/24/2024","RHMA","6076","H",5,"7.5","17.3","1","16.3","G/B","N","Y",NA,"N",NA,2024-08-24,"2024","08","24","St. Thomas",18.35886,-64.8932
"945","Mandahl Bay","ES","ES","8/29/2024","CC","8/24/2024","RHMA","6077","H",3.48,"6.6","13","0.9","12.1","G/B","N","Y",NA,"N",NA,2024-08-24,"2024","08","24","St. Thomas",18.35886,-64.8932
"946","Mandahl Bay","ES","ES","8/29/2024","CC","8/24/2024","RHMA","6078","H",7.79,"9.4","17.4","1","16.4","G/B","N","Y",NA,"N",NA,2024-08-24,"2024","08","24","St. Thomas",18.35886,-64.8932
"947","Mandahl Bay","AND","AND","8/14/2023","3""TP","08/01/2023","RHMA","4503","H",19.7,"10.8","37.7","2.1","35.6","G","Y","Y",NA,"N",NA,2023-08-01,"2023","08","01","St. Thomas",18.35886,-64.8932
"948","Mandahl Bay","AND","AND","8/14/2023","3""TP","08/01/2023","RHMA","4531","H",21.12,"12.3","26.6","1.3","25.3","G","Y","N","VERY CURVED","N",NA,2023-08-01,"2023","08","01","St. Thomas",18.35886,-64.8932
"949","Mandahl Bay","ES","ES","8/29/2024","CC","8/24/2024","RHMA","6081","H",6,"8.1","19","1.6","17.4","G/B","N","Y",NA,"N",NA,2024-08-24,"2024","08","24","St. Thomas",18.35886,-64.8932
"950","Mandahl Bay","ES","ES","8/29/2024","CC","8/24/2024","RHMA","6082","H",6.32,"8.7","16","1.2","14.8","G/B","N","Y",NA,"N",NA,2024-08-24,"2024","08","24","St. Thomas",18.35886,-64.8932
"951","Mandahl Bay","ES","ES","8/29/2024","CC","8/24/2024","RHMA","6083","H",14.89,"11.8","22.5","0.7","21.8","G/B","N","Y",NA,"N",NA,2024-08-24,"2024","08","24","St. Thomas",18.35886,-64.8932
"952","Mandahl Bay","ES","ES","8/29/2024","CC","8/24/2024","RHMA","6084","H",19.62,"11.2","29.8","1.5","28.3","G/B","N","N",NA,"N",NA,2024-08-24,"2024","08","24","St. Thomas",18.35886,-64.8932
"953","Mandahl Bay","TB","SA","8/29/2024","CC","8/24/2024","RHMA","6042","H",26.8,"14","32.8","1.2","31.6","G","Y","Y",NA,"N",NA,2024-08-24,"2024","08","24","St. Thomas",18.35886,-64.8932
"954","Mandahl Bay","TB","SA","8/29/2024","CC","8/24/2024","RHMA","6043","H",22.1,"12.8","30.5","1.2","29.3","GB","Y","N",NA,"N",NA,2024-08-24,"2024","08","24","St. Thomas",18.35886,-64.8932
"955","Mandahl Bay","TB","SA","8/29/2024","CC","8/24/2024","RHMA","6044","H",19.2,"12.6","28.5","1","27.5","G","N","Y",NA,"N",NA,2024-08-24,"2024","08","24","St. Thomas",18.35886,-64.8932
"956","Mandahl Bay","ES","ES","8/29/2024","CC","8/24/2024","RHMA","6074","H",4.25,"8.1","14.2","0.8","13.4","G/B","N","Y",NA,"N",NA,2024-08-24,"2024","08","24","St. Thomas",18.35886,-64.8932
"957","Mandahl Bay","ES","ES","8/29/2024","CC","8/24/2024","RHMA","6075","H",5.8,"8.5","16.7","1.1","15.6","G/B","N","Y",NA,"N",NA,2024-08-24,"2024","08","24","St. Thomas",18.35886,-64.8932
"958","Mandahl Bay","AND","AND","8/14/2023","3""TP","08/01/2023","RHMA","4528","H",32.36,"13.7","40.3","2","38.3","G","Y","Y",NA,"N",NA,2023-08-01,"2023","08","01","St. Thomas",18.35886,-64.8932
"959","Mandahl Bay","AND","AND","8/14/2023","3""TP","08/01/2023","RHMA","4529","H",28.54,"13.2","37.4","1.7","35.7","G","Y","Y",NA,"N",NA,2023-08-01,"2023","08","01","St. Thomas",18.35886,-64.8932
"960","Mandahl Bay","DIRECT UPLOAD","AJH","08/11/2023","3""TP","08/01/2023","RHMA","4488","H",17.33,"10.7","35.9","1.9","34","G","Y","Y",NA,"N",NA,2023-08-01,"2023","08","01","St. Thomas",18.35886,-64.8932
"961","Mandahl Bay","DIRECT UPLOAD","AJH","08/11/2023","3""TP","08/01/2023","RHMA","4489","H",23.5,"12.6","34.3","1.5","32.8","G","Y","Y",NA,"N",NA,2023-08-01,"2023","08","01","St. Thomas",18.35886,-64.8932
"962","Mandahl Bay","AND","AND","8/14/2023","3""TP","08/01/2023","RHMA","4532","H",32.59,"14.1","41.4","1.9","39.5","G","Y","N",NA,"N",NA,2023-08-01,"2023","08","01","St. Thomas",18.35886,-64.8932
"963","Mandahl Bay","AND","AND","8/14/2023","3""TP","08/01/2023","RHMA","4533","H",24.71,"13","34.3","1.6","32.7","G","Y","N",NA,"N",NA,2023-08-01,"2023","08","01","St. Thomas",18.35886,-64.8932
"964","Mandahl Bay","AND","AND","8/14/2023","3""TP","08/01/2023","RHMA","4534","H",29.65,"13.6","37","1.8","35.2","G","Y","N",NA,"N",NA,2023-08-01,"2023","08","01","St. Thomas",18.35886,-64.8932
"965","Mandahl Bay","AND","AND","8/14/2023","3""TP","08/01/2023","RHMA","4535","H",21.89,"12.5","31.7","1.7","30","G","Y","N",NA,"N",NA,2023-08-01,"2023","08","01","St. Thomas",18.35886,-64.8932
"966","Mandahl Bay","AND","AND","8/14/2023","3""TP","08/01/2023","RHMA","4522","H",34.27,"14.8","38.6","1.5","37.1","G","Y","Y",NA,"N",NA,2023-08-01,"2023","08","01","St. Thomas",18.35886,-64.8932
"967","Mandahl Bay","AND","AND","8/14/2023","3""TP","08/01/2023","RHMA","4523","H",24.59,"13.5","33.9","1.7","32.2","G","Y","Y",NA,"N",NA,2023-08-01,"2023","08","01","St. Thomas",18.35886,-64.8932
"968","Mandahl Bay","AND","AND","8/14/2023","3""TP","08/01/2023","RHMA","4524","H",24.43,"13.1","34.4","1.8","32.6","G","Y","Y",NA,"N",NA,2023-08-01,"2023","08","01","St. Thomas",18.35886,-64.8932
"969","Mandahl Bay","AND","AND","8/14/2023","3""TP","08/01/2023","RHMA","4525","H",14.94,"11.5","26.3","1.3","25","G","Y","Y",NA,"N",NA,2023-08-01,"2023","08","01","St. Thomas",18.35886,-64.8932
"970","Mandahl Bay","AND","AND","8/14/2023","3""TP","08/01/2023","RHMA","4526","H",15.29,"11","26.9","1.6","25.3","G","Y","Y",NA,"N",NA,2023-08-01,"2023","08","01","St. Thomas",18.35886,-64.8932
"971","Mandahl Bay","AND","AND","8/14/2023","3""TP","08/01/2023","RHMA","4527","H",26.88,"14.2","29.1","1.4","27.7","G","Y","Y",NA,"N",NA,2023-08-01,"2023","08","01","St. Thomas",18.35886,-64.8932
"972","Mandahl Bay","DIRECT UPLOAD","AJH","08/11/2023","3""TP","08/01/2023","RHMA","4487","H",23,"11","38.2","1.7","36.5","G","Y","Y",NA,"N",NA,2023-08-01,"2023","08","01","St. Thomas",18.35886,-64.8932
"973","Mandahl Bay","AND","AND","8/14/2023","3""TP","08/01/2023","RHMA","4502","H",21.32,"12.2","32.8","1.6","31.2","G","Y","Y",NA,"N",NA,2023-08-01,"2023","08","01","St. Thomas",18.35886,-64.8932
"974","Mandahl Bay","TB","SA","8/29/2024","CC","8/24/2024","RHMA","6048","H",11.51,"9.2","30.4","1.5","28.9","G","N","Y",NA,"N",NA,2024-08-24,"2024","08","24","St. Thomas",18.35886,-64.8932
"975","Mandahl Bay","DIRECT UPLOAD","AJH","08/11/2023","3""TP","08/01/2023","RHMA","4490","H",9.6,"8.9","24","1.1","22.9","G","Y","Y",NA,"N",NA,2023-08-01,"2023","08","01","St. Thomas",18.35886,-64.8932
"976","Mandahl Bay","DIRECT UPLOAD","AJH","08/11/2023","3""TP","08/01/2023","RHMA","4491","H",23,"12.5","34.2","1.9","32.3","G","Y","Y",NA,"N",NA,2023-08-01,"2023","08","01","St. Thomas",18.35886,-64.8932
"977","Mandahl Bay","DIRECT UPLOAD","AJH","08/11/2023","3""TP","08/01/2023","RHMA","4492","H",30.58,"12.2","37.7","1.5","36.2","G","Y","Y",NA,"N",NA,2023-08-01,"2023","08","01","St. Thomas",18.35886,-64.8932
"978","Mandahl Bay","DIRECT UPLOAD","AJH","08/11/2023","3""TP","08/01/2023","RHMA","4493","H",14.68,"9.4","30.5","1.2","29.3","G","Y","Y",NA,"N",NA,2023-08-01,"2023","08","01","St. Thomas",18.35886,-64.8932
"979","Mandahl Bay","DIRECT UPLOAD","AJH","08/11/2023","3""TP","08/01/2023","RHMA","4494","H",26.18,"12.2","36.7","1.5","35.2","G","Y","Y",NA,"N",NA,2023-08-01,"2023","08","01","St. Thomas",18.35886,-64.8932
"980","Mandahl Bay","DIRECT UPLOAD","AJH","08/11/2023","3""TP","08/01/2023","RHMA","4495","H",14.19,"10","31.4","1.3","30.1","G","Y","Y",NA,"N",NA,2023-08-01,"2023","08","01","St. Thomas",18.35886,-64.8932
"981","Mandahl Bay","DIRECT UPLOAD","AJH","08/11/2023","3""TP","08/01/2023","RHMA","4496","H",15.28,"9.7","29.8","1.3","28.5","G","N","Y",NA,"N",NA,2023-08-01,"2023","08","01","St. Thomas",18.35886,-64.8932
"982","Mandahl Bay","DIRECT UPLOAD","AJH","08/11/2023","3""TP","08/01/2023","RHMA","4497","H",38.11,"14.5","37.5","1.7","35.8","G","Y","Y",NA,"N",NA,2023-08-01,"2023","08","01","St. Thomas",18.35886,-64.8932
"983","Mandahl Bay","TB","SA","8/29/2024","CC","8/24/2024","RHMA","6045","H",24.67,"13.1","31.5","1.4","30.1","GB","Y","N",NA,"N",NA,2024-08-24,"2024","08","24","St. Thomas",18.35886,-64.8932
"984","Mandahl Bay","DIRECT UPLOAD","AJH","08/11/2023","3""TP","08/01/2023","RHMA","4500","H",29.58,"12.9","36.6","1.8","34.8","G","Y","Y",NA,"N",NA,2023-08-01,"2023","08","01","St. Thomas",18.35886,-64.8932
"985","Mandahl Bay","AND","AND","8/14/2023","3""TP","08/01/2023","RHMA","4501","H",29.35,"13.6","34.5","1.8","32.7","G","Y","Y",NA,"N",NA,2023-08-01,"2023","08","01","St. Thomas",18.35886,-64.8932
"986","Mandahl Bay","AND","AND","8/14/2023","3""TP","08/01/2023","RHMA","4515","H",23.8,"13.5","32.4","1.6","30.8","G","Y","Y",NA,"N",NA,2023-08-01,"2023","08","01","St. Thomas",18.35886,-64.8932
"987","Mandahl Bay","AND","AND","8/14/2023","3""TP","08/01/2023","RHMA","4516","H",24.78,"12.9","35.1","1","34.1","G","Y","Y",NA,"N",NA,2023-08-01,"2023","08","01","St. Thomas",18.35886,-64.8932
"988","Mandahl Bay","AND","AND","8/14/2023","3""TP","08/01/2023","RHMA","4517","H",28.73,"13.7","38.7","1.7","37","G","Y","Y",NA,"N",NA,2023-08-01,"2023","08","01","St. Thomas",18.35886,-64.8932
"989","Mandahl Bay","AND","AND","8/14/2023","3""TP","08/01/2023","RHMA","4518","H",23.58,"13.1","34.2","1.5","32.7","G","Y","Y",NA,"N",NA,2023-08-01,"2023","08","01","St. Thomas",18.35886,-64.8932
"990","Mandahl Bay","AND","AND","8/14/2023","3""TP","08/01/2023","RHMA","4519","H",24.97,"13.1","35.5","2","33.5","G","Y","Y",NA,"N",NA,2023-08-01,"2023","08","01","St. Thomas",18.35886,-64.8932
"991","Mandahl Bay","AND","AND","8/14/2023","3""TP","08/01/2023","RHMA","4520","H",32.29,"14.3","38.2","2","36.2","G","Y","Y",NA,"N",NA,2023-08-01,"2023","08","01","St. Thomas",18.35886,-64.8932
"992","Mandahl Bay","AND","AND","8/14/2023","3""TP","08/01/2023","RHMA","4521","H",27.42,"12.4","38.4","2.1","36.3","G","Y","Y",NA,"N",NA,2023-08-01,"2023","08","01","St. Thomas",18.35886,-64.8932
"993","Mandahl Bay","ES","ES","8/29/2024","CC","8/24/2024","RHMA","6069","H",16.32,"11.5","25.4","1.2","24","G/B","N","N",NA,"N",NA,2024-08-24,"2024","08","24","St. Thomas",18.35886,-64.8932
"994","Mandahl Bay","ES","ES","8/29/2024","CC","8/24/2024","RHMA","6070","H",19,"12.3","29.8","1.6","28","B","N","N",NA,"N",NA,2024-08-24,"2024","08","24","St. Thomas",18.35886,-64.8932
"995","Mandahl Bay","ES","ES","8/29/2024","CC","8/24/2024","RHMA","6071","H",3.2,"7","11.8","0.5","11.2","G","N","Y",NA,"N",NA,2024-08-24,"2024","08","24","St. Thomas",18.35886,-64.8932
"996","Mandahl Bay","ES","ES","8/29/2024","CC","8/24/2024","RHMA","6072","H",7.12,"7.9","22.5","1.1","21.4","G/B","N","N",NA,"N",NA,2024-08-24,"2024","08","24","St. Thomas",18.35886,-64.8932
"997","Mandahl Bay","LG","SA, TB","8/29/2024","CC","8/14/2024","RHMA","6030","H",18.45,"11.9","27.5","1","26.5","GB","Y","N",NA,"N",NA,2024-08-14,"2024","08","14","St. Thomas",18.35886,-64.8932
"998","Mandahl Bay","TB","SA","8/29/2024","CC","8/14/2024","RHMA","6031","H",17.04,"11.4","28.3","1.5","26.8","GB","Y","N",NA,"N","Shelbianna",2024-08-14,"2024","08","14","St. Thomas",18.35886,-64.8932
"999","Mandahl Bay","TB","SA","8/29/2024","CC","8/24/2024","RHMA","6032","H",33.2,"13.9","41","1.5","39.5","GB","Y","N",NA,"N",NA,2024-08-24,"2024","08","24","St. Thomas",18.35886,-64.8932
"1000","Mandahl Bay","TB","SA","8/29/2024","CC","8/24/2024","RHMA","6033","H",12.19,"9","29.2","1.4","27.8","B","N","Y",NA,"N",NA,2024-08-24,"2024","08","24","St. Thomas",18.35886,-64.8932
"1001","Mandahl Bay","TB","SA","8/29/2024","CC","8/24/2024","RHMA","6034","H",30.04,"13.7","36.5","1.4","35.1","B","Y","N",NA,"N",NA,2024-08-24,"2024","08","24","St. Thomas",18.35886,-64.8932
"1002","Mandahl Bay","TB","SA","8/29/2024","CC","8/24/2024","RHMA","6035","H",21.05,"12.6","32","1.5","30.5","G","N","Y",NA,"N",NA,2024-08-24,"2024","08","24","St. Thomas",18.35886,-64.8932
"1003","Mandahl Bay","TB","SA","8/29/2024","CC","8/24/2024","RHMA","6036","H",14.83,"10.9","27.6","1.4","26.2","G","N","Y",NA,"N",NA,2024-08-24,"2024","08","24","St. Thomas",18.35886,-64.8932
"1004","Mandahl Bay","TB","SA","8/29/2024","CC","8/24/2024","RHMA","6037","H",32.16,"14.2","35.6","1.3","34.3","G","Y","Y",NA,"N",NA,2024-08-24,"2024","08","24","St. Thomas",18.35886,-64.8932
"1005","Mandahl Bay","TB","SA","8/29/2024","CC","8/24/2024","RHMA","6038","H",26.33,"12.9","36.2","1.3","34.9","B","Y","N",NA,"N",NA,2024-08-24,"2024","08","24","St. Thomas",18.35886,-64.8932
"1006","Mandahl Bay","TB","SA","8/29/2024","CC","8/24/2024","RHMA","6039","H",32.31,"14.2","37","1.5","35.5","GB","Y","Y",NA,"N",NA,2024-08-24,"2024","08","24","St. Thomas",18.35886,-64.8932
"1007","Mandahl Bay","TB","SA","8/29/2024","CC","8/24/2024","RHMA","6040","H",31.61,"13.5","37.5","1.5","36","B","Y","N",NA,"N",NA,2024-08-24,"2024","08","24","St. Thomas",18.35886,-64.8932
"1008","Mandahl Bay","TB","SA","8/29/2024","CC","8/24/2024","RHMA","6041","H",31.74,"14.7","34","1","33","B","Y","N",NA,"N",NA,2024-08-24,"2024","08","24","St. Thomas",18.35886,-64.8932
"1009","Mandahl Bay","MA","LG, MA","8/28/2024","CC","8/14/2024","RHMA","6001","H",31.81,"12.3","37.5","1.3","36.2","B/G","Y","Y",NA,"N",NA,2024-08-14,"2024","08","14","St. Thomas",18.35886,-64.8932
"1010","Mandahl Bay","DIRECT UPLOAD","AJH","08/11/2023","3""TP","08/01/2023","RHMA","4498","H",14.5,"9.4","32.6","1.6","31","G","Y","Y",NA,"N",NA,2023-08-01,"2023","08","01","St. Thomas",18.35886,-64.8932
"1011","Mandahl Bay","DIRECT UPLOAD","AJH","08/11/2023","3""TP","08/01/2023","RHMA","4499","H",9,"9.9","21.4","1.1","20.3","G","Y","Y",NA,"N",NA,2023-08-01,"2023","08","01","St. Thomas",18.35886,-64.8932
"1012","Mandahl Bay","MA","LG, MA","8/28/2024","CC","8/14/2024","RHMA","6005","H",28.37,"12","35.5","1.4","34.1","G","Y","Y",NA,"N",NA,2024-08-14,"2024","08","14","St. Thomas",18.35886,-64.8932
"1013","Mandahl Bay","MA","LG, MA","8/28/2024","CC","8/14/2024","RHMA","6006","H",24.73,"12.1","31.3","1.3","30","B/G","Y","Y",NA,"N",NA,2024-08-14,"2024","08","14","St. Thomas",18.35886,-64.8932
"1014","Mandahl Bay","MA","LG, MA","8/28/2024","CC","8/14/2024","RHMA","6007","H",31.25,"13","36.5","1.7","34.8","B/G","Y","Y",NA,"N",NA,2024-08-14,"2024","08","14","St. Thomas",18.35886,-64.8932
"1015","Mandahl Bay","AND","AND","8/14/2023","3""TP","08/01/2023","RHMA","4504","H",23.79,"12.1","36.5","2","34.5","G","Y","Y",NA,"N",NA,2023-08-01,"2023","08","01","St. Thomas",18.35886,-64.8932
"1016","Mandahl Bay","AND","AND","8/14/2023","3""TP","08/01/2023","RHMA","4505","H",12.39,"10.4","25.7","1.3","24.4","G","Y","Y",NA,"N",NA,2023-08-01,"2023","08","01","St. Thomas",18.35886,-64.8932
"1017","Mandahl Bay","AND","AND","8/14/2023","3""TP","08/01/2023","RHMA","4506","H",30.7,"12.6","38.3","1.8","36.5","G","Y","Y",NA,"N",NA,2023-08-01,"2023","08","01","St. Thomas",18.35886,-64.8932
"1018","Mandahl Bay","AND","AND","8/14/2023","3""TP","08/01/2023","RHMA","4507","H",32.92,"13.9","39.1","2","37.1","G","Y","Y",NA,"N",NA,2023-08-01,"2023","08","01","St. Thomas",18.35886,-64.8932
"1019","Mandahl Bay","AND","AND","8/14/2023","3""TP","08/01/2023","RHMA","4508","H",22.61,"12.9","31.4","1.6","29.8","G","Y","Y",NA,"N",NA,2023-08-01,"2023","08","01","St. Thomas",18.35886,-64.8932
"1020","Mandahl Bay","AND","AND","8/14/2023","3""TP","08/01/2023","RHMA","4509","H",20.26,"11.9","35.7","1.7","34","G","Y","Y",NA,"N",NA,2023-08-01,"2023","08","01","St. Thomas",18.35886,-64.8932
"1021","Mandahl Bay","AND","AND","8/14/2023","3""TP","08/01/2023","RHMA","4510","H",24.33,"12.2","36","1.8","34.2","G","Y","Y",NA,"N",NA,2023-08-01,"2023","08","01","St. Thomas",18.35886,-64.8932
"1022","Mandahl Bay","AND","AND","8/14/2023","3""TP","08/01/2023","RHMA","4511","H",16.05,"10.6","32.7","1.7","31","G","Y","Y",NA,"N",NA,2023-08-01,"2023","08","01","St. Thomas",18.35886,-64.8932
"1023","Mandahl Bay","AND","AND","8/14/2023","3""TP","08/01/2023","RHMA","4512","H",33.94,"13.8","40.6","2","38.6","G","Y","Y",NA,"N",NA,2023-08-01,"2023","08","01","St. Thomas",18.35886,-64.8932
"1024","Mandahl Bay","AND","AND","8/14/2023","3""TP","08/01/2023","RHMA","4513","H",23.38,"12.4","34.5","1.9","32.6","G","Y","Y",NA,"N",NA,2023-08-01,"2023","08","01","St. Thomas",18.35886,-64.8932
"1025","Mandahl Bay","AND","AND","8/14/2023","3""TP","08/01/2023","RHMA","4514","H",32.06,"14.4","35.5","1.7","33.8","G","Y","Y",NA,"N",NA,2023-08-01,"2023","08","01","St. Thomas",18.35886,-64.8932
"1026","Mandahl Bay","ST","ST","8/29/2024","CC","8/24/2024","RHMA","6062","H",13.43,"10.4","25.6","1.4","24.2","G","Y","Y",NA,"N",NA,2024-08-24,"2024","08","24","St. Thomas",18.35886,-64.8932
"1027","Mandahl Bay","ST","ST","8/29/2024","CC","8/24/2024","RHMA","6063","H",9.54,"9.1","21.3","1.4","20","G","Y","Y",NA,"N",NA,2024-08-24,"2024","08","24","St. Thomas",18.35886,-64.8932
"1028","Mandahl Bay","ST","ST","8/29/2024","CC","8/24/2024","RHMA","6064","H",19.17,"12","27.9","1.4","26.8","B","Y","Y",NA,"N",NA,2024-08-24,"2024","08","24","St. Thomas",18.35886,-64.8932
"1029","Mandahl Bay","ST","ST","8/29/2024","CC","8/24/2024","RHMA","6065","H",5.8,"7.9","17.2","1.1","16.3","G","N","Y",NA,"N",NA,2024-08-24,"2024","08","24","St. Thomas",18.35886,-64.8932
"1030","Mandahl Bay","ST","ST","8/29/2024","CC","8/24/2024","RHMA","6066","H",9.72,"8.4","23.4","1.5","21.7","G","N","Y",NA,"N",NA,2024-08-24,"2024","08","24","St. Thomas",18.35886,-64.8932
"1031","Mandahl Bay","ST","ST","8/29/2024","CC","8/24/2024","RHMA","6067","H",10.89,"9.3","21.3","1.3","21.5","G","N","Y",NA,"N",NA,2024-08-24,"2024","08","24","St. Thomas",18.35886,-64.8932
"1032","Mandahl Bay","ST","ST","8/29/2024","CC","8/24/2024","RHMA","6068","H",14.33,"10","26.8","1.5","26.9","G","G","N",NA,"N",NA,2024-08-24,"2024","08","24","St. Thomas",18.35886,-64.8932
"1033","Mandahl Bay","LG","SA, TB","8/29/2024","CC","8/14/2024","RHMA","6026","H",13.36,"10.2","22.6","1.3","21.3","G","Y","Y",NA,"N",NA,2024-08-14,"2024","08","14","St. Thomas",18.35886,-64.8932
"1034","Mandahl Bay","LG","SA, TB","8/29/2024","CC","8/14/2024","RHMA","6027","H",24.62,"12.9","31.6","1.4","30.2","GB","Y","N",NA,"N",NA,2024-08-14,"2024","08","14","St. Thomas",18.35886,-64.8932
"1035","Mandahl Bay","LG","SA, TB","8/29/2024","CC","8/14/2024","RHMA","6028","H",26.17,"12.7","34.6","1.5","33.1","B","Y","Y",NA,"N",NA,2024-08-14,"2024","08","14","St. Thomas",18.35886,-64.8932
"1036","Mandahl Bay","LG","SA, TB","8/29/2024","CC","8/14/2024","RHMA","6029","H",25.52,"12.3","30.4","1.6","28.8","GB","Y","N",NA,"N",NA,2024-08-14,"2024","08","14","St. Thomas",18.35886,-64.8932
"1037","Mandahl Bay","DIRECT UPLOAD","AJH","08/11/2023","3""TP","08/01/2023","RHMA","4483","H",21.24,"12","33","1.5","31.5","G","Y","Y",NA,"N",NA,2023-08-01,"2023","08","01","St. Thomas",18.35886,-64.8932
"1038","Mandahl Bay","DIRECT UPLOAD","AJH","08/11/2023","3""TP","08/01/2023","RHMA","4484","H",15.29,"10.9","29.1","1.3","27.8","G","Y","Y",NA,"N",NA,2023-08-01,"2023","08","01","St. Thomas",18.35886,-64.8932
"1039","Mandahl Bay","DIRECT UPLOAD","AJH","08/11/2023","3""TP","08/01/2023","RHMA","4485","H",23.66,"12.4","34.8","1.7","33.1","G","Y","Y","2 BITE MARKS, BUT LOOKS GREAT OTHERWISE","N",NA,2023-08-01,"2023","08","01","St. Thomas",18.35886,-64.8932
"1040","Mandahl Bay","DIRECT UPLOAD","AJH","08/11/2023","3""TP","08/01/2023","RHMA","4486","H",22.76,"11.8","34.4","1.5","32.9","G","Y","Y",NA,"N",NA,2023-08-01,"2023","08","01","St. Thomas",18.35886,-64.8932
"1041","Mandahl Bay",NA,"KR, HH","8/28/2024","CC","8/14/2024","RHMA","5984","H",29.92,"13.7","38.6","1.8","36.8","B/G","Y","Y",NA,"N",NA,2024-08-14,"2024","08","14","St. Thomas",18.35886,-64.8932
"1042","Mandahl Bay",NA,"KR, HH","8/28/2024","CC","8/14/2024","RHMA","5985","H",24.71,"13.4","33.2","1.4","31.8","B/G","N","Y",NA,"N",NA,2024-08-14,"2024","08","14","St. Thomas",18.35886,-64.8932
"1043","Mandahl Bay",NA,"KR, HH","8/28/2024","CC","8/14/2024","RHMA","5986","H",33.34,"13.8","39.1","1.7","37.4","B/G","Y","N",NA,"N",NA,2024-08-14,"2024","08","14","St. Thomas",18.35886,-64.8932
"1044","Mandahl Bay",NA,"KR, HH","8/28/2024","CC","8/14/2024","RHMA","5987","H",20.62,"11.8","31.6","1.6","30","B/G","Y","N",NA,"N",NA,2024-08-14,"2024","08","14","St. Thomas",18.35886,-64.8932
"1045","Mandahl Bay",NA,"KR, HH","8/28/2024","CC","8/14/2024","RHMA","5988","H",22.03,"12.8","28.2","1.5","26.7","B/G","Y","N",NA,"N",NA,2024-08-14,"2024","08","14","St. Thomas",18.35886,-64.8932
"1046","Mandahl Bay",NA,"KR, HH","8/28/2024","CC","8/14/2024","RHMA","5989","H",25.8,"13.6","33.2","1.6","31.6","B/G","Y","Y",NA,"N",NA,2024-08-14,"2024","08","14","St. Thomas",18.35886,-64.8932
"1047","Mandahl Bay",NA,"KR, HH","8/28/2024","CC","8/14/2024","RHMA","5990","H",28.67,"13.6","34","1.3","32.7","B/G","Y","N",NA,"N",NA,2024-08-14,"2024","08","14","St. Thomas",18.35886,-64.8932
"1048","Mandahl Bay",NA,"KR, HH","8/28/2024","CC","8/14/2024","RHMA","5991","H",21.29,"13.5","28.1","1.3","26.8","B/G","N","Y",NA,"N",NA,2024-08-14,"2024","08","14","St. Thomas",18.35886,-64.8932
"1049","Mandahl Bay","MA","LG, MA","8/28/2024","CC","8/14/2024","RHMA","6015","H",20.88,"11","28","1.2","26.8","G","Y","Y",NA,"N",NA,2024-08-14,"2024","08","14","St. Thomas",18.35886,-64.8932
"1050","Mandahl Bay","MA","LG, MA","8/28/2024","CC","8/14/2024","RHMA","6002","H",22.17,"11.5","32","1.6","30.4","G","Y","Y",NA,"N",NA,2024-08-14,"2024","08","14","St. Thomas",18.35886,-64.8932
"1051","Mandahl Bay","MA","LG, MA","8/28/2024","CC","8/14/2024","RHMA","6003","H",29.81,"12.6","37.9","1","36.9","B/G","Y","Y",NA,"N",NA,2024-08-14,"2024","08","14","St. Thomas",18.35886,-64.8932
"1052","Mandahl Bay","MA","LG, MA","8/28/2024","CC","8/14/2024","RHMA","6004","H",20.44,"12.1","25.1","0.5","24.6","G","Y","Y",NA,"N",NA,2024-08-14,"2024","08","14","St. Thomas",18.35886,-64.8932
"1053","Mandahl Bay","TB","SA","8/29/2024","CC","8/24/2024","RHMA","6046","H",11.9,"10.5","20.5","1.2","19.3","G","N","N",NA,"N",NA,2024-08-24,"2024","08","24","St. Thomas",18.35886,-64.8932
"1054","Mandahl Bay","TB","SA","8/29/2024","CC","8/24/2024","RHMA","6047","H",21.85,"12.6","33","1.5","31.5","G","Y","N",NA,"N",NA,2024-08-24,"2024","08","24","St. Thomas",18.35886,-64.8932
"1055","Mandahl Bay","MA","LG, MA","8/28/2024","CC","8/14/2024","RHMA","6008","H",18.35,"10.6","30.5","1.5","29","B/G","Y","Y",NA,"N",NA,2024-08-14,"2024","08","14","St. Thomas",18.35886,-64.8932
"1056","Mandahl Bay","MA","LG, MA","8/28/2024","CC","8/14/2024","RHMA","6009","H",18.1,"10.9","26","1.4","24.6","B/G","Y","Y",NA,"N",NA,2024-08-14,"2024","08","14","St. Thomas",18.35886,-64.8932
"1057","Mandahl Bay","MA","LG, MA","8/28/2024","CC","8/14/2024","RHMA","6010","H",18.55,"10.6","29.2","1.5","27.7","B/G","Y","Y",NA,"N",NA,2024-08-14,"2024","08","14","St. Thomas",18.35886,-64.8932
"1058","Mandahl Bay","MA","LG, MA","8/28/2024","CC","8/14/2024","RHMA","6011","H",15,"10.4","25.3","1.3","24","G","Y","Y",NA,"N",NA,2024-08-14,"2024","08","14","St. Thomas",18.35886,-64.8932
"1059","Mandahl Bay","MA","LG, MA","8/28/2024","CC","8/14/2024","RHMA","6012","H",16.21,"11","23.9","1.2","22.7","B/G","Y","N","DISCOLORED/POTENTIAL SUN DAMAGE","N",NA,2024-08-14,"2024","08","14","St. Thomas",18.35886,-64.8932
"1060","Mandahl Bay","MA","LG, MA","8/28/2024","CC","8/14/2024","RHMA","6013","H",21.07,"11.2","28.5","1.4","27.1","G","Y","Y",NA,"N",NA,2024-08-14,"2024","08","14","St. Thomas",18.35886,-64.8932
"1061","Mandahl Bay","MA","LG, MA","8/28/2024","CC","8/14/2024","RHMA","6014","H",17.95,"11.6","23.8","1.2","22.6","G","Y","Y",NA,"N",NA,2024-08-14,"2024","08","14","St. Thomas",18.35886,-64.8932
"1062","Mandahl Bay","DIRECT UPLOAD","AJH","08/11/2023","3""TP","08/01/2023","RHMA","4481","H",23.56,"12.1","31.5","1.5","30","G","N","Y",NA,"N",NA,2023-08-01,"2023","08","01","St. Thomas",18.35886,-64.8932
"1063","Mandahl Bay","MA","LG, MA","8/28/2024","CC","8/14/2024","RHMA","6016","H",21.5,"11.3","30.3","1.2","29.1","B/G","Y","Y","SCRATCHED","N",NA,2024-08-14,"2024","08","14","St. Thomas",18.35886,-64.8932
"1064","Mandahl Bay","MA","LG, MA","8/28/2024","CC","8/14/2024","RHMA","6017","H",25.75,"12.3","32.3","1.4","30.9","B","Y","Y",NA,"N",NA,2024-08-14,"2024","08","14","St. Thomas",18.35886,-64.8932
"1065","Mandahl Bay","MA","LG, MA","8/28/2024","CC","8/14/2024","RHMA","6018","H",18.81,"11.6","26.5","1.3","25.2","G","Y","Y",NA,"N",NA,2024-08-14,"2024","08","14","St. Thomas",18.35886,-64.8932
"1066","Mandahl Bay","MA","LG, MA","8/28/2024","CC","8/14/2024","RHMA","6019","H",17.69,"10.6","26.7","1.1","25.6","G","Y","N",NA,"N",NA,2024-08-14,"2024","08","14","St. Thomas",18.35886,-64.8932
"1067","Mandahl Bay","MA","LG, MA","8/28/2024","CC","8/14/2024","RHMA","6020","H",22.4,"12.5","28.6","1.5","27.1","B/G","Y","Y",NA,"N",NA,2024-08-14,"2024","08","14","St. Thomas",18.35886,-64.8932
"1068","Mandahl Bay","LG","SA, TB","8/29/2024","CC","8/14/2024","RHMA","6021","H",24.6,"12.8","34","1.5","32.5","BG","Y","Y",NA,"N",NA,2024-08-14,"2024","08","14","St. Thomas",18.35886,-64.8932
"1069","Mandahl Bay","LG","SA, TB","8/29/2024","CC","8/14/2024","RHMA","6022","H",25.76,"12.2","34.6","1.9","32.7","BG","Y","Y",NA,"N",NA,2024-08-14,"2024","08","14","St. Thomas",18.35886,-64.8932
"1070","Mandahl Bay","LG","SA, TB","8/29/2024","CC","8/14/2024","RHMA","6023","H",38.17,"13.6","37.7","1.6","36.1","G","Y","Y",NA,"N",NA,2024-08-14,"2024","08","14","St. Thomas",18.35886,-64.8932
"1071","Mandahl Bay","LG","SA, TB","8/29/2024","CC","8/14/2024","RHMA","6024","H",19.6,"12.8","26.3","1.2","25.1","BG","Y","Y",NA,"N",NA,2024-08-14,"2024","08","14","St. Thomas",18.35886,-64.8932
"1072","Mandahl Bay","LG","SA, TB","8/29/2024","CC","8/14/2024","RHMA","6025","H",25.26,"13.4","32","1.1","30.9","BG","Y","Y",NA,"N",NA,2024-08-14,"2024","08","14","St. Thomas",18.35886,-64.8932
"1073","Mandahl Bay","DIRECT UPLOAD","AJH","08/11/2023","3""TP","08/01/2023","RHMA","4479","H",25.29,"12.6","30.6","1.6","29","G","N","Y","CURVED","N",NA,2023-08-01,"2023","08","01","St. Thomas",18.35886,-64.8932
"1074","Mandahl Bay","DIRECT UPLOAD","AJH","08/11/2023","3""TP","08/01/2023","RHMA","4480","H",22.09,"12.4","24.5","1.4","23.1","G","N","Y",NA,"N",NA,2023-08-01,"2023","08","01","St. Thomas",18.35886,-64.8932
"1075","Mandahl Bay","TB","SA, ST","8/29/2024","CC","8/24/2024","RHMA","6054","H",16.66,"11.5","28.7","1","27.7","B","N","Y",NA,"N",NA,2024-08-24,"2024","08","24","St. Thomas",18.35886,-64.8932
"1076","Mandahl Bay","DIRECT UPLOAD","AJH","08/11/2023","3""TP","08/01/2023","RHMA","4482","H",25.75,"11.8","35","1.5","33.5","G","Y","Y",NA,"N",NA,2023-08-01,"2023","08","01","St. Thomas",18.35886,-64.8932
"1077","Mandahl Bay","TB","SA, ST","8/29/2024","CC","8/24/2024","RHMA","6056","H",19.92,"12.8","27.5","1.3","26.2","GB","Y","Y",NA,"N",NA,2024-08-24,"2024","08","24","St. Thomas",18.35886,-64.8932
"1078","Mandahl Bay","TB","SA","8/29/2024","CC","8/24/2024","RHMA","6057","H",20.95,"12.7","28.5","0","28.5","GB","Y","Y",NA,"N",NA,2024-08-24,"2024","08","24","St. Thomas",18.35886,-64.8932
"1079","Mandahl Bay","ST","ST","8/29/2024","CC","8/24/2024","RHMA","6058","H",13.3,"10.7","22.7","1.3","21.3","G","Y","Y",NA,"N",NA,2024-08-24,"2024","08","24","St. Thomas",18.35886,-64.8932
"1080","Mandahl Bay","ST","ST","8/29/2024","CC","8/24/2024","RHMA","6059","H",14.06,"8.8","32.5","1.6","30.8","G","Y","N",NA,"N",NA,2024-08-24,"2024","08","24","St. Thomas",18.35886,-64.8932
"1081","Mandahl Bay","ST","ST","8/29/2024","CC","8/24/2024","RHMA","6060","H/S",22.19,"13.3","28.4","1.5","28.4","G/B","Y","N",NA,"N",NA,2024-08-24,"2024","08","24","St. Thomas",18.35886,-64.8932
"1082","Mandahl Bay","ST","ST","8/29/2024","CC","8/24/2024","RHMA","6061","H",6.84,"8.3","19.6","1.3","18.2","G","N","Y",NA,"N",NA,2024-08-24,"2024","08","24","St. Thomas",18.35886,-64.8932
"1083","Mandahl Bay","TB","SA","8/29/2024","CC","8/24/2024","RHMA","6049","H",32,"14.2","34.5","1.4","33.1","B","Y","N",NA,"N",NA,2024-08-24,"2024","08","24","St. Thomas",18.35886,-64.8932
"1084","Mandahl Bay","TB","SA","8/29/2024","CC","8/24/2024","RHMA","6050","H",19.29,"12","31","1.3","29.7","GB","Y","Y",NA,"N",NA,2024-08-24,"2024","08","24","St. Thomas",18.35886,-64.8932
"1085","Mandahl Bay","TB","SA","8/29/2024","CC","8/24/2024","RHMA","6051","H",18.82,"13","28.2","1.5","26.7","GB","Y","Y",NA,"N",NA,2024-08-24,"2024","08","24","St. Thomas",18.35886,-64.8932
"1086","Mandahl Bay","TB","SA, ST","8/29/2024","CC","8/24/2024","RHMA","6052","H",8,"8.1","22.9","1.3","21.6","G","N","Y",NA,"N",NA,2024-08-24,"2024","08","24","St. Thomas",18.35886,-64.8932
"1087","Mandahl Bay","TB","SA, ST","8/29/2024","CC","8/24/2024","RHMA","6053","H",19.2,"12","31","1.5","29.5","GB","Y","Y",NA,"N",NA,2024-08-24,"2024","08","24","St. Thomas",18.35886,-64.8932
"1088","Mandahl Bay","TB","SA, ST","8/29/2024","CC","8/24/2024","RHMA","6055","H",19.04,"12.2","33","1.7","31.3","G","N","Y",NA,"N",NA,2024-08-24,"2024","08","24","St. Thomas",18.35886,-64.8932
"1089","Mandahl Bay","Direct Input","KR/MF","11/13/24","CC","10/25/2024","RHMA","6649",NA,11.85,"8.4","23.8","1.7","22.1","G","Y","N",NA,NA,NA,2024-10-25,"2024","10","25","St. Thomas",18.35886,-64.8932
"1090","Oasis Cove","ST","AJH, AND, KWG","05/11/2021","N/A","4/16/2021","RHMA","19","H",9.23,"10.6","18.6","1.3","17.2","OlGr","Y","Y",NA,"N",NA,2021-04-16,"2021","04","16","St. Thomas",18.320665,-64.867323
"1091","Oasis Cove","ST","AJH, AND, KWG","05/11/2021","N/A","4/16/2021","RHMA","27","H",12.22,"10.6","23.6","1.2","22.2","OlGr","Y","Y",NA,"N",NA,2021-04-16,"2021","04","16","St. Thomas",18.320665,-64.867323
"1092","Oasis Cove","ST","AJH, AND, KWG","05/11/2021","N/A","4/16/2021","RHMA","31","H",18.23,"10.56","32.6","1.5","31.1","OlGr","Y","Y","seam lenght of hypo","N",NA,2021-04-16,"2021","04","16","St. Thomas",18.320665,-64.867323
"1093","Oasis Cove","ST","AJH, AND, KWG","05/11/2021","N/A","4/16/2021","RHMA","32","H",12.51,"8.44","30.7","1.2","29.2","BrGr","Y","Y","seam lenght of hypo","N",NA,2021-04-16,"2021","04","16","St. Thomas",18.320665,-64.867323
"1094","Oasis Cove","ST","AJH, AND, KWG","05/11/2021","N/A","4/16/2021","RHMA","26","H",19.2,"11.78","30.5","1.6","28.8","OlGr","Y","Y","wt film on plum, partial browning on hypo, gauge on upper 1/3 of hypo","N",NA,2021-04-16,"2021","04","16","St. Thomas",18.320665,-64.867323
"1095","Oasis Cove","ST","AJH, AND, KWG","05/11/2021","N/A","4/16/2021","RHMA","22","H",17.7,"10.54","30","1.2","28.8","OlGr","Y","Y","gauge from 18.5 - 24 cm to plum, looks healed, but is DrkBrBl","N",NA,2021-04-16,"2021","04","16","St. Thomas",18.320665,-64.867323
"1096","Oasis Cove","ST","AJH, AND, KWG","05/11/2021","N/A","4/16/2021","RHMA","23","H",19.56,"11.09","32.3","1.4","30.8","OlGr","Y","Y","splits on Br tip, upper length of hypo, scar ~ 5cm long @ hypo tip","N",NA,2021-04-16,"2021","04","16","St. Thomas",18.320665,-64.867323
"1097","Oasis Cove","ST","AJH, AND, KWG","05/11/2021","N/A","4/16/2021","RHMA","20","H",10.81,"10.85","20.5","1.2","19.4","BrGr","Y","Y","seam up length of hypo","N",NA,2021-04-16,"2021","04","16","St. Thomas",18.320665,-64.867323
"1098","Oasis Cove","ST","AJH, AND, KWG","05/11/2021","N/A","4/16/2021","RHMA","21","H",14.69,"11.19","26.2","1.2","24.9","OlGr","Y","Y",NA,"N",NA,2021-04-16,"2021","04","16","St. Thomas",18.320665,-64.867323
"1099","Oasis Cove","ST","AJH, AND, KWG","05/11/2021","N/A","4/16/2021","RHMA","12","H",7.4,"8.48","21.9","1.8","21","BrGr","Y","Y","film over Br hypo tip","N",NA,2021-04-16,"2021","04","16","St. Thomas",18.320665,-64.867323
"1100","Oasis Cove","ST","AJH, AND, KWG","05/11/2021","N/A","4/16/2021","RHMA","13","H",28.79,"13.23","36","0.6","35","OlGr","Y","Y","Blk scars on hypo near plum base","N",NA,2021-04-16,"2021","04","16","St. Thomas",18.320665,-64.867323
"1101","Oasis Cove","ST","AJH, AND, KWG","05/11/2021","N/A","4/16/2021","RHMA","28","H",11.9,"8.81","29.6","1","28.6","BrGr","Y","Y",NA,"N",NA,2021-04-16,"2021","04","16","St. Thomas",18.320665,-64.867323
"1102","Oasis Cove","ST","AJH, AND, KWG","05/11/2021","N/A","4/16/2021","RHMA","29","H",11.97,"10.84","22.6","1.4","20.9","OlGr","Y","Y","gauge on hypo towards plum","N",NA,2021-04-16,"2021","04","16","St. Thomas",18.320665,-64.867323
"1103","Oasis Cove","ST","AJH, AND, KWG","05/11/2021","N/A","4/16/2021","RHMA","30","H",15.31,"10.55","30","1.3","28.5","OlGr","Y","N",NA,"N",NA,2021-04-16,"2021","04","16","St. Thomas",18.320665,-64.867323
"1104","Oasis Cove","ST","AJH, AND, KWG","05/11/2021","N/A","4/16/2021","RHMA","17","H",14.16,"11.02","25.5","1.6","23.5","BrGr","Y","Y","seams up hypo","N",NA,2021-04-16,"2021","04","16","St. Thomas",18.320665,-64.867323
"1105","Oasis Cove","ST","AJH, AND, KWG","05/11/2021","N/A","4/16/2021","RHMA","18","H",24.42,"13.09","31","1.5","29.5","OlGr","Y","Y","film","N",NA,2021-04-16,"2021","04","16","St. Thomas",18.320665,-64.867323
"1106","Oasis Cove","ST","AND, AH, KWG","05/11/2021","N/A","4/16/2021","RHMA","59","S",16.92,"11.43","28.6","1.4","27.3","OlGr","Y","Y",NA,"N",NA,2021-04-16,"2021","04","16","St. Thomas",18.320665,-64.867323
"1107","Oasis Cove","ST","AND, AH, KWG","05/11/2021","N/A","4/16/2021","RHMA","60","S",14.8,"11","29","1.1","27.9","Br","Y","Y",NA,"N",NA,2021-04-16,"2021","04","16","St. Thomas",18.320665,-64.867323
"1108","Oasis Cove","ST","AND, AH, KWG","05/11/2021","N/A","4/16/2021","RHMA","61","S",10.64,"10.13","23.7",NA,"23.7","Br","Y","Y",NA,"N",NA,2021-04-16,"2021","04","16","St. Thomas",18.320665,-64.867323
"1109","Oasis Cove","ST","AND, AH, KWG","05/11/2021","N/A","4/16/2021","RHMA","62","S",30.54,"12.37","38","1.2","36.3","OlGr","Y","N",NA,"N",NA,2021-04-16,"2021","04","16","St. Thomas",18.320665,-64.867323
"1110","Oasis Cove","ST","AJH, AND, KWG","05/11/2021","N/A","4/16/2021","RHMA","24","H",23.57,"12.49","34.6","1.8","33.1","OlGr","Y","Y","plum tip partially broken","N",NA,2021-04-16,"2021","04","16","St. Thomas",18.320665,-64.867323
"1111","Oasis Cove","ST","AJH, AND, KWG","05/11/2021","N/A","4/16/2021","RHMA","25","H",22.94,"11.85","34.7","1.7","33.2","OlGr","Y","Y","plum is cracked, hypo has seam up entire length, plus small cracks on Br tip","N",NA,2021-04-16,"2021","04","16","St. Thomas",18.320665,-64.867323
"1112","Oasis Cove","ST","AND, AH, KWG","05/11/2021","N/A","4/16/2021","RHMA","65","S",11.88,"9.24","26.4","1.2","25.4","Br","Y","N",NA,"N",NA,2021-04-16,"2021","04","16","St. Thomas",18.320665,-64.867323
"1113","Oasis Cove","ST","AND, AH, KWG","05/11/2021","N/A","4/16/2021","RHMA","66","S",13.88,"9.7","28.6","1.3","27.1","BrGr","Y","N",NA,"N",NA,2021-04-16,"2021","04","16","St. Thomas",18.320665,-64.867323
"1114","Oasis Cove","ST","AJH, AND, KWG","05/11/2021","N/A","4/16/2021","RHMA","14","H",22.3,"11.17","37.6","1.6","35.9","BrGr","Y","Y","film on entiro hypo","N",NA,2021-04-16,"2021","04","16","St. Thomas",18.320665,-64.867323
"1115","Oasis Cove","ST","AJH, AND, KWG","05/11/2021","N/A","4/16/2021","RHMA","15","H",21.3,"11.25","21.2","1.3","20","OlGr","Y","Y","browning on hypo","N",NA,2021-04-16,"2021","04","16","St. Thomas",18.320665,-64.867323
"1116","Oasis Cove","ST","AJH, AND, KWG","05/11/2021","N/A","4/16/2021","RHMA","16","H",27.92,"12.85","36.6","1.6","35.1","OlGr","Y","Y","crack on Br rooting tip, film","N",NA,2021-04-16,"2021","04","16","St. Thomas",18.320665,-64.867323
"1117","Oasis Cove","ST","AND, AH, KWG","05/11/2021","N/A","4/16/2021","RHMA","70","H",13.5,"10.33","27.7","1.1","26.3","OlGr","Y","Y",NA,"N",NA,2021-04-16,"2021","04","16","St. Thomas",18.320665,-64.867323
"1118","Oasis Cove","ST","AND, AH, KWG","05/11/2021","N/A","4/16/2021","RHMA","71","S",14.11,"10.15","28.2","1.4","26.8","OlGr","Y","N",NA,"N",NA,2021-04-16,"2021","04","16","St. Thomas",18.320665,-64.867323
"1119","Oasis Cove","ST","AND, AH, KWG","05/11/2021","N/A","4/16/2021","RHMA","72","S",14,"10","24.7",NA,"24.7","Br","Y","Y",NA,"N",NA,2021-04-16,"2021","04","16","St. Thomas",18.320665,-64.867323
"1120","Oasis Cove","ST","AJH, AND, KWG","05/11/2021","N/A","4/16/2021","RHMA","33","H",11.4,"9.29","27","1.2","26","OlGr","Y","Y","scar on rooting tip","N",NA,2021-04-16,"2021","04","16","St. Thomas",18.320665,-64.867323
"1121","Oasis Cove","ST","AND, AH, KWG","05/11/2021","N/A","4/16/2021","RHMA","34","H",6.49,"9.47","15","0.9","14.1","OlGr","Y","N",NA,"N",NA,2021-04-16,"2021","04","16","St. Thomas",18.320665,-64.867323
"1122","Oasis Cove","ST","AND, AH, KWG","05/11/2021","N/A","4/16/2021","RHMA","35","S",11.37,"8.29","28","1.1","26.8","BrGr","Y","Y",NA,"N",NA,2021-04-16,"2021","04","16","St. Thomas",18.320665,-64.867323
"1123","Oasis Cove","ST","AND, AH, KWG","05/11/2021","N/A","4/16/2021","RHMA","63","S",21.49,"12.47","29.1","1.6","27.7","OlGr","Y","Y",NA,"N",NA,2021-04-16,"2021","04","16","St. Thomas",18.320665,-64.867323
"1124","Oasis Cove","ST","AND, AH, KWG","05/11/2021","N/A","4/16/2021","RHMA","64","S",13.6,"8.19","31.4","1.3","30.1","OlGr","Y","N",NA,"N",NA,2021-04-16,"2021","04","16","St. Thomas",18.320665,-64.867323
"1125","Oasis Cove","ST","AND, AH, KWG","05/11/2021","N/A","4/16/2021","RHMA","38","H",14.39,"11.09","25.7","1.2","24.6","OlGr","Y","Y",NA,"N",NA,2021-04-16,"2021","04","16","St. Thomas",18.320665,-64.867323
"1126","Oasis Cove","ST","AND, AH, KWG","05/11/2021","N/A","4/16/2021","RHMA","39","S",10.08,"8.02","26.2","1.1","25","OlGr","Y","N",NA,"N",NA,2021-04-16,"2021","04","16","St. Thomas",18.320665,-64.867323
"1127","Oasis Cove","ST","AND, AH, KWG","05/11/2021","N/A","4/16/2021","RHMA","67","S",19.88,"11.41","33.7","1.5","32.1","BrGr","Y","Y",NA,"N",NA,2021-04-16,"2021","04","16","St. Thomas",18.320665,-64.867323
"1128","Oasis Cove","ST","AND, AH, KWG","05/11/2021","N/A","4/16/2021","RHMA","68","S",14.77,"10.13","31.5","1.3","30.1","BrGr","Y","Y",NA,"N",NA,2021-04-16,"2021","04","16","St. Thomas",18.320665,-64.867323
"1129","Oasis Cove","ST","AND, AH, KWG","05/11/2021","N/A","4/16/2021","RHMA","69","H",12.43,"9.8","28.2","1.4","26.8","BrGr","Y","Y",NA,"N",NA,2021-04-16,"2021","04","16","St. Thomas",18.320665,-64.867323
"1130","Oasis Cove","ST","AND, AH, KWG","05/11/2021","N/A","4/16/2021","RHMA","43","S",10.6,"7.93","23.6",NA,"23.6","Br","Y","N",NA,"N",NA,2021-04-16,"2021","04","16","St. Thomas",18.320665,-64.867323
"1131","Oasis Cove","ST","AND, AH, KWG","05/11/2021","N/A","4/16/2021","RHMA","44","S",9.77,"10.28","20.1",NA,"20.1","OlGr","Y","Y",NA,"N",NA,2021-04-16,"2021","04","16","St. Thomas",18.320665,-64.867323
"1132","Oasis Cove","ST","AND, AH, KWG","05/11/2021","N/A","4/16/2021","RHMA","45","S",11.3,"10.91","20.1","1.3","18.9","OlGr","Y","Y",NA,"N",NA,2021-04-16,"2021","04","16","St. Thomas",18.320665,-64.867323
"1133","Oasis Cove","ST","AND, AH, KWG","05/11/2021","N/A","4/16/2021","RHMA","46","S",11.34,"9.61","23.6","1","22.6","OlGr","Y","Y",NA,"N",NA,2021-04-16,"2021","04","16","St. Thomas",18.320665,-64.867323
"1134","Oasis Cove","ST","AND, AH, KWG","05/11/2021","N/A","4/16/2021","RHMA","47","S",23.67,"11.97","35.6","1.5","34","BrGr","Y","Y",NA,"N",NA,2021-04-16,"2021","04","16","St. Thomas",18.320665,-64.867323
"1135","Oasis Cove","ST","AND, AH, KWG","05/11/2021","N/A","4/16/2021","RHMA","48","S",13.93,"10.63","25.5","1.1","24.5","OlGr","Y","Y",NA,"N",NA,2021-04-16,"2021","04","16","St. Thomas",18.320665,-64.867323
"1136","Oasis Cove","ST","AND, AH, KWG","05/11/2021","N/A","4/16/2021","RHMA","36","S",19.23,"11.73","32.8","1.4","31.5","BrGr","Y","Y",NA,"N",NA,2021-04-16,"2021","04","16","St. Thomas",18.320665,-64.867323
"1137","Oasis Cove","ST","AND, AH, KWG","05/11/2021","N/A","4/16/2021","RHMA","37","S",8.42,"10 .14","17.9","1","16.7","OlGr","Y","Y",NA,"N",NA,2021-04-16,"2021","04","16","St. Thomas",18.320665,-64.867323
"1138","Oasis Cove","ST","AND, AH, KWG","05/11/2021","N/A","4/16/2021","RHMA","131","H",8.48,"8.23","22.7","1.3","21.3","BrGr","N/A","Y",NA,"N",NA,2021-04-16,"2021","04","16","St. Thomas",18.320665,-64.867323
"1139","Oasis Cove","ST","AND, AH, KWG","05/11/2021","N/A","4/16/2021","RHMA","132","H",9.93,"8.84","26.5","1.1","25.5","BrGr","N/A","Y",NA,"N",NA,2021-04-16,"2021","04","16","St. Thomas",18.320665,-64.867323
"1140","Oasis Cove","ST","AND, AH, KWG","05/11/2021","N/A","4/16/2021","RHMA","133","H",7.91,"7.36","27","1.1","26","BrGr","N/A","Y",NA,"N",NA,2021-04-16,"2021","04","16","St. Thomas",18.320665,-64.867323
"1141","Oasis Cove","ST","AND, AH, KWG","05/11/2021","N/A","4/16/2021","RHMA","134","H",9.14,"9.4","23.1","0.9","22.1","BrGr","N/A","Y",NA,"N",NA,2021-04-16,"2021","04","16","St. Thomas",18.320665,-64.867323
"1142","Oasis Cove","AJH","AJH, AND, KWG",NA,"3'' TP","08-23-22","RHMA","2066","H",10.65,"12","18.5","0.8","17.6","G","N","Y",NA,"N",NA,2022-08-23,"2022","08","23","St. Thomas",18.320665,-64.867323
"1143","Oasis Cove","AJH","AJH, AND, KWG",NA,"3'' TP","08-23-22","RHMA","2067","H",13.83,"11.9","22.6","1.3","21.5","P","N","Y",NA,"N",NA,2022-08-23,"2022","08","23","St. Thomas",18.320665,-64.867323
"1144","Oasis Cove","AJH","AJH, AND, KWG",NA,"3'' TP","08-23-22","RHMA","2068","H",14.42,"11.4","27","1.4","25.5","GB","N","N",NA,"N",NA,2022-08-23,"2022","08","23","St. Thomas",18.320665,-64.867323
"1145","Oasis Cove","AJH","AJH, AND, KWG",NA,"3'' TP","08-23-22","RHMA","2069","H",11.51,"10","22.8","1.4","21.6","P","N","N",NA,"N",NA,2022-08-23,"2022","08","23","St. Thomas",18.320665,-64.867323
"1146","Oasis Cove","AJH","AJH, AND, KWG",NA,"3'' TP","08-23-22","RHMA","2070","H",12,"11.3","21.2","1.1","20","P","N","N",NA,"N",NA,2022-08-23,"2022","08","23","St. Thomas",18.320665,-64.867323
"1147","Oasis Cove","AJH","AJH, AND, KWG",NA,"3'' TP","08-23-22","RHMA","2071","H",8.34,"9.6","17.5","0.9","17","P","N","N",NA,"N",NA,2022-08-23,"2022","08","23","St. Thomas",18.320665,-64.867323
"1148","Oasis Cove","AJH","AJH, AND, KWG",NA,"3'' TP","08-23-22","RHMA","2072","H",11.94,"10.2","26.8","1.2","25.6","G","N","N",NA,"N",NA,2022-08-23,"2022","08","23","St. Thomas",18.320665,-64.867323
"1149","Oasis Cove","AJH","AJH, AND, KWG",NA,"3'' TP","08-23-22","RHMA","2073","H",8.31,"10.1","17","1","16","P","N","N",NA,"N",NA,2022-08-23,"2022","08","23","St. Thomas",18.320665,-64.867323
"1150","Oasis Cove","ST","AND, AH, KWG","05/11/2021","N/A","4/16/2021","RHMA","130","H",22,"13.31","28.8","1.5","27.3","OlGr","N/A","Y",NA,"N",NA,2021-04-16,"2021","04","16","St. Thomas",18.320665,-64.867323
"1151","Oasis Cove","AJH","AJH, AND, KWG",NA,"3'' TP","08-23-22","RHMA","2075","H",9.62,"9.8","18.4","1","17.3","P","N","N",NA,"N",NA,2022-08-23,"2022","08","23","St. Thomas",18.320665,-64.867323
"1152","Oasis Cove","AJH","AJH, AND, KWG",NA,"3'' TP","08-23-22","RHMA","2076","H",10.31,"11.6","16.5","1","16","P","N","N",NA,"N",NA,2022-08-23,"2022","08","23","St. Thomas",18.320665,-64.867323
"1153","Oasis Cove","AJH","AJH, AND, KWG",NA,"3'' TP","08-23-22","RHMA","2077","H",9.74,"9.4","19","1.2","19","G","N","N",NA,"N",NA,2022-08-23,"2022","08","23","St. Thomas",18.320665,-64.867323
"1154","Oasis Cove","AJH","AJH, AND, KWG",NA,"3'' TP","08-23-22","RHMA","2078","H",20.03,"11.9","26.2","1.4","27.6","P","Y","N",NA,"N",NA,2022-08-23,"2022","08","23","St. Thomas",18.320665,-64.867323
"1155","Oasis Cove","AJH","AJH, AND, KWG",NA,"3'' TP","08-23-22","RHMA","2079","H",15.66,"12.1","22.5","1.3","23.8","P","Y","N",NA,"N",NA,2022-08-23,"2022","08","23","St. Thomas",18.320665,-64.867323
"1156","Oasis Cove","AJH","AJH, AND, KWG",NA,"3'' TP","08-23-22","RHMA","2080","H",13.87,"12.5","21.7","1.5","23.2","P","Y","N",NA,"N",NA,2022-08-23,"2022","08","23","St. Thomas",18.320665,-64.867323
"1157","Oasis Cove","AJH","AJH, AND, KWG",NA,"3'' TP","08-23-22","RHMA","2081","H",17.43,"12.7","24.3","1.8","26.1","G","Y","N",NA,"N",NA,2022-08-23,"2022","08","23","St. Thomas",18.320665,-64.867323
"1158","Oasis Cove","AJH","AJH, AND, KWG",NA,"3'' TP","08-23-22","RHMA","2082","H",18.64,"11.8","28.8","1.5","30.3","G","Y","N",NA,"N",NA,2022-08-23,"2022","08","23","St. Thomas",18.320665,-64.867323
"1159","Oasis Cove","AJH","AJH, AND, KWG",NA,"3'' TP","08-23-22","RHMA","2083","H",10.79,"10.4","20.5","1.3","21.8","G","Y","N",NA,"N",NA,2022-08-23,"2022","08","23","St. Thomas",18.320665,-64.867323
"1160","Oasis Cove","AJH","AJH, AND, KWG",NA,"3'' TP","08-23-22","RHMA","2084","H",14.2,"10","10.5","1.3","11.8","G","Y","N",NA,"N",NA,2022-08-23,"2022","08","23","St. Thomas",18.320665,-64.867323
"1161","Oasis Cove","LP","AJH, AND, KWG",NA,"3'' TP","05-16-22","RHMA","2085","H",17.88,"11.4","23.8","1.7","22.6","G","Y","Y","curved and one leaf","N",NA,2022-05-16,"2022","05","16","St. Thomas",18.320665,-64.867323
"1162","Oasis Cove","LP","AJH, AND, KWG",NA,"3'' TP","05-16-22","RHMA","2086","H",16.44,"9.8","20.5","0.9","19.9","G","Y","Y","curved and 1st set of leaves","N",NA,2022-05-16,"2022","05","16","St. Thomas",18.320665,-64.867323
"1163","Oasis Cove","AJH","AJH, AND, KWG",NA,"3'' TP","08-23-22","RHMA","2074","H",12.52,"11.5","20","1.2","19.4","P","N","N",NA,"N",NA,2022-08-23,"2022","08","23","St. Thomas",18.320665,-64.867323
"1164","Oasis Cove","LP","AJH, AND, KWG",NA,"3'' TP","08-23-22","RHMA","2088","H",49.46,"15.4","42.9","2.2","40.8","B","Y","N",NA,"N",NA,2022-08-23,"2022","08","23","St. Thomas",18.320665,-64.867323
"1165","Oasis Cove","LP","AJH, AND, KWG",NA,"3'' TP","08-23-22","RHMA","2089","H",16.13,"11.9","25.2","1.6","24","B","Y","Y",NA,"N",NA,2022-08-23,"2022","08","23","St. Thomas",18.320665,-64.867323
"1166","Oasis Cove","LP","AJH, AND, KWG",NA,"3'' TP","08-23-22","RHMA","2090","H",23.35,"12.9","31.4","1.7","29.8","B","Y","Y",NA,"N",NA,2022-08-23,"2022","08","23","St. Thomas",18.320665,-64.867323
"1167","Oasis Cove","ST","AND, AH, KWG","05/11/2021","N/A","4/16/2021","RHMA","40","S",13.17,"9.54","32.3","1.4","31.3","Br","Y","Y",NA,"N",NA,2021-04-16,"2021","04","16","St. Thomas",18.320665,-64.867323
"1168","Oasis Cove","ST","AND, AH, KWG","05/11/2021","N/A","4/16/2021","RHMA","41","H",17,"11.09","28.5","1.5","27","OlGr","Y","Y",NA,"N",NA,2021-04-16,"2021","04","16","St. Thomas",18.320665,-64.867323
"1169","Oasis Cove","ST","AND, AH, KWG","05/11/2021","N/A","4/16/2021","RHMA","42","S",15.43,"9.81","32.4","1.2","31.2","OlGr","Y","Y",NA,"N",NA,2021-04-16,"2021","04","16","St. Thomas",18.320665,-64.867323
"1170","Oasis Cove","ST","AND, AH, KWG","05/11/2021","N/A","4/16/2021","RHMA","123","H",9.26,"9.44","21.8","1","20.6","OlGr","N/A","Y",NA,"N",NA,2021-04-16,"2021","04","16","St. Thomas",18.320665,-64.867323
"1171","Oasis Cove","ST","AND, AH, KWG","05/11/2021","N/A","4/16/2021","RHMA","124","H",12.48,"9.8","27.1","1","26","OlGr","N/A","Y",NA,"N",NA,2021-04-16,"2021","04","16","St. Thomas",18.320665,-64.867323
"1172","Oasis Cove","ST","AND, AH, KWG","05/11/2021","N/A","4/16/2021","RHMA","125","H",9.69,"9.78","20.7","1.3","19.4","OlGr","N/A","Y",NA,"N",NA,2021-04-16,"2021","04","16","St. Thomas",18.320665,-64.867323
"1173","Oasis Cove","ST","AND, AH, KWG","05/11/2021","N/A","4/16/2021","RHMA","126","H",12.89,"9.11","29.2","1.2","28.1","BrGr","N/A","Y",NA,"N",NA,2021-04-16,"2021","04","16","St. Thomas",18.320665,-64.867323
"1174","Oasis Cove","ST","AND, AH, KWG","05/11/2021","N/A","4/16/2021","RHMA","127","H",13.92,"9.45","29.2","1.4","27.7","BrGr","N/A","Y",NA,"N",NA,2021-04-16,"2021","04","16","St. Thomas",18.320665,-64.867323
"1175","Oasis Cove","ST","AND, AH, KWG","05/11/2021","N/A","4/16/2021","RHMA","128","S",7.91,"9.07","20.3","0.3","19.9","OlGr","N/A","Y",NA,"N",NA,2021-04-16,"2021","04","16","St. Thomas",18.320665,-64.867323
"1176","Oasis Cove","LP","AJH, AND, KWG",NA,"3'' TP","05-16-22","RHMA","2087","H",24.28,"11.6","29.9","3.1","26.7","G","Y","Y","3rd set of leaves","N",NA,2022-05-16,"2022","05","16","St. Thomas",18.320665,-64.867323
"1177","Oasis Cove","ST","AND, AH, KWG","05/11/2021","N/A","4/16/2021","RHMA","49","H",10.62,"10.31","19.4","1.1","18.1","OlGr","Y","N",NA,"N",NA,2021-04-16,"2021","04","16","St. Thomas",18.320665,-64.867323
"1178","Oasis Cove","ST","AND, AH, KWG","05/11/2021","N/A","4/16/2021","RHMA","50","H",20.41,"11.71","30.6","1.4","29.1","OlGr","Y","N",NA,"N",NA,2021-04-16,"2021","04","16","St. Thomas",18.320665,-64.867323
"1179","Oasis Cove","ST","AND, AH, KWG","05/11/2021","N/A","4/16/2021","RHMA","51","S",17.77,"10.62","33.2","1.8","31.6","BrGr","Y","Y",NA,"N",NA,2021-04-16,"2021","04","16","St. Thomas",18.320665,-64.867323
"1180","Oasis Cove","ST","AND, AH, KWG","05/11/2021","N/A","4/16/2021","RHMA","52","S",18.25,"11.6","27.6","1.2","26.5","OlGr","Y","Y",NA,"N",NA,2021-04-16,"2021","04","16","St. Thomas",18.320665,-64.867323
"1181","Oasis Cove","ST","AND, AH, KWG","05/11/2021","N/A","4/16/2021","RHMA","53","S",10.21,"9.79","20.8","1.5","19.2","BrGr","Y","Y",NA,"N",NA,2021-04-16,"2021","04","16","St. Thomas",18.320665,-64.867323
"1182","Oasis Cove","ST","AND, AH, KWG","05/11/2021","N/A","4/16/2021","RHMA","54","S",14,"10.49","26","1.7","24.4","OlGr","Y","Y",NA,"N",NA,2021-04-16,"2021","04","16","St. Thomas",18.320665,-64.867323
"1183","Oasis Cove","ST","AND, AH, KWG","05/11/2021","N/A","4/16/2021","RHMA","55","S",11.62,"9.35","24.5","1.2","23.2","OlGr","Y","N",NA,"N",NA,2021-04-16,"2021","04","16","St. Thomas",18.320665,-64.867323
"1184","Oasis Cove","ST","AND, AH, KWG","05/11/2021","N/A","4/16/2021","RHMA","56","S",23.46,"12.51","31.4","1.2","30.1","OlGr","Y","Y",NA,"N",NA,2021-04-16,"2021","04","16","St. Thomas",18.320665,-64.867323
"1185","Oasis Cove","ST","AND, AH, KWG","05/11/2021","N/A","4/16/2021","RHMA","57","S",19.55,"10.93","33","1.6","31.3","Br","Y","Y",NA,"N",NA,2021-04-16,"2021","04","16","St. Thomas",18.320665,-64.867323
"1186","Oasis Cove","ST","AND, AH, KWG","05/11/2021","N/A","4/16/2021","RHMA","58","H",11.58,"10.22","22","1.6","20.9","OlGr","Y","N",NA,"N",NA,2021-04-16,"2021","04","16","St. Thomas",18.320665,-64.867323
"1187","Oasis Cove","LP","AJH, AND, KWG",NA,"3""","08-23-22","RHMA","2111","H",25,"12.8","32.6","1.4","31.2","G/B","Y","N",NA,"N",NA,2022-08-23,"2022","08","23","St. Thomas",18.320665,-64.867323
"1188","Oasis Cove","LP","AJH, AND, KWG",NA,"3''","08-23-22","RHMA","2112","H",15.05,"11.2","26.7","1.5","25.2","G","Y","N",NA,"N",NA,2022-08-23,"2022","08","23","St. Thomas",18.320665,-64.867323
"1189","Oasis Cove","LP","AJH, AND, KWG",NA,"3""","08-23-22","RHMA","2113","H",19.78,"13.1","28.9","1.5","27.4","B","Y","N",NA,"N",NA,2022-08-23,"2022","08","23","St. Thomas",18.320665,-64.867323
"1190","Oasis Cove","LP","AJH, AND, KWG",NA,"3''","08-23-22","RHMA","2114","H",14.41,"11.9","23","1.5","21.5","B","Y","N",NA,"N",NA,2022-08-23,"2022","08","23","St. Thomas",18.320665,-64.867323
"1191","Oasis Cove","LP","AJH, AND, KWG",NA,"3""","08-23-22","RHMA","2115","H",15.54,"12.3","24.5","1","23.5","B","Y","N",NA,"N",NA,2022-08-23,"2022","08","23","St. Thomas",18.320665,-64.867323
"1192","Oasis Cove","LP","AJH, AND, KWG",NA,"3''","08-23-22","RHMA","2116","H",17.68,"12.6","25.3","1.4","23.9","B","Y","N",NA,"N",NA,2022-08-23,"2022","08","23","St. Thomas",18.320665,-64.867323
"1193","Oasis Cove","LP","AJH, AND, KWG",NA,"3""","08-23-22","RHMA","2117","H",9.46,"11","19.3","1.2","18.1","B","N","N",NA,"N",NA,2022-08-23,"2022","08","23","St. Thomas",18.320665,-64.867323
"1194","Oasis Cove","LP","AJH, AND, KWG",NA,"3''","08-23-22","RHMA","2118","H",12.67,"11","24.7","1.3","23.4","G","Y","N",NA,"N",NA,2022-08-23,"2022","08","23","St. Thomas",18.320665,-64.867323
"1195","Oasis Cove","LP","AJH, AND, KWG",NA,"3""","08-23-22","RHMA","2119","H",9.46,"9.8","22.5","1","21.5","B","Y","N",NA,"N",NA,2022-08-23,"2022","08","23","St. Thomas",18.320665,-64.867323
"1196","Oasis Cove","LP","AJH, AND, KWG",NA,"3''","08-23-22","RHMA","2120","H",14.89,"12","24.1","1.2","22.9","G","Y","N","Plumule brown, dead? curved","N",NA,2022-08-23,"2022","08","23","St. Thomas",18.320665,-64.867323
"1197","Oasis Cove","LP","AJH, AND, KWG",NA,"3""","08-23-22","RHMA","2121","H",10.14,"10.9","17.8","1.1","16.7","G","Y","N",NA,"N",NA,2022-08-23,"2022","08","23","St. Thomas",18.320665,-64.867323
"1198","Oasis Cove",NA,"AJH, AND, KWG",NA,"3""","09/01/2022","RHMA","2122","H",16,"11.2","23.9","1.4","22.5","G","Y","N",NA,"N",NA,2022-09-01,"2022","09","01","St. Thomas",18.320665,-64.867323
"1199","Oasis Cove",NA,"AJH, AND, KWG",NA,"3""","09/01/2022","RHMA","2123","H",23.4,"13.7","28","1.5","26.5","G","Y","N",NA,"N",NA,2022-09-01,"2022","09","01","St. Thomas",18.320665,-64.867323
"1200","Oasis Cove",NA,"AJH, AND, KWG",NA,"3""","09/01/2022","RHMA","2124","H",38.81,"14.6","37.7","1.8","35.9","G","Y","N",NA,"N",NA,2022-09-01,"2022","09","01","St. Thomas",18.320665,-64.867323
"1201","Oasis Cove","ST","AND, AH, KWG","05/11/2021","N/A","4/16/2021","RHMA","73","S",17.94,"9.64","31.6","1.7","30.9","BrGr","Y","Y",NA,"N",NA,2021-04-16,"2021","04","16","St. Thomas",18.320665,-64.867323
"1202","Oasis Cove","ST","AND, AH, KWG","05/11/2021","N/A","4/16/2021","RHMA","74","S",15.33,"11.43","27.2","1.6","24.9","BrGr","Y","Y",NA,"N",NA,2021-04-16,"2021","04","16","St. Thomas",18.320665,-64.867323
"1203","Oasis Cove","ST","AND, AH, KWG","05/11/2021","N/A","4/16/2021","RHMA","75","H",11.4,"9.64","26.5","1.4","24.9","BrGr","Y","Y",NA,"N",NA,2021-04-16,"2021","04","16","St. Thomas",18.320665,-64.867323
"1204","Oasis Cove","ST","AND, AH, KWG","05/11/2021","N/A","4/16/2021","RHMA","76","H",12.53,"9.97","26.3","1.4","24.9","BrGr","Y","Y",NA,"N",NA,2021-04-16,"2021","04","16","St. Thomas",18.320665,-64.867323
"1205","Oasis Cove","ST","AND, AH, KWG","05/11/2021","N/A","4/16/2021","RHMA","77","S",19.85,"11.85","26.5",NA,"26.2","Br","Y","N",NA,"N",NA,2021-04-16,"2021","04","16","St. Thomas",18.320665,-64.867323
"1206","Oasis Cove","ST","AND, AH, KWG","05/11/2021","N/A","4/16/2021","RHMA","78","S",14.2,"10.51","26.7","1.2","25.6","OlGr","Y","N",NA,"N",NA,2021-04-16,"2021","04","16","St. Thomas",18.320665,-64.867323
"1207","Oasis Cove","LP","AJH, AND, KWG",NA,"3'' TP","08-23-22","RHMA","2091","H",18.96,"12.1","28","1.6","26.4","B","Y","Y",NA,"N",NA,2022-08-23,"2022","08","23","St. Thomas",18.320665,-64.867323
"1208","Oasis Cove","LP","AJH, AND, KWG",NA,"3'' TP","08-23-22","RHMA","2092","H",12.39,"10.1","23.8","1.2","22.3","G","Y","Y",NA,"N",NA,2022-08-23,"2022","08","23","St. Thomas",18.320665,-64.867323
"1209","Oasis Cove","LP","AJH, AND, KWG",NA,"3'' TP","08-23-22","RHMA","2093","H",17.04,"12.1","24.2","1.5","22.7","B","Y","Y",NA,"N",NA,2022-08-23,"2022","08","23","St. Thomas",18.320665,-64.867323
"1210","Oasis Cove","LP","AJH, AND, KWG",NA,"3'' TP","08-23-22","RHMA","2094","H",18.55,"11.6","30.5","1.9","28.8","G","Y","Y",NA,"N",NA,2022-08-23,"2022","08","23","St. Thomas",18.320665,-64.867323
"1211","Oasis Cove","LP","AJH, AND, KWG",NA,"3'' TP","08-23-22","RHMA","2095","H",17.2,"12","26.3","1.9","24.5","B","Y","Y",NA,"N",NA,2022-08-23,"2022","08","23","St. Thomas",18.320665,-64.867323
"1212","Oasis Cove","LP","AJH, AND, KWG",NA,"3'' TP","08-23-22","RHMA","2096","H",22.79,"13.4","30.7","1.8","29.1","G","Y","Y",NA,"N",NA,2022-08-23,"2022","08","23","St. Thomas",18.320665,-64.867323
"1213","Oasis Cove","LP","AJH, AND, KWG",NA,"3'' TP","08-23-22","RHMA","2097","H",16.25,"1.8","23","1.5","21.5","B","Y","Y",NA,"N",NA,2022-08-23,"2022","08","23","St. Thomas",18.320665,-64.867323
"1214","Oasis Cove","LP","AJH, AND, KWG",NA,"3'' TP","08-23-22","RHMA","2098","H",8.17,"9","20.7","0.6","20.1","G","Y","Y",NA,"N",NA,2022-08-23,"2022","08","23","St. Thomas",18.320665,-64.867323
"1215","Oasis Cove","LP","AJH, AND, KWG",NA,"3'' TP","08-23-22","RHMA","2099","H",9.69,"9.8","21.3","0.9","20.3","G","N","Y",NA,"N",NA,2022-08-23,"2022","08","23","St. Thomas",18.320665,-64.867323
"1216","Oasis Cove","ST","AND, AH, KWG","05/11/2021","N/A","4/16/2021","RHMA","129","H",8.29,"7.57","25.4","0.3","25.1","OlGr","N/A","Y",NA,"N",NA,2021-04-16,"2021","04","16","St. Thomas",18.320665,-64.867323
"1217","Oasis Cove","ST","AND, AH, KWG","05/11/2021","N/A","4/16/2021","RHMA","89","S",6.36,"8.18","18.3","0.2","17.9","BrGr","Y","Y",NA,"N",NA,2021-04-16,"2021","04","16","St. Thomas",18.320665,-64.867323
"1218","Oasis Cove","ST","AND, AH, KWG","05/11/2021","N/A","4/16/2021","RHMA","90","H",15.08,"10.33","26.8","1.5","25.4","OlGr","Y","Y",NA,"N",NA,2021-04-16,"2021","04","16","St. Thomas",18.320665,-64.867323
"1219","Oasis Cove","ST","AND, AH, KWG","05/11/2021","N/A","4/16/2021","RHMA","91","S",15.06,"11.34","26","1.7","26","BrGr","Y","Y",NA,"N",NA,2021-04-16,"2021","04","16","St. Thomas",18.320665,-64.867323
"1220","Oasis Cove","ST","AND, AH, KWG","05/11/2021","N/A","4/16/2021","RHMA","92","S",11.06,"10.07","22.5","1.1","21.4","BrGr","Y","Y",NA,"N",NA,2021-04-16,"2021","04","16","St. Thomas",18.320665,-64.867323
"1221","Oasis Cove","ST","AND, AH, KWG","05/11/2021","N/A","4/16/2021","RHMA","93","S",7.32,"8.17","22.1","0.7","22","BrGr","Y","Y",NA,"N",NA,2021-04-16,"2021","04","16","St. Thomas",18.320665,-64.867323
"1222","Oasis Cove","ST","AND, AH, KWG","05/11/2021","N/A","4/16/2021","RHMA","94","S",7.2,"7.98","21.4","1.2","21.3","Br","Y","Y",NA,"N",NA,2021-04-16,"2021","04","16","St. Thomas",18.320665,-64.867323
"1223","Oasis Cove","ST","AND, AH, KWG","05/11/2021","N/A","4/16/2021","RHMA","95","S",12.83,"10.5","25.8","1.2","24.3","BrGr","Y","Y",NA,"N",NA,2021-04-16,"2021","04","16","St. Thomas",18.320665,-64.867323
"1224","Oasis Cove","ST","AND, AH, KWG","05/11/2021","N/A","4/16/2021","RHMA","96","S",9.81,"8.08","24",NA,"23.9","BrGr","Y","N",NA,"N",NA,2021-04-16,"2021","04","16","St. Thomas",18.320665,-64.867323
"1225","Oasis Cove","ST","AND, AH, KWG","05/11/2021","N/A","4/16/2021","RHMA","97","H",15.63,"11.21","27.7","1","26.4","BrGr","N/A","Y",NA,"N",NA,2021-04-16,"2021","04","16","St. Thomas",18.320665,-64.867323
"1226","Oasis Cove","ST","AND, AH, KWG","05/11/2021","N/A","4/16/2021","RHMA","98","H",15.44,"10.09","29.8","1","29","BrGr","N/A","Y",NA,"N",NA,2021-04-16,"2021","04","16","St. Thomas",18.320665,-64.867323
"1227","Oasis Cove","ST","AND, AH, KWG","05/11/2021","N/A","4/16/2021","RHMA","99","S",6.23,"7.16","16.8","0.8","15.7","OlGr","N/A","N",NA,"N",NA,2021-04-16,"2021","04","16","St. Thomas",18.320665,-64.867323
"1228","Oasis Cove","ST","AND, AH, KWG","05/11/2021","N/A","4/16/2021","RHMA","100","S",4.06,"5.97","17.1","0.6","16.2","OlGr","N/A","N",NA,"N",NA,2021-04-16,"2021","04","16","St. Thomas",18.320665,-64.867323
"1229","Oasis Cove","ST","AND, AH, KWG","05/11/2021","N/A","4/16/2021","RHMA","101","H",8.46,"8.3","24.5","1","23.6","BrGr","N/A","Y",NA,"N",NA,2021-04-16,"2021","04","16","St. Thomas",18.320665,-64.867323
"1230","Oasis Cove","ST","AND, AH, KWG","05/11/2021","N/A","4/16/2021","RHMA","102","H",10.37,"9.54","22.5","1.2","21.5","BrGr","N/A","Y",NA,"N",NA,2021-04-16,"2021","04","16","St. Thomas",18.320665,-64.867323
"1231","Oasis Cove","ST","AND, AH, KWG","05/11/2021","N/A","4/16/2021","RHMA","103","H",12.03,"11.28","19.7","1.2","18.8","OlGr","N/A","Y",NA,"N",NA,2021-04-16,"2021","04","16","St. Thomas",18.320665,-64.867323
"1232","Oasis Cove","ST","AND, AH, KWG","05/11/2021","N/A","4/16/2021","RHMA","104","S",8.89,"8.88","21.1","1.2","20.1","BrGr","N/A","N",NA,"N",NA,2021-04-16,"2021","04","16","St. Thomas",18.320665,-64.867323
"1233","Oasis Cove","ST","AND, AH, KWG","05/11/2021","N/A","4/16/2021","RHMA","105","S",13.7,"10","27.8","1.2","26.6","OlGr","N/A","N",NA,"N",NA,2021-04-16,"2021","04","16","St. Thomas",18.320665,-64.867323
"1234","Oasis Cove","ST","AND, AH, KWG","05/11/2021","N/A","4/16/2021","RHMA","106","S",4.73,"6.51","17.6",NA,"17.6","Br","N/A","N",NA,"N",NA,2021-04-16,"2021","04","16","St. Thomas",18.320665,-64.867323
"1235","Oasis Cove","ST","AND, AH, KWG","05/11/2021","N/A","4/16/2021","RHMA","107","S",8.03,"8.77","21.3","1","20.4","BrGr","N/A","N",NA,"N",NA,2021-04-16,"2021","04","16","St. Thomas",18.320665,-64.867323
"1236","Oasis Cove","ST","AND, AH, KWG","05/11/2021","N/A","4/16/2021","RHMA","108","H",9.82,"9.82","20.6","1.1","19.5","BrGr","N/A","Y",NA,"N",NA,2021-04-16,"2021","04","16","St. Thomas",18.320665,-64.867323
"1237","Oasis Cove","ST","AND, AH, KWG","05/11/2021","N/A","4/16/2021","RHMA","109","H",13,"10.39","24.1","1.4","22.8","OlGr","N/A","Y",NA,"N",NA,2021-04-16,"2021","04","16","St. Thomas",18.320665,-64.867323
"1238","Oasis Cove","ST","AND, AH, KWG","05/11/2021","N/A","4/16/2021","RHMA","110","S",13,"9.53","27.2","1.3","26.1","BrGr","N/A","Y",NA,"N",NA,2021-04-16,"2021","04","16","St. Thomas",18.320665,-64.867323
"1239","Oasis Cove","ST","AND, AH, KWG","05/11/2021","N/A","4/16/2021","RHMA","111","S",6.16,"7.7","20.5","0.9","19.9","BrGr","N/A","Y",NA,"N",NA,2021-04-16,"2021","04","16","St. Thomas",18.320665,-64.867323
"1240","Oasis Cove","ST","AND, AH, KWG","05/11/2021","N/A","4/16/2021","RHMA","112","H",15.24,"11.21","26.7","1.4","25.3","OlGr","N/A","Y",NA,"N",NA,2021-04-16,"2021","04","16","St. Thomas",18.320665,-64.867323
"1241","Oasis Cove","ST","AND, AH, KWG","05/11/2021","N/A","4/16/2021","RHMA","113","S",3.94,"7.98","12.2",NA,"12.2","BrGr","N/A","Y",NA,"N",NA,2021-04-16,"2021","04","16","St. Thomas",18.320665,-64.867323
"1242","Oasis Cove","ST","AND, AH, KWG","05/11/2021","N/A","4/16/2021","RHMA","114","H",17.69,"10.72","31.2","1.3","29.8","BrGr","N/A","Y",NA,"N",NA,2021-04-16,"2021","04","16","St. Thomas",18.320665,-64.867323
"1243","Oasis Cove","ST","AND, AH, KWG","05/11/2021","N/A","4/16/2021","RHMA","115","S",19.4,"12.51","27.5",NA,"27.5","Br","N/A","Y",NA,"N",NA,2021-04-16,"2021","04","16","St. Thomas",18.320665,-64.867323
"1244","Oasis Cove","ST","AND, AH, KWG","05/11/2021","N/A","4/16/2021","RHMA","116","S",19.16,"12.16","27.1","1.3","25.9","OlGr","N/A","Y",NA,"N",NA,2021-04-16,"2021","04","16","St. Thomas",18.320665,-64.867323
"1245","Oasis Cove","ST","AND, AH, KWG","05/11/2021","N/A","4/16/2021","RHMA","117","S",11.09,"9.13","27","1.1","26","BrGr","N/A","Y",NA,"N",NA,2021-04-16,"2021","04","16","St. Thomas",18.320665,-64.867323
"1246","Oasis Cove","ST","AND, AH, KWG","05/11/2021","N/A","4/16/2021","RHMA","118","H",22.76,"12.49","35","1.6","32.8","BrGr","N/A","Y",NA,"N",NA,2021-04-16,"2021","04","16","St. Thomas",18.320665,-64.867323
"1247","Oasis Cove","ST","AND, AH, KWG","05/11/2021","N/A","4/16/2021","RHMA","119","H",10.89,"10.25","20.2","1.3","19.4","OlGr","N/A","Y",NA,"N",NA,2021-04-16,"2021","04","16","St. Thomas",18.320665,-64.867323
"1248","Oasis Cove","ST","AND, AH, KWG","05/11/2021","N/A","4/16/2021","RHMA","120","H",16.12,"10.25","31","1.7","29.3","BrGr","N/A","Y",NA,"N",NA,2021-04-16,"2021","04","16","St. Thomas",18.320665,-64.867323
"1249","Oasis Cove","ST","AND, AH, KWG","05/11/2021","N/A","4/16/2021","RHMA","121","H",12.61,"9.86","25.5","1.3","24.3","BrGr","N/A","N",NA,"N",NA,2021-04-16,"2021","04","16","St. Thomas",18.320665,-64.867323
"1250","Oasis Cove","ST","AND, AH, KWG","05/11/2021","N/A","4/16/2021","RHMA","122","H",17.72,"11.35","26.9","1.2","25.6","OlGr","N/A","Y",NA,"N",NA,2021-04-16,"2021","04","16","St. Thomas",18.320665,-64.867323
"1251","Oasis Cove","HH","AND, KWG, ZR","05-20-21","N/A","05/07/2021","RHMA","144","S",18.45,"10.71","29.3","1.5","27.9","OlGr","N/A","Y",NA,"N",NA,2021-05-07,"2021","05","07","St. Thomas",18.320665,-64.867323
"1252","Oasis Cove","HH","AND, KWG, ZR","05-20-21","N/A","05/07/2021","RHMA","145","S",13.16,"9.45","27.4","1.1","26.4","BrGr","N/A","Y",NA,"N",NA,2021-05-07,"2021","05","07","St. Thomas",18.320665,-64.867323
"1253","Oasis Cove","HH","AND, KWG, ZR","05-20-21","N/A","05/07/2021","RHMA","146","S",22.48,"11.42","34.9","1.6","33.3","OlGr","N/A","Y",NA,"N",NA,2021-05-07,"2021","05","07","St. Thomas",18.320665,-64.867323
"1254","Oasis Cove","HH","AND, KWG, ZR","05-20-21","N/A","05/07/2021","RHMA","147","S",15.25,"11.31","25.6","1.4","24.4","BrGr","N/A","Y",NA,"N",NA,2021-05-07,"2021","05","07","St. Thomas",18.320665,-64.867323
"1255","Oasis Cove","HH","AND, KWG, ZR","05-20-21","N/A","05/07/2021","RHMA","148","S",9.39,"9.23","21.4","0.7","20.6","OlGr","N/A","Y",NA,"N",NA,2021-05-07,"2021","05","07","St. Thomas",18.320665,-64.867323
"1256","Oasis Cove","LP","AJH, AND, KWG",NA,"3'' TP","08-23-22","RHMA","2100","H",9.25,"10.2","19.1","1.1","18","G","N","Y",NA,"N",NA,2022-08-23,"2022","08","23","St. Thomas",18.320665,-64.867323
"1257","Oasis Cove","HH","AND, KWG, ZR","05-20-21","N/A","05/07/2021","RHMA","150","H",11.2,"10.28","22.4","1.3","21.1","OlGr","N/A","Y",NA,"N",NA,2021-05-07,"2021","05","07","St. Thomas",18.320665,-64.867323
"1258","Oasis Cove","HH","AND, KWG, ZR","05-20-21","N/A","05/07/2021","RHMA","151","S",17.84,"10.01","32.9","1.2, 1.1","31.8","BrGr","N/A","Y",NA,"N",NA,2021-05-07,"2021","05","07","St. Thomas",18.320665,-64.867323
"1259","Oasis Cove","HH","AND, KWG, ZR","05-20-21","N/A","05/07/2021","RHMA","152","S",11.91,"8.7","29.9","1.6","28.3","OlGr","N/A","Y",NA,"N",NA,2021-05-07,"2021","05","07","St. Thomas",18.320665,-64.867323
"1260","Oasis Cove","HH","AND, KWG, ZR","05-20-21","N/A","05/07/2021","RHMA","153","S",17.54,"12.37","25.6","1.4","24.2","OlGr","N/A","Y",NA,"N",NA,2021-05-07,"2021","05","07","St. Thomas",18.320665,-64.867323
"1261","Oasis Cove","HH","AND, KWG, ZR","05-20-21","N/A","05/07/2021","RHMA","154","H",26.52,"12.58","33.1","1.6","31.7","OlGr","N/A","Y",NA,"N",NA,2021-05-07,"2021","05","07","St. Thomas",18.320665,-64.867323
"1262","Oasis Cove","HH","AND, KWG, ZR","05-20-21","N/A","05/07/2021","RHMA","155","H",18.51,"11.98","29.9","1.6","28.3","BrGr","N/A","Y",NA,"N",NA,2021-05-07,"2021","05","07","St. Thomas",18.320665,-64.867323
"1263","Oasis Cove","HH","AND, KWG, ZR","05-20-21","N/A","05/07/2021","RHMA","156","S",12.25,"9.89","20.3","N/A","N/A","BrGr","N/A","Y",NA,"N",NA,2021-05-07,"2021","05","07","St. Thomas",18.320665,-64.867323
"1264","Oasis Cove","HH","AND, KWG, ZR","05-20-21","N/A","05/07/2021","RHMA","157","S",10.57,"8.65","25.7","1.5","25.2","BrGr","N/A","Y",NA,"N",NA,2021-05-07,"2021","05","07","St. Thomas",18.320665,-64.867323
"1265","Oasis Cove","HH","AND, KWG, ZR","05-20-21","N/A","05/07/2021","RHMA","158","S",7.66,"7.78","21","1.1","20.2","BrGr","N/A","Y",NA,"N",NA,2021-05-07,"2021","05","07","St. Thomas",18.320665,-64.867323
"1266","Oasis Cove","HH","AND, KWG, ZR","05-20-21","N/A","05/07/2021","RHMA","159","S",13.1,"10.12","29.1","1.2","27.9","BrGr","N/A","Y",NA,"N",NA,2021-05-07,"2021","05","07","St. Thomas",18.320665,-64.867323
"1267","Oasis Cove","HH","AND, KWG, ZR","05-20-21","N/A","05/07/2021","RHMA","160","S",11.8,"10.38","21.3","1.8","20.6","BrGr","N/A","Y",NA,"N",NA,2021-05-07,"2021","05","07","St. Thomas",18.320665,-64.867323
"1268","Oasis Cove","HH","AND, KWG, ZR","05-20-21","N/A","05/07/2021","RHMA","161","S",11.45,"11.5","19.2","1.1","18.3","OlGr","N/A","Y",NA,"N",NA,2021-05-07,"2021","05","07","St. Thomas",18.320665,-64.867323
"1269","Oasis Cove","HH","AND, KWG, ZR","05-20-21","N/A","05/07/2021","RHMA","162","S",9.94,"9.55","22","1.4","20.8","BrGr","N/A","Y",NA,"N",NA,2021-05-07,"2021","05","07","St. Thomas",18.320665,-64.867323
"1270","Oasis Cove","HH","AND, KWG, ZR","05-20-21","N/A","05/07/2021","RHMA","163","S",11.36,"10.59","25.2","1.5","23.8","BrGr","N/A","Y",NA,"N",NA,2021-05-07,"2021","05","07","St. Thomas",18.320665,-64.867323
"1271","Oasis Cove","HH","AND, KWG, ZR","05-20-21","N/A","05/07/2021","RHMA","164","S",14.67,"10.2","28.4","1.3","27.3","OlGr","N/A","Y",NA,"N",NA,2021-05-07,"2021","05","07","St. Thomas",18.320665,-64.867323
"1272","Oasis Cove","HH","AND, KWG, ZR","05-20-21","N/A","05/07/2021","RHMA","165","S",6.36,"8.61","17","N/A","17","BrGr","N/A","Y",NA,"N",NA,2021-05-07,"2021","05","07","St. Thomas",18.320665,-64.867323
"1273","Oasis Cove","HH","AND, KWG, ZR","05-20-21","N/A","05/07/2021","RHMA","166","S",13.2,"9.96","25.7","1.7","25.2","BrGr","N/A","Y",NA,"N",NA,2021-05-07,"2021","05","07","St. Thomas",18.320665,-64.867323
"1274","Oasis Cove","HH","AND, KWG, ZR","05-20-21","N/A","05/07/2021","RHMA","167","S",7.47,"10.64","13.4","N/A","13.4","OlGr","N/A","Y",NA,"N",NA,2021-05-07,"2021","05","07","St. Thomas",18.320665,-64.867323
"1275","Oasis Cove","SC","AND, KWG","5/20/2021","N/A","05/07/2021","RHMA","168","H",18.57,"12.1","27.5","1.5","26","Br","N/A","N",NA,"N",NA,2021-05-07,"2021","05","07","St. Thomas",18.320665,-64.867323
"1276","Oasis Cove","SC","AND, KWG","5/20/2021","N/A","05/07/2021","RHMA","169","S",11.34,"10.21","24.3","0.4","23.9","OlGr","N/A","N",NA,"N",NA,2021-05-07,"2021","05","07","St. Thomas",18.320665,-64.867323
"1277","Oasis Cove","SC","AND, KWG","5/20/2021","N/A","05/07/2021","RHMA","170","H",12.96,"10.31","24.2","1.3","23","BrGr","N/A","Y",NA,"N",NA,2021-05-07,"2021","05","07","St. Thomas",18.320665,-64.867323
"1278","Oasis Cove","SC","AND, KWG","5/20/2021","N/A","05/07/2021","RHMA","171","H",16.22,"10.68","31.2","1.5","29.8","OlGr","N/A","N",NA,"N",NA,2021-05-07,"2021","05","07","St. Thomas",18.320665,-64.867323
"1279","Oasis Cove","SC","AND, KWG","5/20/2021","N/A","05/07/2021","RHMA","172","H",8.28,"9.51","18.6","1.2","17.7","OlGr","N/A","Y",NA,"N",NA,2021-05-07,"2021","05","07","St. Thomas",18.320665,-64.867323
"1280","Oasis Cove","SC","AND, KWG","5/20/2021","N/A","05/07/2021","RHMA","173","H",13.46,"10.46","27.2","1.6","25.7","OlGr","N/A","Y",NA,"N",NA,2021-05-07,"2021","05","07","St. Thomas",18.320665,-64.867323
"1281","Oasis Cove","SC","AND, KWG","5/20/2021","N/A","05/07/2021","RHMA","174","H",5.85,"8.74","16.2","0.8","15.4","OlGr","N/A","Y",NA,"N",NA,2021-05-07,"2021","05","07","St. Thomas",18.320665,-64.867323
"1282","Oasis Cove","SC","AND, KWG","5/20/2021","N/A","05/07/2021","RHMA","175","H",22.64,"11.32","37.2","1.5","35.8","OlGr","N/A","N",NA,"N",NA,2021-05-07,"2021","05","07","St. Thomas",18.320665,-64.867323
"1283","Oasis Cove","SC","AND, KWG","5/20/2021","N/A","05/07/2021","RHMA","176","H",17.87,"11.13","27.2","N/A","27.2","OlGr","N/A","N",NA,"N",NA,2021-05-07,"2021","05","07","St. Thomas",18.320665,-64.867323
"1284","Oasis Cove","SC","AND, KWG","5/20/2021","N/A","05/07/2021","RHMA","177","H",14.87,"10.03","28.2","1.4","26.8","BrGr","N/A","N",NA,"N",NA,2021-05-07,"2021","05","07","St. Thomas",18.320665,-64.867323
"1285","Oasis Cove","SC","AND, KWG","5/20/2021","N/A","05/07/2021","RHMA","178","S",9.63,"8.55","24.2","N/A","24.2","Br/Bl","N/A","N",NA,"N",NA,2021-05-07,"2021","05","07","St. Thomas",18.320665,-64.867323
"1286","Oasis Cove","SC","AND, KWG","5/20/2021","N/A","05/07/2021","RHMA","179","H",11.15,"10.52","22.1","1.6","20.8","BrGr","N/A","Y",NA,"N",NA,2021-05-07,"2021","05","07","St. Thomas",18.320665,-64.867323
"1287","Oasis Cove","SC","AND, KWG","5/20/2021","N/A","05/07/2021","RHMA","180","H",17.75,"11.52","29.3","N/A","29.3","OlGr","N/A","Y",NA,"N",NA,2021-05-07,"2021","05","07","St. Thomas",18.320665,-64.867323
"1288","Oasis Cove","SC","AND, KWG","5/20/2021","N/A","05/07/2021","RHMA","181","H",16.4,"11.19","26","1.5","24.5","OlGr","N/A","Y",NA,"N",NA,2021-05-07,"2021","05","07","St. Thomas",18.320665,-64.867323
"1289","Oasis Cove","SC","AND, KWG","5/20/2021","N/A","05/07/2021","RHMA","182","H",16.58,"11.35","26.5","1.4","25.4","OlGr","N/A","Y",NA,"N",NA,2021-05-07,"2021","05","07","St. Thomas",18.320665,-64.867323
"1290","Oasis Cove","SC","AND, KWG","5/20/2021","N/A","05/07/2021","RHMA","183","H",15.03,"11.02","25.4","1.4","24","OlGr","N/A","Y",NA,"N",NA,2021-05-07,"2021","05","07","St. Thomas",18.320665,-64.867323
"1291","Oasis Cove","SC","AND, KWG","5/20/2021","N/A","05/07/2021","RHMA","184","H",15.06,"10.16","30.2","1.5","28.8","BrGr","N/A","Y",NA,"N",NA,2021-05-07,"2021","05","07","St. Thomas",18.320665,-64.867323
"1292","Oasis Cove","SC","AND, KWG","5/20/2021","N/A","05/07/2021","RHMA","185","H",15.84,"11.83","24.7","1.3","23.5","OlGr","N/A","Y",NA,"N",NA,2021-05-07,"2021","05","07","St. Thomas",18.320665,-64.867323
"1293","Oasis Cove","SC","AND, KWG","5/20/2021","N/A","05/07/2021","RHMA","186","S",18.67,"11.14","30.5","1.3","29.3","OlGr","N/A","Y",NA,"N",NA,2021-05-07,"2021","05","07","St. Thomas",18.320665,-64.867323
"1294","Oasis Cove","SC","AND, KWG","5/20/2021","N/A","05/07/2021","RHMA","187","H",12.51,"10.19","24.1","N/A","24.1","BrGr","N/A","Y",NA,"N",NA,2021-05-07,"2021","05","07","St. Thomas",18.320665,-64.867323
"1295","Oasis Cove","SC","AND, KWG","5/20/2021","N/A","05/07/2021","RHMA","188","H",15.71,"11.22","25","1.5","23.5","OlGr","N/A","Y",NA,"N",NA,2021-05-07,"2021","05","07","St. Thomas",18.320665,-64.867323
"1296","Oasis Cove","HH","AND, KWG, ZR","05-20-21","N/A","05/07/2021","RHMA","149","H",13.05,"11.13","23.5","1.3","22.3","BrGr","N/A","Y",NA,"N",NA,2021-05-07,"2021","05","07","St. Thomas",18.320665,-64.867323
"1297","Oasis Cove","SC","AND, KWG","5/20/2021","N/A","05/07/2021","RHMA","190","H",14.72,"10.75","26.8","1.7","25.2","OlGr","N/A","Y",NA,"N",NA,2021-05-07,"2021","05","07","St. Thomas",18.320665,-64.867323
"1298","Oasis Cove","SC","AND, KWG","5/20/2021","N/A","05/07/2021","RHMA","191","H",18.49,"11.89","28.6","1.5","27.1","OlGr","N/A","Y",NA,"N",NA,2021-05-07,"2021","05","07","St. Thomas",18.320665,-64.867323
"1299","Oasis Cove","SC","AND, KWG","5/20/2021","N/A","05/07/2021","RHMA","192","H",17.51,"12.94","23.4","1.4","22","BrGr","N/A","Y",NA,"N",NA,2021-05-07,"2021","05","07","St. Thomas",18.320665,-64.867323
"1300","Oasis Cove","SC","AND, KWG","5/20/2021","N/A","05/07/2021","RHMA","193","H",23.14,"12.43","31.4","0.4","31","OlGr","N/A","Y",NA,"N",NA,2021-05-07,"2021","05","07","St. Thomas",18.320665,-64.867323
"1301","Oasis Cove","SC","AND, KWG","5/20/2021","N/A","05/07/2021","RHMA","194","H",18.71,"11.61","31.8","1.5","30.4","OlGr","N/A","N",NA,"N",NA,2021-05-07,"2021","05","07","St. Thomas",18.320665,-64.867323
"1302","Oasis Cove","SC","AND, KWG","5/20/2021","N/A","05/07/2021","RHMA","195","H",15.68,"10.42","30.5","1.3","29.2","OlGr","N/A","N",NA,"N",NA,2021-05-07,"2021","05","07","St. Thomas",18.320665,-64.867323
"1303","Oasis Cove","LU","Lee'ani","9/28/24","CC","09/11/2024","RHMA","6267",NA,12,NA,NA,NA,"25.1",NA,NA,NA,NA,"VICM Day of Play","Cupcake",2024-09-11,"2024","09","11","St. Thomas",18.320665,-64.867323
"1304","Oasis Cove","LU","LU","9/28/24","CC","09/11/2024","RHMA","6268",NA,14.26,NA,NA,NA,"26",NA,NA,NA,NA,"VICM Day of Play","plantie",2024-09-11,"2024","09","11","St. Thomas",18.320665,-64.867323
"1305","Oasis Cove","LU","LU","9/28/24","CC","09/11/2024","RHMA","6269",NA,16.26,NA,NA,NA,"31",NA,NA,NA,NA,"VICM Day of Play","cinna",2024-09-11,"2024","09","11","St. Thomas",18.320665,-64.867323
"1306","Oasis Cove","LU","LU","9/28/24","CC","09/11/2024","RHMA","6270",NA,18.27,NA,NA,NA,"27",NA,NA,NA,NA,"VICM Day of Play","nayelis",2024-09-11,"2024","09","11","St. Thomas",18.320665,-64.867323
"1307","Oasis Cove","LU","LU","9/28/24","CC","09/11/2024","RHMA","6271",NA,14.24,NA,NA,NA,"27",NA,NA,NA,NA,"VICM Day of Play","encanto",2024-09-11,"2024","09","11","St. Thomas",18.320665,-64.867323
"1308","Oasis Cove","ZDB","AJH, AND, KWG",NA,"3""","09/02/2022","RHMA","2172","H",23.78,"12.7","32.6","1.7","30.9","G","Y","N",NA,"N",NA,2022-09-02,"2022","09","02","St. Thomas",18.320665,-64.867323
"1309","Oasis Cove","KH","AND, KWG, ZR",NA,"3""","09/08/2022","RHMA","2173","H",14.17,"11.5","24.6","1.3","23.3","G","Y","Y",NA,"N",NA,2022-09-08,"2022","09","08","St. Thomas",18.320665,-64.867323
"1310","Oasis Cove","KH","AND, KWG, ZR",NA,"3""","09/08/2022","RHMA","2174","H",16,"11.6","26.7","1.4","25.3","G","Y","Y",NA,"N",NA,2022-09-08,"2022","09","08","St. Thomas",18.320665,-64.867323
"1311","Oasis Cove","KH","AND, KWG, ZR",NA,"3""","09/08/2022","RHMA","2175","H",21.92,"14","25.6","1.3","24.3","G","Y","Y",NA,"N",NA,2022-09-08,"2022","09","08","St. Thomas",18.320665,-64.867323
"1312","Oasis Cove","KH","AND, KWG, ZR",NA,"3""","09/08/2022","RHMA","2176","H",17,"11.9","26.2","1.1","25.1","G","Y","Y",NA,"N",NA,2022-09-08,"2022","09","08","St. Thomas",18.320665,-64.867323
"1313","Oasis Cove","KH","AND, KWG, ZR",NA,"3""","09/08/2022","RHMA","2177","H",25.05,"12.8","33.7","1.4","32.3","G","Y","N",NA,"N",NA,2022-09-08,"2022","09","08","St. Thomas",18.320665,-64.867323
"1314","Oasis Cove","KH","AND, KWG, ZR",NA,"3""","09/08/2022","RHMA","2178","H",24.48,"13.9","28.7","1.6","27.1","G","Y","N",NA,"N",NA,2022-09-08,"2022","09","08","St. Thomas",18.320665,-64.867323
"1315","Oasis Cove","KH","AND, KWG, ZR",NA,"3""","09/08/2022","RHMA","2179","H",22.12,"12.4","29.6","1.5","28.1","G","Y","N",NA,"N",NA,2022-09-08,"2022","09","08","St. Thomas",18.320665,-64.867323
"1316","Oasis Cove","KH","AND, KWG, ZR",NA,"3""","09/08/2022","RHMA","2180","H",20.48,"12.5","27","1.7","25.3","G","Y","N",NA,"N",NA,2022-09-08,"2022","09","08","St. Thomas",18.320665,-64.867323
"1317","Oasis Cove","KH","AND, KWG, ZR",NA,"3""","09/08/2022","RHMA","2181","H",24.16,"13.7","30.6","1.1","29.5","G","Y","N",NA,"N",NA,2022-09-08,"2022","09","08","St. Thomas",18.320665,-64.867323
"1318","Oasis Cove","KH","AND, KWG, ZR",NA,"3""","09/08/2022","RHMA","2182","H",17.04,"12.3","23","1.1","21.9","G","Y","N",NA,"N",NA,2022-09-08,"2022","09","08","St. Thomas",18.320665,-64.867323
"1319","Oasis Cove","KH","AND, KWG, ZR",NA,"3""","09/08/2022","RHMA","2183","H",17.79,"12.2","25.9","1.3","24.6","G","Y","N",NA,"N",NA,2022-09-08,"2022","09","08","St. Thomas",18.320665,-64.867323
"1320","Oasis Cove","KH","AND, KWG, ZR",NA,"3""","09/08/2022","RHMA","2184","H",20.7,"13.6","26.3","1.6","24.7","G","Y","N",NA,"N",NA,2022-09-08,"2022","09","08","St. Thomas",18.320665,-64.867323
"1321","Oasis Cove","KH","AND, KWG, ZR",NA,"3""","09/08/2022","RHMA","2185","H",19.28,"12.3","25.7","1.5","24.2","G","Y","N",NA,"N",NA,2022-09-08,"2022","09","08","St. Thomas",18.320665,-64.867323
"1322","Oasis Cove",NA,"AJH, AND, KWG",NA,"3""","09/01/2022","RHMA","2125","H",29.88,"14.1","33.9","1.7","32.2","G","N","N",NA,"N",NA,2022-09-01,"2022","09","01","St. Thomas",18.320665,-64.867323
"1323","Oasis Cove",NA,"AJH, AND, KWG",NA,"3""","09/01/2022","RHMA","2126","H",27.63,"13.1","31.5","1.5","30","G","Y","N",NA,"N",NA,2022-09-01,"2022","09","01","St. Thomas",18.320665,-64.867323
"1324","Oasis Cove",NA,"AJH, AND, KWG",NA,"3""","09/01/2022","RHMA","2127","H",21,"13.4","28.1","1.5","26.6","G","Y","N",NA,"N",NA,2022-09-01,"2022","09","01","St. Thomas",18.320665,-64.867323
"1325","Oasis Cove",NA,"AJH, AND, KWG",NA,"3""","09/01/2022","RHMA","2128","H",12.9,"11.8","18.2","1.2","17","G","N","N",NA,"N",NA,2022-09-01,"2022","09","01","St. Thomas",18.320665,-64.867323
"1326","Oasis Cove",NA,"AJH, AND, KWG",NA,"3""","09/01/2022","RHMA","2129","H",17.58,"12.2","24.1","1.6","22.5","G","Y","N",NA,"N",NA,2022-09-01,"2022","09","01","St. Thomas",18.320665,-64.867323
"1327","Oasis Cove",NA,"AJH, AND, KWG",NA,"3""","09/01/2022","RHMA","2130","H",11.42,"0.9","24.2","1.3","22.9","G","Y","N",NA,"N",NA,2022-09-01,"2022","09","01","St. Thomas",18.320665,-64.867323
"1328","Oasis Cove",NA,"AJH, AND, KWG",NA,"3""","09/01/2022","RHMA","2131","H",16.03,"12.2","25.7","1.5","24.2","G","Y","N",NA,"N",NA,2022-09-01,"2022","09","01","St. Thomas",18.320665,-64.867323
"1329","Oasis Cove",NA,"AJH, AND, KWG",NA,"3""","09/01/2022","RHMA","2132","H",22.47,"13.3","29","1.5","27.5","G","Y","N",NA,"N",NA,2022-09-01,"2022","09","01","St. Thomas",18.320665,-64.867323
"1330","Oasis Cove",NA,"AJH, AND, KWG",NA,"3""","09/01/2022","RHMA","2133","H",16.11,"11","25.9","1.4","24.5","G","Y","N",NA,"N",NA,2022-09-01,"2022","09","01","St. Thomas",18.320665,-64.867323
"1331","Oasis Cove",NA,"AJH, AND, KWG",NA,"3""","09/01/2022","RHMA","2134","H",13.08,"11.2","22","1.8","20.2","G","Y","N",NA,"N",NA,2022-09-01,"2022","09","01","St. Thomas",18.320665,-64.867323
"1332","Oasis Cove",NA,"AJH, AND, KWG",NA,"3""","09/01/2022","RHMA","2135","H",20.79,"12.2","27.7","1.7","26","G","Y","N",NA,"N",NA,2022-09-01,"2022","09","01","St. Thomas",18.320665,-64.867323
"1333","Oasis Cove",NA,"AJH, AND, KWG",NA,"3""","09/01/2022","RHMA","2136","H",26.2,"13.5","31.2","1.9","29.3","G","Y","N",NA,"N",NA,2022-09-01,"2022","09","01","St. Thomas",18.320665,-64.867323
"1334","Oasis Cove",NA,"AJH, AND, KWG",NA,"3""","09/01/2022","RHMA","2137","H",16.73,"12.1","24.6","1.6","23","G","Y","N",NA,"N",NA,2022-09-01,"2022","09","01","St. Thomas",18.320665,-64.867323
"1335","Oasis Cove",NA,"AJH, AND, KWG",NA,"3""","09/01/2022","RHMA","2138","H",14.5,"0.94","28.7","1.5","27.2","G","Y","N",NA,"N",NA,2022-09-01,"2022","09","01","St. Thomas",18.320665,-64.867323
"1336","Oasis Cove","SC","AND, KWG","5/20/2021","N/A","05/07/2021","RHMA","189","H",7.36,"8.5","20.3","0.8","19.5","BrGr","N/A","Y",NA,"N",NA,2021-05-07,"2021","05","07","St. Thomas",18.320665,-64.867323
"1337","Oasis Cove",NA,"AJH, AND, KWG",NA,"3""","09/01/2022","RHMA","2140","H",15.43,"11.1","25.1","1.2","23.9","G","Y","N",NA,"N",NA,2022-09-01,"2022","09","01","St. Thomas",18.320665,-64.867323
"1338","Oasis Cove",NA,"AJH, AND, KWG",NA,"3""","09/01/2022","RHMA","2141","H",21.53,"12.7","26.2","1.6","24.6","G","Y","N",NA,"N",NA,2022-09-01,"2022","09","01","St. Thomas",18.320665,-64.867323
"1339","Oasis Cove",NA,"AJH, AND, KWG",NA,"3""","09/01/2022","RHMA","2142","H",13.11,"12.2","18.8","1.5","17.3","G","N","N",NA,"N",NA,2022-09-01,"2022","09","01","St. Thomas",18.320665,-64.867323
"1340","Oasis Cove",NA,"AJH, AND, KWG",NA,"3""","09/01/2022","RHMA","2143","H",12.71,"10.2","23.4","1.3","22.1","G","Y","N",NA,"N",NA,2022-09-01,"2022","09","01","St. Thomas",18.320665,-64.867323
"1341","Oasis Cove",NA,"AJH, AND, KWG",NA,"3""","09/01/2022","RHMA","2144","H",14.12,"11.5","22.1","1.5","20.6","G","Y","N",NA,"N",NA,2022-09-01,"2022","09","01","St. Thomas",18.320665,-64.867323
"1342","Oasis Cove",NA,"AJH, AND, KWG",NA,"3""","09/01/2022","RHMA","2145","H",15.66,"10","27.9","1.7","26.2","G","Y","N",NA,"N",NA,2022-09-01,"2022","09","01","St. Thomas",18.320665,-64.867323
"1343","Oasis Cove",NA,"AJH, AND, KWG",NA,"3""","09/01/2022","RHMA","2146","H",17.27,"12.7","23.7","1.3","22.4","G","Y","N",NA,"N",NA,2022-09-01,"2022","09","01","St. Thomas",18.320665,-64.867323
"1344","Oasis Cove",NA,"AJH, AND, KWG",NA,"3""","09/01/2022","RHMA","2147","H",14.95,"10.9","25.2","1.6","23.6","G","Y","N",NA,"N",NA,2022-09-01,"2022","09","01","St. Thomas",18.320665,-64.867323
"1345","Oasis Cove",NA,"AJH, AND, KWG",NA,"3""","09/01/2022","RHMA","2148","H",16.93,"11.9","23.3","1.4","21.9","G","Y","N",NA,"N",NA,2022-09-01,"2022","09","01","St. Thomas",18.320665,-64.867323
"1346","Oasis Cove",NA,"AJH, AND, KWG",NA,"3""","09/01/2022","RHMA","2149","H",21.55,"11","31","1.7","29.3","G","Y","N",NA,"N",NA,2022-09-01,"2022","09","01","St. Thomas",18.320665,-64.867323
"1347","Oasis Cove",NA,"AJH, AND, KWG",NA,"3""","09/01/2022","RHMA","2150","H",9.23,"8.9","20","1","19","G","Y","N",NA,"N",NA,2022-09-01,"2022","09","01","St. Thomas",18.320665,-64.867323
"1348","Oasis Cove",NA,"AJH, AND, KWG",NA,"3""","09/02/2022","RHMA","2151","H",26.47,"12.2","34","1.9","32.1","G","Y","N",NA,"N",NA,2022-09-02,"2022","09","02","St. Thomas",18.320665,-64.867323
"1349","Oasis Cove",NA,"AJH, AND, KWG",NA,"3""","09/02/2022","RHMA","2152","H",33.85,"13.3","37.5","2.2","35.3","P","Y","N",NA,"N",NA,2022-09-02,"2022","09","02","St. Thomas",18.320665,-64.867323
"1350","Oasis Cove",NA,"AJH, AND, KWG",NA,"3""","09/02/2022","RHMA","2153","H",25.73,"13","31","1.7","29.3","P","Y","N",NA,"N",NA,2022-09-02,"2022","09","02","St. Thomas",18.320665,-64.867323
"1351","Oasis Cove",NA,"AJH, AND, KWG",NA,"3""","09/02/2022","RHMA","2154","H",24.14,"11.7","31.6","1.9","29.7","G/B","Y","N",NA,"N",NA,2022-09-02,"2022","09","02","St. Thomas",18.320665,-64.867323
"1352","Oasis Cove",NA,"AJH, AND, KWG",NA,"3""","09/02/2022","RHMA","2155","H",19.94,"10.5","32.6","1.7","30.9","G/B","Y","N",NA,"N",NA,2022-09-02,"2022","09","02","St. Thomas",18.320665,-64.867323
"1353","Oasis Cove",NA,"AJH, AND, KWG",NA,"3""","09/02/2022","RHMA","2156","H",24.89,"12","36","1.5","34.5","G","Y","N",NA,"N",NA,2022-09-02,"2022","09","02","St. Thomas",18.320665,-64.867323
"1354","Oasis Cove",NA,"AJH, AND, KWG",NA,"3""","09/02/2022","RHMA","2157","H",22.43,"12","32.5","1.6","30.9","G","Y","N",NA,"N",NA,2022-09-02,"2022","09","02","St. Thomas",18.320665,-64.867323
"1355","Oasis Cove",NA,"AJH, AND, KWG",NA,"3""","09/02/2022","RHMA","2158","H",24.16,"13.1","32.1","1.7","30.4","G","Y","N",NA,"N",NA,2022-09-02,"2022","09","02","St. Thomas",18.320665,-64.867323
"1356","Oasis Cove",NA,"AJH, AND, KWG",NA,"3""","09/02/2022","RHMA","2159","H",25.52,"13","30.2","1.5","28.7","G","Y","N",NA,"N",NA,2022-09-02,"2022","09","02","St. Thomas",18.320665,-64.867323
"1357","Oasis Cove",NA,"AJH, AND, KWG",NA,"3""","09/02/2022","RHMA","2160","H",18.66,"11.2","29.4","1.3","28.1","G","Y","N",NA,"N",NA,2022-09-02,"2022","09","02","St. Thomas",18.320665,-64.867323
"1358","Oasis Cove",NA,"AJH, AND, KWG",NA,"3""","09/02/2022","RHMA","2161","H",22.92,"11.6","33.7","1.9","31.8","G/B","Y","N",NA,"N",NA,2022-09-02,"2022","09","02","St. Thomas",18.320665,-64.867323
"1359","Oasis Cove","ZDB","AJH, AND, KWG",NA,"3""","09/02/2022","RHMA","2162","H",13,"8.3","28.5","1.5","27","G","Y","Y",NA,"N",NA,2022-09-02,"2022","09","02","St. Thomas",18.320665,-64.867323
"1360","Oasis Cove","ZDB","AJH, AND, KWG",NA,"3""","09/02/2022","RHMA","2163","H",19.95,"11","33","1.8","31.2","G","Y","Y",NA,"N",NA,2022-09-02,"2022","09","02","St. Thomas",18.320665,-64.867323
"1361","Oasis Cove","ZDB","AJH, AND, KWG",NA,"3""","09/02/2022","RHMA","2164","H",31.8,"14","33","1.8","31.2","G/B","Y","Y",NA,"N",NA,2022-09-02,"2022","09","02","St. Thomas",18.320665,-64.867323
"1362","Oasis Cove","ZDB","AJH, AND, KWG",NA,"3""","09/02/2022","RHMA","2165","H",21.65,"11.5","32.7","1.6","31.1","G","Y","Y",NA,"N",NA,2022-09-02,"2022","09","02","St. Thomas",18.320665,-64.867323
"1363","Oasis Cove","ZDB","AJH, AND, KWG",NA,"3""","09/02/2022","RHMA","2166","H",23.09,"13.3","26","1.2","24.8","G","Y","Y",NA,"N",NA,2022-09-02,"2022","09","02","St. Thomas",18.320665,-64.867323
"1364","Oasis Cove","HH","AJH, AND, KWG","05-20-21","N/A","04-16-21","RHMA","136","S",15.92,"11.37","25.9","1.7","24.3","OlGr","N/A","Y",NA,"N",NA,2021-04-16,"2021","04","16","St. Thomas",18.320665,-64.867323
"1365","Oasis Cove","HH","AJH, AND, KWG","05-20-21","N/A","04-16-21","RHMA","137","S",5.05,"8.46","13.7","0.6","13.1","BrGr","N/A","Y",NA,"N",NA,2021-04-16,"2021","04","16","St. Thomas",18.320665,-64.867323
"1366","Oasis Cove","HH","AJH, AND, KWG","05-20-21","N/A","04-16-21","RHMA","138","S",6.35,"6.65","17.5","N/A","14.2","BrGr","N/A","N",NA,"N",NA,2021-04-16,"2021","04","16","St. Thomas",18.320665,-64.867323
"1367","Oasis Cove","HH","AJH, AND, KWG","05-20-21","N/A","04-16-21","RHMA","139","S",2.87,"7.66","9.9","0.2","9.5","BrGr","N/A","N",NA,"N",NA,2021-04-16,"2021","04","16","St. Thomas",18.320665,-64.867323
"1368","Oasis Cove","HH","AJH, AND, KWG","05-20-21","N/A","05/07/2021","RHMA","140","H",10.72,"10.47","22.5","1.2","21.4","OlGr","N/A","Y",NA,"N",NA,2021-05-07,"2021","05","07","St. Thomas",18.320665,-64.867323
"1369","Oasis Cove","HH","AND, KWG, ZR","05-20-21","N/A","05/07/2021","RHMA","141","H",14.7,"11.08","25.1","1.4","24","OlGr","N/A","Y",NA,"N",NA,2021-05-07,"2021","05","07","St. Thomas",18.320665,-64.867323
"1370","Oasis Cove","HH","AND, KWG, ZR","05-20-21","N/A","05/07/2021","RHMA","142","H",12.92,"10.54","25.5","1.3","24.2","BrGr","N/A","Y",NA,"N",NA,2021-05-07,"2021","05","07","St. Thomas",18.320665,-64.867323
"1371","Oasis Cove","HH","AND, KWG, ZR","05-20-21","N/A","05/07/2021","RHMA","143","S",14.76,"10.29","27.2","1.2","26.2","BrGr","N/A","Y",NA,"N",NA,2021-05-07,"2021","05","07","St. Thomas",18.320665,-64.867323
"1372","Oasis Cove","ST","AJH, AND, KWG","05/11/2021","N/A","4/16/2021","RHMA","1","H",7.62,"9.38","18.1","1","17.1","OlGr","Y","Y",NA,"N",NA,2021-04-16,"2021","04","16","St. Thomas",18.320665,-64.867323
"1373","Oasis Cove","ST","AJH, AND, KWG","05/11/2021","N/A","4/16/2021","RHMA","2","H",32.67,"18.02","39.1","0.5","38.9","OlGr","Y","Y","plum damage, tip broken off","N",NA,2021-04-16,"2021","04","16","St. Thomas",18.320665,-64.867323
"1374","Oasis Cove","ST","AJH, AND, KWG","05/11/2021","N/A","4/16/2021","RHMA","3","S",9.82,"9.3","23.9","1.8","22.7","BrGr","Y","Y","gauge @ top of brown hypo tip","N",NA,2021-04-16,"2021","04","16","St. Thomas",18.320665,-64.867323
"1375","Oasis Cove","ST","AJH, AND, KWG","05/11/2021","N/A","4/16/2021","RHMA","4","H",6.96,"9.01","18","1.1","16.8","BrGr","Y","Y",NA,"N",NA,2021-04-16,"2021","04","16","St. Thomas",18.320665,-64.867323
"1376","Oasis Cove","ST","AJH, AND, KWG","05/11/2021","N/A","4/16/2021","RHMA","5","H",20,"11.99","26.8",NA,"26.7","OlGr","Y","Y","film over Br hypo tip, no plumule","N",NA,2021-04-16,"2021","04","16","St. Thomas",18.320665,-64.867323
"1377","Oasis Cove","ST","AJH, AND, KWG","05/11/2021","N/A","4/16/2021","RHMA","6","H",16.81,"11.32","27","1.4","29.5","OlGr","Y","Y","nick in rooting tip","N",NA,2021-04-16,"2021","04","16","St. Thomas",18.320665,-64.867323
"1378","Oasis Cove","ST","AJH, AND, KWG","05/11/2021","N/A","4/16/2021","RHMA","7","H",18.85,"10.97","31",NA,"26.9","OlGr","Y","Y","film on Br hypo","N",NA,2021-04-16,"2021","04","16","St. Thomas",18.320665,-64.867323
"1379","Oasis Cove","ST","AJH, AND, KWG","05/11/2021","N/A","4/16/2021","RHMA","8","H",26.89,"12.96","37.5","1.8","35.6","OlGr","Y","Y","gauge, nicks on hypo, seem / scratch ~ 18.2 cm up the hypo from Br tip to Gr","N",NA,2021-04-16,"2021","04","16","St. Thomas",18.320665,-64.867323
"1380","Oasis Cove","ST","AJH, AND, KWG","05/11/2021","N/A","4/16/2021","RHMA","9","H",17.63,"11.86","28.7","1.5","27.1","OlGr","Y","Y",NA,"N",NA,2021-04-16,"2021","04","16","St. Thomas",18.320665,-64.867323
"1381","Oasis Cove","ST","AJH, AND, KWG","05/11/2021","N/A","4/16/2021","RHMA","10","H",8.46,"9.75","20.5",NA,"19.2","OlGr","Y","Y","plum broken off, hypo 1/2 Br @ top","N",NA,2021-04-16,"2021","04","16","St. Thomas",18.320665,-64.867323
"1382","Oasis Cove","ST","AJH, AND, KWG","05/11/2021","N/A","4/16/2021","RHMA","11","H",19.73,"11.32","33.1","1.1","30.8","BrGr","Y","Y",NA,"N",NA,2021-04-16,"2021","04","16","St. Thomas",18.320665,-64.867323
"1383","Oasis Cove","SC","AJH, KWG","5/24/2021","N/A","05/07/2021","RHMA","215","H",14.73,"10.07","26.5","1.3","25.2","OlGr",NA,"N",NA,"N",NA,2021-05-07,"2021","05","07","St. Thomas",18.320665,-64.867323
"1384","Oasis Cove","SC","AJH, KWG","5/24/2021","N/A","05/07/2021","RHMA","216","H",4.46,"7.89","14","0.3","13.7","BrGr",NA,"Y",NA,"N",NA,2021-05-07,"2021","05","07","St. Thomas",18.320665,-64.867323
"1385","Oasis Cove","SC","AJH, KWG","5/24/2021","N/A","05/07/2021","RHMA","217","S",19.74,"11.1","31.7","1.2","30.4","OlGr",NA,"Y",NA,"N",NA,2021-05-07,"2021","05","07","St. Thomas",18.320665,-64.867323
"1386","Oasis Cove","SC","AJH, KWG","5/24/2021","N/A","05/07/2021","RHMA","218","H",19.75,"10.48","32.8","1.5","31.2","OlGr",NA,"Y",NA,"N",NA,2021-05-07,"2021","05","07","St. Thomas",18.320665,-64.867323
"1387","Oasis Cove","SC","AJH, KWG","5/24/2021","N/A","05/07/2021","RHMA","219","H",9.38,"9.19","20.1","1.1","19","BrGr",NA,"Y",NA,"N",NA,2021-05-07,"2021","05","07","St. Thomas",18.320665,-64.867323
"1388","Oasis Cove","SC","AJH, KWG","5/24/2021","N/A","05/07/2021","RHMA","220","H",14.34,"11.56","23.1","1.5","21.5","BrGr",NA,"Y",NA,"N",NA,2021-05-07,"2021","05","07","St. Thomas",18.320665,-64.867323
"1389","Oasis Cove","SC","AJH, KWG","5/24/2021","N/A","05/07/2021","RHMA","221","H",29.6,"12.27","35","1.4","33.5","OlGr",NA,"N",NA,"N",NA,2021-05-07,"2021","05","07","St. Thomas",18.320665,-64.867323
"1390","Oasis Cove","SC","AJH, KWG","5/24/2021","N/A","05/07/2021","RHMA","222","H",22.18,"11.22","33.2","1.5","31.9","OlGr",NA,"Y",NA,"N",NA,2021-05-07,"2021","05","07","St. Thomas",18.320665,-64.867323
"1391","Oasis Cove","SC","AJH, KWG","5/24/2021","N/A","05/07/2021","RHMA","223","H",15.36,"10.01","26.3","1.2","25.1","OlGr",NA,"Y",NA,"N",NA,2021-05-07,"2021","05","07","St. Thomas",18.320665,-64.867323
"1392","Oasis Cove","SC","AJH, KWG","5/24/2021","N/A","05/07/2021","RHMA","224","H",19.76,"10.15","34.3","1.4","32.8","OlGr",NA,"N",NA,"N",NA,2021-05-07,"2021","05","07","St. Thomas",18.320665,-64.867323
"1393","Oasis Cove","SC","AJH, KWG","5/24/2021","N/A","05/07/2021","RHMA","225","H",17.6,"10.23","31.6","1.4","30.3","OlGr",NA,"Y",NA,"N",NA,2021-05-07,"2021","05","07","St. Thomas",18.320665,-64.867323
"1394","Oasis Cove","SC","AJH, KWG","5/24/2021","N/A","05/07/2021","RHMA","226","H",17.81,"12.15","22.9","1.2","21.6","BrGr",NA,"Y",NA,"N",NA,2021-05-07,"2021","05","07","St. Thomas",18.320665,-64.867323
"1395","Oasis Cove","SC","AJH, KWG","5/24/2021","N/A","05/07/2021","RHMA","227","H",18,"11.05","28.1","N/A","28.1","OlGr",NA,"Y",NA,"N",NA,2021-05-07,"2021","05","07","St. Thomas",18.320665,-64.867323
"1396","Oasis Cove","SC","AJH, AND","5/24/2021","N/A","05/07/2021","RHMA","228","H",18.06,"10.41","28.2","1.3","27","Br",NA,"Y",NA,"N",NA,2021-05-07,"2021","05","07","St. Thomas",18.320665,-64.867323
"1397","Oasis Cove","SC","AJH, AND","5/24/2021","N/A","05/07/2021","RHMA","229","H",15.53,"10.69","28.2","1","27.2","OlGr",NA,"Y",NA,"N",NA,2021-05-07,"2021","05","07","St. Thomas",18.320665,-64.867323
"1398","Oasis Cove","SC","AJH, AND","5/24/2021","N/A","05/07/2021","RHMA","230","H",13.9,"10.11","27.1","1.4","25.7","OlGr",NA,"Y",NA,"N",NA,2021-05-07,"2021","05","07","St. Thomas",18.320665,-64.867323
"1399","Oasis Cove","SC","AJH, AND","5/24/2021","N/A","05/07/2021","RHMA","231","H",18.49,"10.79","31.5","1.4","30","OlGr",NA,"Y",NA,"N",NA,2021-05-07,"2021","05","07","St. Thomas",18.320665,-64.867323
"1400","Oasis Cove","SC","AJH, AND","5/24/2021","N/A","05/07/2021","RHMA","232","H",17.39,"10.85","29.2","1.5","27.6","OlGr",NA,"Y",NA,"N",NA,2021-05-07,"2021","05","07","St. Thomas",18.320665,-64.867323
"1401","Oasis Cove","SC","AJH, AND","5/24/2021","N/A","05/07/2021","RHMA","233","H",17.74,"10.21","29.7","1.3","28.2","OlGr",NA,"Y",NA,"N",NA,2021-05-07,"2021","05","07","St. Thomas",18.320665,-64.867323
"1402","Oasis Cove","SC","AJH, AND","5/24/2021","N/A","05/07/2021","RHMA","234","H",10.13,"9.76","23.1","1.3","21.6","OlGr",NA,"Y",NA,"N",NA,2021-05-07,"2021","05","07","St. Thomas",18.320665,-64.867323
"1403","Oasis Cove","SC","AJH, AND","5/24/2021","N/A","05/07/2021","RHMA","235","H",13.39,"9.95","24.6","1.5","23.1","OlGr",NA,"N",NA,"N",NA,2021-05-07,"2021","05","07","St. Thomas",18.320665,-64.867323
"1404","Oasis Cove","SC","AJH, AND","5/24/2021","N/A","05/07/2021","RHMA","236","H",18.4,"11.27","27.6","N/A","27.6","OlGr",NA,"Y",NA,"N",NA,2021-05-07,"2021","05","07","St. Thomas",18.320665,-64.867323
"1405","Oasis Cove","SC","AJH, AND","5/24/2021","N/A","05/07/2021","RHMA","237","H",24.12,"11.17","33.8","1.3","32.5","OlGr",NA,"Y",NA,"N",NA,2021-05-07,"2021","05","07","St. Thomas",18.320665,-64.867323
"1406","Oasis Cove","SC","AJH, AND","5/24/2021","N/A","05/07/2021","RHMA","238","H",9.6,"10.29","20.2","1.3","19","OlGr",NA,"Y",NA,"N",NA,2021-05-07,"2021","05","07","St. Thomas",18.320665,-64.867323
"1407","Oasis Cove","SC","AJH, AND","5/24/2021","N/A","05/07/2021","RHMA","239","H",10.17,"14.9","26.1","1.4","25","OlGr",NA,"Y",NA,"N",NA,2021-05-07,"2021","05","07","St. Thomas",18.320665,-64.867323
"1408","Oasis Cove","SC","AJH, AND","5/24/2021","N/A","05/07/2021","RHMA","240","H",13.33,"10.15","25.6","1.3","24.3","OlGr",NA,"Y",NA,"N",NA,2021-05-07,"2021","05","07","St. Thomas",18.320665,-64.867323
"1409","Oasis Cove","SC","AJH, AND","5/24/2021","N/A","05/07/2021","RHMA","241","H",7.74,"9.4","17.9","1.1","16.9","OlGr",NA,"Y",NA,"N",NA,2021-05-07,"2021","05","07","St. Thomas",18.320665,-64.867323
"1410","Oasis Cove","SC","AJH, AND","5/24/2021","N/A","05/07/2021","RHMA","242","H",14.53,"10.58","27.5","1.4","26.4","OlGr",NA,"Y",NA,"N",NA,2021-05-07,"2021","05","07","St. Thomas",18.320665,-64.867323
"1411","Oasis Cove","SC","AJH, AND","5/24/2021","N/A","05/07/2021","RHMA","243","H",12.39,"10.54","24.7","1.4","23.4","OlGr",NA,"Y",NA,"N",NA,2021-05-07,"2021","05","07","St. Thomas",18.320665,-64.867323
"1412","Oasis Cove","SC","AJH, AND","5/24/2021","N/A","05/07/2021","RHMA","244","H",18.88,"11.99","30.4","1.4","29.1","OlGr",NA,"Y",NA,"N",NA,2021-05-07,"2021","05","07","St. Thomas",18.320665,-64.867323
"1413","Oasis Cove","SC","AJH, AND","5/24/2021","N/A","05/07/2021","RHMA","245","H",17.12,"10.44","31","1.3","29.9","OlGr",NA,"Y",NA,"N",NA,2021-05-07,"2021","05","07","St. Thomas",18.320665,-64.867323
"1414","Oasis Cove","SC","AJH, AND","5/24/2021","N/A","05/07/2021","RHMA","246","S",11.43,"9.32","28.1","1.5","26.6","OlGr",NA,"Y",NA,"N",NA,2021-05-07,"2021","05","07","St. Thomas",18.320665,-64.867323
"1415","Oasis Cove","SC","AJH, AND","5/24/2021","N/A","05/07/2021","RHMA","247","H",10.2,"9.13","23.5","0.3","23.2","OlGr",NA,"Y",NA,"N",NA,2021-05-07,"2021","05","07","St. Thomas",18.320665,-64.867323
"1416","Oasis Cove","SC","AJH, AND","5/24/2021","N/A","05/07/2021","RHMA","248","H",20.85,"12.07","31.5","1.1","30.3","OlGr",NA,"Y",NA,"N",NA,2021-05-07,"2021","05","07","St. Thomas",18.320665,-64.867323
"1417","Oasis Cove","SC","AJH, AND","5/24/2021","N/A","05/07/2021","RHMA","249","S",24.51,"11.89","37.2","1.4","35.8","OlGr",NA,"Y",NA,"N",NA,2021-05-07,"2021","05","07","St. Thomas",18.320665,-64.867323
"1418","Oasis Cove","SC","AJH, AND","5/24/2021","N/A","05/07/2021","RHMA","250","H",16.1,"11.04","28.2","1.3","27","BrGr",NA,"Y",NA,"N",NA,2021-05-07,"2021","05","07","St. Thomas",18.320665,-64.867323
"1419","Oasis Cove","SC","AJH, AND","5/24/2021","N/A","05/07/2021","RHMA","251","H",14.4,"11.3","25.6","1.2","24.4","Br-OlGr",NA,"Y",NA,"N",NA,2021-05-07,"2021","05","07","St. Thomas",18.320665,-64.867323
"1420","Oasis Cove","SC","AJH, AND","5/24/2021","N/A","05/07/2021","RHMA","252","H",16.96,"10.94","31.3","1.5","29.9","BrGr",NA,"N",NA,"N",NA,2021-05-07,"2021","05","07","St. Thomas",18.320665,-64.867323
"1421","Oasis Cove","SC","AJH, AND","5/24/2021","N/A","05/07/2021","RHMA","253","H",22.15,"13.25","28.2","1.6","26.7","OlGr",NA,"Y",NA,"N",NA,2021-05-07,"2021","05","07","St. Thomas",18.320665,-64.867323
"1422","Oasis Cove","SC","AJH, AND","5/24/2021","N/A","05/07/2021","RHMA","254","H",15.11,"11.03","27.3","N/A","27.3","OlGr",NA,"Y",NA,"N",NA,2021-05-07,"2021","05","07","St. Thomas",18.320665,-64.867323
"1423","Oasis Cove","SC","AJH, AND","5/24/2021","N/A","05/07/2021","RHMA","255","H",20.56,"12.26","28.5","0.5","28","OlGr",NA,"Y",NA,"N",NA,2021-05-07,"2021","05","07","St. Thomas",18.320665,-64.867323
"1424","Oasis Cove","SC","AJH, AND","5/24/2021","N/A","05/07/2021","RHMA","256","S",9.24,"8.23","24.2","N/A","24.2","Br-OlGr",NA,"Y",NA,"N",NA,2021-05-07,"2021","05","07","St. Thomas",18.320665,-64.867323
"1425","Oasis Cove","SC","AJH, AND","5/24/2021","N/A","05/07/2021","RHMA","257","H",14,"10.25","26.8","1.3","25.6","BrGr",NA,"Y",NA,"N",NA,2021-05-07,"2021","05","07","St. Thomas",18.320665,-64.867323
"1426","Oasis Cove","SC","AJH, AND","5/24/2021","N/A","05/07/2021","RHMA","258","H",28.84,"12.05","37.3","1.7","35.7","OlGr",NA,"N",NA,"N",NA,2021-05-07,"2021","05","07","St. Thomas",18.320665,-64.867323
"1427","Oasis Cove","SC","AJH, AND","5/24/2021","N/A","05/07/2021","RHMA","259","S",7.57,"7.94","25.2","1.4","24","OlGr",NA,"Y",NA,"N",NA,2021-05-07,"2021","05","07","St. Thomas",18.320665,-64.867323
"1428","Oasis Cove","SC","AJH, AND","5/24/2021","N/A","05/07/2021","RHMA","260","H",14.45,"9.37","30.1","1.1","29.2","BrGr",NA,"Y",NA,"N",NA,2021-05-07,"2021","05","07","St. Thomas",18.320665,-64.867323
"1429","Oasis Cove","SC","AJH, AND","5/24/2021","N/A","05/07/2021","RHMA","261","H",24.73,"13.19","31.9","1.8","30.2","Br-OlGr",NA,"Y",NA,"N",NA,2021-05-07,"2021","05","07","St. Thomas",18.320665,-64.867323
"1430","Oasis Cove","SC","AJH, AND","5/24/2021","N/A","05/07/2021","RHMA","262","H",11.58,"9.18","24.7","1.2","23.5","BrGr",NA,"Y",NA,"N",NA,2021-05-07,"2021","05","07","St. Thomas",18.320665,-64.867323
"1431","Oasis Cove","SC","AJH, AND","5/24/2021","N/A","05/07/2021","RHMA","263","H",12.96,"8.96","26.3","1.3","25.1","BrGr",NA,"Y",NA,"N",NA,2021-05-07,"2021","05","07","St. Thomas",18.320665,-64.867323
"1432","Oasis Cove","SC","AJH, AND","5/24/2021","N/A","05/07/2021","RHMA","264","H",19.17,"9.56","39.1","1.7","37.5","OlGr",NA,"Y",NA,"N",NA,2021-05-07,"2021","05","07","St. Thomas",18.320665,-64.867323
"1433","Oasis Cove","SC","AJH, AND","5/24/2021","N/A","05/07/2021","RHMA","265","H",14.12,"10.79","27","1.3","25.7","BrGr",NA,"Y",NA,"N",NA,2021-05-07,"2021","05","07","St. Thomas",18.320665,-64.867323
"1434","Oasis Cove","SC","AJH, AND","5/24/2021","N/A","05/07/2021","RHMA","266","H",19.63,"11.43","29.5","1.6","27.8","OlGr",NA,"N",NA,"N",NA,2021-05-07,"2021","05","07","St. Thomas",18.320665,-64.867323
"1435","Oasis Cove","DIRECT INPUT","AJH, KWG",NA,"3""TP","02-22-23","RHMA","3042","H",15.61,"10.4","26.2","1.2","25","G","Y","N",NA,"N",NA,2023-02-22,"2023","02","22","St. Thomas",18.320665,-64.867323
"1436","Oasis Cove","DIRECT INPUT","AJH, KWG",NA,"3""TP","02-22-23","RHMA","3043","H",20.49,"11.9","28.9","1.7","27.2","G","N","N","BUMPY ROOTING TIP","N",NA,2023-02-22,"2023","02","22","St. Thomas",18.320665,-64.867323
"1437","Oasis Cove","DIRECT INPUT","AJH, KWG",NA,"3""TP","02-22-23","RHMA","3044","H",17.5,"10.6","29.2","1.5","27.7","G","Y","N",NA,"N",NA,2023-02-22,"2023","02","22","St. Thomas",18.320665,-64.867323
"1438","Oasis Cove","DIRECT INPUT","AJH, KWG",NA,"3""TP","02-22-23","RHMA","3045","H",9.52,"12.3","28.6","1.5","27.1","G","Y","N",NA,"N",NA,2023-02-22,"2023","02","22","St. Thomas",18.320665,-64.867323
"1439","Oasis Cove","DIRECT INPUT","AJH, KWG",NA,"3""TP","02-22-23","RHMA","3046","H",15.87,"11","21.8","1.7","22","G","Y","N",NA,"N",NA,2023-02-22,"2023","02","22","St. Thomas",18.320665,-64.867323
"1440","Oasis Cove","DIRECT INPUT","AJH, KWG",NA,"3""TP","02-22-23","RHMA","3047","H",16.43,"12.3","21.1","1","21.6","G","Y","Y",NA,"N",NA,2023-02-22,"2023","02","22","St. Thomas",18.320665,-64.867323
"1441","Oasis Cove","DIRECT INPUT","AJH, KWG",NA,"3""TP","02-22-23","RHMA","3048","H",16.97,"11.8","21.5","1.4","22.5","G","Y","Y",NA,"N",NA,2023-02-22,"2023","02","22","St. Thomas",18.320665,-64.867323
"1442","Oasis Cove","DIRECT INPUT","AJH, KWG",NA,"3""TP","02-22-23","RHMA","3049","H",13.8,"12","17.3","1.3","16","G","Y","N",NA,"N",NA,2023-02-22,"2023","02","22","St. Thomas",18.320665,-64.867323
"1443","Oasis Cove","DIRECT INPUT","AJH, KWG",NA,"3""TP","02-22-23","RHMA","3050","H",13.17,"8.1","30.3","1.5","28.8","G","N","N","BUMPY ROOTING TIP","N",NA,2023-02-22,"2023","02","22","St. Thomas",18.320665,-64.867323
"1444","Oasis Cove","DIRECT INPUT","AJH, KWG",NA,"3""TP","02-22-23","RHMA","3051","H",20.73,"13.9","23.4","1.4","22","G","N","N","BUMPY ROOTING TIP/ BITE MARK/ SNAIL EGGS","N",NA,2023-02-22,"2023","02","22","St. Thomas",18.320665,-64.867323
"1445","Oasis Cove","DIRECT INPUT","AJH, KWG",NA,"3""TP","02-22-23","RHMA","3052","H",10.54,"9.9","21","1","20","G","Y","N",NA,"N",NA,2023-02-22,"2023","02","22","St. Thomas",18.320665,-64.867323
"1446","Oasis Cove","DIRECT INPUT","AJH, KWG",NA,"3""TP","02-22-23","RHMA","3053","H",23.66,"12.3","33.1","1.5","31.6","G","Y","N",NA,"N",NA,2023-02-22,"2023","02","22","St. Thomas",18.320665,-64.867323
"1447","Oasis Cove","DIRECT INPUT","AJH, KWG",NA,"3""TP","02-22-23","RHMA","3054","H",13.09,"11.2","21.2","1.3","19.9","G","Y","N",NA,"N",NA,2023-02-22,"2023","02","22","St. Thomas",18.320665,-64.867323
"1448","Oasis Cove","DIRECT INPUT","AJH, KWG",NA,"3""TP","02-22-23","RHMA","3055","H",10.52,"9.9","21.8","1.3","20.5","G","N","N","PLUM DEAD","N",NA,2023-02-22,"2023","02","22","St. Thomas",18.320665,-64.867323
"1449","Oasis Cove","DIRECT INPUT","AJH, KWG",NA,"3""TP","02-22-23","RHMA","3056","H",18.52,"2.3","24.6","1.6","23","G","Y","N","HERBIV","N",NA,2023-02-22,"2023","02","22","St. Thomas",18.320665,-64.867323
"1450","Oasis Cove","DIRECT INPUT","AJH, KWG",NA,"3""TP","02-22-23","RHMA","3057","H",14.67,"1.6","24.7","1.1","23.6","G","N","N",NA,"N",NA,2023-02-22,"2023","02","22","St. Thomas",18.320665,-64.867323
"1451","Oasis Cove","DIRECT INPUT","AJH, KWG",NA,"3""TP","02-22-23","RHMA","3058","H",8.8,"0.7","19","1.1","17.9","G","Y","N",NA,"N",NA,2023-02-22,"2023","02","22","St. Thomas",18.320665,-64.867323
"1452","Oasis Cove","DIRECT INPUT","AJH, KWG",NA,"3""TP","02-22-23","RHMA","3059","H",6.58,"9.9","14.3","1.3","13","G","Y","N",NA,"N",NA,2023-02-22,"2023","02","22","St. Thomas",18.320665,-64.867323
"1453","Oasis Cove","DIRECT INPUT","AJH, KWG",NA,"3""TP","02-22-23","RHMA","3060","H",24.34,"12.8","30.7","1.2","29.5","G","Y","N",NA,"N",NA,2023-02-22,"2023","02","22","St. Thomas",18.320665,-64.867323
"1454","Oasis Cove","DIRECT INPUT","AJH, KWG",NA,"3""TP","02-22-23","RHMA","3062","H",23.34,"14","24.5","1","23.5","G","Y","N",NA,"N",NA,2023-02-22,"2023","02","22","St. Thomas",18.320665,-64.867323
"1455","Oasis Cove","DIRECT INPUT","AJH, KWG",NA,"3""TP","02/09/2023","RHMA","3063","H",11.83,"7.5","22.2","1.4","20.8","G","Y","Y",NA,"N",NA,2023-02-09,"2023","02","09","St. Thomas",18.320665,-64.867323
"1456","Oasis Cove","DIRECT INPUT","AJH, KWG",NA,"3""TP","02/09/2023","RHMA","3064","H",18.77,"13.4","23.5","1.6","21.9","G","Y","N",NA,"N",NA,2023-02-09,"2023","02","09","St. Thomas",18.320665,-64.867323
"1457","Oasis Cove",NA,"AJH, AND, KWG",NA,"3""","09/01/2022","RHMA","2139","H",15.91,"11.2","26","1.6","24.4","G","Y","N",NA,"N",NA,2022-09-01,"2022","09","01","St. Thomas",18.320665,-64.867323
"1458","Oasis Cove","DIRECT INPUT","AJH, KWG",NA,"3""TP","02/09/2023","RHMA","3066","H",9.33,"7.9","20.1","1.3","18.8","G","Y","Y",NA,"N",NA,2023-02-09,"2023","02","09","St. Thomas",18.320665,-64.867323
"1459","Oasis Cove","DIRECT INPUT","AJH, KWG",NA,"3""TP","02/09/2023","RHMA","3067","H",9.61,"7.5","18.9","1","17.9","G","Y","Y",NA,"N",NA,2023-02-09,"2023","02","09","St. Thomas",18.320665,-64.867323
"1460","Oasis Cove","DIRECT INPUT","AJH, KWG",NA,"3""TP","02/09/2023","RHMA","3068","H",10.97,"7.6","22.1","1.5","20.6","G","Y","Y",NA,"N",NA,2023-02-09,"2023","02","09","St. Thomas",18.320665,-64.867323
"1461","Oasis Cove","DIRECT INPUT","AJH, KWG",NA,"3""TP","02/09/2023","RHMA","3069","H",10.39,"6.9","23.6","1.1","22.5","G","Y","Y",NA,"N",NA,2023-02-09,"2023","02","09","St. Thomas",18.320665,-64.867323
"1462","Oasis Cove","DIRECT INPUT","AJH, KWG",NA,"3""TP","02/09/2023","RHMA","3070","H",24.57,"13.8","27","1","26","G","Y","Y",NA,"N",NA,2023-02-09,"2023","02","09","St. Thomas",18.320665,-64.867323
"1463","Oasis Cove","DIRECT INPUT","AJH, KWG",NA,"3""TP","02/09/2023","RHMA","3071","H",9.93,"7.2","19.4","1.4","18","G","Y","Y",NA,"N",NA,2023-02-09,"2023","02","09","St. Thomas",18.320665,-64.867323
"1464","Oasis Cove","DIRECT INPUT","AJH, KWG",NA,"3""TP","02/09/2023","RHMA","3072","P",22.79,"13.9","29.9","1.9","28","G","Y","Y",NA,"N",NA,2023-02-09,"2023","02","09","St. Thomas",18.320665,-64.867323
"1465","Oasis Cove","DIRECT INPUT","AJH, KWG",NA,"3""TP","02/09/2023","RHMA","3073","H",21.34,"12.6","33.5","2","31.5","GB","Y","Y",NA,"N",NA,2023-02-09,"2023","02","09","St. Thomas",18.320665,-64.867323
"1466","Oasis Cove","DIRECT INPUT","AJH, KWG",NA,"3""TP","02/09/2023","RHMA","3074","H",14.66,"11","27","1.5","25.5","G","Y","Y",NA,"N",NA,2023-02-09,"2023","02","09","St. Thomas",18.320665,-64.867323
"1467","Oasis Cove","DIRECT INPUT","AJH, AND",NA,"3""TP","02/09/2023","RHMA","3075","S",32.53,"15.6","31","1.5","29.5","G","Y","N",NA,"N",NA,2023-02-09,"2023","02","09","St. Thomas",18.320665,-64.867323
"1468","Oasis Cove","DIRECT INPUT","AJH, AND",NA,"3""TP","02/09/2023","RHMA","3076","H",17.81,"13.3","23.8","1.3","22.5","G","Y","N",NA,"N",NA,2023-02-09,"2023","02","09","St. Thomas",18.320665,-64.867323
"1469","Oasis Cove","DIRECT INPUT","AJH, AND",NA,"3""TP","02/09/2023","RHMA","3077","H",22.95,"12.9","32.5","1.4","31.1","G","Y","N",NA,"N",NA,2023-02-09,"2023","02","09","St. Thomas",18.320665,-64.867323
"1470","Oasis Cove","DIRECT INPUT","AJH, AND",NA,"3""TP","02/09/2023","RHMA","3078","H",17.8,"10.9","33.7","1.6","32.1","G","Y","N",NA,"N",NA,2023-02-09,"2023","02","09","St. Thomas",18.320665,-64.867323
"1471","Oasis Cove","DIRECT INPUT","AJH, AND",NA,"3""TP","02/09/2023","RHMA","3079","S",14.17,"10.5","26.9","1.4","25.5","GB","Y","N",NA,"N",NA,2023-02-09,"2023","02","09","St. Thomas",18.320665,-64.867323
"1472","Oasis Cove","DIRECT INPUT","AJH, AND",NA,"3""TP","02/09/2023","RHMA","3080","S",18.17,"12.1","30.8","1.3","29.5","BG","Y","N",NA,"N",NA,2023-02-09,"2023","02","09","St. Thomas",18.320665,-64.867323
"1473","Oasis Cove","DIRECT INPUT","AJH, AND",NA,"3"" TP","02/09/2023","RHMA","3081","P",22,"12.7","30.4","1.7","28.7","G","Y","N",NA,"N",NA,2023-02-09,"2023","02","09","St. Thomas",18.320665,-64.867323
"1474","Oasis Cove","DIRECT INPUT","AJH, AND",NA,"3"" TP","02/09/2023","RHMA","3082","H",13.83,"10.5","25.2","1.6","23.6","G","Y","N",NA,"N",NA,2023-02-09,"2023","02","09","St. Thomas",18.320665,-64.867323
"1475","Oasis Cove","DIRECT INPUT","AJH, AND",NA,"3"" TP","02/09/2023","RHMA","3083","H",9.35,"8.4","22.4","1.4","21","G","Y","Y",NA,"N",NA,2023-02-09,"2023","02","09","St. Thomas",18.320665,-64.867323
"1476","Oasis Cove","DIRECT INPUT","AJH, AND",NA,"3"" TP","02/09/2023","RHMA","3084","H",14.2,"10.3","25.9","1.3","24.6","G","Y","N",NA,"N",NA,2023-02-09,"2023","02","09","St. Thomas",18.320665,-64.867323
"1477","Oasis Cove","DIRECT INPUT","AJH, AND",NA,"3"" TP","02/09/2023","RHMA","3085","H",15.9,"12.1","23.5","1.4","22.1","G","Y","Y",NA,"N",NA,2023-02-09,"2023","02","09","St. Thomas",18.320665,-64.867323
"1478","Oasis Cove","DIRECT INPUT","AJH, AND",NA,"3"" TP","02/09/2023","RHMA","3086","H",17.7,"10.7","27.9","1.6","26.3","G","N","N",NA,"N",NA,2023-02-09,"2023","02","09","St. Thomas",18.320665,-64.867323
"1479","Oasis Cove","DIRECT INPUT","AJH, AND",NA,"3"" TP","02/09/2023","RHMA","3087","H",8,"8.4","22.3","1.2","21.1","G","Y","Y",NA,"N",NA,2023-02-09,"2023","02","09","St. Thomas",18.320665,-64.867323
"1480","Oasis Cove","DIRECT INPUT","AJH, AND",NA,"3"" TP","02/09/2023","RHMA","3088","H",11.76,"9.7","22.1","1.3","20.8","G","Y","N",NA,"N",NA,2023-02-09,"2023","02","09","St. Thomas",18.320665,-64.867323
"1481","Oasis Cove","DIRECT INPUT","AJH, AND",NA,"3"" TP","02/09/2023","RHMA","3089","H",19,"11.6","33.1","1.5","31.6","G/B","Y","N",NA,"N",NA,2023-02-09,"2023","02","09","St. Thomas",18.320665,-64.867323
"1482","Oasis Cove","DIRECT INPUT","AJH, AND",NA,"3"" TP","02/09/2023","RHMA","3090","H",16.34,"10.1","29","1.4","27.6","G","Y","N",NA,"N",NA,2023-02-09,"2023","02","09","St. Thomas",18.320665,-64.867323
"1483","Oasis Cove","DIRECT INPUT","AJH, AND",NA,"3"" TP","02/09/2023","RHMA","3091","H",21,"10.8","38.6","1.8","36.8","G","Y","N",NA,"N",NA,2023-02-09,"2023","02","09","St. Thomas",18.320665,-64.867323
"1484","Oasis Cove","DIRECT INPUT","AJH, AND",NA,"3"" TP","02/09/2023","RHMA","3092","H",21.05,"11.7","31.5","1.6","29.9","G","Y","N",NA,"N",NA,2023-02-09,"2023","02","09","St. Thomas",18.320665,-64.867323
"1485","Oasis Cove","DIRECT INPUT","AJH, AND",NA,"3"" TP","02/09/2023","RHMA","3093","H",13.19,"10.1","22.1","1.1","21","G","Y","N",NA,"N",NA,2023-02-09,"2023","02","09","St. Thomas",18.320665,-64.867323
"1486","Oasis Cove","DIRECT INPUT","AJH, AND",NA,"3"" TP","02/09/2023","RHMA","3094","H",10.15,"9.2","22.3","1.3","21","G","Y","N",NA,"N",NA,2023-02-09,"2023","02","09","St. Thomas",18.320665,-64.867323
"1487","Oasis Cove","DIRECT INPUT","AJH, AND",NA,"3"" TP","02/09/2023","RHMA","3095","H",13.63,"11","24.4","1.3","23.1","G","Y","Y",NA,"N",NA,2023-02-09,"2023","02","09","St. Thomas",18.320665,-64.867323
"1488","Oasis Cove","DIRECT INPUT","AJH, AND",NA,"3"" TP","02/09/2023","RHMA","3096","H",8.24,"9.1","19","1","18","G/B","N","N","PLUM DEAD","N",NA,2023-02-09,"2023","02","09","St. Thomas",18.320665,-64.867323
"1489","Oasis Cove","DIRECT INPUT","AJH, AND",NA,"3"" TP","02/09/2023","RHMA","3097","H",11.7,"9.2","23.6","0.9","22.7","G","Y","N",NA,"N",NA,2023-02-09,"2023","02","09","St. Thomas",18.320665,-64.867323
"1490","Oasis Cove","DIRECT INPUT","AJH, AND",NA,"3"" TP","02/09/2023","RHMA","3098","H",19.43,"11","28.8","1.5","27.3","G","Y","N",NA,"N",NA,2023-02-09,"2023","02","09","St. Thomas",18.320665,-64.867323
"1491","Oasis Cove","DIRECT INPUT","AJH, AND",NA,"3"" TP","02/09/2023","RHMA","3099","H",25.58,"10.8","32","0","32","G","N","N","NO PLUM","N",NA,2023-02-09,"2023","02","09","St. Thomas",18.320665,-64.867323
"1492","Oasis Cove","DIRECT INPUT","AJH, AND",NA,"3"" TP","02/09/2023","RHMA","3100","H",5.19,"6.7","14.7","0.8","13.9","G","N","N",NA,"N",NA,2023-02-09,"2023","02","09","St. Thomas",18.320665,-64.867323
"1493","Oasis Cove","DIRECT INPUT","AJH, AND",NA,"3"" TP","02/09/2023","RHMA","3101","H",18.96,"1.7","26.2","1.2","25","G","Y","N",NA,"N",NA,2023-02-09,"2023","02","09","St. Thomas",18.320665,-64.867323
"1494","Oasis Cove","DIRECT INPUT","AJH, AND",NA,"3"" TP","02/09/2023","RHMA","3102","H",32.25,"11.4","35.9","1.9","34","G","Y","N",NA,"N",NA,2023-02-09,"2023","02","09","St. Thomas",18.320665,-64.867323
"1495","Oasis Cove","DIRECT INPUT","AJH, AND",NA,"3"" TP","02/09/2023","RHMA","3103","H",13.48,"12.1","20.4","1.2","19.2","G","Y","N",NA,"N",NA,2023-02-09,"2023","02","09","St. Thomas",18.320665,-64.867323
"1496","Oasis Cove","DIRECT INPUT","AJH, AND",NA,"3"" TP","02/09/2023","RHMA","3104","H",18.89,"10.7","28.3","1.3","27","G","Y","N","PLUM BROWN","N",NA,2023-02-09,"2023","02","09","St. Thomas",18.320665,-64.867323
"1497","Oasis Cove","DIRECT INPUT","AJH, AND",NA,"3"" TP","02/09/2023","RHMA","3105","H",18.34,"12.3","23.5","1.5","22","G","Y","N","PLUM BROWN","N",NA,2023-02-09,"2023","02","09","St. Thomas",18.320665,-64.867323
"1498","Oasis Cove","DIRECT INPUT","AJH, AND",NA,"3"" TP","02/09/2023","RHMA","3106","H",12.63,"7.6","27.9","1.7","26.2","G","Y","N",NA,"N",NA,2023-02-09,"2023","02","09","St. Thomas",18.320665,-64.867323
"1499","Oasis Cove","DIRECT INPUT","AJH, AND",NA,"3"" TP","02/09/2023","RHMA","3107","H",12.31,"11.9","16.9","1.3","15.6","G","N","N","PLUM BROWN","N",NA,2023-02-09,"2023","02","09","St. Thomas",18.320665,-64.867323
"1500","Oasis Cove","DIRECT INPUT","AJH, AND",NA,"3"" TP","02/09/2023","RHMA","3108","H",9.78,"10.1","19.3","1.1","18.2","G","Y","Y",NA,"N",NA,2023-02-09,"2023","02","09","St. Thomas",18.320665,-64.867323
"1501","Oasis Cove","DIRECT INPUT","AJH, AND",NA,"3"" TP","02/09/2023","RHMA","3109","H",10.81,"11","18","1","17","G","Y","Y",NA,"N",NA,2023-02-09,"2023","02","09","St. Thomas",18.320665,-64.867323
"1502","Oasis Cove","DIRECT INPUT","AJH, AND",NA,"3"" TP","02/09/2023","RHMA","3110","S",19.39,"11","33.5","1.4","32.1","G","Y","N",NA,"N",NA,2023-02-09,"2023","02","09","St. Thomas",18.320665,-64.867323
"1503","Oasis Cove","DIRECT INPUT","AJH, AND",NA,"3"" TP","02/09/2023","RHMA","3111","H",18.18,"14.2","18.3","1.3","17","G","Y","Y",NA,"N",NA,2023-02-09,"2023","02","09","St. Thomas",18.320665,-64.867323
"1504","Oasis Cove","DIRECT INPUT","AJH, AND",NA,"3"" TP","02/09/2023","RHMA","3112","S",16.16,"11.1","27.6","1.4","26.2","G","Y","N",NA,"N",NA,2023-02-09,"2023","02","09","St. Thomas",18.320665,-64.867323
"1505","Oasis Cove","DIRECT INPUT","AJH, AND",NA,"3"" TP","02/09/2023","RHMA","3113","H",14.23,"11.2","22.7","0.9","21.8","G","Y","N",NA,"N",NA,2023-02-09,"2023","02","09","St. Thomas",18.320665,-64.867323
"1506","Oasis Cove","SC","KWG, AND, AJH","5/25/2021","N/A","05/07/2021","RHMA","267","S",7.7,"8.29","19.9","1","19","BrGr","N/A","Y",NA,"N",NA,2021-05-07,"2021","05","07","St. Thomas",18.320665,-64.867323
"1507","Oasis Cove","SC","KWG, AND, AJH","5/25/2021","N/A","05/07/2021","RHMA","268","H",9.97,"10.31","19.8","1.1","18.7","BrGr","N/A","Y",NA,"N",NA,2021-05-07,"2021","05","07","St. Thomas",18.320665,-64.867323
"1508","Oasis Cove","SC","KWG, AND, AJH","5/25/2021","N/A","05/07/2021","RHMA","269","H",7.34,"8.83","19.4","0.9","18.5","BrGr","N/A","Y",NA,"N",NA,2021-05-07,"2021","05","07","St. Thomas",18.320665,-64.867323
"1509","Oasis Cove","SC","KWG, AND, AJH","5/25/2021","N/A","05/07/2021","RHMA","270","S",8.86,"9.26","21.3","N/A","21.3","OlGr","N/A","Y",NA,"N",NA,2021-05-07,"2021","05","07","St. Thomas",18.320665,-64.867323
"1510","Oasis Cove","SC","KWG, AND, AJH","5/25/2021","N/A","05/07/2021","RHMA","271","S",13,"10.06","28.9","1.7","27.1","OlGr","N/A","Y",NA,"N",NA,2021-05-07,"2021","05","07","St. Thomas",18.320665,-64.867323
"1511","Oasis Cove","SC","KWG, AND, AJH","5/25/2021","N/A","05/07/2021","RHMA","272","S",15.12,"10.34","26.5","1.4","25","OlGr","N/A","N",NA,"N",NA,2021-05-07,"2021","05","07","St. Thomas",18.320665,-64.867323
"1512","Oasis Cove","SC","KWG, AND, AJH","5/25/2021","N/A","05/07/2021","RHMA","273","H",21.1,"11.65","32.9","1.5","31.2","OlGr","N/A","Y",NA,"N",NA,2021-05-07,"2021","05","07","St. Thomas",18.320665,-64.867323
"1513","Oasis Cove","SC","KWG, AND, AJH","5/25/2021","N/A","05/07/2021","RHMA","274","H",15.32,"10.68","28.7","1.5","27.1","OlGr","N/A","Y",NA,"N",NA,2021-05-07,"2021","05","07","St. Thomas",18.320665,-64.867323
"1514","Oasis Cove","SC","KWG, AND, AJH","5/25/2021","N/A","05/07/2021","RHMA","275","S",11.1,"9.16","25.1","N/A","25.1","OlGr","N/A","Y",NA,"N",NA,2021-05-07,"2021","05","07","St. Thomas",18.320665,-64.867323
"1515","Oasis Cove","SC","KWG, AND, AJH","5/25/2021","N/A","05/07/2021","RHMA","276","H",15,"9.82","31.2","1.2","30","OlGr","N/A","Y",NA,"N",NA,2021-05-07,"2021","05","07","St. Thomas",18.320665,-64.867323
"1516","Oasis Cove","SC","KWG, AND, AJH","5/25/2021","N/A","05/07/2021","RHMA","277","S",26,"12.49","32.8","0.1","32.7","OlGr","N/A","Y",NA,"N",NA,2021-05-07,"2021","05","07","St. Thomas",18.320665,-64.867323
"1517","Oasis Cove","SC","KWG, AND, AJH","5/25/2021","N/A","05/07/2021","RHMA","278","H",16.89,"10.44","28.2","1.5","26.5","BrGr","N/A","N",NA,"N",NA,2021-05-07,"2021","05","07","St. Thomas",18.320665,-64.867323
"1518","Oasis Cove","SC","KWG, AND, AJH","5/25/2021","N/A","05/07/2021","RHMA","279","H",14.06,"10.67","24.5","1.1","23.4","OlGr","N/A","N",NA,"N",NA,2021-05-07,"2021","05","07","St. Thomas",18.320665,-64.867323
"1519","Oasis Cove","SC","KWG, AND, AJH","5/25/2021","N/A","05/07/2021","RHMA","280","H",17.96,"11.73","27.2","1.4","25.8","BrGr","N/A","N",NA,"N",NA,2021-05-07,"2021","05","07","St. Thomas",18.320665,-64.867323
"1520","Oasis Cove","SC","KWG, AND, AJH","5/25/2021","N/A","05/07/2021","RHMA","281","H",18.82,"10.98","32.9","1.5","31.3","OlGr","N/A","Y",NA,"N",NA,2021-05-07,"2021","05","07","St. Thomas",18.320665,-64.867323
"1521","Oasis Cove","SC","KWG, AND, AJH","5/25/2021","N/A","05/07/2021","RHMA","282","H",7.31,"9.03","17.5","1.7","16.9","BrGr","N/A","Y",NA,"N",NA,2021-05-07,"2021","05","07","St. Thomas",18.320665,-64.867323
"1522","Oasis Cove","SC","KWG, AND, AJH","5/25/2021","N/A","05/07/2021","RHMA","283","S",9.82,"8.67","23.3","1","22.2","OlGr","N/A","Y",NA,"N",NA,2021-05-07,"2021","05","07","St. Thomas",18.320665,-64.867323
"1523","Oasis Cove","SC","KWG, AND, AJH","5/25/2021","N/A","05/07/2021","RHMA","284","S",10.14,"8.81","23.3","1.1","22.2","OlGr","N/A","Y",NA,"N",NA,2021-05-07,"2021","05","07","St. Thomas",18.320665,-64.867323
"1524","Oasis Cove","SC","KWG, AND, AJH","5/25/2021","N/A","05/07/2021","RHMA","285","H",10.79,"9.31","25","1","24.1","OlGr","N/A","Y",NA,"N",NA,2021-05-07,"2021","05","07","St. Thomas",18.320665,-64.867323
"1525","Oasis Cove","SC","KWG, AND, AJH","5/25/2021","N/A","05/07/2021","RHMA","286","H",13.29,"10.62","25.8","1.4","24.2","BrGr","N/A","Y",NA,"N",NA,2021-05-07,"2021","05","07","St. Thomas",18.320665,-64.867323
"1526","Oasis Cove","SC","KWG, AND, AJH","5/25/2021","N/A","05/07/2021","RHMA","287","H",21.71,"11.64","33.4","1.4","31.8","OlGr","N/A","Y",NA,"N",NA,2021-05-07,"2021","05","07","St. Thomas",18.320665,-64.867323
"1527","Oasis Cove","SC","KWG, AND, AJH","5/25/2021","N/A","05/07/2021","RHMA","288","S",10.78,"8.84","28.5","1.2","27.3","BrGr","N/A","Y",NA,"N",NA,2021-05-07,"2021","05","07","St. Thomas",18.320665,-64.867323
"1528","Oasis Cove","SC","KWG, AND, AJH","5/25/2021","N/A","05/07/2021","RHMA","289","S",16.3,"10.73","29.5","1.2","28.1","OlGr","N/A","Y",NA,"N",NA,2021-05-07,"2021","05","07","St. Thomas",18.320665,-64.867323
"1529","Oasis Cove","SC","KWG, AND, AJH","5/25/2021","N/A","05/07/2021","RHMA","290","H",21.71,"12.27","31.5","1.3","30.1","OlGr","N/A","Y",NA,"N",NA,2021-05-07,"2021","05","07","St. Thomas",18.320665,-64.867323
"1530","Oasis Cove","SC","KWG, AND, AJH","5/25/2021","N/A","05/07/2021","RHMA","291","H",17.71,"10","32.7","1.4","31.2","OlGr","N/A","Y",NA,"N",NA,2021-05-07,"2021","05","07","St. Thomas",18.320665,-64.867323
"1531","Oasis Cove","SC","KWG, AND, AJH","5/25/2021","N/A","05/07/2021","RHMA","292","H",14.93,"9.89","30.4","1.2","29.1","BrGr","N/A","Y",NA,"N",NA,2021-05-07,"2021","05","07","St. Thomas",18.320665,-64.867323
"1532","Oasis Cove","SC","KWG, AND, AJH","5/25/2021","N/A","05/07/2021","RHMA","293","H",18.94,"11.83","27.2","1.5","25.6","OlGr","N/A","Y",NA,"N",NA,2021-05-07,"2021","05","07","St. Thomas",18.320665,-64.867323
"1533","Oasis Cove","SC","KWG, AND, AJH","5/25/2021","N/A","05/07/2021","RHMA","294","H",11.14,"9.78","24.5","1.1","23.3","OlGr","N/A","Y",NA,"N",NA,2021-05-07,"2021","05","07","St. Thomas",18.320665,-64.867323
"1534","Oasis Cove","SC","KWG, AND, AJH","5/25/2021","N/A","05/07/2021","RHMA","295","S",6.41,"9.76","13.3","1","12.1","OlGr","N/A","Y",NA,"N",NA,2021-05-07,"2021","05","07","St. Thomas",18.320665,-64.867323
"1535","Oasis Cove","SC","KWG, AND, AJH","5/25/2021","N/A","05/07/2021","RHMA","296","H",6.24,"8.17","18.1","1","19.1","OlGr","N/A","Y",NA,"N",NA,2021-05-07,"2021","05","07","St. Thomas",18.320665,-64.867323
"1536","Oasis Cove","SC","KWG, AND, AJH","5/25/2021","N/A","05/07/2021","RHMA","297","H",10.29,"9.98","23","1.1","21.8","BrGr","N/A","Y",NA,"N",NA,2021-05-07,"2021","05","07","St. Thomas",18.320665,-64.867323
"1537","Oasis Cove","SC","KWG, AND, AJH","5/25/2021","N/A","05/07/2021","RHMA","298","H",13.06,"10.28","23.3","1.5","22","OlGr","N/A","Y",NA,"N",NA,2021-05-07,"2021","05","07","St. Thomas",18.320665,-64.867323
"1538","Oasis Cove","SC","KWG, AND, AJH","5/25/2021","N/A","05/07/2021","RHMA","299","H",14.24,"10.68","26.3","1.3","23.5","OlGr","N/A","N",NA,"N",NA,2021-05-07,"2021","05","07","St. Thomas",18.320665,-64.867323
"1539","Oasis Cove","SC","KWG, AND, AJH","5/25/2021","N/A","05/07/2021","RHMA","300","H",21.61,"11.94","30.8","1.5","29.3","OlGr-Br","N/A","N",NA,"N",NA,2021-05-07,"2021","05","07","St. Thomas",18.320665,-64.867323
"1540","Oasis Cove","SC","KWG, AND, AJH","5/25/2021","N/A","05/07/2021","RHMA","301","S",19.75,"11.09","32.5","1.3","31.2","OlGr","N/A","Y",NA,"N",NA,2021-05-07,"2021","05","07","St. Thomas",18.320665,-64.867323
"1541","Oasis Cove","SC","KWG, AND, AJH","5/25/2021","N/A","05/07/2021","RHMA","302","H",15.35,"10.94","26.5","1.6","24.9","BrGr","N/A","N",NA,"N",NA,2021-05-07,"2021","05","07","St. Thomas",18.320665,-64.867323
"1542","Oasis Cove","SC","KWG, AND, AJH","5/25/2021","N/A","05/07/2021","RHMA","303","H",13.37,"10.79","22","N/A","22","OlGr","N/A","N",NA,"N",NA,2021-05-07,"2021","05","07","St. Thomas",18.320665,-64.867323
"1543","Oasis Cove","SC","KWG, AND, AJH","5/25/2021","N/A","05/07/2021","RHMA","304","S",17.43,"10.84","28.5","1.3","27.2","OlGr-Br","N/A","N",NA,"N",NA,2021-05-07,"2021","05","07","St. Thomas",18.320665,-64.867323
"1544","Oasis Cove","SC","KWG, AND, AJH","5/25/2021","N/A","05/07/2021","RHMA","305","H",19.49,"11.18","29.6","1.2","28.5","OlGr","N/A","Y",NA,"N",NA,2021-05-07,"2021","05","07","St. Thomas",18.320665,-64.867323
"1545","Oasis Cove","SC","KWG, AND, AJH","5/25/2021","N/A","05/07/2021","RHMA","306","H",10.03,"9.64","23.1","1.5","21.5","OlGr","N/A","Y",NA,"N",NA,2021-05-07,"2021","05","07","St. Thomas",18.320665,-64.867323
"1546","Oasis Cove","SC","KWG, AND, AJH","5/25/2021","N/A","05/07/2021","RHMA","307","H",8.16,"10.05","16.5","0.8","15.6","BrGr","N/A","Y",NA,"N",NA,2021-05-07,"2021","05","07","St. Thomas",18.320665,-64.867323
"1547","Oasis Cove","SC","KWG, AND, AJH","5/25/2021","N/A","05/07/2021","RHMA","308","H",14.22,"11.91","24.5","1.3","23.3","OlGr","N/A","N",NA,"N",NA,2021-05-07,"2021","05","07","St. Thomas",18.320665,-64.867323
"1548","Oasis Cove","SC","KWG, AND, AJH","5/25/2021","N/A","05/07/2021","RHMA","309","H",16.61,"12.76","22.5","1.7","21.2","OlGr","N/A","Y",NA,"N",NA,2021-05-07,"2021","05","07","St. Thomas",18.320665,-64.867323
"1549","Oasis Cove","SC","KWG, AND, AJH","5/25/2021","N/A","05/07/2021","RHMA","310","H",11.6,"9.99","23.8","1.4","22.6","OlGr","N/A","Y",NA,"N",NA,2021-05-07,"2021","05","07","St. Thomas",18.320665,-64.867323
"1550","Oasis Cove","SC","KWG, AND, AJH","5/25/2021","N/A","05/07/2021","RHMA","311","H",7.82,"9.05","19.6","1.3","18.3","BrGr","N/A","Y",NA,"N",NA,2021-05-07,"2021","05","07","St. Thomas",18.320665,-64.867323
"1551","Oasis Cove","SC","KWG, AND, AJH","5/25/2021","N/A","05/07/2021","RHMA","312","H",16.11,"11.19","25","1.4","23.6","OlGr-Br","N/A","N",NA,"N",NA,2021-05-07,"2021","05","07","St. Thomas",18.320665,-64.867323
"1552","Oasis Cove","SC","KWG, AND, AJH","5/25/2021","N/A","05/07/2021","RHMA","313","H",11.47,"9.23","24.9","0.6","24.3","BrGr","N/A","Y",NA,"N",NA,2021-05-07,"2021","05","07","St. Thomas",18.320665,-64.867323
"1553","Oasis Cove","SC","KWG, AND, AJH","5/25/2021","N/A","05/07/2021","RHMA","314","H",18.04,"12.16","26","1.2","24.8","OlGr","N/A","Y",NA,"N",NA,2021-05-07,"2021","05","07","St. Thomas",18.320665,-64.867323
"1554","Oasis Cove","SC","KWG, AND, AJH","5/25/2021","N/A","05/07/2021","RHMA","315","H",16.78,"11.3","27.5","1","26.5","OlGr","N/A","Y",NA,"N",NA,2021-05-07,"2021","05","07","St. Thomas",18.320665,-64.867323
"1555","Oasis Cove","SC","KWG, AND, AJH","5/25/2021","N/A","05/07/2021","RHMA","316","S",9.89,"8.71","25.5","1.4","24","OlGr","N/A","Y",NA,"N",NA,2021-05-07,"2021","05","07","St. Thomas",18.320665,-64.867323
"1556","Oasis Cove","SC","KWG, AND, AJH","5/25/2021","N/A","05/07/2021","RHMA","317","H",11.76,"9.62","25.6","1.1","24.6","BrGr","N/A","N",NA,"N",NA,2021-05-07,"2021","05","07","St. Thomas",18.320665,-64.867323
"1557","Oasis Cove","SC","KWG, AND, AJH","5/25/2021","N/A","05/07/2021","RHMA","318","H",23.73,"12.19","31.2","1.3","20.1","BrGr","N/A","N",NA,"N",NA,2021-05-07,"2021","05","07","St. Thomas",18.320665,-64.867323
"1558","Oasis Cove","SC","KWG, AND, AJH","5/25/2021","N/A","05/07/2021","RHMA","319","H",17.29,"11.53","28","1.6","26.5","BrGr","N/A","Y",NA,"N",NA,2021-05-07,"2021","05","07","St. Thomas",18.320665,-64.867323
"1559","Oasis Cove","SC","KWG, AND, AJH","5/25/2021","N/A","05/07/2021","RHMA","320","H",16.7,"11.19","26.8","1.2","25.7","OlGr","N/A","Y",NA,"N",NA,2021-05-07,"2021","05","07","St. Thomas",18.320665,-64.867323
"1560","Oasis Cove","SC","KWG, AND, AJH","5/25/2021","N/A","05/07/2021","RHMA","321","H",10.8,"9.25","25.9","1.2","24.6","BrGr","N/A","Y",NA,"N",NA,2021-05-07,"2021","05","07","St. Thomas",18.320665,-64.867323
"1561","Oasis Cove","SC","KWG, AND, AJH","5/25/2021","N/A","05/07/2021","RHMA","322","H",10.91,"9.21","27.1","1.3","25.9","OlGr","N/A","Y",NA,"N",NA,2021-05-07,"2021","05","07","St. Thomas",18.320665,-64.867323
"1562","Oasis Cove","SC","KWG, AND, AJH","5/25/2021","N/A","05/07/2021","RHMA","323","H",16.93,"9.94","30","1.2","28.7","OlGr","N/A","N",NA,"N",NA,2021-05-07,"2021","05","07","St. Thomas",18.320665,-64.867323
"1563","Oasis Cove","SC","KWG, AND, AJH","5/25/2021","N/A","05/07/2021","RHMA","324","H",18.38,"10.71","32.7","1.5","31.1","OlGr","N/A","N",NA,"N",NA,2021-05-07,"2021","05","07","St. Thomas",18.320665,-64.867323
"1564","Oasis Cove","SC","KWG, AND, AJH","5/25/2021","N/A","05/07/2021","RHMA","325","H",14,"10","27.8","N/A","27.8","BrGr","N/A","Y",NA,"N",NA,2021-05-07,"2021","05","07","St. Thomas",18.320665,-64.867323
"1565","Oasis Cove","SC","KWG, AND, AJH","5/25/2021","N/A","05/07/2021","RHMA","326","H",14.77,"10.28","27.2","0.5","26.7","OlGr","N/A","Y",NA,"N",NA,2021-05-07,"2021","05","07","St. Thomas",18.320665,-64.867323
"1566","Oasis Cove","SC","KWG, AND, AJH","5/25/2021","N/A","05/07/2021","RHMA","327","H",12.58,"10.4","21.7","1.4","20.2","BrGr","N/A","Y",NA,"N",NA,2021-05-07,"2021","05","07","St. Thomas",18.320665,-64.867323
"1567","Oasis Cove","SC","KWG, AND, AJH","5/25/2021","N/A","05/07/2021","RHMA","328","H",38.11,"14.92","34.8","N/A","34.8","BrGr","N/A","N",NA,"N",NA,2021-05-07,"2021","05","07","St. Thomas",18.320665,-64.867323
"1568","Oasis Cove","SC","KWG, AND, AJH","5/25/2021","N/A","05/07/2021","RHMA","329","H",15.39,"9.98","29.7","1.2","28.5","BrGr","N/A","Y",NA,"N",NA,2021-05-07,"2021","05","07","St. Thomas",18.320665,-64.867323
"1569","Oasis Cove","SC","KWG, AND, AJH","5/25/2021","N/A","05/07/2021","RHMA","330","H",22.66,"11.52","30.6","1.2","29.3","OlGr","N/A","N/A",NA,"N",NA,2021-05-07,"2021","05","07","St. Thomas",18.320665,-64.867323
"1570","Oasis Cove","SC","AJH","5/25/2021","N/A","05/07/2021","RHMA","331","H",10.52,"8.42","27.7","1.1","26.5","BrGr","N/A","Y",NA,"N",NA,2021-05-07,"2021","05","07","St. Thomas",18.320665,-64.867323
"1571","Oasis Cove","SC","AJH","5/25/2021","N/A","05/07/2021","RHMA","332","H",18.13,"11.65","28.3","1.5","26.9","Br","N/A","N",NA,"N",NA,2021-05-07,"2021","05","07","St. Thomas",18.320665,-64.867323
"1572","Oasis Cove","SC","AJH","5/25/2021","N/A","05/07/2021","RHMA","333","H",17.07,"11.63","26.8","1.5","25.1","OlGr","N/A","Y",NA,"N",NA,2021-05-07,"2021","05","07","St. Thomas",18.320665,-64.867323
"1573","Oasis Cove","SC","AJH","5/25/2021","N/A","05/07/2021","RHMA","334","S",17.49,"8.28","36.1","1.6","34.5","OlGr","N/A","N",NA,"N",NA,2021-05-07,"2021","05","07","St. Thomas",18.320665,-64.867323
"1574","Oasis Cove","SC","AJH","5/25/2021","N/A","05/07/2021","RHMA","335","H",22.59,"12.02","31.2",NA,"31.2","OlGr","N/A","Y",NA,"N",NA,2021-05-07,"2021","05","07","St. Thomas",18.320665,-64.867323
"1575","Oasis Cove","SC","AJH","5/25/2021","N/A","05/07/2021","RHMA","336","S",9.26,"10.99","17.5","1.1","16.5","BrGr","N/A","Y",NA,"N",NA,2021-05-07,"2021","05","07","St. Thomas",18.320665,-64.867323
"1576","Oasis Cove","SC","AJH","5/25/2021","N/A","05/07/2021","RHMA","337","H",7.13,"7.96","20.4","0.9","19.5","BrGr","N/A","Y",NA,"N",NA,2021-05-07,"2021","05","07","St. Thomas",18.320665,-64.867323
"1577","Oasis Cove","SC","AJH","5/25/2021","N/A","05/07/2021","RHMA","338","H",13.45,"9.52","31.5","1.4","30.2","BrGr","N/A","Y",NA,"N",NA,2021-05-07,"2021","05","07","St. Thomas",18.320665,-64.867323
"1578","Oasis Cove","SC","AJH","5/25/2021","N/A","05/07/2021","RHMA","339","H",16.08,"11.1","25.9","1.4","24.5","OlGr","N/A","N",NA,"N",NA,2021-05-07,"2021","05","07","St. Thomas",18.320665,-64.867323
"1579","Oasis Cove","SC","AJH","5/25/2021","N/A","05/07/2021","RHMA","340","H",20.23,"12.45","27.9","1.5","26.4","OlGr","N/A","N",NA,"N",NA,2021-05-07,"2021","05","07","St. Thomas",18.320665,-64.867323
"1580","Oasis Cove","SC","AJH","5/25/2021","N/A","05/07/2021","RHMA","341","S",13.88,"9.34","25","1.2","24.2","OlGr","N/A","N",NA,"N",NA,2021-05-07,"2021","05","07","St. Thomas",18.320665,-64.867323
"1581","Oasis Cove","SC","AJH","5/25/2021","N/A","05/07/2021","RHMA","342","H",21.48,"12.86","28.1","1.5","26.1","OlGr","N/A","N",NA,"N",NA,2021-05-07,"2021","05","07","St. Thomas",18.320665,-64.867323
"1582","Oasis Cove","SC","AJH","5/25/2021","N/A","05/07/2021","RHMA","343","H",17.97,"10.54","28","1.4","26.8","OlGr","N/A","N",NA,"N",NA,2021-05-07,"2021","05","07","St. Thomas",18.320665,-64.867323
"1583","Oasis Cove","SC","AJH","5/25/2021","N/A","05/07/2021","RHMA","344","H",11.75,"9.89","24.7",NA,"24.7","BrGr","N/A","Y",NA,"N",NA,2021-05-07,"2021","05","07","St. Thomas",18.320665,-64.867323
"1584","Oasis Cove","SC","AJH","5/25/2021","N/A","05/07/2021","RHMA","345","H",10.96,"10.36","19.2",NA,"19.2","BrGr","N/A","Y",NA,"N",NA,2021-05-07,"2021","05","07","St. Thomas",18.320665,-64.867323
"1585","Oasis Cove","SC","AJH","5/25/2021","N/A","05/07/2021","RHMA","346","H",7.41,"9.32","15.5",NA,"15.5","LtGr","N/A","Y",NA,"N",NA,2021-05-07,"2021","05","07","St. Thomas",18.320665,-64.867323
"1586","Oasis Cove","SC","AJH","5/25/2021","N/A","05/07/2021","RHMA","347","H",17.5,"10.32","31.3","1.3","30.2","BrGr","N/A","Y",NA,"N",NA,2021-05-07,"2021","05","07","St. Thomas",18.320665,-64.867323
"1587","Oasis Cove","SC","AJH","5/25/2021","N/A","05/07/2021","RHMA","348","H",17.79,"11.72","27.6","1.2","26.3","OlGr","N/A","Y",NA,"N",NA,2021-05-07,"2021","05","07","St. Thomas",18.320665,-64.867323
"1588","Oasis Cove","SC","AJH","5/25/2021","N/A","05/07/2021","RHMA","349","H",9.22,"6.87","24.7","0.9","23.8","BrGr","N/A","Y",NA,"N",NA,2021-05-07,"2021","05","07","St. Thomas",18.320665,-64.867323
"1589","Oasis Cove","SC","AJH","5/25/2021","N/A","05/07/2021","RHMA","350","H",3.44,"7.92","11",NA,"11","BrGr","N/A","Y",NA,"N",NA,2021-05-07,"2021","05","07","St. Thomas",18.320665,-64.867323
"1590","Oasis Cove","SC","AJH","5/25/2021","N/A","05/07/2021","RHMA","351","H",12.13,"10.68","21.9","1.3","20.6","BrGr","N/A","Y",NA,"N",NA,2021-05-07,"2021","05","07","St. Thomas",18.320665,-64.867323
"1591","Oasis Cove","SC","AJH","5/25/2021","N/A","05/07/2021","RHMA","352","H",19,"11.19","29.2","1.4","28","OlGr","N/A","Y",NA,"N",NA,2021-05-07,"2021","05","07","St. Thomas",18.320665,-64.867323
"1592","Oasis Cove","SC","AJH","5/25/2021","N/A","05/07/2021","RHMA","353","H",11.63,"10.06","24","1.2","22.7","OlGr","N/A","Y",NA,"N",NA,2021-05-07,"2021","05","07","St. Thomas",18.320665,-64.867323
"1593","Oasis Cove","SC","AJH","5/25/2021","N/A","05/07/2021","RHMA","354","H",10.17,"9.78","20.2","1","19","BrGr","N/A","Y",NA,"N",NA,2021-05-07,"2021","05","07","St. Thomas",18.320665,-64.867323
"1594","Oasis Cove","SC","AJH","5/25/2021","N/A","05/07/2021","RHMA","355","S",15.2,"10.31","28.2",NA,"28.2","OlGr","N/A","N",NA,"N",NA,2021-05-07,"2021","05","07","St. Thomas",18.320665,-64.867323
"1595","Oasis Cove","SC","AJH","5/25/2021","N/A","05/07/2021","RHMA","356","H",9.09,"9.77","18.8","1","17.8","OlGr","N/A","Y",NA,"N",NA,2021-05-07,"2021","05","07","St. Thomas",18.320665,-64.867323
"1596","Oasis Cove","SC","AJH","5/25/2021","N/A","05/07/2021","RHMA","357","S",7.4,"7.8","21.5","0.9","20.5","LtGr","N/A","Y",NA,"N",NA,2021-05-07,"2021","05","07","St. Thomas",18.320665,-64.867323
"1597","Oasis Cove","SC","AJH","5/25/2021","N/A","05/07/2021","RHMA","358","H",9.14,"9.31","21.7","1","20.7","BrGr","N/A","Y",NA,"N",NA,2021-05-07,"2021","05","07","St. Thomas",18.320665,-64.867323
"1598","Oasis Cove","SC","AJH","5/25/2021","N/A","05/07/2021","RHMA","359","H",18.47,"10.16","28.3","0.4","27.9","OlGr","N/A","N",NA,"N",NA,2021-05-07,"2021","05","07","St. Thomas",18.320665,-64.867323
"1599","Oasis Cove","SC","AJH","5/25/2021","N/A","05/07/2021","RHMA","360","H",13.68,"10.51","23.1","1.6","21.5","OlGr","N/A","N",NA,"N",NA,2021-05-07,"2021","05","07","St. Thomas",18.320665,-64.867323
"1600","Oasis Cove","SC","AJH","5/25/2021","N/A","05/07/2021","RHMA","361","H",12.96,"9.37","23",NA,"23","OlGr","N/A","N",NA,"N",NA,2021-05-07,"2021","05","07","St. Thomas",18.320665,-64.867323
"1601","Oasis Cove","SC","AJH","5/25/2021","N/A","05/07/2021","RHMA","362","S",10.75,"8.15","25.6","1.1","24.4","OlGr","N/A","N",NA,"N",NA,2021-05-07,"2021","05","07","St. Thomas",18.320665,-64.867323
"1602","Oasis Cove","SC","AJH","5/25/2021","N/A","05/07/2021","RHMA","363","H",17,"12.33","24.5","1.3","23.1","BrGr","N/A","Y",NA,"N",NA,2021-05-07,"2021","05","07","St. Thomas",18.320665,-64.867323
"1603","Oasis Cove","SC","AJH","5/25/2021","N/A","05/07/2021","RHMA","364","H",8.54,"10.59","15.8","0.9","14.7","OlGr","N/A","Y",NA,"N",NA,2021-05-07,"2021","05","07","St. Thomas",18.320665,-64.867323
"1604","Oasis Cove","SC","AJH","5/25/2021","N/A","05/07/2021","RHMA","365","S",12.79,"11.03","21.4","1.1","20.4","OlGr","N/A","N",NA,"N",NA,2021-05-07,"2021","05","07","St. Thomas",18.320665,-64.867323
"1605","Oasis Cove","SC","AJH","5/25/2021","N/A","05/07/2021","RHMA","366","S",17.94,"11.91","24.7",NA,"24.7","OlGr","N/A","N",NA,"N",NA,2021-05-07,"2021","05","07","St. Thomas",18.320665,-64.867323
"1606","Oasis Cove","SC","AJH","5/25/2021","N/A","05/07/2021","RHMA","367","H",16.63,"9.88","28.5","1.1","27.2","OlGr","N/A","N",NA,"N",NA,2021-05-07,"2021","05","07","St. Thomas",18.320665,-64.867323
"1607","Oasis Cove","SC","AJH","5/25/2021","N/A","05/07/2021","RHMA","368","S",3.48,"7","13.3","0.6","12.6","OlGr","N/A","N",NA,"N",NA,2021-05-07,"2021","05","07","St. Thomas",18.320665,-64.867323
"1608","Oasis Cove","SC","AJH","5/25/2021","N/A","05/07/2021","RHMA","369","H",11,"9.57","23",NA,"23","BrGr","N/A","N",NA,"N",NA,2021-05-07,"2021","05","07","St. Thomas",18.320665,-64.867323
"1609","Oasis Cove","SC","AJH","5/25/2021","N/A","05/07/2021","RHMA","370","S",11.92,"9.18","27.2","1.3","25.9","BrGr","N/A","N",NA,"N",NA,2021-05-07,"2021","05","07","St. Thomas",18.320665,-64.867323
"1610","Oasis Cove","SC","AJH","5/25/2021","N/A","05/07/2021","RHMA","371","H",13.03,"9.3","25.2","1.3","23.9","BrGr","N/A","N",NA,"N",NA,2021-05-07,"2021","05","07","St. Thomas",18.320665,-64.867323
"1611","Oasis Cove","SC","AJH","5/25/2021","N/A","05/07/2021","RHMA","372","H",17.13,"10.14","31.5","1.4","30","OlGr","N/A","N",NA,"N",NA,2021-05-07,"2021","05","07","St. Thomas",18.320665,-64.867323
"1612","Oasis Cove","SC","AJH","5/25/2021","N/A","05/07/2021","RHMA","373","H",12.06,"10.04","22","1","21","OlGr","N/A","N",NA,"N",NA,2021-05-07,"2021","05","07","St. Thomas",18.320665,-64.867323
"1613","Oasis Cove","SC","AJH","5/25/2021","N/A","05/07/2021","RHMA","374","H",10.63,"9.53","19.9","1.1","18.7","OlGr","N/A","N",NA,"N",NA,2021-05-07,"2021","05","07","St. Thomas",18.320665,-64.867323
"1614","Oasis Cove","SC","AJH","5/25/2021","N/A","05/07/2021","RHMA","375","S",8.07,"5.4","22",NA,"19.2","OlGr","N/A","N",NA,"N",NA,2021-05-07,"2021","05","07","St. Thomas",18.320665,-64.867323
"1615","Oasis Cove","SC","AJH","5/25/2021","N/A","05/07/2021","RHMA","376","H",12.77,"10.44","23.4","1.2","22.1","OlGr","N/A","N",NA,"N",NA,2021-05-07,"2021","05","07","St. Thomas",18.320665,-64.867323
"1616","Oasis Cove","SC","AJH","5/25/2021","N/A","05/07/2021","RHMA","377","S",6.61,"6.24","19",NA,"16.3","OlGr","N/A","N",NA,"N",NA,2021-05-07,"2021","05","07","St. Thomas",18.320665,-64.867323
"1617","Oasis Cove","SC","AJH","5/25/2021","N/A","05/07/2021","RHMA","378","H",10.95,"8.83","22","1","20.9","BrGr","N/A","N",NA,"N",NA,2021-05-07,"2021","05","07","St. Thomas",18.320665,-64.867323
"1618","Oasis Cove","SC","AJH","5/25/2021","N/A","05/07/2021","RHMA","379","H",3.82,"6.05","9.8",NA,"7.2","OlGr","N/A","N",NA,"N",NA,2021-05-07,"2021","05","07","St. Thomas",18.320665,-64.867323
"1619","Oasis Cove","SC","AJH","5/25/2021","N/A","05/07/2021","RHMA","380","H",12.12,"10.89","21","1.3","18.8","OlGr","N/A","N",NA,"N",NA,2021-05-07,"2021","05","07","St. Thomas",18.320665,-64.867323
"1620","Oasis Cove","SC","AJH","5/25/2021","N/A","05/07/2021","RHMA","381","H",5.58,"7.91","15.2","0.8","14.3","BrGr","N/A","Y",NA,"N",NA,2021-05-07,"2021","05","07","St. Thomas",18.320665,-64.867323
"1621","Oasis Cove","SC","AJH","5/25/2021","N/A","05/07/2021","RHMA","382","H",2.85,"6.83","11.1","0.3","10.7","BrGr","N/A","Y",NA,"N",NA,2021-05-07,"2021","05","07","St. Thomas",18.320665,-64.867323
"1622","Oasis Cove","SC","AJH","5/25/2021","N/A","05/07/2021","RHMA","383","H",3.42,"8.17","11.6",NA,"11.6","BrGr","N/A","Y",NA,"N",NA,2021-05-07,"2021","05","07","St. Thomas",18.320665,-64.867323
"1623","Oasis Cove","SC","AJH","5/25/2021","N/A","05/07/2021","RHMA","384","S",6.28,"7","20","1.1","18.8","OlGr","N/A","Y",NA,"N",NA,2021-05-07,"2021","05","07","St. Thomas",18.320665,-64.867323
"1624","Oasis Cove","SC","AJH","5/25/2021","N/A","05/07/2021","RHMA","385","H",9.46,"9.5","20.4","0.9","19.5","BrGr","N/A","Y",NA,"N",NA,2021-05-07,"2021","05","07","St. Thomas",18.320665,-64.867323
"1625","Oasis Cove","SC","AJH","5/25/2021","N/A","05/07/2021","RHMA","386","H",12.82,"9.43","24.3","1.6","22.7","OlGr","N/A","Y",NA,"N",NA,2021-05-07,"2021","05","07","St. Thomas",18.320665,-64.867323
"1626","Oasis Cove","SC","AJH","5/25/2021","N/A","05/07/2021","RHMA","387","H",13.37,"10.62","23.2","1.2","21.9","OlGr","N/A","Y",NA,"N",NA,2021-05-07,"2021","05","07","St. Thomas",18.320665,-64.867323
"1627","Oasis Cove","SC","AJH","5/25/2021","N/A","05/07/2021","RHMA","388","H",7.59,"8.55","19.9","1.1","18.6","OlGr","N/A","Y",NA,"N",NA,2021-05-07,"2021","05","07","St. Thomas",18.320665,-64.867323
"1628","Oasis Cove","SC","AJH","5/25/2021","N/A","05/07/2021","RHMA","389","H",11.44,"10.09","22.7","1.3","21.3","BrGr","N/A","Y",NA,"N",NA,2021-05-07,"2021","05","07","St. Thomas",18.320665,-64.867323
"1629","Oasis Cove","SC","AJH","5/25/2021","N/A","05/07/2021","RHMA","390","H",8.36,"7.46","21.2","1","20.2","BrGr","N/A","Y",NA,"N",NA,2021-05-07,"2021","05","07","St. Thomas",18.320665,-64.867323
"1630","Oasis Cove","SC","AJH","5/25/2021","N/A","05/07/2021","RHMA","391","S",9.77,"9.19","21.4","1.3","20","OlGr","N/A","Y",NA,"N",NA,2021-05-07,"2021","05","07","St. Thomas",18.320665,-64.867323
"1631","Oasis Cove","SC","AJH","5/25/2021","N/A","05/07/2021","RHMA","392","H",13.19,"10.11","25","1.4","23.6","BrGr","N/A","Y",NA,"N",NA,2021-05-07,"2021","05","07","St. Thomas",18.320665,-64.867323
"1632","Oasis Cove","SC","AJH","5/25/2021","N/A","05/07/2021","RHMA","393","S",15.77,"9.44","29.8",NA,"29.8","OlGr","N/A","Y",NA,"N",NA,2021-05-07,"2021","05","07","St. Thomas",18.320665,-64.867323
"1633","Oasis Cove","SC","AJH","5/25/2021","N/A","05/07/2021","RHMA","394","S",15.45,"9.86","27.2","1.6","25.5","OlGr","N/A","Y",NA,"N",NA,2021-05-07,"2021","05","07","St. Thomas",18.320665,-64.867323
"1634","Oasis Cove","DIRECT INPUT","KWG, AND, AJH",NA,"3"" TP","02/09/2023","RHMA","3114","H",8.17,"8.6","21.2","1","20.2","G","Y","N",NA,"N",NA,2023-02-09,"2023","02","09","St. Thomas",18.320665,-64.867323
"1635","Oasis Cove","DIRECT INPUT","KWG, AND, AJH",NA,"3"" TP","02/09/2023","RHMA","3115","H",9.89,"10.2","18.2","1","17.2","G","N","N",NA,"N",NA,2023-02-09,"2023","02","09","St. Thomas",18.320665,-64.867323
"1636","Oasis Cove","DIRECT INPUT","KWG, AND, AJH",NA,"3"" TP","02/09/2023","RHMA","3116","H",26.32,"13.7","31.2","1.7","29.5","G","Y","N",NA,"N",NA,2023-02-09,"2023","02","09","St. Thomas",18.320665,-64.867323
"1637","Oasis Cove","DIRECT INPUT","KWG, AND, AJH",NA,"3"" TP","02/09/2023","RHMA","3117","P",8.22,"9.1","16.2","1.2","15","G","Y","N",NA,"N",NA,2023-02-09,"2023","02","09","St. Thomas",18.320665,-64.867323
"1638","Oasis Cove","DIRECT INPUT","KWG, AND, AJH",NA,"3"" TP","02/09/2023","RHMA","3118","H",14,"10.9","24.3","1.1","23.2","G","Y","N",NA,"N",NA,2023-02-09,"2023","02","09","St. Thomas",18.320665,-64.867323
"1639","Oasis Cove","DIRECT INPUT","KWG, AND, AJH",NA,"3"" TP","02/09/2023","RHMA","3119","H",8.4,"8.6","19.7","1.2","18.5","G","Y","N",NA,"N",NA,2023-02-09,"2023","02","09","St. Thomas",18.320665,-64.867323
"1640","Oasis Cove","DIRECT INPUT","KWG, AND, AJH",NA,"3"" TP","02/09/2023","RHMA","3120","H",27.63,"13.9","31.1","1.7","29.4","G","Y","N",NA,"N",NA,2023-02-09,"2023","02","09","St. Thomas",18.320665,-64.867323
"1641","Oasis Cove","DIRECT INPUT","KWG, AND, AJH",NA,"3"" TP","02/09/2023","RHMA","3121","H",14.71,"11.2","20.5","1.1","19.4","G","Y","N",NA,"N",NA,2023-02-09,"2023","02","09","St. Thomas",18.320665,-64.867323
"1642","Oasis Cove","DIRECT INPUT","KWG, AND, AJH",NA,"3"" TP","02/09/2023","RHMA","3122","H",14.21,"11.5","23.3","1.4","21.9","G","Y","N",NA,"N",NA,2023-02-09,"2023","02","09","St. Thomas",18.320665,-64.867323
"1643","Oasis Cove","DIRECT INPUT","KWG, AND, AJH",NA,"3"" TP","02/09/2023","RHMA","3123","H",9.75,"9.3","20.8","1.4","19.4","G","Y","N",NA,"N",NA,2023-02-09,"2023","02","09","St. Thomas",18.320665,-64.867323
"1644","Oasis Cove","DIRECT INPUT","KWG, AND, AJH",NA,"3"" TP","02/09/2023","RHMA","3124","H",7.14,"8.5","18.7","1.1","17.6","G","Y","Y",NA,"N",NA,2023-02-09,"2023","02","09","St. Thomas",18.320665,-64.867323
"1645","Oasis Cove","DIRECT INPUT","KWG, AND, AJH",NA,"3"" TP","02/09/2023","RHMA","3125","H",7,"8.7","18.6","1.1","17.5","G","Y","N",NA,"N",NA,2023-02-09,"2023","02","09","St. Thomas",18.320665,-64.867323
"1646","Oasis Cove","DIRECT INPUT","KWG, AND, AJH",NA,"3"" TP","02/09/2023","RHMA","3126","H",9.08,"9.7","19.9","1.2","18.7","G","Y","Y",NA,"N",NA,2023-02-09,"2023","02","09","St. Thomas",18.320665,-64.867323
"1647","Oasis Cove","DIRECT INPUT","KWG, AND, AJH",NA,"3"" TP","02/09/2023","RHMA","3127","H",10.72,"9.1","18.7","1.2","17.5","G","Y","N",NA,"N",NA,2023-02-09,"2023","02","09","St. Thomas",18.320665,-64.867323
"1648","Oasis Cove","DIRECT INPUT","KWG, AND, AJH",NA,"3"" TP","02/09/2023","RHMA","3128","H",12.52,"10.8","21.5","1.2","20.3","G","Y","N",NA,"N",NA,2023-02-09,"2023","02","09","St. Thomas",18.320665,-64.867323
"1649","Oasis Cove","DIRECT INPUT","KWG, AND, AJH",NA,"3"" TP","02/09/2023","RHMA","3129","H",13.46,"10.8","21.1","1.3","19.8","G","Y","N",NA,"N",NA,2023-02-09,"2023","02","09","St. Thomas",18.320665,-64.867323
"1650","Oasis Cove","DIRECT INPUT","KWG, AND, AJH",NA,"3"" TP","02/09/2023","RHMA","3130","P",15.51,"11.1","25","1.3","23.7","G","Y","N",NA,"N",NA,2023-02-09,"2023","02","09","St. Thomas",18.320665,-64.867323
"1651","Oasis Cove","DIRECT INPUT","KWG, AND, AJH",NA,"3"" TP","02/09/2023","RHMA","3131","H",33.53,"13.2","37.4","1.4","36","R","Y","N",NA,"N",NA,2023-02-09,"2023","02","09","St. Thomas",18.320665,-64.867323
"1652","Oasis Cove","DIRECT INPUT","KWG, AND, AJH",NA,"3"" TP","02/09/2023","RHMA","3132","H",9.11,"9.3","20.8","2.3","18.5","G","Y","N","2 LEAVES","N",NA,2023-02-09,"2023","02","09","St. Thomas",18.320665,-64.867323
"1653","Oasis Cove","DIRECT INPUT","KWG, AND, AJH",NA,"3"" TP","02/09/2023","RHMA","3133","H",23.73,"12.5","34.6","1.6","33","G/B","Y","N",NA,"N",NA,2023-02-09,"2023","02","09","St. Thomas",18.320665,-64.867323
"1654","Oasis Cove","DIRECT INPUT","KWG, AND, AJH",NA,"3"" TP","02/09/2023","RHMA","3134","H",14.41,"9","32.1","1.5","30.6","G","Y","N",NA,"N",NA,2023-02-09,"2023","02","09","St. Thomas",18.320665,-64.867323
"1655","Oasis Cove","DIRECT INPUT","KWG, AND, AJH",NA,"3"" TP","02/09/2023","RHMA","3135","H",27.35,"12.7","30.2","1.2","29","G/B","Y","N",NA,"N",NA,2023-02-09,"2023","02","09","St. Thomas",18.320665,-64.867323
"1656","Oasis Cove","DIRECT INPUT","KWG, AND, AJH",NA,"3"" TP","02/09/2023","RHMA","3136","H",7.6,"8.5","20.3","0.9","19.4","G","Y","N",NA,"N",NA,2023-02-09,"2023","02","09","St. Thomas",18.320665,-64.867323
"1657","Oasis Cove","DIRECT INPUT","KWG, AND, AJH",NA,"3"" TP","02/09/2023","RHMA","3137","H",16.66,"12.3","23","1.5","21.5","G/B","N","N",NA,"N",NA,2023-02-09,"2023","02","09","St. Thomas",18.320665,-64.867323
"1658","Oasis Cove","DIRECT INPUT","KWG, AND, AJH",NA,"3"" TP","02/09/2023","RHMA","3138","P",8.43,"9.4","20.9","1.1","19.8","G","Y","N",NA,"N",NA,2023-02-09,"2023","02","09","St. Thomas",18.320665,-64.867323
"1659","Oasis Cove","DIRECT INPUT","KWG, AND, AJH",NA,"3"" TP","02/09/2023","RHMA","3139","H",17.77,"11.5","27.2","1.2","26","G/B","Y","N",NA,"N",NA,2023-02-09,"2023","02","09","St. Thomas",18.320665,-64.867323
"1660","Oasis Cove","DIRECT INPUT","KWG, AND, AJH",NA,"3"" TP","02/09/2023","RHMA","3140","H",6.05,"7.2","18.2","0.5","17.7","G","Y","N",NA,"N",NA,2023-02-09,"2023","02","09","St. Thomas",18.320665,-64.867323
"1661","Oasis Cove","DIRECT INPUT","KWG, AND, AJH",NA,"3"" TP","02/09/2023","RHMA","3141","H",15.24,"10","27","1.5","25.5","G","Y","N",NA,"N",NA,2023-02-09,"2023","02","09","St. Thomas",18.320665,-64.867323
"1662","Oasis Cove","DIRECT INPUT","KWG, AND, AJH",NA,"3"" TP","02/09/2023","RHMA","3142","H",13.65,"10.6","25.6","1.4","24.2","G","Y","N",NA,"N",NA,2023-02-09,"2023","02","09","St. Thomas",18.320665,-64.867323
"1663","Oasis Cove","DIRECT INPUT","KWG, AND, AJH",NA,"3"" TP","02/09/2023","RHMA","3143","H",18.69,"12.2","26","1.2","24.8","G/B","Y","N",NA,"N",NA,2023-02-09,"2023","02","09","St. Thomas",18.320665,-64.867323
"1664","Oasis Cove","DIRECT INPUT","KWG, AND, AJH",NA,"3"" TP","02/09/2023","RHMA","3144","P",13,"10.2","26.7","1.5","25.2","G","Y","N",NA,"N",NA,2023-02-09,"2023","02","09","St. Thomas",18.320665,-64.867323
"1665","Oasis Cove","DIRECT INPUT","KWG, AND, AJH",NA,"3"" TP","02/09/2023","RHMA","3145","H",16.05,"10.5","28.9","1.5","27.4","G","Y","N",NA,"N",NA,2023-02-09,"2023","02","09","St. Thomas",18.320665,-64.867323
"1666","Oasis Cove","DIRECT INPUT","KWG, AND, AJH",NA,"3"" TP","02/09/2023","RHMA","3146","H",10,"10.4","19.2","0.9","18.3","G","Y",NA,NA,"N",NA,2023-02-09,"2023","02","09","St. Thomas",18.320665,-64.867323
"1667","Oasis Cove","DIRECT INPUT","KWG, AND, AJH",NA,"3"" TP","02/09/2023","RHMA","3147","H",20.4,"11.3","31.4","1.6","29.8","G/B","Y","N",NA,"N",NA,2023-02-09,"2023","02","09","St. Thomas",18.320665,-64.867323
"1668","Oasis Cove","DIRECT INPUT","KWG, AND, AJH",NA,"3"" TP","02/09/2023","RHMA","3148","H",5.15,"7.4","16.7","0.7","16","G","Y","N",NA,"N",NA,2023-02-09,"2023","02","09","St. Thomas",18.320665,-64.867323
"1669","Oasis Cove","DIRECT INPUT","KWG, AND, AJH",NA,"3"" TP","02/09/2023","RHMA","3149","H",6.84,"7.5","21.5","0","21.5","G","Y","N","NO PLUM","N",NA,2023-02-09,"2023","02","09","St. Thomas",18.320665,-64.867323
"1670","Oasis Cove","DIRECT INPUT","KWG, AND, AJH",NA,"3""TP","02-21-23","RHMA","3150","H",12.81,"10","24.6","0","24.6","G","Y","N","DECAP","N",NA,2023-02-21,"2023","02","21","St. Thomas",18.320665,-64.867323
"1671","Oasis Cove","DIRECT INPUT","KWG, AND, AJH",NA,"3"" TP","02/09/2023","RHMA","3151","H",25.64,"13.3","27.2","1.5","25.7","G/B","Y","N",NA,"N",NA,2023-02-09,"2023","02","09","St. Thomas",18.320665,-64.867323
"1672","Oasis Cove","DIRECT INPUT","KWG, AND, AJH",NA,"3""TP","02-21-23","RHMA","3152","H",17.21,"11.5","26","1.7","24.3","G","Y","N","LPC","N",NA,2023-02-21,"2023","02","21","St. Thomas",18.320665,-64.867323
"1673","Oasis Cove","DIRECT INPUT","KWG, AND, AJH",NA,"3"" TP","02/09/2023","RHMA","3153","H",23.23,"11.9","33.4","1.5","31.9","R","Y","N",NA,"N",NA,2023-02-09,"2023","02","09","St. Thomas",18.320665,-64.867323
"1674","Oasis Cove","DIRECT INPUT","KWG, AND, AJH",NA,"3""TP","02-21-23","RHMA","3154","H",21.72,"12.8","26.1","0.4","25.7","G","Y","N",NA,"N",NA,2023-02-21,"2023","02","21","St. Thomas",18.320665,-64.867323
"1675","Oasis Cove","DIRECT INPUT","KWG, AND, AJH",NA,"3"" TP","02/09/2023","RHMA","3155","P",16.11,"10.5","27.1","1","26.1","R","N","N",NA,"N",NA,2023-02-09,"2023","02","09","St. Thomas",18.320665,-64.867323
"1676","Oasis Cove","DIRECT INPUT","KWG, AND, AJH",NA,"3""TP","02-21-23","RHMA","3156","S",21.67,"10.5","31.5","0.5","31","G","Y","N",NA,"N",NA,2023-02-21,"2023","02","21","St. Thomas",18.320665,-64.867323
"1677","Oasis Cove","DIRECT INPUT","KWG, AND, AJH",NA,"3"" TP","02/09/2023","RHMA","3157","H",14,"10","25.9","1.4","24.5","G/R","Y","N",NA,"N",NA,2023-02-09,"2023","02","09","St. Thomas",18.320665,-64.867323
"1678","Oasis Cove","DIRECT INPUT","KWG, AND, AJH",NA,"3""TP","02-21-23","RHMA","3158","S",11.08,"7.6","26.5","1.1","25.4","G","Y","N",NA,"N",NA,2023-02-21,"2023","02","21","St. Thomas",18.320665,-64.867323
"1679","Oasis Cove","DIRECT INPUT","KWG, AND, AJH",NA,"3"" TP","02/09/2023","RHMA","3159","H",19.26,"10.9","30.1","1.5","28.6","G","Y","N",NA,"N",NA,2023-02-09,"2023","02","09","St. Thomas",18.320665,-64.867323
"1680","Oasis Cove","DIRECT INPUT","KWG, AND, AJH",NA,"3""TP","02-21-23","RHMA","3160","H",16.83,"11.3","24.5","0.6","23.9","G","Y","N",NA,"N",NA,2023-02-21,"2023","02","21","St. Thomas",18.320665,-64.867323
"1681","Oasis Cove","DIRECT INPUT","KWG, AND, AJH",NA,"3"" TP","02/09/2023","RHMA","3161","H",16.76,"11","26.4","1.4","25","G/R","Y","N",NA,"N",NA,2023-02-09,"2023","02","09","St. Thomas",18.320665,-64.867323
"1682","Oasis Cove","DIRECT INPUT","KWG, AND, AJH",NA,"3""TP","02-21-23","RHMA","3162","S",16,"11.7","25.8","1.2","24.6","G","Y","N",NA,"N",NA,2023-02-21,"2023","02","21","St. Thomas",18.320665,-64.867323
"1683","Oasis Cove","DIRECT INPUT","KWG, AND, AJH",NA,"3"" TP","02/09/2023","RHMA","3163","H",6.03,"7.6","18.3","0.9","17.4","G/B","Y","N",NA,"N",NA,2023-02-09,"2023","02","09","St. Thomas",18.320665,-64.867323
"1684","Oasis Cove","DIRECT INPUT","KWG, AND, AJH",NA,"3""TP","02-21-23","RHMA","3164","H",20.7,"13","25.7","1.3","24.4","G","Y","N",NA,"N",NA,2023-02-21,"2023","02","21","St. Thomas",18.320665,-64.867323
"1685","Oasis Cove","DIRECT INPUT","KWG, AND, AJH",NA,"3"" TP","02/09/2023","RHMA","3165","H",21.96,"11.6","29.8","1.3","28.5","G","Y","F",NA,"N",NA,2023-02-09,"2023","02","09","St. Thomas",18.320665,-64.867323
"1686","Oasis Cove","DIRECT INPUT","KWG, AND, AJH",NA,"3""TP","02-21-23","RHMA","3166","H",20.11,"12.8","23.8","0","23.8","G","Y","N","DECAP AND SNAIL EGGS","N",NA,2023-02-21,"2023","02","21","St. Thomas",18.320665,-64.867323
"1687","Oasis Cove","DIRECT INPUT","KWG, AND, AJH",NA,"3"" TP","02/09/2023","RHMA","3167","H",20.14,"11","31.9","1.4","30.5","G","Y","F",NA,"N",NA,2023-02-09,"2023","02","09","St. Thomas",18.320665,-64.867323
"1688","Oasis Cove","DIRECT INPUT","KWG, AND, AJH",NA,"3""TP","02-21-23","RHMA","3168","H",9.75,"9","21.5","1.2","20.3","G","Y","N",NA,"N",NA,2023-02-21,"2023","02","21","St. Thomas",18.320665,-64.867323
"1689","Oasis Cove","DIRECT INPUT","KWG, AND, AJH",NA,"3"" TP","02/09/2023","RHMA","3169","H",10.45,"8.6","25.7","1.2","24.5","G","Y","F",NA,"N",NA,2023-02-09,"2023","02","09","St. Thomas",18.320665,-64.867323
"1690","Oasis Cove","DIRECT INPUT","KWG, AND, AJH",NA,"3""TP","02-21-23","RHMA","3170","S",15.78,"10.4","29","1.3","27.7","G","Y","N",NA,"N",NA,2023-02-21,"2023","02","21","St. Thomas",18.320665,-64.867323
"1691","Oasis Cove","DIRECT INPUT","KWG, AND, AJH",NA,"3"" TP","02/09/2023","RHMA","3171","H",15.05,"11","23.8","1.4","22.4","G","Y","F",NA,"N",NA,2023-02-09,"2023","02","09","St. Thomas",18.320665,-64.867323
"1692","Oasis Cove","DIRECT INPUT","KWG, AND, AJH",NA,"3""TP","02-21-23","RHMA","3172","H",29.33,"13.7","34","0","34","G","Y","N","DECAP","N",NA,2023-02-21,"2023","02","21","St. Thomas",18.320665,-64.867323
"1693","Oasis Cove","DIRECT INPUT","KWG, AND, AJH",NA,"3"" TP","02/09/2023","RHMA","3173","H",19.34,"11.8","28.8","1.7","27.1","R/G","Y","N",NA,"N",NA,2023-02-09,"2023","02","09","St. Thomas",18.320665,-64.867323
"1694","Oasis Cove","DIRECT INPUT","KWG, AND, AJH",NA,"3""TP","02-21-23","RHMA","3174","H",21.83,"13","26.4","1.7","24.7","G","Y","N",NA,"N",NA,2023-02-21,"2023","02","21","St. Thomas",18.320665,-64.867323
"1695","Oasis Cove","DIRECT INPUT","KWG, AND, AJH",NA,"3"" TP","02/09/2023","RHMA","3175","H",23.27,"13.1","30.8","1.7","29.1","G","Y","N",NA,"N",NA,2023-02-09,"2023","02","09","St. Thomas",18.320665,-64.867323
"1696","Oasis Cove","DIRECT INPUT","KWG, AND, AJH",NA,"3""TP","02-21-23","RHMA","3176","H",20.8,"13.1","24.1","1.6","22.5","G","Y","N",NA,"N",NA,2023-02-21,"2023","02","21","St. Thomas",18.320665,-64.867323
"1697","Oasis Cove","DIRECT INPUT","KWG, AND, AJH",NA,"3"" TP","02/09/2023","RHMA","3177","S",22.67,"11.4","38","0.7","37.3","G","Y","N",NA,"N",NA,2023-02-09,"2023","02","09","St. Thomas",18.320665,-64.867323
"1698","Oasis Cove","DIRECT INPUT","AJH",NA,"3""TP","02-21-23","RHMA","3178","H",17.37,"12.8","24","1.2","22.8","G","Y","N",NA,"N",NA,2023-02-21,"2023","02","21","St. Thomas",18.320665,-64.867323
"1699","Oasis Cove","DIRECT INPUT","AJH",NA,"3"" TP","02/09/2023","RHMA","3179","H",17,"11","27.5","1.5","26","B","Y","Y",NA,"N",NA,2023-02-09,"2023","02","09","St. Thomas",18.320665,-64.867323
"1700","Oasis Cove","DIRECT INPUT","AJH",NA,"3""TP","02-21-23","RHMA","3180","P",16.24,"11.4","25.2","1.1","24.1","G","Y","N",NA,"N",NA,2023-02-21,"2023","02","21","St. Thomas",18.320665,-64.867323
"1701","Oasis Cove","DIRECT INPUT","AJH",NA,"3"" TP","02/09/2023","RHMA","3181","H",14.07,"10.3","25.2","1.2","24","G","Y","Y",NA,"N",NA,2023-02-09,"2023","02","09","St. Thomas",18.320665,-64.867323
"1702","Oasis Cove","DIRECT INPUT","AJH",NA,"3""TP","02-21-23","RHMA","3182","H",13.61,"11.1","22.2","1.6","20.6","G","Y","N",NA,"N",NA,2023-02-21,"2023","02","21","St. Thomas",18.320665,-64.867323
"1703","Oasis Cove","DIRECT INPUT","AJH",NA,"3"" TP","02/09/2023","RHMA","3183","P",14.48,"10.6","24.6","1.6","23","G","Y","Y","crab predation","N",NA,2023-02-09,"2023","02","09","St. Thomas",18.320665,-64.867323
"1704","Oasis Cove","DIRECT INPUT","AJH",NA,"3""TP","02-21-23","RHMA","3184","H",19.58,"13.3","22.4","0.9","21.5","G","Y","N",NA,"N",NA,2023-02-21,"2023","02","21","St. Thomas",18.320665,-64.867323
"1705","Oasis Cove","DIRECT INPUT","AJH",NA,"3"" TP","02/09/2023","RHMA","3185","H",17.78,"11.7","24.7","1.2","23.5","G","Y","Y",NA,"N",NA,2023-02-09,"2023","02","09","St. Thomas",18.320665,-64.867323
"1706","Oasis Cove","DIRECT INPUT","AJH",NA,"3""TP","02-21-23","RHMA","3186","H",9.16,"8.1","25.8","1.3","24.5","G","Y","N",NA,"N",NA,2023-02-21,"2023","02","21","St. Thomas",18.320665,-64.867323
"1707","Oasis Cove","DIRECT INPUT","AJH",NA,"3"" TP","02/09/2023","RHMA","3187","H",13.87,"10","26.2","1.2","25","G","Y","Y",NA,"N",NA,2023-02-09,"2023","02","09","St. Thomas",18.320665,-64.867323
"1708","Oasis Cove","DIRECT INPUT","AJH",NA,"3""TP","02-21-23","RHMA","3188","H",15.04,"10.8","24.2","0","24.2","G","Y","N","DECAP","N",NA,2023-02-21,"2023","02","21","St. Thomas",18.320665,-64.867323
"1709","Oasis Cove","DIRECT INPUT","AJH",NA,"3"" TP","02/09/2023","RHMA","3189","H",16.52,"11.5","23.5","1.5","22","G","Y","Y",NA,"N",NA,2023-02-09,"2023","02","09","St. Thomas",18.320665,-64.867323
"1710","Oasis Cove","DIRECT INPUT","AJH",NA,"3""TP","02-21-23","RHMA","3190","H",28.61,"14.1","28.2","0","28.2","G","Y","N","DECAP","N",NA,2023-02-21,"2023","02","21","St. Thomas",18.320665,-64.867323
"1711","Oasis Cove","DIRECT INPUT","AJH",NA,"3"" TP","02/09/2023","RHMA","3191","H",16.81,"9.6","33.3","1.8","31.5","G","Y","N",NA,"N",NA,2023-02-09,"2023","02","09","St. Thomas",18.320665,-64.867323
"1712","Oasis Cove","DIRECT INPUT","AJH",NA,"3""TP","02-21-23","RHMA","3192","H",18.29,"10.9","28.1","0","28.1","G","Y","N","DECAP","N",NA,2023-02-21,"2023","02","21","St. Thomas",18.320665,-64.867323
"1713","Oasis Cove","DIRECT INPUT","AJH",NA,"3"" TP","02/09/2023","RHMA","3193","S",19.23,"9.8","35.1","1.9","33.2","B","Y","N",NA,"N",NA,2023-02-09,"2023","02","09","St. Thomas",18.320665,-64.867323
"1714","Oasis Cove","DIRECT INPUT","AJH",NA,"3""TP","02-21-23","RHMA","3194","H",7.71,"10","15.7","0","15.7","G","Y","N","DECAP","N",NA,2023-02-21,"2023","02","21","St. Thomas",18.320665,-64.867323
"1715","Oasis Cove","DIRECT INPUT","AJH",NA,"3"" TP","02/09/2023","RHMA","3195","H",9.54,"8.5","21.4","1.1","20.3","G","Y","N",NA,"N",NA,2023-02-09,"2023","02","09","St. Thomas",18.320665,-64.867323
"1716","Oasis Cove","DIRECT INPUT","AJH",NA,"3""TP","02-21-23","RHMA","3196","H",12.2,"11","19.8","1.1","18.7","G","Y","N",NA,"N",NA,2023-02-21,"2023","02","21","St. Thomas",18.320665,-64.867323
"1717","Oasis Cove","DIRECT INPUT","AJH",NA,"3"" TP","02/09/2023","RHMA","3197","H",4.94,"6.8","15.2","0.7","14.5","G","N","N",NA,"N",NA,2023-02-09,"2023","02","09","St. Thomas",18.320665,-64.867323
"1718","Oasis Cove","DIRECT INPUT","AJH",NA,"3""TP","02-21-23","RHMA","3198","S",28.5,"12.1","37.2","1.2","36","G","Y","N","SNAIL EGGS","N",NA,2023-02-21,"2023","02","21","St. Thomas",18.320665,-64.867323
"1719","Oasis Cove","DIRECT INPUT","AJH",NA,"3"" TP","02/09/2023","RHMA","3199","H",15.26,"10","28.9","1.1","27.8","G","Y","Y",NA,"N",NA,2023-02-09,"2023","02","09","St. Thomas",18.320665,-64.867323
"1720","Oasis Cove","DIRECT INPUT","AJH",NA,"3""TP","02-21-23","RHMA","3200","H",31.87,"14.6","32.3","0.5","31.8","G","Y",NA,"SNAIL EGGS","N",NA,2023-02-21,"2023","02","21","St. Thomas",18.320665,-64.867323
"1721","Oasis Cove","DIRECT INPUT","AJH",NA,"3"" TP","02/09/2023","RHMA","3201","S",31.14,"12.9","36.8","0","36.8","GB","Y","Y","DECAP","N",NA,2023-02-09,"2023","02","09","St. Thomas",18.320665,-64.867323
"1722","Oasis Cove","DIRECT INPUT","AJH",NA,"3""TP","02/09/2023","RHMA","3202","H",13,"9.1","28.7","1.2","27.5","G","N","N",NA,"N",NA,2023-02-09,"2023","02","09","St. Thomas",18.320665,-64.867323
"1723","Oasis Cove","DIRECT INPUT","AJH",NA,"3"" TP","02/09/2023","RHMA","3203","H",18.16,"11.8","24.2","1.2","23","R","Y","Y",NA,"N",NA,2023-02-09,"2023","02","09","St. Thomas",18.320665,-64.867323
"1724","Oasis Cove","DIRECT INPUT","AJH",NA,"3""TP","02/09/2023","RHMA","3204","H",29.65,"13.3","36","1.4","34.6","G","Y","N",NA,"N",NA,2023-02-09,"2023","02","09","St. Thomas",18.320665,-64.867323
"1725","Oasis Cove","DIRECT INPUT","AJH",NA,"3"" TP","02/09/2023","RHMA","3205","H",7.96,"7.5","24.5","1.5","23","G","Y","Y",NA,"N",NA,2023-02-09,"2023","02","09","St. Thomas",18.320665,-64.867323
"1726","Oasis Cove","DIRECT INPUT","AJH",NA,"3""TP","02/09/2023","RHMA","3206","H",17.68,"10.5","32.5","1.7","30.8","G","Y","N",NA,"N",NA,2023-02-09,"2023","02","09","St. Thomas",18.320665,-64.867323
"1727","Oasis Cove","DIRECT INPUT","AJH",NA,"3"" TP","02/09/2023","RHMA","3207","P",26.55,"12.9","35.3","1.3","34","G","Y","Y","crab predation","N",NA,2023-02-09,"2023","02","09","St. Thomas",18.320665,-64.867323
"1728","Oasis Cove","DIRECT INPUT","AJH",NA,"3""TP","02/09/2023","RHMA","3208","H",12.83,"10.1","24.8","1.3","23.5","G","Y","N",NA,"N",NA,2023-02-09,"2023","02","09","St. Thomas",18.320665,-64.867323
"1729","Oasis Cove","DIRECT INPUT","AJH",NA,"3"" TP","02/09/2023","RHMA","3209","H",16.91,"11.5","26.1","1.6","24.5","G","Y","Y",NA,"N",NA,2023-02-09,"2023","02","09","St. Thomas",18.320665,-64.867323
"1730","Oasis Cove","DIRECT INPUT","AJH",NA,"3""TP","02/09/2023","RHMA","3210","H",17.26,"11.2","28.2","1.2","27","G","Y","N",NA,"N",NA,2023-02-09,"2023","02","09","St. Thomas",18.320665,-64.867323
"1731","Oasis Cove","DIRECT INPUT","AJH",NA,"3"" TP","02/09/2023","RHMA","3211","H",28.21,"13.3","32.5","1.5","31","G","Y","Y",NA,"N",NA,2023-02-09,"2023","02","09","St. Thomas",18.320665,-64.867323
"1732","Oasis Cove","DIRECT INPUT","AJH",NA,"3""TP","02/09/2023","RHMA","3212","H",28.19,"12.7","36.3","1.9","34.4","G","Y","N",NA,"N",NA,2023-02-09,"2023","02","09","St. Thomas",18.320665,-64.867323
"1733","Oasis Cove","DIRECT INPUT","AJH",NA,"3"" TP","02/09/2023","RHMA","3213","H",24.61,"12.5","30.7","1.7","29","GR","Y","Y",NA,"N",NA,2023-02-09,"2023","02","09","St. Thomas",18.320665,-64.867323
"1734","Oasis Cove","DIRECT INPUT","AJH",NA,"3""TP","02/09/2023","RHMA","3214","H",25.22,"12.4","33","1.5","31.5","G","Y","N",NA,"N",NA,2023-02-09,"2023","02","09","St. Thomas",18.320665,-64.867323
"1735","Oasis Cove","DIRECT INPUT","AJH",NA,"3"" TP","02/09/2023","RHMA","3215","H",20.38,"12.9","24.1","1.3","22.8","G","Y","Y",NA,"N",NA,2023-02-09,"2023","02","09","St. Thomas",18.320665,-64.867323
"1736","Oasis Cove","DIRECT INPUT","AJH",NA,"3""TP","02/09/2023","RHMA","3216","H",18.08,"11","31.5","1.3","30.2","G","Y","N",NA,"N",NA,2023-02-09,"2023","02","09","St. Thomas",18.320665,-64.867323
"1737","Oasis Cove","DIRECT INPUT","AJH",NA,"3"" TP","02/09/2023","RHMA","3217","H",13.41,"9","24.5","0.5","24","G","Y","Y",NA,"N",NA,2023-02-09,"2023","02","09","St. Thomas",18.320665,-64.867323
"1738","Oasis Cove","DIRECT INPUT","AJH",NA,"3""TP","02/09/2023","RHMA","3218","H",19.88,"11","31.7","1.3","30.4","G","Y","N",NA,"N",NA,2023-02-09,"2023","02","09","St. Thomas",18.320665,-64.867323
"1739","Oasis Cove","DIRECT INPUT","AJH",NA,"3"" TP","02/09/2023","RHMA","3219","H",12.49,"10","21.6","1.1","20.5","G","Y","N",NA,"N",NA,2023-02-09,"2023","02","09","St. Thomas",18.320665,-64.867323
"1740","Oasis Cove","DIRECT INPUT","AJH",NA,"3""TP","02/09/2023","RHMA","3220","H",20.21,"11.7","30.8","1.3","29.5","G","Y","N",NA,"N",NA,2023-02-09,"2023","02","09","St. Thomas",18.320665,-64.867323
"1741","Oasis Cove","DIRECT INPUT","AJH",NA,"3"" TP","02/09/2023","RHMA","3221","S",16.58,"11","24.4","1.3","23.1","B","N","N",NA,"N",NA,2023-02-09,"2023","02","09","St. Thomas",18.320665,-64.867323
"1742","Oasis Cove","DIRECT INPUT","AJH",NA,"3""TP","02/09/2023","RHMA","3222","H",7.97,"9.4","19.1","1.2","17.9","G","Y","N",NA,"N",NA,2023-02-09,"2023","02","09","St. Thomas",18.320665,-64.867323
"1743","Oasis Cove","DIRECT INPUT","AJH",NA,"3"" TP","02/09/2023","RHMA","3223","H",9.76,"7.2","21.3","0.8","20.5","G","Y","N",NA,"N",NA,2023-02-09,"2023","02","09","St. Thomas",18.320665,-64.867323
"1744","Oasis Cove","DIRECT INPUT","AJH",NA,"3""TP","02/09/2023","RHMA","3224","H",14.78,"10.5","28.4","1.5","26.9","G","Y","N",NA,"N",NA,2023-02-09,"2023","02","09","St. Thomas",18.320665,-64.867323
"1745","Oasis Cove","DIRECT INPUT","AJH",NA,"3"" TP","02/09/2023","RHMA","3225","H",19.81,"10.9","31.2","1.2","30","G","Y","Y",NA,"N",NA,2023-02-09,"2023","02","09","St. Thomas",18.320665,-64.867323
"1746","Oasis Cove","DIRECT INPUT","AJH",NA,"3""TP","02/09/2023","RHMA","3226","H",16.26,"10.6","29","1.3","27.7","G","Y","N",NA,"N",NA,2023-02-09,"2023","02","09","St. Thomas",18.320665,-64.867323
"1747","Oasis Cove","DIRECT INPUT","AJH",NA,"3"" TP","02/09/2023","RHMA","3227","S",25.24,"12.4","33","1.8","31.2","G","Y","Y",NA,"N",NA,2023-02-09,"2023","02","09","St. Thomas",18.320665,-64.867323
"1748","Oasis Cove","DIRECT INPUT","AJH",NA,"3""TP","02/09/2023","RHMA","3228","H",20.27,"12.2","28.9","1.4","27.5","G","Y","N",NA,"N",NA,2023-02-09,"2023","02","09","St. Thomas",18.320665,-64.867323
"1749","Oasis Cove","DIRECT INPUT","AJH",NA,"3"" TP","02/09/2023","RHMA","3229","H",22.52,"11","35.2","1.2","34","GB","Y","Y","TOP IS DEAD","N",NA,2023-02-09,"2023","02","09","St. Thomas",18.320665,-64.867323
"1750","Oasis Cove","DIRECT INPUT","AJH",NA,"3""TP","02/09/2023","RHMA","3230","H",21.53,"12","31.6","1.8","29.8","G","Y","N",NA,"N",NA,2023-02-09,"2023","02","09","St. Thomas",18.320665,-64.867323
"1751","Oasis Cove","HH","HH,ES","10/09/2024","CC","09/11/2024","RHMA","6350","H",8.17,"9.4","20","0.5","19.5","GB","N","N",NA,NA,NA,2024-09-11,"2024","09","11","St. Thomas",18.320665,-64.867323
"1752","Oasis Cove","HH","HH,ES","10/09/2024","CC","09/11/2024","RHMA","6351","H",13.48,"10.9","26","1.5","24.5","B","N","N",NA,NA,NA,2024-09-11,"2024","09","11","St. Thomas",18.320665,-64.867323
"1753","Oasis Cove","HH","HH,ES","10/09/2024","CC","09/11/2024","RHMA","6352","H",9.7,"10.2","21.5","1.8","19.7","GB","Y","N",NA,NA,NA,2024-09-11,"2024","09","11","St. Thomas",18.320665,-64.867323
"1754","Oasis Cove","HH","HH,ES","10/09/2024","CC","09/11/2024","RHMA","6353","H",8.37,"8.8","21.7","0.7","21","GB","Y","Y",NA,NA,NA,2024-09-11,"2024","09","11","St. Thomas",18.320665,-64.867323
"1755","Oasis Cove","HH","HH,ES","10/09/2024","CC","09/11/2024","RHMA","6354","H",7.66,"9.6","17.8","1.8","16","GB","Y","Y",NA,NA,NA,2024-09-11,"2024","09","11","St. Thomas",18.320665,-64.867323
"1756","Oasis Cove","HH","HH,ES","10/09/2024","CC","09/11/2024","RHMA","6355","H",10.7,"10","21.6","1.1","20.5","B","N","N",NA,NA,NA,2024-09-11,"2024","09","11","St. Thomas",18.320665,-64.867323
"1757","Oasis Cove","HH","HH,ES","10/09/2024","CC","09/11/2024","RHMA","6356","H",13.14,"11.2","20.6","1.4","19.2","B","Y","N",NA,NA,NA,2024-09-11,"2024","09","11","St. Thomas",18.320665,-64.867323
"1758","Oasis Cove","HH","HH,ES","10/09/2024","CC","09/11/2024","RHMA","6357","H",15.39,"10.4","31.5","1.4","30.1","GB","Y","N",NA,NA,NA,2024-09-11,"2024","09","11","St. Thomas",18.320665,-64.867323
"1759","Oasis Cove","HH","HH,ES","10/09/2024","CC","09/11/2024","RHMA","6358","H",15.95,"11.2","24.1","1.3","22.8","B","Y","N",NA,NA,NA,2024-09-11,"2024","09","11","St. Thomas",18.320665,-64.867323
"1760","Oasis Cove","HH","HH,ES","10/09/2024","CC","09/11/2024","RHMA","6359","H",6.8,"9.4","16.3","0.8","15.5","GB","Y","Y",NA,NA,NA,2024-09-11,"2024","09","11","St. Thomas",18.320665,-64.867323
"1761","Oasis Cove","HH","HH,ES","10/09/2024","CC","09/11/2024","RHMA","6360","H",12.15,"12.4","15.5","0.8","14.7","GB","Y","N",NA,NA,NA,2024-09-11,"2024","09","11","St. Thomas",18.320665,-64.867323
"1762","Oasis Cove","HH","HH,ES","10/09/2024","CC","09/11/2024","RHMA","6361","H",12.4,"10.1","26.7","1.1","25.6","GB","Y","N",NA,NA,NA,2024-09-11,"2024","09","11","St. Thomas",18.320665,-64.867323
"1763","Oasis Cove","HH","HH,ES","10/09/2024","CC","09/11/2024","RHMA","6362","H",15.39,"11.9","24.1","1.5","22.6","GB","N","Y",NA,NA,NA,2024-09-11,"2024","09","11","St. Thomas",18.320665,-64.867323
"1764","Oasis Cove","HH","HH,ES","10/09/2024","CC","09/11/2024","RHMA","6363","H",14.71,"10.7","29","1.2","27.8","GB","N","Y",NA,NA,NA,2024-09-11,"2024","09","11","St. Thomas",18.320665,-64.867323
"1765","Oasis Cove","HH","HH,ES","10/09/2024","CC","09/11/2024","RHMA","6364","H",20.8,"12.1","29.3","0","29.3","GB","Y","Y","NO PLUMULE",NA,NA,2024-09-11,"2024","09","11","St. Thomas",18.320665,-64.867323
"1766","Oasis Cove","HH","HH,ES","10/09/2024","CC","09/11/2024","RHMA","6365","H",17.23,"11.8","23.2","1.5","21.7","B","Y","N",NA,NA,NA,2024-09-11,"2024","09","11","St. Thomas",18.320665,-64.867323
"1767","Oasis Cove","HH","HH,ES","10/09/2024","CC","09/11/2024","RHMA","6366","H",14.42,"11.3","23.3","0","23.3","GB","Y","Y","DECAP",NA,NA,2024-09-11,"2024","09","11","St. Thomas",18.320665,-64.867323
"1768","Oasis Cove","HH","HH,ES","10/09/2024","CC","09/11/2024","RHMA","6367","H",19.93,"13.4","23.4","1.4","22","GB","Y","N",NA,NA,NA,2024-09-11,"2024","09","11","St. Thomas",18.320665,-64.867323
"1769","Oasis Cove","HH","HH,ES","10/09/2024","CC","09/11/2024","RHMA","6368","H",11.76,"10","23.2","1.6","21.6","GB","Y","N",NA,NA,NA,2024-09-11,"2024","09","11","St. Thomas",18.320665,-64.867323
"1770","Oasis Cove","HH","HH,ES","10/09/2024","CC","09/11/2024","RHMA","6369","H",20.83,"10.4","36.6","1.3","35.3","GB","N","Y",NA,NA,NA,2024-09-11,"2024","09","11","St. Thomas",18.320665,-64.867323
"1771","Oasis Cove","HH","HH,ES","10/09/2024","CC","09/11/2024","RHMA","6370","H",14.06,"11.3","26.9","1.6","25.3","GB","Y","Y",NA,NA,NA,2024-09-11,"2024","09","11","St. Thomas",18.320665,-64.867323
"1772","Oasis Cove","HH","HH,ES","10/09/2024","CC","09/11/2024","RHMA","6371","H",28.83,"13.7","29.4","0","29.4","GB","Y","N","NO PLUMULE",NA,NA,2024-09-11,"2024","09","11","St. Thomas",18.320665,-64.867323
"1773","Oasis Cove","HH","HH,ES","10/09/2024","CC","09/11/2024","RHMA","6372","H",7.62,"9.2","18.1","1.1","17","GB","N","N",NA,NA,NA,2024-09-11,"2024","09","11","St. Thomas",18.320665,-64.867323
"1774","Oasis Cove","HH","HH,ES","10/09/2024","CC","09/11/2024","RHMA","6373","H",8.34,"9.4","19.3","1.2","18.1","B","N","N",NA,NA,NA,2024-09-11,"2024","09","11","St. Thomas",18.320665,-64.867323
"1775","Oasis Cove","HH","HH,ES","10/09/2024","CC","09/11/2024","RHMA","6374","H",16.63,"10.5","28.6","1.3","27.3","B","Y","N",NA,NA,NA,2024-09-11,"2024","09","11","St. Thomas",18.320665,-64.867323
"1776","Oasis Cove","HH","HH, KR","10/09/2024","CC","09/11/2024","RHMA","6375","H",17.39,"11.8","23.7","1.5","22.2","B","Y","N",NA,NA,NA,2024-09-11,"2024","09","11","St. Thomas",18.320665,-64.867323
"1777","Oasis Cove","HH","HH, KR","10/09/2024","CC","09/11/2024","RHMA","6376","H",15.06,"11.4","22.1","1.6","20.5","B","Y","N",NA,NA,NA,2024-09-11,"2024","09","11","St. Thomas",18.320665,-64.867323
"1778","Oasis Cove","DIRECT INPUT","DG, AJH","06/23/2023","3""TP","6/13/23","RHMA","4062","H",27.48,"12.7","36.9","1.4","35.5","G","Y","N",NA,"N",NA,2023-06-13,"2023","06","13","St. Thomas",18.320665,-64.867323
"1779","Oasis Cove","DIRECT INPUT","DG, AJH","06/23/2023","3""TP","6/13/23","RHMA","4063","H",18.89,"11","27.7","1.6","26.1","G","Y","N",NA,"N",NA,2023-06-13,"2023","06","13","St. Thomas",18.320665,-64.867323
"1780","Oasis Cove","DIRECT INPUT","DG, AJH","06/23/2023","3""TP","6/13/23","RHMA","4064","H",26.88,"11.6","36.5","1.4","35.1","G","Y","N",NA,"N",NA,2023-06-13,"2023","06","13","St. Thomas",18.320665,-64.867323
"1781","Oasis Cove","DIRECT INPUT","DG, AJH","06/23/2023","3""TP","6/13/23","RHMA","4065","H",17.16,"11.7","24.7","1.5","23.2","G","Y","N",NA,"N",NA,2023-06-13,"2023","06","13","St. Thomas",18.320665,-64.867323
"1782","Oasis Cove","DIRECT INPUT","DG, AJH","06/23/2023","3""TP","6/13/23","RHMA","4066","H",24,"11.5","32.7","1.3","31.4","G","Y","N","PLUM BROWN","N",NA,2023-06-13,"2023","06","13","St. Thomas",18.320665,-64.867323
"1783","Oasis Cove","DIRECT INPUT","DG, AJH","06/23/2023","3""TP","6/13/23","RHMA","4067","H",26.25,"11.3","33.6","1.4","32.2","G","Y","N","PLUM BROWN/ HEALTHY","N",NA,2023-06-13,"2023","06","13","St. Thomas",18.320665,-64.867323
"1784","Oasis Cove","DIRECT INPUT","DG, AJH","06/23/2023","3""TP","6/13/23","RHMA","4068","H",31.35,"12.2","35.6","1.4","34.2","G","Y","N",NA,"N",NA,2023-06-13,"2023","06","13","St. Thomas",18.320665,-64.867323
"1785","Oasis Cove","LP","AJH, AND, KWG",NA,"3'' TP","08-23-22","RHMA","2101","H",8.32,"10.2","16.8","1.1","15.8","B","N","Y",NA,"N",NA,2022-08-23,"2022","08","23","St. Thomas",18.320665,-64.867323
"1786","Oasis Cove","LP","AJH, AND, KWG",NA,"3'' TP","08-23-22","RHMA","2102","H",7.54,"10.3","16.7","1","15.8","BG","N","Y",NA,"N",NA,2022-08-23,"2022","08","23","St. Thomas",18.320665,-64.867323
"1787","Oasis Cove","LP","AJH, AND, KWG",NA,"3'' TP","08-23-22","RHMA","2103","H",43.28,"14.6","42.2","1.9","40.4","P","Y","N",NA,"N",NA,2022-08-23,"2022","08","23","St. Thomas",18.320665,-64.867323
"1788","Oasis Cove","LP","AJH, AND, KWG",NA,"3'' TP","08-23-22","RHMA","2104","H",17.54,"11.2","28.1","1.4","26.8","G","Y","N",NA,"N",NA,2022-08-23,"2022","08","23","St. Thomas",18.320665,-64.867323
"1789","Oasis Cove","LP","AJH, AND, KWG",NA,"3""","08-23-22","RHMA","2105","H",17.04,"13.1","25.7","1.5","24.2","B","N","Y",NA,"N",NA,2022-08-23,"2022","08","23","St. Thomas",18.320665,-64.867323
"1790","Oasis Cove","LP","AJH, AND, KWG",NA,"3''","08-23-22","RHMA","2106","H",6.72,"9.4","16.3","1","15.3","B","N","Y","curved","N",NA,2022-08-23,"2022","08","23","St. Thomas",18.320665,-64.867323
"1791","Oasis Cove","LP","AJH, AND, KWG",NA,"3""","08-23-22","RHMA","2107","H",39.37,"15.7","41.4","1.9","39.5","B","N","N","curved","N",NA,2022-08-23,"2022","08","23","St. Thomas",18.320665,-64.867323
"1792","Oasis Cove","LP","AJH, AND, KWG",NA,"3''","08-23-22","RHMA","2108","H",29.64,"13.9","36.6","1.3","35.3","B","Y","N",NA,"N",NA,2022-08-23,"2022","08","23","St. Thomas",18.320665,-64.867323
"1793","Oasis Cove","LP","AJH, AND, KWG",NA,"3""","08-23-22","RHMA","2109","H",34.55,"14.3","36","2","34","B","Y","N",NA,"N",NA,2022-08-23,"2022","08","23","St. Thomas",18.320665,-64.867323
"1794","Oasis Cove","LP","AJH, AND, KWG",NA,"3''","08-23-22","RHMA","2110","H",9.35,"10.1","20.8","1","19.8","B","N","N",NA,"N",NA,2022-08-23,"2022","08","23","St. Thomas",18.320665,-64.867323
"1795","Oasis Cove","DIRECT INPUT","DG, AJH","06/23/2023","3""TP","6/13/23","RHMA","4079","H",27.4,"12.8","33.2","1.8","31.4","GB","Y","N",NA,"N",NA,2023-06-13,"2023","06","13","St. Thomas",18.320665,-64.867323
"1796","Oasis Cove","DIRECT INPUT","DG, AJH","06/23/2023","3""TP","6/13/23","RHMA","4080","H",18.15,"11","27.4","1.4","26","GB","Y","N",NA,"N",NA,2023-06-13,"2023","06","13","St. Thomas",18.320665,-64.867323
"1797","Oasis Cove","DIRECT INPUT","DG, AJH","06/23/2023","3""TP","6/13/23","RHMA","4081","H",20,"11","28.1","1.6","26.5","G","N","N",NA,"N",NA,2023-06-13,"2023","06","13","St. Thomas",18.320665,-64.867323
"1798","Oasis Cove","DIRECT INPUT","DG, AJH","06/23/2023","3""TP","6/13/23","RHMA","4082","H",22.95,"12","30.4","1.6","28.8","G","N","N",NA,"N",NA,2023-06-13,"2023","06","13","St. Thomas",18.320665,-64.867323
"1799","Oasis Cove","DIRECT INPUT","DG, AJH","06/23/2023","3""TP","6/13/23","RHMA","4083","H",17,"10.7","26.1","1.5","24.6","G","N","N",NA,"N",NA,2023-06-13,"2023","06","13","St. Thomas",18.320665,-64.867323
"1800","Oasis Cove","DIRECT INPUT","DG, AJH","06/23/2023","3""TP","6/13/23","RHMA","4084","H",26.87,"12","35.1","1.3","33.8","G","N","N",NA,"N",NA,2023-06-13,"2023","06","13","St. Thomas",18.320665,-64.867323
"1801","Oasis Cove","DIRECT INPUT","DG, AJH","06/23/2023","3""TP","6/13/23","RHMA","4085","H",17.11,"12.1","23","1","22","G","N","N",NA,"N",NA,2023-06-13,"2023","06","13","St. Thomas",18.320665,-64.867323
"1802","Oasis Cove","DIRECT INPUT","DG, AJH","06/23/2023","3""TP","6/13/23","RHMA","4086","H",16.05,"11","24.9","1.5","23.4","G","N","N",NA,"N",NA,2023-06-13,"2023","06","13","St. Thomas",18.320665,-64.867323
"1803","Oasis Cove","JS, SC","JS, SC","1/29/2024","3""TP","1/29/2024","RHMA","3909","H",30.57,"11.9","43.2","1.9","41.3","G","N","N",NA,"N",NA,2024-01-29,"2024","01","29","St. Thomas",18.320665,-64.867323
"1804","Oasis Cove","JS, SC","JS, SC","1/29/2024","3""TP","1/29/2024","RHMA","3910","H",14.41,"10.3","27.5","1.5","26","B","N","N",NA,"N",NA,2024-01-29,"2024","01","29","St. Thomas",18.320665,-64.867323
"1805","Oasis Cove","JS, SC","JS, SC","1/29/2024","3""TP","1/29/2024","RHMA","3911","H",20.27,"10.8","31","1.5","29.5","B","N","N",NA,"N",NA,2024-01-29,"2024","01","29","St. Thomas",18.320665,-64.867323
"1806","Oasis Cove","JS, SC","JS, SC","1/29/2024","3""TP","1/29/2024","RHMA","3912","H",12.92,"10.5","24.4","1.3","23.1","B","N","N",NA,"N",NA,2024-01-29,"2024","01","29","St. Thomas",18.320665,-64.867323
"1807","Oasis Cove","JS, SC","JS, SC","1/29/2024","3""TP","1/29/2024","RHMA","3913","H",19.61,"10.5","30.9","1.5","29.4","G","N","N",NA,"N",NA,2024-01-29,"2024","01","29","St. Thomas",18.320665,-64.867323
"1808","Oasis Cove","JS, SC","JS, SC","1/29/2024","3""TP","1/29/2024","RHMA","3914","H",14.03,"10.4","24.6","1.3","23.3","B","N","N",NA,"N",NA,2024-01-29,"2024","01","29","St. Thomas",18.320665,-64.867323
"1809","Oasis Cove","JS, SC","JS, SC","1/29/2024","3""TP","1/29/2024","RHMA","3915","H",10,"8.9","23.2","1","22.2","B","N","N",NA,"N",NA,2024-01-29,"2024","01","29","St. Thomas",18.320665,-64.867323
"1810","Oasis Cove","JS, SC","JS, SC","1/29/2024","3""TP","1/29/2024","RHMA","3916","H",14.15,"11.5","24","1.3","22.7","GB","N","Y",NA,"N",NA,2024-01-29,"2024","01","29","St. Thomas",18.320665,-64.867323
"1811","Oasis Cove","JS, SC","JS, SC","1/29/2024","3""TP","1/29/2024","RHMA","3917","H",19,"12.5","26.4","1.3","25.1","B","N","N",NA,"N",NA,2024-01-29,"2024","01","29","St. Thomas",18.320665,-64.867323
"1812","Oasis Cove","JS, SC","JS, SC","1/29/2024","3""TP","1/29/2024","RHMA","3918","H",7.78,"8","20","1.1","18.9","B","N","N",NA,"N",NA,2024-01-29,"2024","01","29","St. Thomas",18.320665,-64.867323
"1813","Oasis Cove","JS, SC","JS, SC","1/29/2024","3""TP","1/29/2024","RHMA","3919","H",15.45,"10.6","28","1.2","26.8","B","N","Y",NA,"N",NA,2024-01-29,"2024","01","29","St. Thomas",18.320665,-64.867323
"1814","Oasis Cove","JS, SC","JS, SC","1/29/2024","3""TP","1/29/2024","RHMA","3920","H",12.95,"10.3","23.5","1.3","22.2","B","N","N",NA,"N",NA,2024-01-29,"2024","01","29","St. Thomas",18.320665,-64.867323
"1815","Oasis Cove","ST","AND, AH, KWG","05/11/2021","N/A","4/16/2021","RHMA","79","S",10.16,"9.67","23","1","21.8","BrGr","Y","N",NA,"N",NA,2021-04-16,"2021","04","16","St. Thomas",18.320665,-64.867323
"1816","Oasis Cove","ST","AND, AH, KWG","05/11/2021","N/A","4/16/2021","RHMA","80","H",9,"9.8","19.7","0.9","18.6","Br","Y","Y",NA,"N",NA,2021-04-16,"2021","04","16","St. Thomas",18.320665,-64.867323
"1817","Oasis Cove","ST","AND, AH, KWG","05/11/2021","N/A","4/16/2021","RHMA","81","H",5.38,"7.95","16.1","0.9","16","BrGr","Y","N",NA,"N",NA,2021-04-16,"2021","04","16","St. Thomas",18.320665,-64.867323
"1818","Oasis Cove","ST","AND, AH, KWG","05/11/2021","N/A","4/16/2021","RHMA","82","S",17.59,"10.62","31.6","1.6","30.2","BrGr","Y","Y",NA,"N",NA,2021-04-16,"2021","04","16","St. Thomas",18.320665,-64.867323
"1819","Oasis Cove","ST","AND, AH, KWG","05/11/2021","N/A","4/16/2021","RHMA","83","S",11.7,"9.53","25.6",NA,"25","BrGr","Y","Y",NA,"N",NA,2021-04-16,"2021","04","16","St. Thomas",18.320665,-64.867323
"1820","Oasis Cove","ST","AND, AH, KWG","05/11/2021","N/A","4/16/2021","RHMA","84","S",14,"10.2","24.4","1.5","22.9","OlGr","Y","Y",NA,"N",NA,2021-04-16,"2021","04","16","St. Thomas",18.320665,-64.867323
"1821","Oasis Cove","DIRECT INPUT","AJH, KWG",NA,"3""TP","02/09/2023","RHMA","3065","H",12.2,"7","23.3","1.5","21.8","G","Y","Y",NA,"N",NA,2023-02-09,"2023","02","09","St. Thomas",18.320665,-64.867323
"1822","Oasis Cove","ST","AND, AH, KWG","05/11/2021","N/A","4/16/2021","RHMA","86","H",12.4,"10.5","24.6","1.2","23.3","OlGr","Y","Y",NA,"N",NA,2021-04-16,"2021","04","16","St. Thomas",18.320665,-64.867323
"1823","Oasis Cove","ST","AND, AH, KWG","05/11/2021","N/A","4/16/2021","RHMA","87","H",26.89,"12.63","34.3","1.6","32.5","OlGr","Y","Y",NA,"N",NA,2021-04-16,"2021","04","16","St. Thomas",18.320665,-64.867323
"1824","Oasis Cove","ST","AND, AH, KWG","05/11/2021","N/A","4/16/2021","RHMA","88","S",7.44,"9.26","18.1","1","17.1","OlGr","Y","Y",NA,"N",NA,2021-04-16,"2021","04","16","St. Thomas",18.320665,-64.867323
"1825","Oasis Cove","MA","MA","10/04/2023","3"" TP","9/28/2023","RHMA","4737","H",30.26,"13","39","1.5","37.5","G","Y","N",NA,"N",NA,2023-09-28,"2023","09","28","St. Thomas",18.320665,-64.867323
"1826","Oasis Cove","DN","Crystal","9/28/24","CC","09/11/2024","RHMA","6182",NA,27.72,NA,NA,NA,"28",NA,NA,NA,NA,NA,"Blue",2024-09-11,"2024","09","11","St. Thomas",18.320665,-64.867323
"1827","Oasis Cove","KR","Rick Rossi","9/25/24","CC","09/11/2024","RHMA","6183",NA,20.67,NA,NA,NA,"27.2",NA,NA,NA,"Presidents Gala","C",NA,2024-09-11,"2024","09","11","St. Thomas",18.320665,-64.867323
"1828","Oasis Cove","KR","Zeidan Boss","9/25/24","CC","09/11/2024","RHMA","6184",NA,27.78,NA,NA,NA,"29.5",NA,NA,NA,"Presidents Gala","C",NA,2024-09-11,"2024","09","11","St. Thomas",18.320665,-64.867323
"1829","Oasis Cove","KR","Eversley Davis","9/25/24","CC","09/11/2024","RHMA","6185",NA,19.58,NA,NA,NA,"27",NA,NA,NA,"Presidents Gala","C",NA,2024-09-11,"2024","09","11","St. Thomas",18.320665,-64.867323
"1830","Oasis Cove","KR","Wendy Coram Violet","9/25/24","CC","09/11/2024","RHMA","6186",NA,20.41,NA,NA,NA,"37.5",NA,NA,NA,"Presidents Gala","C",NA,2024-09-11,"2024","09","11","St. Thomas",18.320665,-64.867323
"1831","Oasis Cove","KR","Darian Connor","9/25/24","CC","09/11/2024","RHMA","6187",NA,22.49,NA,NA,NA,"32.1",NA,NA,NA,"Presidents Gala","C",NA,2024-09-11,"2024","09","11","St. Thomas",18.320665,-64.867323
"1832","Oasis Cove","KR","Tamara James","9/25/24","CC","09/11/2024","RHMA","6188",NA,19.51,NA,NA,NA,"33",NA,NA,NA,"Presidents Gala","C",NA,2024-09-11,"2024","09","11","St. Thomas",18.320665,-64.867323
"1833","Oasis Cove","KR","Christina Creque","9/25/24","CC","09/11/2024","RHMA","6189",NA,28.17,NA,NA,NA,"33.6",NA,NA,NA,"Presidents Gala","C",NA,2024-09-11,"2024","09","11","St. Thomas",18.320665,-64.867323
"1834","Oasis Cove","DN",NA,"9/28/24","CC","09/11/2024","RHMA","6190",NA,37.93,NA,NA,NA,"36",NA,NA,NA,NA,"VICM Day of Play","Hummingbird",2024-09-11,"2024","09","11","St. Thomas",18.320665,-64.867323
"1835","Oasis Cove","DN",NA,"9/28/24","CC","09/11/2024","RHMA","6191",NA,32.52,NA,NA,NA,"36.5",NA,NA,NA,NA,"VICM Day of Play","Rosie",2024-09-11,"2024","09","11","St. Thomas",18.320665,-64.867323
"1836","Oasis Cove","DN","Glie","9/28/24","CC","09/11/2024","RHMA","6192",NA,41.06,NA,NA,NA,"42.5",NA,NA,NA,NA,"VICM Day of Play","Tiffany",2024-09-11,"2024","09","11","St. Thomas",18.320665,-64.867323
"1837","Oasis Cove","DN","Ava","9/28/24","CC","09/11/2024","RHMA","6193",NA,18.69,NA,NA,NA,"24.5",NA,NA,NA,NA,"VICM Day of Play","Rihana",2024-09-11,"2024","09","11","St. Thomas",18.320665,-64.867323
"1838","Oasis Cove","DN","Keiori","9/28/24","CC","09/11/2024","RHMA","6194",NA,23.53,NA,NA,NA,"31",NA,NA,NA,NA,"VICM Day of Play","Lily",2024-09-11,"2024","09","11","St. Thomas",18.320665,-64.867323
"1839","Oasis Cove","DN","Kashayla","9/28/24","CC","09/11/2024","RHMA","6195",NA,21.34,NA,NA,NA,"28",NA,NA,NA,NA,"VICM Day of Play","Rose",2024-09-11,"2024","09","11","St. Thomas",18.320665,-64.867323
"1840","Oasis Cove","DIRECT INPUT","DG","04/25/2023","CC",NA,"RHMA","E2-199","H",15.82,NA,"27.5",NA,"26.5","G","N",NA,NA,"E","ADIRA",NA,NA,NA,NA,"St. Thomas",18.320665,-64.867323
"1841","Oasis Cove","MA","MA","10/04/2023","3"" TP","9/28/2023","RHMA","4753","H",19.91,"12.5","27.7","1.7","26","G","N","N",NA,"N",NA,2023-09-28,"2023","09","28","St. Thomas",18.320665,-64.867323
"1842","Oasis Cove","MA","MA","10/04/2023","3"" TP","9/28/2023","RHMA","4754","H",14.77,"11.2","24.6","1.1","23.5","G","N","Y",NA,"N",NA,2023-09-28,"2023","09","28","St. Thomas",18.320665,-64.867323
"1843","Oasis Cove","MA","MA","10/04/2023","3"" TP","9/28/2023","RHMA","4755","H",25.76,"13","34","1.7","32.3","G","Y","Y",NA,"N",NA,2023-09-28,"2023","09","28","St. Thomas",18.320665,-64.867323
"1844","Oasis Cove","MA","MA","10/04/2023","3"" TP","9/28/2023","RHMA","4756","H",20.09,"12.2","27.1","1.5","25.6","G","Y","Y",NA,"N",NA,2023-09-28,"2023","09","28","St. Thomas",18.320665,-64.867323
"1845","Oasis Cove","MA","MA","10/04/2023","3"" TP","9/28/2023","RHMA","4757","H",13.53,"11.3","24.2","1.2","23","G","Y","N",NA,"N",NA,2023-09-28,"2023","09","28","St. Thomas",18.320665,-64.867323
"1846","Oasis Cove","MA","MA","10/04/2023","3"" TP","9/28/2023","RHMA","4758","H",11.58,"11.1","21.6","1.3","20.3","G","Y","Y",NA,"N",NA,2023-09-28,"2023","09","28","St. Thomas",18.320665,-64.867323
"1847","Oasis Cove","MA","MA","10/04/2023","3"" TP","9/28/2023","RHMA","4759","H",16,"11.5","27.6","1.6","26","G","Y","N",NA,"N",NA,2023-09-28,"2023","09","28","St. Thomas",18.320665,-64.867323
"1848","Oasis Cove","MA","MA","10/04/2023","3"" TP","9/28/2023","RHMA","4760","H",16.62,"11.6","28.4","1.4","27","G","Y","N",NA,"N",NA,2023-09-28,"2023","09","28","St. Thomas",18.320665,-64.867323
"1849","Oasis Cove","MA","MA","10/04/2023","3"" TP","9/28/2023","RHMA","4761","H",11.58,"11.5","22.6","1.4","21.2","G","N","N",NA,"N",NA,2023-09-28,"2023","09","28","St. Thomas",18.320665,-64.867323
"1850","Oasis Cove","MA","MA","10/04/2023","3"" TP","9/28/2023","RHMA","4762","H",24.78,"12.4","34.6","1.6","33","G","Y","N",NA,"N",NA,2023-09-28,"2023","09","28","St. Thomas",18.320665,-64.867323
"1851","Oasis Cove","MA","MA","10/04/2023","3"" TP","9/28/2023","RHMA","4763","H",35.56,"13.5","42.2","1.7","40.5","G","Y","N",NA,"N",NA,2023-09-28,"2023","09","28","St. Thomas",18.320665,-64.867323
"1852","Oasis Cove","MA","MA","10/04/2023","3"" TP","9/28/2023","RHMA","4764","H",37.48,"13.2","44.5","2","42.5","G","Y","N",NA,"N",NA,2023-09-28,"2023","09","28","St. Thomas",18.320665,-64.867323
"1853","Oasis Cove","MA","MA","10/04/2023","3"" TP","9/28/2023","RHMA","4765","H",33,"12.2","34.9","1.4","33.5","G","N","N",NA,"N",NA,2023-09-28,"2023","09","28","St. Thomas",18.320665,-64.867323
"1854","Oasis Cove","MA","MA","10/04/2023","3"" TP","9/28/2023","RHMA","4766","H",13.31,"11.5","24.2","1.4","22.8","G","N","Y",NA,"N",NA,2023-09-28,"2023","09","28","St. Thomas",18.320665,-64.867323
"1855","Oasis Cove","MA","MA","10/04/2023","3"" TP","9/28/2023","RHMA","4767","H",15.77,"12.6","21.6","1.5","20.1","G","N","Y",NA,"N",NA,2023-09-28,"2023","09","28","St. Thomas",18.320665,-64.867323
"1856","Oasis Cove","DIRECT INPUT","DG","04/25/2023","CC",NA,"RHMA","E2-215","H",22.05,"12","30.3",NA,"29","B","Y",NA,NA,"E","SMILE KYLE",NA,NA,NA,NA,"St. Thomas",18.320665,-64.867323
"1857","Oasis Cove","DIRECT INPUT","DG","04/25/2023","CC",NA,"RHMA","E2-216","H",14.66,"1.07","24.5",NA,"23.5","G","N",NA,NA,"E","TOMMY",NA,NA,NA,NA,"St. Thomas",18.320665,-64.867323
"1858","Oasis Cove","DIRECT INPUT","DG","04/25/2023","CC",NA,"RHMA","E2-217","H",15.46,"10.5","27.4",NA,"26.3","G","N",NA,NA,"E","I DONT KNOW",NA,NA,NA,NA,"St. Thomas",18.320665,-64.867323
"1859","Oasis Cove","DIRECT INPUT","DG","04/25/2023","CC",NA,"RHMA","E2-218","H",16.37,"10.1","25",NA,"24","G","Y",NA,NA,"E","JAHOL JIMMY",NA,NA,NA,NA,"St. Thomas",18.320665,-64.867323
"1860","Oasis Cove","DIRECT INPUT","DG","04/25/2023","CC",NA,"RHMA","E2-219","H",18.16,"12","29",NA,"27.5","G","Y",NA,NA,"E","QUANDALE DINGLE",NA,NA,NA,NA,"St. Thomas",18.320665,-64.867323
"1861","Oasis Cove","DIRECT INPUT","DG","04/25/2023","CC",NA,"RHMA","E2-220","H",18.35,"10","22.5",NA,"21.5","G","Y",NA,NA,"E","187",NA,NA,NA,NA,"St. Thomas",18.320665,-64.867323
"1862","Oasis Cove","DIRECT INPUT","DG","04/25/2023","CC",NA,"RHMA","E2-221","H",11.59,"9","24.5",NA,"23.5","G","Y",NA,NA,"E","BARTHALAMOUE GINGERSNAP THE III",NA,NA,NA,NA,"St. Thomas",18.320665,-64.867323
"1863","Oasis Cove","DIRECT INPUT","DG","04/25/2023","CC",NA,"RHMA","E2-222","H",19.78,"11.9","29.5",NA,"28.1","G","Y",NA,NA,"E","JERRY 2.0",NA,NA,NA,NA,"St. Thomas",18.320665,-64.867323
"1864","Oasis Cove","DIRECT INPUT","DG","04/25/2023","CC",NA,"RHMA","E2-223","H",12,"10.5","24.2",NA,"22.9","G","N",NA,NA,"E",NA,NA,NA,NA,NA,"St. Thomas",18.320665,-64.867323
"1865","Oasis Cove","DIRECT INPUT","DG","04/25/2023","CC",NA,"RHMA","E2-224","H",5.7,"8.2","16.2",NA,"15.2","G","N",NA,NA,"E",NA,NA,NA,NA,NA,"St. Thomas",18.320665,-64.867323
"1866","Oasis Cove","DIRECT INPUT","DG","04/25/2023","CC",NA,"RHMA","E2-225","H",13.5,"10","23.6",NA,"22.7","G","Y",NA,NA,"E",NA,NA,NA,NA,NA,"St. Thomas",18.320665,-64.867323
"1867","Oasis Cove","DIRECT INPUT","DG","04/25/2023","CC",NA,"RHMA","E2-226","H",7.1,"9.5","18",NA,"17.1","G","N",NA,NA,"E",NA,NA,NA,NA,NA,"St. Thomas",18.320665,-64.867323
"1868","Oasis Cove","DIRECT INPUT","DG","04/25/2023","CC",NA,"RHMA","E2-227","H",8.82,"11.3","15.2",NA,"14.3","G","N",NA,NA,"E",NA,NA,NA,NA,NA,"St. Thomas",18.320665,-64.867323
"1869","Oasis Cove","DIRECT INPUT","DG","04/25/2023","CC",NA,"RHMA","E2-228","H",9.63,"8.6","23.4",NA,"22.5","G","Y",NA,NA,"E","BILINDA",NA,NA,NA,NA,"St. Thomas",18.320665,-64.867323
"1870","Oasis Cove","DIRECT INPUT","DG","04/25/2023","CC",NA,"RHMA","E2-229","H",19.62,"11","30",NA,"28.5","G","Y",NA,NA,"E","REDNO-REDTAIL\",NA,NA,NA,NA,"St. Thomas",18.320665,-64.867323
"1871","Oasis Cove","DIRECT INPUT","DG","04/25/2023","CC",NA,"RHMA","E2-230","H",9.45,"9.1","25.3",NA,"25.3","G","Y",NA,NA,"E","JERRY",NA,NA,NA,NA,"St. Thomas",18.320665,-64.867323
"1872","Oasis Cove","DIRECT INPUT","DG","04/25/2023","CC",NA,"RHMA","E2-231","H",16.73,"9.4","22.8",NA,"22","G","N",NA,NA,"E","MANY THE MANGROVE",NA,NA,NA,NA,"St. Thomas",18.320665,-64.867323
"1873","Oasis Cove","DIRECT INPUT","DG","04/25/2023","CC",NA,"RHMA","E2-232","H",8.16,"8","21.8",NA,"20.5","G","N",NA,NA,"E","MALINDA",NA,NA,NA,NA,"St. Thomas",18.320665,-64.867323
"1874","Oasis Cove","DIRECT INPUT","DG","04/25/2023","CC",NA,"RHMA","E2-233","H",13.22,"9.8","25.5",NA,"24.2","G","N",NA,NA,"E","BOB THE PLANT",NA,NA,NA,NA,"St. Thomas",18.320665,-64.867323
"1875","Oasis Cove","DIRECT INPUT","DG","04/25/2023","CC",NA,"RHMA","E2-234","H",10.63,"9.1","21.3",NA,"20.3","G","Y",NA,NA,"E",NA,NA,NA,NA,NA,"St. Thomas",18.320665,-64.867323
"1876","Oasis Cove","DIRECT INPUT","DG","04/25/2023","CC",NA,"RHMA","E2-235","H",7.23,"6","20.8",NA,"19.6","G","N",NA,NA,"E",NA,NA,NA,NA,NA,"St. Thomas",18.320665,-64.867323
"1877","Oasis Cove","DIRECT INPUT","DG","04/25/2023","CC",NA,"RHMA","E2-236","H",7.73,"6.9","18",NA,"17","G","N",NA,NA,"E",NA,NA,NA,NA,NA,"St. Thomas",18.320665,-64.867323
"1878","Oasis Cove","DIRECT INPUT","DG","04/25/2023","CC",NA,"RHMA","E2-237","H",7.7,"8.2","18",NA,"17.1","G","N",NA,NA,"E",NA,NA,NA,NA,NA,"St. Thomas",18.320665,-64.867323
"1879","Oasis Cove","DIRECT INPUT","DG","04/25/2023","CC",NA,"RHMA","E2-238","H",10.41,"6.8","22.4",NA,"21.3","G","N",NA,NA,"E",NA,NA,NA,NA,NA,"St. Thomas",18.320665,-64.867323
"1880","Oasis Cove","DIRECT INPUT","DG","04/25/2023","CC",NA,"RHMA","E2-239","H",14.41,"8.8","25.8",NA,"24.8","G","Y",NA,NA,"E",NA,NA,NA,NA,NA,"St. Thomas",18.320665,-64.867323
"1881","Oasis Cove","DIRECT INPUT","DG","04/25/2023","CC",NA,"RHMA","E2-241","H",8.14,"5.9","20.3",NA,"20.2","G","Y",NA,"DAMGED PLUM","E",NA,NA,NA,NA,NA,"St. Thomas",18.320665,-64.867323
"1882","Oasis Cove","DIRECT INPUT","DG","04/25/2023","CC",NA,"RHMA","E2-242","H",8.9,"6.7","19.9",NA,"19.2","B","N",NA,NA,"E",NA,NA,NA,NA,NA,"St. Thomas",18.320665,-64.867323
"1883","Oasis Cove","DIRECT INPUT","DG","04/25/2023","CC",NA,"RHMA","E2-243","H",5.85,"8","17",NA,"16","G","Y",NA,NA,"E",NA,NA,NA,NA,NA,"St. Thomas",18.320665,-64.867323
"1884","Oasis Cove","DIRECT INPUT","DG","04/25/2023","CC",NA,"RHMA","E2-244","H",23.25,"13","31.3",NA,"30","B","Y",NA,"BROKEN HYPOCOTYL","E",NA,NA,NA,NA,NA,"St. Thomas",18.320665,-64.867323
"1885","Oasis Cove","DIRECT INPUT","DG","04/25/2023","CC",NA,"RHMA","E2-245","H",8.4,"8.4","19.2",NA,"18.5","G","Y",NA,NA,"E",NA,NA,NA,NA,NA,"St. Thomas",18.320665,-64.867323
"1886","Oasis Cove","DIRECT INPUT","DG","04/25/2023","CC",NA,"RHMA","E2-246","H",7,"6.8","21",NA,"20.2","G","N",NA,NA,"E",NA,NA,NA,NA,NA,"St. Thomas",18.320665,-64.867323
"1887","Oasis Cove","DIRECT INPUT","DG","04/25/2023","CC",NA,"RHMA","E2-246","H",7.37,"9","16.1",NA,"15.2","P","P",NA,NA,"E",NA,NA,NA,NA,NA,"St. Thomas",18.320665,-64.867323
"1888","Oasis Cove","DIRECT INPUT","DG","04/25/2023","CC",NA,"RHMA","E2-247","H",4.5,"7.8","15",NA,"14.5","G","N",NA,"VERY DAMAGED","E",NA,NA,NA,NA,NA,"St. Thomas",18.320665,-64.867323
"1889","Oasis Cove","DIRECT INPUT","DG","04/25/2023","CC",NA,"RHMA","E2-250","H",13.74,"6.7","27.7",NA,"26.8","G","Y",NA,NA,"E","BIG TOE BRADLEY",NA,NA,NA,NA,"St. Thomas",18.320665,-64.867323
"1890","Oasis Cove","DIRECT INPUT","DG","04/25/2023","CC",NA,"RHMA","E2-251","H",9.79,"5.4","24.7",NA,"23.5","G","N",NA,NA,"E","BRAINS",NA,NA,NA,NA,"St. Thomas",18.320665,-64.867323
"1891","Oasis Cove","DIRECT INPUT","DG, AJH","06/23/2023","4''TP","6/13/23","RHMA","4054","H",12.03,"10.9","20.6","1.1","19.5","G","N","Y",NA,"N",NA,2023-06-13,"2023","06","13","St. Thomas",18.320665,-64.867323
"1892","Oasis Cove","DIRECT INPUT","DG, AJH","06/23/2023","4''TP","6/13/23","RHMA","4055","H",5.86,"8.3","16.9","0.9","16","G","N","Y",NA,"N",NA,2023-06-13,"2023","06","13","St. Thomas",18.320665,-64.867323
"1893","Oasis Cove","DIRECT INPUT","DG, AJH","06/23/2023","4''TP","6/13/23","RHMA","4056","H",6,"7.6","17","1","16","G","N","Y",NA,"N",NA,2023-06-13,"2023","06","13","St. Thomas",18.320665,-64.867323
"1894","Oasis Cove","DIRECT INPUT","DG, AJH","06/23/2023","3""TP","6/13/23","RHMA","4057","H",15.79,"9.9","27.6","1.2","26.4","G","N","Y",NA,"N",NA,2023-06-13,"2023","06","13","St. Thomas",18.320665,-64.867323
"1895","Oasis Cove","DIRECT INPUT","DG, AJH","06/23/2023","3""TP","6/13/23","RHMA","4058","H",21.54,"10.6","33.9","1.3","32.6","G","Y","Y",NA,"N",NA,2023-06-13,"2023","06","13","St. Thomas",18.320665,-64.867323
"1896","Oasis Cove","DIRECT INPUT","DG, AJH","06/23/2023","3""TP","6/13/23","RHMA","4059","H",16.86,"11.2","26.3","1","25.3","G","Y","N",NA,"N",NA,2023-06-13,"2023","06","13","St. Thomas",18.320665,-64.867323
"1897","Oasis Cove","DIRECT INPUT","DG, AJH","06/23/2023","3""TP","6/13/23","RHMA","4060","H",14.93,"10.2","26.6","1.2","25.4","G","Y","N",NA,"N",NA,2023-06-13,"2023","06","13","St. Thomas",18.320665,-64.867323
"1898","Oasis Cove","DIRECT INPUT","DG, AJH","06/23/2023","3""TP","6/13/23","RHMA","4061","H",22.64,"10.7","32.6","1.4","31.2","G","Y","N",NA,"N",NA,2023-06-13,"2023","06","13","St. Thomas",18.320665,-64.867323
"1899","Oasis Cove","DIRECT INPUT","DG","04/25/2023","CC",NA,"RHMA","E2-48","H",17.64,"9","23.7",NA,"22.6","B","N",NA,NA,"E",NA,NA,NA,NA,NA,"St. Thomas",18.320665,-64.867323
"1900","Oasis Cove","DN","Abd","9/28/24","CC","09/11/2024","RHMA","6256",NA,17.72,NA,NA,NA,"32.4",NA,NA,NA,NA,"VICM Day of Play","Abd 23",2024-09-11,"2024","09","11","St. Thomas",18.320665,-64.867323
"1901","Oasis Cove","DN","Kaylie","9/28/24","CC","09/11/2024","RHMA","6257",NA,21.84,NA,NA,NA,"34.1",NA,NA,NA,NA,"VICM Day of Play","Tiki",2024-09-11,"2024","09","11","St. Thomas",18.320665,-64.867323
"1902","Oasis Cove","DN","Kasani","9/28/24","CC","09/11/2024","RHMA","6258",NA,34.1,NA,NA,NA,"37.6",NA,NA,NA,NA,"VICM Day of Play","Roses",2024-09-11,"2024","09","11","St. Thomas",18.320665,-64.867323
"1903","Oasis Cove","DN","Owencla","9/28/24","CC","09/11/2024","RHMA","6259",NA,20.74,NA,NA,NA,"32",NA,NA,NA,NA,"VICM Day of Play","Mushroom",2024-09-11,"2024","09","11","St. Thomas",18.320665,-64.867323
"1904","Oasis Cove","DN","Lisa","9/28/24","CC","09/11/2024","RHMA","6260",NA,22.25,NA,NA,NA,"34.1",NA,NA,NA,NA,"VICM Day of Play","Lavender",2024-09-11,"2024","09","11","St. Thomas",18.320665,-64.867323
"1905","Oasis Cove","LU","Julien","9/28/24","CC","09/11/2024","RHMA","6261",NA,15.77,NA,NA,NA,"26",NA,NA,NA,NA,"VICM Day of Play","Julien",2024-09-11,"2024","09","11","St. Thomas",18.320665,-64.867323
"1906","Oasis Cove","LU","Waim","9/28/24","CC","09/11/2024","RHMA","6262",NA,13.74,NA,NA,NA,"28.5",NA,NA,NA,NA,"VICM Day of Play","Love",2024-09-11,"2024","09","11","St. Thomas",18.320665,-64.867323
"1907","Oasis Cove","LU","LU","9/28/24","CC","09/11/2024","RHMA","6263",NA,13.08,NA,NA,NA,"28",NA,NA,NA,NA,"VICM Day of Play","daisy",2024-09-11,"2024","09","11","St. Thomas",18.320665,-64.867323
"1908","Oasis Cove","LU","LU","9/28/24","CC","09/11/2024","RHMA","6264",NA,17.24,NA,NA,NA,"28",NA,NA,NA,NA,"VICM Day of Play","precious",2024-09-11,"2024","09","11","St. Thomas",18.320665,-64.867323
"1909","Oasis Cove","LU","Khalsawi","9/28/24","CC","09/11/2024","RHMA","6265",NA,22.44,NA,NA,NA,"27.3",NA,NA,NA,NA,"VICM Day of Play","Jason",2024-09-11,"2024","09","11","St. Thomas",18.320665,-64.867323
"1910","Oasis Cove","LU","LU","9/28/24","CC","09/11/2024","RHMA","6266",NA,21.39,NA,NA,NA,"27",NA,NA,NA,NA,"VICM Day of Play","flower",2024-09-11,"2024","09","11","St. Thomas",18.320665,-64.867323
"1911","Oasis Cove","Direct Input","LU & DN","11/07/2024","CC","10/25/2024","RHMA","6579","H",12.14,"10.6","20.6","1.3","19.3","G","Y","Y",NA,NA,NA,2024-10-25,"2024","10","25","St. Thomas",18.320665,-64.867323
"1912","Oasis Cove","Direct Input","LU & DN","11/07/2024","CC","10/25/2024","RHMA","6580","H",18.91,"12.3","28.1","1.5","26.6","G","Y","Y",NA,NA,NA,2024-10-25,"2024","10","25","St. Thomas",18.320665,-64.867323
"1913","Oasis Cove","DIRECT INPUT","DG, AJH","06/23/2023","3""TP","6/13/23","RHMA","4075","H",24.72,"12.9","30.9","1.5","29.4","B","Y","N",NA,"N",NA,2023-06-13,"2023","06","13","St. Thomas",18.320665,-64.867323
"1914","Oasis Cove","DIRECT INPUT","DG, AJH","06/23/2023","3""TP","6/13/23","RHMA","4076","H",30.34,"12.9","36.6","1.6","35","GB","N","N",NA,"N",NA,2023-06-13,"2023","06","13","St. Thomas",18.320665,-64.867323
"1915","Oasis Cove","DIRECT INPUT","DG, AJH","06/23/2023","3""TP","6/13/23","RHMA","4077","H",23.86,"10.8","32.5","1.5","31","GB","Y","N",NA,"N",NA,2023-06-13,"2023","06","13","St. Thomas",18.320665,-64.867323
"1916","Oasis Cove","LU","LU","9/28/24","CC","09/11/2024","RHMA","6272",NA,14.08,NA,NA,NA,"28",NA,NA,NA,NA,"VICM Day of Play","bingo",2024-09-11,"2024","09","11","St. Thomas",18.320665,-64.867323
"1917","Oasis Cove","LU","LU","9/28/24","CC","09/11/2024","RHMA","6273",NA,11.11,NA,NA,NA,"24",NA,NA,NA,NA,"VICM Day of Play","justin",2024-09-11,"2024","09","11","St. Thomas",18.320665,-64.867323
"1918","Oasis Cove","LU","LU","9/28/24","CC","09/11/2024","RHMA","6274",NA,14.88,NA,NA,NA,"28",NA,NA,NA,NA,"VICM Day of Play","gogo",2024-09-11,"2024","09","11","St. Thomas",18.320665,-64.867323
"1919","Oasis Cove","LU","LU","9/28/24","CC","09/11/2024","RHMA","6275",NA,13.47,NA,NA,NA,"22",NA,NA,NA,NA,"VICM Day of Play","mango",2024-09-11,"2024","09","11","St. Thomas",18.320665,-64.867323
"1920","Oasis Cove","LU","LU","9/28/24","CC","09/11/2024","RHMA","6276",NA,12.12,NA,NA,NA,"23",NA,NA,NA,NA,"VICM Day of Play","apple",2024-09-11,"2024","09","11","St. Thomas",18.320665,-64.867323
"1921","Oasis Cove","LU","LU","9/28/24","CC","09/11/2024","RHMA","6277",NA,20.59,NA,NA,NA,"28.5",NA,NA,NA,NA,"VICM Day of Play","mira",2024-09-11,"2024","09","11","St. Thomas",18.320665,-64.867323
"1922","Oasis Cove","LU","LU","9/28/24","CC","09/11/2024","RHMA","6278",NA,19.63,NA,NA,NA,"25",NA,NA,NA,NA,"VICM Day of Play","cali",2024-09-11,"2024","09","11","St. Thomas",18.320665,-64.867323
"1923","Oasis Cove","LU","LU","9/28/24","CC","09/11/2024","RHMA","6279",NA,21.6,NA,NA,NA,"28",NA,NA,NA,NA,"VICM Day of Play","apple",2024-09-11,"2024","09","11","St. Thomas",18.320665,-64.867323
"1924","Oasis Cove","DIRECT INPUT","DG, AJH","06/23/2023","3""TP","6/13/23","RHMA","4087","H",11.07,"8.4","21","1.2","19.8","G","N","N",NA,"N",NA,2023-06-13,"2023","06","13","St. Thomas",18.320665,-64.867323
"1925","Oasis Cove","DIRECT INPUT","DG, AJH","06/23/2023","3""TP","6/13/23","RHMA","4088","H",25.77,"11.7","31.6","1.9","29.7","G","Y","N",NA,"N",NA,2023-06-13,"2023","06","13","St. Thomas",18.320665,-64.867323
"1926","Oasis Cove","DIRECT INPUT","DG, AJH","06/23/2023","3""TP","6/13/23","RHMA","4089","H",30.22,"12.3","34.4","1.6","32.8","G","Y","N",NA,"N",NA,2023-06-13,"2023","06","13","St. Thomas",18.320665,-64.867323
"1927","Oasis Cove","DIRECT INPUT","DG, AJH","06/23/2023","3""TP","6/13/23","RHMA","4090","H",9.48,"9.4","18.9","0.9","18","G","Y","N",NA,"N",NA,2023-06-13,"2023","06","13","St. Thomas",18.320665,-64.867323
"1928","Oasis Cove","DIRECT INPUT","DG, AJH","06/23/2023","3""TP","6/13/23","RHMA","4091","H",24.17,"11","31","0.5","30.5","G","Y","N",NA,"N",NA,2023-06-13,"2023","06","13","St. Thomas",18.320665,-64.867323
"1929","Oasis Cove","DIRECT INPUT","DG, AJH","06/23/2023","3""TP","6/13/23","RHMA","4092","H",12.13,"9.7","24","1.1","22.9","G","Y","N",NA,"N",NA,2023-06-13,"2023","06","13","St. Thomas",18.320665,-64.867323
"1930","Oasis Cove","DIRECT INPUT","DG, AJH","06/23/2023","4""TP","6/13/23","RHMA","4093","H",17.35,"11.5","26","1.5","24.5","G","Y","N",NA,"N",NA,2023-06-13,"2023","06","13","St. Thomas",18.320665,-64.867323
"1931","Oasis Cove","DIRECT INPUT","DG, AJH","06/23/2023","4""TP","6/13/23","RHMA","4094","H",28.47,"12.5","23.6","1.6","22","G","Y","N",NA,"N",NA,2023-06-13,"2023","06","13","St. Thomas",18.320665,-64.867323
"1932","Oasis Cove","DIRECT INPUT","DG, AJH","06/23/2023","4""TP","6/13/23","RHMA","4095","H",24.93,"12.5","29.8","1.3","28.5","B","Y","N",NA,"N",NA,2023-06-13,"2023","06","13","St. Thomas",18.320665,-64.867323
"1933","Oasis Cove","DIRECT INPUT","DG, AJH","06/23/2023","4""TP","6/13/23","RHMA","4096","H",21.49,"11","30.7","1","29.7","G","Y","N","PLUM DAMAGE","N",NA,2023-06-13,"2023","06","13","St. Thomas",18.320665,-64.867323
"1934","Oasis Cove","DIRECT INPUT","DG, AJH","06/23/2023","4""TP","6/13/23","RHMA","4097","H",19.64,"10.8","31.1","1.2","29.9","G","Y","N",NA,"N",NA,2023-06-13,"2023","06","13","St. Thomas",18.320665,-64.867323
"1935","Oasis Cove","DIRECT INPUT","DG, AJH","06/23/2023","4""TP","6/13/23","RHMA","4098","H",15.9,"9.3","28.9","1.3","27.6","G","Y","N",NA,"N",NA,2023-06-13,"2023","06","13","St. Thomas",18.320665,-64.867323
"1936","Oasis Cove","AB","AND, KWG, ZR",NA,"CC","02-15-23","RHMA","3006","H",10,NA,"18",NA,NA,NA,NA,NA,"STX Ag Fair","C","Zia",2023-02-15,"2023","02","15","St. Thomas",18.320665,-64.867323
"1937","Oasis Cove","AB","AND, KWG, ZR",NA,"CC","02-17-23","RHMA","3007","H",9.4,NA,"16.5",NA,NA,NA,NA,NA,"STX Ag Fair","C","Balto",2023-02-17,"2023","02","17","St. Thomas",18.320665,-64.867323
"1938","Oasis Cove","AB","AND, KWG, ZR",NA,"CC","02-15-23","RHMA","3008","H",8.74,NA,"10",NA,NA,NA,NA,NA,"STX Ag Fair","C","Oliver",2023-02-15,"2023","02","15","St. Thomas",18.320665,-64.867323
"1939","Oasis Cove","AB","AND, KWG, ZR",NA,"CC","02-17-23","RHMA","3009","H",8.74,NA,"20",NA,NA,NA,NA,NA,"STX Ag Fair","C",NA,2023-02-17,"2023","02","17","St. Thomas",18.320665,-64.867323
"1940","Oasis Cove","AB","AND, KWG, ZR",NA,"CC","02-17-23","RHMA","3010","H",14,NA,"29",NA,NA,NA,NA,NA,"STX Ag Fair","C","Croix",2023-02-17,"2023","02","17","St. Thomas",18.320665,-64.867323
"1941","Oasis Cove","AB","AND, KWG, ZR",NA,"CC","02-17-23","RHMA","3011","H",23.2,NA,"15",NA,NA,NA,NA,NA,"STX Ag Fair","C","Pookie Wilson",2023-02-17,"2023","02","17","St. Thomas",18.320665,-64.867323
"1942","Oasis Cove","AB","AND, KWG, ZR",NA,"CC","02-17-23","RHMA","3012","H",26,NA,"20",NA,NA,NA,NA,NA,"STX Ag Fair","C","Maclane",2023-02-17,"2023","02","17","St. Thomas",18.320665,-64.867323
"1943","Oasis Cove","DN","Diorgio","9/28/24","CC","09/11/2024","RHMA","6178",NA,16.29,NA,NA,NA,"40.4",NA,NA,NA,NA,NA,"Frog Palace",2024-09-11,"2024","09","11","St. Thomas",18.320665,-64.867323
"1944","Oasis Cove","DN","Lauren","9/28/24","CC","09/11/2024","RHMA","6179",NA,16.29,NA,NA,NA,"30",NA,NA,NA,NA,NA,"Mr. Sprinkles",2024-09-11,"2024","09","11","St. Thomas",18.320665,-64.867323
"1945","Oasis Cove","DN","Sariah","9/28/24","CC","09/11/2024","RHMA","6180",NA,23.61,NA,NA,NA,"36.5",NA,NA,NA,NA,NA,"mimi",2024-09-11,"2024","09","11","St. Thomas",18.320665,-64.867323
"1946","Oasis Cove","DN","Olivia","9/28/24","CC","09/11/2024","RHMA","6181",NA,25.54,NA,NA,NA,"33.4",NA,NA,NA,NA,NA,"Kozia",2024-09-11,"2024","09","11","St. Thomas",18.320665,-64.867323
"1947","Oasis Cove","AB","AND, KWG",NA,"CC","02-15-23","RHMA","3017","H",4.2,NA,"12",NA,NA,NA,NA,NA,"STX Ag Fair","C","Ellie",2023-02-15,"2023","02","15","St. Thomas",18.320665,-64.867323
"1948","Oasis Cove","AB","AND, KWG",NA,"CC","02-15-23","RHMA","3018","H",9.06,NA,"15",NA,NA,NA,NA,NA,"STX Ag Fair","C","Nathanel",2023-02-15,"2023","02","15","St. Thomas",18.320665,-64.867323
"1949","Oasis Cove","AB","AND, KWG",NA,"CC","02-15-23","RHMA","3019","H",5.3,NA,"16",NA,NA,NA,NA,NA,"STX Ag Fair","C","Sleeping Beauty",2023-02-15,"2023","02","15","St. Thomas",18.320665,-64.867323
"1950","Oasis Cove","AB","AND, KWG",NA,"CC","02-17-23","RHMA","3020","H",21.4,NA,"26",NA,NA,NA,NA,NA,"STX Ag Fair","C","Ava",2023-02-17,"2023","02","17","St. Thomas",18.320665,-64.867323
"1951","Oasis Cove","AB","AND, KWG",NA,"CC","02-17-23","RHMA","3021","H",4.2,NA,"29.5",NA,NA,NA,NA,NA,"STX Ag Fair","C","Redie (Pt 2)",2023-02-17,"2023","02","17","St. Thomas",18.320665,-64.867323
"1952","Oasis Cove","AB","AND, KWG",NA,"CC","02-17-23","RHMA","3022","H",15.14,NA,"23.5",NA,NA,NA,NA,NA,"STX Ag Fair","C","Jojobino",2023-02-17,"2023","02","17","St. Thomas",18.320665,-64.867323
"1953","Oasis Cove","AB","AND, KWG",NA,"CC","02-15-23","RHMA","3023","H",5.48,NA,"15",NA,NA,NA,NA,NA,"STX Ag Fair","C","JJ Mangroves",2023-02-15,"2023","02","15","St. Thomas",18.320665,-64.867323
"1954","Oasis Cove","AB","AND, KWG",NA,"CC","02-15-23","RHMA","3024","H",3.62,NA,"8.5",NA,NA,NA,NA,NA,"STX Ag Fair","C","Lady Red",2023-02-15,"2023","02","15","St. Thomas",18.320665,-64.867323
"1955","Oasis Cove","AB","AND, KWG",NA,"CC","02-17-23","RHMA","3025","H",13.75,NA,"25",NA,NA,NA,NA,NA,"STX Ag Fair","C","Kangrove the Mangrove",2023-02-17,"2023","02","17","St. Thomas",18.320665,-64.867323
"1956","Oasis Cove","AB","AND, KWG",NA,"CC","02-15-23","RHMA","3026","H",9.71,NA,"6.2",NA,NA,NA,NA,NA,"STX Ag Fair","C","Indaco",2023-02-15,"2023","02","15","St. Thomas",18.320665,-64.867323
"1957","Oasis Cove","AB","AND, KWG",NA,"CC","02-17-23","RHMA","3027","H",21,NA,"11",NA,NA,NA,NA,NA,"STX Ag Fair","C","Crabo",2023-02-17,"2023","02","17","St. Thomas",18.320665,-64.867323
"1958","Oasis Cove","AB","AND, KWG",NA,"CC","02-17-23","RHMA","3028","H",31.91,NA,"23",NA,NA,NA,NA,NA,"STX Ag Fair","C","Man",2023-02-17,"2023","02","17","St. Thomas",18.320665,-64.867323
"1959","Oasis Cove","AB","AND, KWG",NA,"CC","02-17-23","RHMA","3029","H",22.31,NA,"33",NA,NA,NA,NA,NA,"STX Ag Fair","C","Mango",2023-02-17,"2023","02","17","St. Thomas",18.320665,-64.867323
"1960","Oasis Cove","AB","AND, KWG",NA,"CC","02-17-23","RHMA","3030","H",14.44,NA,"28",NA,NA,NA,NA,NA,"STX Ag Fair","C","Strawberry",2023-02-17,"2023","02","17","St. Thomas",18.320665,-64.867323
"1961","Oasis Cove","AB","AND, KWG",NA,"CC","02-17-23","RHMA","3031","H",17.6,NA,"26.3",NA,NA,NA,NA,NA,"STX Ag Fair","C","Maia's",2023-02-17,"2023","02","17","St. Thomas",18.320665,-64.867323
"1962","Oasis Cove","DIRECT INPUT","DG","04/25/2023","CC",NA,"RHMA","E2-200","H",13.48,NA,"24",NA,"23","G","N",NA,NA,"E","DARMINLE VI",NA,NA,NA,NA,"St. Thomas",18.320665,-64.867323
"1963","Oasis Cove","DIRECT INPUT","DG","04/25/2023","CC",NA,"RHMA","E2-201","H",7.36,NA,"20",NA,"19","G","N",NA,NA,"E","JR",NA,NA,NA,NA,"St. Thomas",18.320665,-64.867323
"1964","Oasis Cove","DIRECT INPUT","DG","04/25/2023","CC",NA,"RHMA","E2-202","H",20.51,NA,"30.5",NA,"29.5","B","N",NA,NA,"E","JEREMY",NA,NA,NA,NA,"St. Thomas",18.320665,-64.867323
"1965","Oasis Cove","DIRECT INPUT","DG","04/25/2023","CC",NA,"RHMA","E2-203","H",13.6,NA,"24.9",NA,"23.5","G","N",NA,NA,"E","BISCUIT",NA,NA,NA,NA,"St. Thomas",18.320665,-64.867323
"1966","Oasis Cove","DIRECT INPUT","DG","04/25/2023","CC",NA,"RHMA","E2-204","H",17.82,NA,"27",NA,"26.3","B","N",NA,NA,"E","DARMINGLE XVI",NA,NA,NA,NA,"St. Thomas",18.320665,-64.867323
"1967","Oasis Cove","DIRECT INPUT","DG","04/25/2023","CC",NA,"RHMA","E2-205","H",18.31,"10.5","27",NA,"26","B","Y",NA,NA,"E","SERGER JR.",NA,NA,NA,NA,"St. Thomas",18.320665,-64.867323
"1968","Oasis Cove","DIRECT INPUT","DG","04/25/2023","CC",NA,"RHMA","E2-206","H",9.37,"7","23.5",NA,"22.6","G","Y",NA,NA,"E","TANNER-KINGSVELD",NA,NA,NA,NA,"St. Thomas",18.320665,-64.867323
"1969","Oasis Cove","DIRECT INPUT","DG","04/25/2023","CC",NA,"RHMA","E2-207","H",11.04,"8.5","25",NA,"24","G","Y",NA,NA,"E","VILONG TUSK",NA,NA,NA,NA,"St. Thomas",18.320665,-64.867323
"1970","Oasis Cove","DIRECT INPUT","DG","04/25/2023","CC",NA,"RHMA","E2-208","H",13.89,"10","25",NA,"23.6","G","Y",NA,NA,"E","JABANTIGATON THE 3RD",NA,NA,NA,NA,"St. Thomas",18.320665,-64.867323
"1971","Oasis Cove","DIRECT INPUT","DG","04/25/2023","CC",NA,"RHMA","E2-209","H",16.16,"11.2","28",NA,"27","G","Y",NA,NA,"E","GROOT",NA,NA,NA,NA,"St. Thomas",18.320665,-64.867323
"1972","Oasis Cove","DIRECT INPUT","DG","04/25/2023","CC",NA,"RHMA","E2-210","H",10.57,"9.4","25",NA,"24.3","G","N",NA,NA,"E","SAM",NA,NA,NA,NA,"St. Thomas",18.320665,-64.867323
"1973","Oasis Cove","DIRECT INPUT","DG","04/25/2023","CC",NA,"RHMA","E2-210","H",9,"9.7","24",NA,"23","G","N",NA,NA,"E","GLIZZY JR.",NA,NA,NA,NA,"St. Thomas",18.320665,-64.867323
"1974","Oasis Cove","DIRECT INPUT","DG","04/25/2023","CC",NA,"RHMA","E2-211","H",21.14,"11.8","30.5",NA,"29","G","N",NA,NA,"E","FRIED CHICKEN",NA,NA,NA,NA,"St. Thomas",18.320665,-64.867323
"1975","Oasis Cove","DIRECT INPUT","DG","04/25/2023","CC",NA,"RHMA","E2-213","H",18.25,"11.7","28.3",NA,"27","B","N",NA,NA,"E","DARMINGLE THE 3RD",NA,NA,NA,NA,"St. Thomas",18.320665,-64.867323
"1976","Oasis Cove","DIRECT INPUT","DG","04/25/2023","CC",NA,"RHMA","E2-214","H",18.86,"11.7","33.3",NA,"33","B","N",NA,NA,"E","LONG JOHN",NA,NA,NA,NA,"St. Thomas",18.320665,-64.867323
"1977","Oasis Cove","SC","AJH, KWG","5/24/2021","N/A","05/07/2021","RHMA","201","H",18.95,"10.99","31.2","1.3","30","OlGr",NA,"Y",NA,"N",NA,2021-05-07,"2021","05","07","St. Thomas",18.320665,-64.867323
"1978","Oasis Cove","SC","AJH, KWG","5/24/2021","N/A","05/07/2021","RHMA","202","H",11.86,"9.71","26.5","1.2","25.2","OlGr",NA,"Y",NA,"N",NA,2021-05-07,"2021","05","07","St. Thomas",18.320665,-64.867323
"1979","Oasis Cove","SC","AJH, KWG","5/24/2021","N/A","05/07/2021","RHMA","203","S",9,"7.59","23.6","1","22.7","OlGr",NA,"N",NA,"N",NA,2021-05-07,"2021","05","07","St. Thomas",18.320665,-64.867323
"1980","Oasis Cove","SC","AJH, KWG","5/24/2021","N/A","05/07/2021","RHMA","204","H",19.55,"11.17","31.4","1.6","29.7","OlGr",NA,"Y",NA,"N",NA,2021-05-07,"2021","05","07","St. Thomas",18.320665,-64.867323
"1981","Oasis Cove","SC","AJH, KWG","5/24/2021","N/A","05/07/2021","RHMA","205","H",8.45,"9.61","17.9","1","16.9","OlGr",NA,"Y",NA,"N",NA,2021-05-07,"2021","05","07","St. Thomas",18.320665,-64.867323
"1982","Oasis Cove","SC","AJH, KWG","5/24/2021","N/A","05/07/2021","RHMA","206","H",16.71,"10.63","28.1","1.3","26.8","OlGr",NA,"Y",NA,"N",NA,2021-05-07,"2021","05","07","St. Thomas",18.320665,-64.867323
"1983","Oasis Cove","SC","AJH, KWG","5/24/2021","N/A","05/07/2021","RHMA","207","H",13,"9.35","27.7","1","26.7","OlGr",NA,"Y",NA,"N",NA,2021-05-07,"2021","05","07","St. Thomas",18.320665,-64.867323
"1984","Oasis Cove","SC","AJH, KWG","5/24/2021","N/A","05/07/2021","RHMA","208","H",26.87,"12.4","31.3","1.4","30","OlGr",NA,"N",NA,"N",NA,2021-05-07,"2021","05","07","St. Thomas",18.320665,-64.867323
"1985","Oasis Cove","SC","AJH, KWG","5/24/2021","N/A","05/07/2021","RHMA","209","H",22.24,"10.87","33.1","1.5","31.5","OlGr",NA,"Y",NA,"N",NA,2021-05-07,"2021","05","07","St. Thomas",18.320665,-64.867323
"1986","Oasis Cove","SC","AJH, KWG","5/24/2021","N/A","05/07/2021","RHMA","210","H",15.63,"10.69","29.5","N/A","29.5","OlGr",NA,"Y",NA,"N",NA,2021-05-07,"2021","05","07","St. Thomas",18.320665,-64.867323
"1987","Oasis Cove","SC","AJH, KWG","5/24/2021","N/A","05/07/2021","RHMA","211","H",23.23,"11.1","33.3","1.3","32","OlGr",NA,"N",NA,"N",NA,2021-05-07,"2021","05","07","St. Thomas",18.320665,-64.867323
"1988","Oasis Cove","SC","AJH, KWG","5/24/2021","N/A","05/07/2021","RHMA","212","H",21.91,"11.48","29.1","N/A","21.9","OlGr",NA,"N",NA,"N",NA,2021-05-07,"2021","05","07","St. Thomas",18.320665,-64.867323
"1989","Oasis Cove","SC","AJH, KWG","5/24/2021","N/A","05/07/2021","RHMA","213","S",13.75,"10.46","28.6","1.5","27.1","Br",NA,"Y",NA,"N",NA,2021-05-07,"2021","05","07","St. Thomas",18.320665,-64.867323
"1990","Oasis Cove","SC","AJH, KWG","5/24/2021","N/A","05/07/2021","RHMA","214","H",23.26,"11.98","33.5","1.3","32.1","OlGr",NA,"N",NA,"N",NA,2021-05-07,"2021","05","07","St. Thomas",18.320665,-64.867323
"1991","Oasis Cove","HH","HH,ES","10/09/2024","CC","09/11/2024","RHMA","6347","H",10.26,"9.7","24.3","1.5","22.8","GB","Y","N",NA,NA,NA,2024-09-11,"2024","09","11","St. Thomas",18.320665,-64.867323
"1992","Oasis Cove","HH","HH,ES","10/09/2024","CC","09/11/2024","RHMA","6348","H",9.33,"9.8","21.2","1.2","20","GB","Y","Y",NA,NA,NA,2024-09-11,"2024","09","11","St. Thomas",18.320665,-64.867323
"1993","Oasis Cove","HH","HH,ES","10/09/2024","CC","09/11/2024","RHMA","6349","H",7.91,"9.3","19.1","1","18.1","GB","Y","N",NA,NA,NA,2024-09-11,"2024","09","11","St. Thomas",18.320665,-64.867323
"1994","Oasis Cove","DN","IEKHS MIC Field Trip","11/06/2024","CC","10/25/2024","RHMA","6540","H",12.33,NA,"21.7",NA,"21.7",NA,NA,NA,"IEKHS MIC Field Trip","C","Altona",2024-10-25,"2024","10","25","St. Thomas",18.320665,-64.867323
"1995","Oasis Cove","DN","IEKHS MIC Field Trip","11/06/2024","CC","10/25/2024","RHMA","6541","H",12.89,NA,"23.3",NA,"23.3",NA,NA,NA,"IEKHS MIC Field Trip","C","Cass",2024-10-25,"2024","10","25","St. Thomas",18.320665,-64.867323
"1996","Oasis Cove","ST,DG","ST","11/07/2024","CC","10/25/2024","RHMA","6542","H",26.7,"1.2","33.5","1.5","32","B","Y","N",NA,NA,NA,2024-10-25,"2024","10","25","St. Thomas",18.320665,-64.867323
"1997","Oasis Cove","ST,DG","ST","11/07/2024","CC","10/25/2024","RHMA","6543","H",22.53,"5.8","33.7","1.5","32.2","G","Y","N",NA,NA,NA,2024-10-25,"2024","10","25","St. Thomas",18.320665,-64.867323
"1998","Oasis Cove","ST,DG","ST","11/07/2024","CC","10/25/2024","RHMA","6544","H",19.82,"4.8","33.6","2","31.6","G","Y","Y",NA,NA,NA,2024-10-25,"2024","10","25","St. Thomas",18.320665,-64.867323
"1999","Oasis Cove","ST,DG","ST","11/07/2024","CC","10/25/2024","RHMA","6545","H",20.12,"5.6","31.5","1.9","29.6","G","Y","Y",NA,NA,NA,2024-10-25,"2024","10","25","St. Thomas",18.320665,-64.867323
"2000","Oasis Cove","ST,DG","ST","11/07/2024","CC","10/25/2024","RHMA","6546","H",23.6,"6.7","35.9","2.1","33.8","G","Y","Y",NA,NA,NA,2024-10-25,"2024","10","25","St. Thomas",18.320665,-64.867323
"2001","Oasis Cove","ST,DG","ST","11/07/2024","CC","10/25/2024","RHMA","6547","H",25.96,"6.7","36.7","1.7","35","G","Y","Y",NA,NA,NA,2024-10-25,"2024","10","25","St. Thomas",18.320665,-64.867323
"2002","Oasis Cove","ST,DG","ST","11/07/2024","CC","10/25/2024","RHMA","6548","H",25,"7","33.1","1.3","31.8","G","Y","Y",NA,NA,NA,2024-10-25,"2024","10","25","St. Thomas",18.320665,-64.867323
"2003","Oasis Cove","ST,DG","ST","11/07/2024","CC","10/25/2024","RHMA","6549","H",20.66,"5.6","31","1.4","29.6","G","N","N",NA,NA,NA,2024-10-25,"2024","10","25","St. Thomas",18.320665,-64.867323
"2004","Oasis Cove","ST,DG","ST","11/07/2024","CC","10/25/2024","RHMA","6550","H",18.94,"5.2","32","1.6","30.4","G","Y","Y",NA,NA,NA,2024-10-25,"2024","10","25","St. Thomas",18.320665,-64.867323
"2005","Oasis Cove","ST,DG","ST","11/07/2024","CC","10/25/2024","RHMA","6551","H",27.7,"6.7","35.8","1.8","34","G","Y","Y",NA,NA,NA,2024-10-25,"2024","10","25","St. Thomas",18.320665,-64.867323
"2006","Oasis Cove","ST,DG","ST","11/07/2024","CC","10/25/2024","RHMA","6552","H",22.81,"5.8","32","1.8","30.2","G","Y","Y",NA,NA,NA,2024-10-25,"2024","10","25","St. Thomas",18.320665,-64.867323
"2007","Oasis Cove","ST,DG","ST","11/07/2024","CC","10/25/2024","RHMA","6553","H",17.19,"5","29.9","1.3","28.6","G","Y","Y",NA,NA,NA,2024-10-25,"2024","10","25","St. Thomas",18.320665,-64.867323
"2008","Oasis Cove","ST,DG","ST","11/07/2024","CC","10/25/2024","RHMA","6554","H",21.96,"6.9","28.5","1.7","26.8","G","Y","Y",NA,NA,NA,2024-10-25,"2024","10","25","St. Thomas",18.320665,-64.867323
"2009","Oasis Cove","ST,DG","ST","11/07/2024","CC","10/25/2024","RHMA","6555","H",22,"5.9","32.4","2","30.4","G","Y","Y",NA,NA,NA,2024-10-25,"2024","10","25","St. Thomas",18.320665,-64.867323
"2010","Oasis Cove","ST,DG","ST","11/07/2024","CC","10/25/2024","RHMA","6556","H",15.47,"4.3","28.8","1.5","27.3","G","Y","Y",NA,NA,NA,2024-10-25,"2024","10","25","St. Thomas",18.320665,-64.867323
"2011","Oasis Cove","Direct Input","LU & DN","11/07/2024","CC","10/25/2024","RHMA","6557","H",13.41,"10.1","28.3","1.8","26.5","G","Y","Y",NA,NA,NA,2024-10-25,"2024","10","25","St. Thomas",18.320665,-64.867323
"2012","Oasis Cove","DIRECT INPUT","DG","04/25/2023","CC",NA,"RHMA","E2-252","H",7.96,"8.5","20.2",NA,"19.3","G","Y",NA,NA,"E",NA,NA,NA,NA,NA,"St. Thomas",18.320665,-64.867323
"2013","Oasis Cove","DIRECT INPUT","DG","04/25/2023","CC",NA,"RHMA","E2-253","H",14.88,"10","25.5",NA,"24.9","G","Y",NA,NA,"E",NA,NA,NA,NA,NA,"St. Thomas",18.320665,-64.867323
"2014","Oasis Cove","DIRECT INPUT","DG","04/25/2023","CC",NA,"RHMA","E2-254","H",14.54,"10.8","24.5",NA,"23.3","B","Y",NA,NA,"E",NA,NA,NA,NA,NA,"St. Thomas",18.320665,-64.867323
"2015","Oasis Cove","DIRECT INPUT","DG","04/25/2023","CC",NA,"RHMA","E2-255","H",15.4,"10.1","23.9",NA,"23","G","N",NA,NA,"E",NA,NA,NA,NA,NA,"St. Thomas",18.320665,-64.867323
"2016","Oasis Cove","DIRECT INPUT","DG","04/25/2023","CC",NA,"RHMA","E2-256","H",10.18,"9.2","21.8",NA,"20.5","G","Y",NA,NA,"E",NA,NA,NA,NA,NA,"St. Thomas",18.320665,-64.867323
"2017","Oasis Cove","DIRECT INPUT","DG","04/25/2023","CC",NA,"RHMA","E2-257","H",20.28,"11","27",NA,"26","B","N",NA,NA,"E","BIG BOB",NA,NA,NA,NA,"St. Thomas",18.320665,-64.867323
"2018","Oasis Cove","DIRECT INPUT","DG","04/25/2023","CC",NA,"RHMA","E2-258","H",16.42,"10","22.5",NA,"22.2","B","N",NA,NA,"E","BIG MAN",NA,NA,NA,NA,"St. Thomas",18.320665,-64.867323
"2019","Oasis Cove","DIRECT INPUT","DG","04/25/2023","CC",NA,"RHMA","E2-259","H",12.49,"8.5","22.5",NA,"21","G","N",NA,NA,"E","BIG BROTHA",NA,NA,NA,NA,"St. Thomas",18.320665,-64.867323
"2020","Oasis Cove","Direct Input","LU & DN","11/07/2024","CC","10/25/2024","RHMA","6566","H",7.37,"9.3","17.1","1.4","15.7","G","N","N",NA,NA,NA,2024-10-25,"2024","10","25","St. Thomas",18.320665,-64.867323
"2021","Oasis Cove","Direct Input","LU & DN","11/07/2024","CC","10/25/2024","RHMA","6567","H",17.89,"10","29.2","1.5","27.7","B","N","N",NA,NA,NA,2024-10-25,"2024","10","25","St. Thomas",18.320665,-64.867323
"2022","Oasis Cove","Direct Input","LU & DN","11/07/2024","CC","10/25/2024","RHMA","6568","H",27.83,"12.2","39.7","1.7","38","GB","Y","N",NA,NA,NA,2024-10-25,"2024","10","25","St. Thomas",18.320665,-64.867323
"2023","Oasis Cove","Direct Input","LU & DN","11/07/2024","CC","10/25/2024","RHMA","6569","H",29.25,"13.5","35.3","1.5","33.8","G","Y","N",NA,NA,NA,2024-10-25,"2024","10","25","St. Thomas",18.320665,-64.867323
"2024","Oasis Cove","Direct Input","LU & DN","11/07/2024","CC","10/25/2024","RHMA","6570","H",20.76,"13.2","26.3","1.3","25","G","Y","Y",NA,NA,NA,2024-10-25,"2024","10","25","St. Thomas",18.320665,-64.867323
"2025","Oasis Cove","Direct Input","LU & DN","11/07/2024","CC","10/25/2024","RHMA","6571","H",31.03,"14.3","34.8","1.6","33.2","G","Y","N",NA,NA,NA,2024-10-25,"2024","10","25","St. Thomas",18.320665,-64.867323
"2026","Oasis Cove","Direct Input","LU & DN","11/07/2024","CC","10/25/2024","RHMA","6572","H",14.92,"11.1","26.3","1.5","24.8","G","N","Y",NA,NA,NA,2024-10-25,"2024","10","25","St. Thomas",18.320665,-64.867323
"2027","Oasis Cove","Direct Input","LU & DN","11/07/2024","CC","10/25/2024","RHMA","6573","H",15.64,"11.7","24.1","1.8","22.3","G","N","Y",NA,NA,NA,2024-10-25,"2024","10","25","St. Thomas",18.320665,-64.867323
"2028","Oasis Cove","DIRECT INPUT","DG, AJH","06/23/2023","3""TP","6/13/23","RHMA","4069","H",22.49,"11.1","32.8","1.2","31.6","G","Y","N",NA,"N",NA,2023-06-13,"2023","06","13","St. Thomas",18.320665,-64.867323
"2029","Oasis Cove","DIRECT INPUT","DG, AJH","06/23/2023","3""TP","6/13/23","RHMA","4070","H",19,"10.6","31.2","1.4","29.8","G","Y","N",NA,"N",NA,2023-06-13,"2023","06","13","St. Thomas",18.320665,-64.867323
"2030","Oasis Cove","DIRECT INPUT","DG, AJH","06/23/2023","3""TP","6/13/23","RHMA","4071","H",21.62,"12.2","26.5","1.4","25.1","G","Y","N",NA,"N",NA,2023-06-13,"2023","06","13","St. Thomas",18.320665,-64.867323
"2031","Oasis Cove","DIRECT INPUT","DG, AJH","06/23/2023","3""TP","6/13/23","RHMA","4072","H",12.48,"10.6","19.8","1.1","18.7","B","N","N",NA,"N",NA,2023-06-13,"2023","06","13","St. Thomas",18.320665,-64.867323
"2032","Oasis Cove","DIRECT INPUT","DG, AJH","06/23/2023","3""TP","6/13/23","RHMA","4073","H",23.9,"11.5","29.9","1.5","28.4","B","Y","N","PLUM BROWN BUT HEALTHY","N",NA,2023-06-13,"2023","06","13","St. Thomas",18.320665,-64.867323
"2033","Oasis Cove","DIRECT INPUT","DG, AJH","06/23/2023","3""TP","6/13/23","RHMA","4074","H",21.35,"12","27.7","2","25.7","B","Y","N",NA,"N",NA,2023-06-13,"2023","06","13","St. Thomas",18.320665,-64.867323
"2034","Oasis Cove","DN","IEKHS MIC Field Trip","11/06/2024","CC","10/25/2024","RHMA","6495","H",15.46,NA,"24",NA,"24",NA,NA,NA,"IEKHS MIC Field Trip","C","Elariia",2024-10-25,"2024","10","25","St. Thomas",18.320665,-64.867323
"2035","Oasis Cove","DN","IEKHS MIC Field Trip","11/06/2024","CC","10/25/2024","RHMA","6496","H",11.65,NA,"22.5",NA,"22.5",NA,NA,NA,"IEKHS MIC Field Trip","C","Alexander",2024-10-25,"2024","10","25","St. Thomas",18.320665,-64.867323
"2036","Oasis Cove","DN","IEKHS MIC Field Trip","11/06/2024","CC","10/25/2024","RHMA","6497","H",10.78,NA,"21",NA,"21",NA,NA,NA,"IEKHS MIC Field Trip","C","Joanca",2024-10-25,"2024","10","25","St. Thomas",18.320665,-64.867323
"2037","Oasis Cove","DIRECT INPUT","DG, AJH","06/23/2023","3""TP","6/13/23","RHMA","4078","H",13.5,"9.8","26.7","1.2","25.5","GB","Y","N",NA,"N",NA,2023-06-13,"2023","06","13","St. Thomas",18.320665,-64.867323
"2038","Oasis Cove","DN","DN,TB","11/05/2024","CC","10/25/2024","RHMA","3722B","H",40.05,"14.3","44.8","1.5","43.3","G","Y","N","duplicate numbers added B to tags",NA,NA,2024-10-25,"2024","10","25","St. Thomas",18.320665,-64.867323
"2039","Oasis Cove","DN","DN,TB","11/05/2024","CC","10/25/2024","RHMA","3723B","H",35.35,"11.5","42.6","2","40.6","G","Y","N","duplicate numbers added B to tags",NA,NA,2024-10-25,"2024","10","25","St. Thomas",18.320665,-64.867323
"2040","Oasis Cove","DN","DN,TB","11/05/2024","CC","10/25/2024","RHMA","3724B","H",30.35,"13.1","39.8","1.8","38","G","Y","N","duplicate numbers added B to tags",NA,NA,2024-10-25,"2024","10","25","St. Thomas",18.320665,-64.867323
"2041","Oasis Cove","DN","DN,TB","11/05/2024","CC","10/25/2024","RHMA","3725B","H",34.16,"13.7","41.2","1.7","39.5","G","Y","N","duplicate numbers added B to tags",NA,NA,2024-10-25,"2024","10","25","St. Thomas",18.320665,-64.867323
"2042","Oasis Cove","DN","DN,TB","11/05/2024","CC","10/25/2024","RHMA","3726B","H",22.69,"10.6","40.5","1.8","38.7","G","Y","N","duplicate numbers added B to tags",NA,NA,2024-10-25,"2024","10","25","St. Thomas",18.320665,-64.867323
"2043","Oasis Cove","DN","DN,TB","11/05/2024","CC","10/25/2024","RHMA","3727B","H",38.1,"14.2","38.9","1.8","37.1","G","Y","N","duplicate numbers added B to tags",NA,NA,2024-10-25,"2024","10","25","St. Thomas",18.320665,-64.867323
"2044","Oasis Cove","DN","DN,TB","11/05/2024","CC","10/25/2024","RHMA","3728B","H",27.9,"11.5","38.7","1.7","37","GB","N","N","duplicate numbers added B to tags",NA,NA,2024-10-25,"2024","10","25","St. Thomas",18.320665,-64.867323
"2045","Oasis Cove","LU","LU","9/28/24","CC","09/11/2024","RHMA","6280",NA,15.58,NA,NA,NA,"24",NA,NA,NA,NA,"VICM Day of Play","frank",2024-09-11,"2024","09","11","St. Thomas",18.320665,-64.867323
"2046","Oasis Cove","LU","LU","9/28/24","CC","09/11/2024","RHMA","6281",NA,17.58,NA,NA,NA,"25",NA,NA,NA,NA,"VICM Day of Play","amenra",2024-09-11,"2024","09","11","St. Thomas",18.320665,-64.867323
"2047","Oasis Cove","LU","Khalif","9/28/24","CC","09/11/2024","RHMA","6282",NA,12.78,NA,NA,NA,"29",NA,NA,NA,NA,"VICM Day of Play","Blue",2024-09-11,"2024","09","11","St. Thomas",18.320665,-64.867323
"2048","Oasis Cove","LU","LU","9/28/24","CC","09/11/2024","RHMA","6283",NA,9.33,NA,NA,NA,"20",NA,NA,NA,NA,"VICM Day of Play","aaliya",2024-09-11,"2024","09","11","St. Thomas",18.320665,-64.867323
"2049","Oasis Cove","LU","LU","9/28/24","CC","09/11/2024","RHMA","6284",NA,7.3,NA,NA,NA,"18",NA,NA,NA,NA,"VICM Day of Play","aliana",2024-09-11,"2024","09","11","St. Thomas",18.320665,-64.867323
"2050","Oasis Cove","LU","LU","9/28/24","CC","09/11/2024","RHMA","6285",NA,17.29,NA,NA,NA,"26",NA,NA,NA,NA,"VICM Day of Play","alay",2024-09-11,"2024","09","11","St. Thomas",18.320665,-64.867323
"2051","Oasis Cove","AB","AND, KWG, ZR",NA,"CC","02-17-23","RHMA","3000","H",23.54,NA,"32.5",NA,NA,NA,NA,NA,"2 leaves, STX Ag Fair","C","Oscar",2023-02-17,"2023","02","17","St. Thomas",18.320665,-64.867323
"2052","Oasis Cove","AB","AND, KWG, ZR",NA,"CC","02-15-23","RHMA","3001","H",5.32,NA,"14.2",NA,NA,NA,NA,NA,"STX Ag Fair","C","Lewis Jr.",2023-02-15,"2023","02","15","St. Thomas",18.320665,-64.867323
"2053","Oasis Cove","AB","AND, KWG, ZR",NA,"CC","02-17-23","RHMA","3002","H",18.4,NA,"27",NA,NA,NA,NA,NA,"2 leaves, STX Ag Fair","C","Pixie",2023-02-17,"2023","02","17","St. Thomas",18.320665,-64.867323
"2054","Oasis Cove","AB","AND, KWG, ZR",NA,"CC","02-17-23","RHMA","3003","H",16.6,NA,"24.9",NA,NA,NA,NA,NA,"2 leaves, very cute, STX Ag Fair","C","Batman",2023-02-17,"2023","02","17","St. Thomas",18.320665,-64.867323
"2055","Oasis Cove","AB","AND, KWG, ZR",NA,"CC","02-17-23","RHMA","3004","H",17.89,NA,"23.5",NA,NA,NA,NA,NA,"STX Ag Fair","C","Mako",2023-02-17,"2023","02","17","St. Thomas",18.320665,-64.867323
"2056","Oasis Cove","AB","AND, KWG, ZR",NA,"CC","02-15-23","RHMA","3005","H",9.1,NA,"17",NA,NA,NA,NA,NA,"STX Ag Fair","C","Orlando III",2023-02-15,"2023","02","15","St. Thomas",18.320665,-64.867323
"2057","Oasis Cove","SC","AJH, KWG","5/24/2021","N/A","05/07/2021","RHMA","200","H",25.97,"12.02","38.6","1.6","37","OlGr",NA,"Y",NA,"N",NA,2021-05-07,"2021","05","07","St. Thomas",18.320665,-64.867323
"2058","Oasis Cove","JS, SC","JS, SC","1/29/2024","3""TP","1/29/2024","RHMA","3921","H",12.08,"9.3","25.5","1.4","24.1","B","N","N",NA,"N",NA,2024-01-29,"2024","01","29","St. Thomas",18.320665,-64.867323
"2059","Oasis Cove","DN","IEKHS MIC Field Trip","11/06/2024","CC","10/25/2024","RHMA","6521","H",30.48,NA,"37.6",NA,"37.6",NA,NA,NA,"IEKHS MIC Field Trip","C","Future",2024-10-25,"2024","10","25","St. Thomas",18.320665,-64.867323
"2060","Oasis Cove","DN","IEKHS MIC Field Trip","11/06/2024","CC","10/25/2024","RHMA","6522","H",24.5,NA,"35.9",NA,"35.9",NA,NA,NA,"IEKHS MIC Field Trip","C","Shari",2024-10-25,"2024","10","25","St. Thomas",18.320665,-64.867323
"2061","Oasis Cove","MA","MA","10/04/2023","3"" TP","9/28/2023","RHMA","4729","H",26.5,"10.1","38.1","1.5","36.7","G","N","N",NA,"N",NA,2023-09-28,"2023","09","28","St. Thomas",18.320665,-64.867323
"2062","Oasis Cove","MA","MA","10/04/2023","3"" TP","9/28/2023","RHMA","4730","H",20.69,"0.91","31.7","1.5","30.8","G","Y","Y",NA,"N",NA,2023-09-28,"2023","09","28","St. Thomas",18.320665,-64.867323
"2063","Oasis Cove","MA","MA","10/04/2023","3"" TP","9/28/2023","RHMA","4731","H",20.26,"11.6","32.7","1.5","31.2","G","N","N",NA,"N",NA,2023-09-28,"2023","09","28","St. Thomas",18.320665,-64.867323
"2064","Oasis Cove","AB","AND, KWG, ZR",NA,"CC","02-15-23","RHMA","3013","H",9.2,NA,"14",NA,NA,NA,NA,NA,"STX Ag Fair","C","Mangrovia",2023-02-15,"2023","02","15","St. Thomas",18.320665,-64.867323
"2065","Oasis Cove","AB","AND, KWG",NA,"CC","02-15-23","RHMA","3014","H",6.1,NA,"17",NA,NA,NA,NA,NA,"STX Ag Fair","C","Mangy",2023-02-15,"2023","02","15","St. Thomas",18.320665,-64.867323
"2066","Oasis Cove","AB","AND, KWG",NA,"CC","02-17-23","RHMA","3015","H",11.5,NA,"37",NA,NA,NA,NA,NA,"no leaves","C","Elisheba",2023-02-17,"2023","02","17","St. Thomas",18.320665,-64.867323
"2067","Oasis Cove","AB","AND, KWG",NA,"CC","02-17-23","RHMA","3016","H",15,NA,"27.2",NA,NA,NA,NA,NA,"STX Ag Fair","C","Christian",2023-02-17,"2023","02","17","St. Thomas",18.320665,-64.867323
"2068","Oasis Cove","MA","MA","10/04/2023","3"" TP","9/28/2023","RHMA","4736","H",16.46,"11.3","27.9","1.4","26.5","G","Y","N",NA,"N",NA,2023-09-28,"2023","09","28","St. Thomas",18.320665,-64.867323
"2069","Oasis Cove","ST,SF,SC","ST,SF,SC","1/22/2024","4""TP","1/19/24","RHMA","3808","H",18.79,"10.6","31","1.7","29.6","B","Y","Y",NA,"N",NA,2024-01-19,"2024","01","19","St. Thomas",18.320665,-64.867323
"2070","Oasis Cove","ST,SF,SC","ST,SF,SC","1/22/2024","4""TP","1/19/24","RHMA","3809","H",18.25,"11.2","27.6","1.1","26.3","G","N","N",NA,"N",NA,2024-01-19,"2024","01","19","St. Thomas",18.320665,-64.867323
"2071","Oasis Cove","ST,SF,SC","ST,SF,SC","1/22/2024","4""TP","1/19/24","RHMA","3810","H",10.92,"9.8","22.7","1.5","21.3","G","N","N",NA,"N",NA,2024-01-19,"2024","01","19","St. Thomas",18.320665,-64.867323
"2072","Oasis Cove","ST,SF,SC","ST,SF,SC","1/22/2024","4""TP","1/19/24","RHMA","3811","H",15.3,"10.1","28.7","1.3","27.5","G","Y","N",NA,"N",NA,2024-01-19,"2024","01","19","St. Thomas",18.320665,-64.867323
"2073","Oasis Cove","ST,SF,SC","ST,SF,SC","1/22/2024","4""TP","1/19/24","RHMA","3813","H",13.65,"10","26.4","1.3","25","G","Y","Y",NA,"N",NA,2024-01-19,"2024","01","19","St. Thomas",18.320665,-64.867323
"2074","Oasis Cove","DN","IEKHS MIC Field Trip","11/06/2024","CC","10/25/2024","RHMA","6539","H",19.19,NA,"28.3",NA,"28.3",NA,NA,NA,"IEKHS MIC Field Trip","C","Sally 3",2024-10-25,"2024","10","25","St. Thomas",18.320665,-64.867323
"2075","Oasis Cove","LU","Da'jaunell","9/28/24","CC","09/11/2024","RHMA","6226",NA,16.4,NA,NA,NA,"29.7",NA,NA,NA,NA,"VICM Day of Play","Cute",2024-09-11,"2024","09","11","St. Thomas",18.320665,-64.867323
"2076","Oasis Cove","LU","Sewar","9/28/24","CC","09/11/2024","RHMA","6227",NA,41.21,NA,NA,NA,"41",NA,NA,NA,NA,"VICM Day of Play","Daisy",2024-09-11,"2024","09","11","St. Thomas",18.320665,-64.867323
"2077","Oasis Cove","DN","IEKHS MIC Field Trip","11/06/2024","CC","10/25/2024","RHMA","6498","H",13,NA,"27.1",NA,"27.1",NA,NA,NA,"IEKHS MIC Field Trip","C","Shane",2024-10-25,"2024","10","25","St. Thomas",18.320665,-64.867323
"2078","Oasis Cove","DN","IEKHS MIC Field Trip","11/06/2024","CC","10/25/2024","RHMA","6499","H",21.25,NA,"36.9",NA,"36.9",NA,NA,NA,"IEKHS MIC Field Trip","C","Jeffo3I",2024-10-25,"2024","10","25","St. Thomas",18.320665,-64.867323
"2079","Oasis Cove","DN","IEKHS MIC Field Trip","11/06/2024","CC","10/25/2024","RHMA","6500","H",21.17,NA,"33.2",NA,"33.2",NA,NA,NA,"IEKHS MIC Field Trip","C","Jeff",2024-10-25,"2024","10","25","St. Thomas",18.320665,-64.867323
"2080","Oasis Cove","DN","IEKHS MIC Field Trip","11/06/2024","CC","10/25/2024","RHMA","6501","H",29.2,NA,"37.5",NA,"37.5",NA,NA,NA,"IEKHS MIC Field Trip","C","Chupapi",2024-10-25,"2024","10","25","St. Thomas",18.320665,-64.867323
"2081","Oasis Cove","DN","IEKHS MIC Field Trip","11/06/2024","CC","10/25/2024","RHMA","6502","H",27.18,NA,"32.5",NA,"32.5",NA,NA,NA,"IEKHS MIC Field Trip","C","Anajah",2024-10-25,"2024","10","25","St. Thomas",18.320665,-64.867323
"2082","Oasis Cove","DN","IEKHS MIC Field Trip","11/06/2024","CC","10/25/2024","RHMA","6503","H",20.24,NA,"21.5",NA,"21.5",NA,NA,NA,"IEKHS MIC Field Trip","C","Tiveh",2024-10-25,"2024","10","25","St. Thomas",18.320665,-64.867323
"2083","Oasis Cove","AB","AND, KWG",NA,"CC","02-15-23","RHMA","3032","H",7.9,NA,"18",NA,NA,NA,NA,NA,"STX Ag Fair","C","Petra",2023-02-15,"2023","02","15","St. Thomas",18.320665,-64.867323
"2084","Oasis Cove","AB","AND, KWG",NA,"CC","02-15-23","RHMA","3033","H",4.87,NA,"13",NA,NA,NA,NA,NA,"STX Ag Fair","C","Rio Rio <3",2023-02-15,"2023","02","15","St. Thomas",18.320665,-64.867323
"2085","Oasis Cove","AB","AND, KWG",NA,"CC","02-15-23","RHMA","3034","H",4.28,NA,"10.8",NA,NA,NA,NA,NA,"STX Ag Fair","C","Laurie",2023-02-15,"2023","02","15","St. Thomas",18.320665,-64.867323
"2086","Oasis Cove","AB","AND, KWG",NA,"CC","02-15-23","RHMA","3035","H",5,NA,"13",NA,NA,NA,NA,NA,"STX Ag Fair","C","Manny :)",2023-02-15,"2023","02","15","St. Thomas",18.320665,-64.867323
"2087","Oasis Cove","AB","AND, KWG",NA,"CC","02-17-23","RHMA","3036","H",16.32,NA,"20",NA,NA,NA,NA,NA,"STX Ag Fair","C","Aminah",2023-02-17,"2023","02","17","St. Thomas",18.320665,-64.867323
"2088","Oasis Cove","AB","AND, KWG",NA,"CC","02-17-23","RHMA","3037","H",18.5,NA,"24",NA,NA,NA,NA,NA,"STX Ag Fair","C","Zakiya",2023-02-17,"2023","02","17","St. Thomas",18.320665,-64.867323
"2089","Oasis Cove","AB","AND, KWG",NA,"CC","02-15-23","RHMA","3038","H",5.4,NA,"12.5",NA,NA,NA,NA,NA,"STX Ag Fair","C","Leafy",2023-02-15,"2023","02","15","St. Thomas",18.320665,-64.867323
"2090","Oasis Cove","AB","AND, KWG",NA,"CC","02-17-23","RHMA","3039","H",21.08,NA,"29",NA,NA,NA,NA,NA,"STX Ag Fair","C","Panda",2023-02-17,"2023","02","17","St. Thomas",18.320665,-64.867323
"2091","Oasis Cove","DIRECT INPUT","AND, KWG",NA,"3""TP","02-22-23","RHMA","3040","H",11.16,"7.8","28.7","1.6","27.1","G","N","N",NA,"N",NA,2023-02-22,"2023","02","22","St. Thomas",18.320665,-64.867323
"2092","Oasis Cove","DIRECT INPUT","AND, KWG",NA,"3""TP","02-22-23","RHMA","3041","H",17.15,"11.5","26.3","1.4","24.9","GB","Y","Y",NA,"N",NA,2023-02-22,"2023","02","22","St. Thomas",18.320665,-64.867323
"2093","Oasis Cove","SC","AJH, KWG","5/24/2021","N/A","05/07/2021","RHMA","196","H",17.66,"10.78","30.7","1.5","29","OlGr",NA,"Y",NA,"N",NA,2021-05-07,"2021","05","07","St. Thomas",18.320665,-64.867323
"2094","Oasis Cove","SC","AJH, KWG","5/24/2021","N/A","05/07/2021","RHMA","197","H",12.67,"9.56","29.7","1.2","28.5","BrGr",NA,"Y",NA,"N",NA,2021-05-07,"2021","05","07","St. Thomas",18.320665,-64.867323
"2095","Oasis Cove","SC","AJH, KWG","5/24/2021","N/A","05/07/2021","RHMA","198","H",17.47,"10.71","32.9","1.6","31.2","OlGr",NA,"Y",NA,"N",NA,2021-05-07,"2021","05","07","St. Thomas",18.320665,-64.867323
"2096","Oasis Cove","SC","AJH, KWG","5/24/2021","N/A","05/07/2021","RHMA","199","H",23.73,"12.11","34.7","1.4","33.2","OlGr",NA,"Y",NA,"N",NA,2021-05-07,"2021","05","07","St. Thomas",18.320665,-64.867323
"2097","Oasis Cove","Direct Input","LU & DN","11/07/2024","CC","10/25/2024","RHMA","6562","H",8.46,"9","19.4","1.4","18","G","N","Y",NA,NA,NA,2024-10-25,"2024","10","25","St. Thomas",18.320665,-64.867323
"2098","Oasis Cove","11/06/2024","IEKHS MIC Field Trip","11/06/2024","CC","10/25/2024","RHMA","6519","H",NA,NA,"0",NA,NA,NA,NA,NA,NA,NA,NA,2024-10-25,"2024","10","25","St. Thomas",18.320665,-64.867323
"2099","Oasis Cove","Direct Input","LU & DN","11/07/2024","CC","10/25/2024","RHMA","6564","H",27.91,"13.1","37","1.8","35.2","G","Y","Y",NA,NA,NA,2024-10-25,"2024","10","25","St. Thomas",18.320665,-64.867323
"2100","Oasis Cove","Direct Input","LU & DN","11/07/2024","CC","10/25/2024","RHMA","6565","H",12.65,"10.8","22","1.3","20.7","G","Y","Y",NA,NA,NA,2024-10-25,"2024","10","25","St. Thomas",18.320665,-64.867323
"2101","Oasis Cove","DN","IEKHS MIC Field Trip","11/06/2024","CC","10/25/2024","RHMA","6523","H",24.97,NA,"36.5",NA,"36.5",NA,NA,NA,"IEKHS MIC Field Trip","C","Street Runner",2024-10-25,"2024","10","25","St. Thomas",18.320665,-64.867323
"2102","Oasis Cove","DN","IEKHS MIC Field Trip","11/06/2024","CC","10/25/2024","RHMA","6524","H",17.17,NA,"24.7",NA,"24.7",NA,NA,NA,"IEKHS MIC Field Trip","C","Kanye",2024-10-25,"2024","10","25","St. Thomas",18.320665,-64.867323
"2103","Oasis Cove","DN","IEKHS MIC Field Trip","11/06/2024","CC","10/25/2024","RHMA","6525","H",25.29,NA,"37",NA,"37",NA,NA,NA,"IEKHS MIC Field Trip","C","Soul Fly",2024-10-25,"2024","10","25","St. Thomas",18.320665,-64.867323
"2104","Oasis Cove","DN","IEKHS MIC Field Trip","11/06/2024","CC","10/25/2024","RHMA","6526","H",18.36,NA,"29.7",NA,"29.7",NA,NA,NA,"IEKHS MIC Field Trip","C","Tune",2024-10-25,"2024","10","25","St. Thomas",18.320665,-64.867323
"2105","Oasis Cove","DN","IEKHS MIC Field Trip","11/06/2024","CC","10/25/2024","RHMA","6527","H",21.91,NA,"26",NA,"26",NA,NA,NA,"IEKHS MIC Field Trip","C","John",2024-10-25,"2024","10","25","St. Thomas",18.320665,-64.867323
"2106","Oasis Cove","DN","IEKHS MIC Field Trip","11/06/2024","CC","10/25/2024","RHMA","6528","H",11.87,NA,"28",NA,"28",NA,NA,NA,"IEKHS MIC Field Trip","C","Shello",2024-10-25,"2024","10","25","St. Thomas",18.320665,-64.867323
"2107","Oasis Cove","DN","IEKHS MIC Field Trip","11/06/2024","CC","10/25/2024","RHMA","6529","H",11.19,NA,"35",NA,"35",NA,NA,NA,"IEKHS MIC Field Trip","C","Cassy",2024-10-25,"2024","10","25","St. Thomas",18.320665,-64.867323
"2108","Oasis Cove","DN","IEKHS MIC Field Trip","11/06/2024","CC","10/25/2024","RHMA","6530","H",15,NA,"29.5",NA,"29.5",NA,NA,NA,"IEKHS MIC Field Trip","C","Jemar",2024-10-25,"2024","10","25","St. Thomas",18.320665,-64.867323
"2109","Oasis Cove","DN","IEKHS MIC Field Trip","11/06/2024","CC","10/25/2024","RHMA","6533","H",13.25,NA,"23",NA,"23",NA,NA,NA,"IEKHS MIC Field Trip","C","Tony",2024-10-25,"2024","10","25","St. Thomas",18.320665,-64.867323
"2110","Oasis Cove","DN","IEKHS MIC Field Trip","11/06/2024","CC","10/25/2024","RHMA","6534","H",17.31,NA,"24",NA,"24",NA,NA,NA,"IEKHS MIC Field Trip","C","Anna",2024-10-25,"2024","10","25","St. Thomas",18.320665,-64.867323
"2111","Oasis Cove","DN","IEKHS MIC Field Trip","11/06/2024","CC","10/25/2024","RHMA","6535","H",18.05,NA,"26.3",NA,"26.3",NA,NA,NA,"IEKHS MIC Field Trip","C","Sarah",2024-10-25,"2024","10","25","St. Thomas",18.320665,-64.867323
"2112","Oasis Cove","DN","IEKHS MIC Field Trip","11/06/2024","CC","10/25/2024","RHMA","6537","H",15.64,NA,"27.5",NA,"27.5",NA,NA,NA,"IEKHS MIC Field Trip","C","Tola",2024-10-25,"2024","10","25","St. Thomas",18.320665,-64.867323
"2113","Oasis Cove","DN","IEKHS MIC Field Trip","11/06/2024","CC","10/25/2024","RHMA","6538","H",18.7,NA,"26.8",NA,"26.8",NA,NA,NA,"IEKHS MIC Field Trip","C","Sam 3",2024-10-25,"2024","10","25","St. Thomas",18.320665,-64.867323
"2114","Oasis Cove","LU","Felix","9/28/24","CC","09/11/2024","RHMA","6224",NA,13.74,NA,NA,NA,"27",NA,NA,NA,NA,"VICM Day of Play","sonic",2024-09-11,"2024","09","11","St. Thomas",18.320665,-64.867323
"2115","Oasis Cove","ST,SF,SC","ST,SF,SC","1/22/2024","4""TP","1/19/24","RHMA","3814","H",15.81,"10.5","26.1","1.3","24.8","G","Y","N",NA,"N",NA,2024-01-19,"2024","01","19","St. Thomas",18.320665,-64.867323
"2116","Oasis Cove","ST,SF,SC","ST,SF,SC","1/22/2024","4""TP","1/19/24","RHMA","3815","H",13.8,"10","25.7","1.7","24.5","G","N","N",NA,"N",NA,2024-01-19,"2024","01","19","St. Thomas",18.320665,-64.867323
"2117","Oasis Cove","LU","Sara","9/28/24","CC","09/11/2024","RHMA","6228",NA,29.95,NA,NA,NA,"38",NA,NA,NA,NA,"VICM Day of Play","Daisy 2",2024-09-11,"2024","09","11","St. Thomas",18.320665,-64.867323
"2118","Oasis Cove","LU","Diamond","9/28/24","CC","09/11/2024","RHMA","6229",NA,21.64,NA,NA,NA,"33.1",NA,NA,NA,NA,"VICM Day of Play","Diamond",2024-09-11,"2024","09","11","St. Thomas",18.320665,-64.867323
"2119","Oasis Cove","DN","Elizabeth","9/28/24","CC","09/11/2024","RHMA","6230",NA,30.51,NA,NA,NA,"33.5",NA,NA,NA,NA,"VICM Day of Play","Wormy",2024-09-11,"2024","09","11","St. Thomas",18.320665,-64.867323
"2120","Oasis Cove","DN","Halirema","9/28/24","CC","09/11/2024","RHMA","6231",NA,23.3,NA,NA,NA,"29",NA,NA,NA,NA,"VICM Day of Play","Baby P.",2024-09-11,"2024","09","11","St. Thomas",18.320665,-64.867323
"2121","Oasis Cove","LU","Kataleya","9/28/24","CC","09/11/2024","RHMA","6232",NA,21,NA,NA,NA,"35.5",NA,NA,NA,NA,"VICM Day of Play","leya",2024-09-11,"2024","09","11","St. Thomas",18.320665,-64.867323
"2122","Oasis Cove","DN","Kylee","9/28/24","CC","09/11/2024","RHMA","6233",NA,29.2,NA,NA,NA,"34",NA,NA,NA,NA,"VICM Day of Play","Kilye",2024-09-11,"2024","09","11","St. Thomas",18.320665,-64.867323
"2123","Oasis Cove","DN","Sophia","9/28/24","CC","09/11/2024","RHMA","6234",NA,21.22,NA,NA,NA,"33.5",NA,NA,NA,NA,"VICM Day of Play","Tree Branch",2024-09-11,"2024","09","11","St. Thomas",18.320665,-64.867323
"2124","Oasis Cove","LU","Jahreem","9/28/24","CC","09/11/2024","RHMA","6235",NA,26.68,NA,NA,NA,"34",NA,NA,NA,NA,"VICM Day of Play","jef",2024-09-11,"2024","09","11","St. Thomas",18.320665,-64.867323
"2125","Oasis Cove","LU","Arianna","9/28/24","CC","09/11/2024","RHMA","6236",NA,13.25,NA,NA,NA,"30.4",NA,NA,NA,NA,"VICM Day of Play","A",2024-09-11,"2024","09","11","St. Thomas",18.320665,-64.867323
"2126","Oasis Cove","LU","Ahniah","9/28/24","CC","09/11/2024","RHMA","6237",NA,18.95,NA,NA,NA,"30",NA,NA,NA,NA,"VICM Day of Play","Ava",2024-09-11,"2024","09","11","St. Thomas",18.320665,-64.867323
"2127","Oasis Cove","LU","Melody","9/28/24","CC","09/11/2024","RHMA","6238",NA,13.29,NA,NA,NA,"26.9",NA,NA,NA,NA,"VICM Day of Play","Rose",2024-09-11,"2024","09","11","St. Thomas",18.320665,-64.867323
"2128","Oasis Cove","LU","Niaomi","9/28/24","CC","09/11/2024","RHMA","6239",NA,13.25,NA,NA,NA,"26.4",NA,NA,NA,NA,"VICM Day of Play","purple",2024-09-11,"2024","09","11","St. Thomas",18.320665,-64.867323
"2129","Oasis Cove","LU","Maiah","9/28/24","CC","09/11/2024","RHMA","6240",NA,16.62,NA,NA,NA,"29",NA,NA,NA,NA,"VICM Day of Play","lyric",2024-09-11,"2024","09","11","St. Thomas",18.320665,-64.867323
"2130","Oasis Cove","LU","Elias","9/28/24","CC","09/11/2024","RHMA","6241",NA,21.63,NA,NA,NA,"37.3",NA,NA,NA,NA,"VICM Day of Play","milo",2024-09-11,"2024","09","11","St. Thomas",18.320665,-64.867323
"2131","Oasis Cove","LU","LaCori","9/28/24","CC","09/11/2024","RHMA","6242",NA,15.83,NA,NA,NA,"27",NA,NA,NA,NA,"VICM Day of Play","lacori",2024-09-11,"2024","09","11","St. Thomas",18.320665,-64.867323
"2132","Oasis Cove","LU","nellie","9/28/24","CC","09/11/2024","RHMA","6243",NA,14.22,NA,NA,NA,"25",NA,NA,NA,NA,"VICM Day of Play","waldo",2024-09-11,"2024","09","11","St. Thomas",18.320665,-64.867323
"2133","Oasis Cove","Direct Input","LU & DN","11/07/2024","CC","10/25/2024","RHMA","6558","H",8.05,"8.8","20.4","1","19.4","G","Y","Y",NA,NA,NA,2024-10-25,"2024","10","25","St. Thomas",18.320665,-64.867323
"2134","Oasis Cove","Direct Input","LU & DN","11/07/2024","CC","10/25/2024","RHMA","6559","P",18.35,"12","27.8","2","25.8","G","Y","Y","KNICKS",NA,NA,2024-10-25,"2024","10","25","St. Thomas",18.320665,-64.867323
"2135","Oasis Cove","Direct Input","LU & DN","11/07/2024","CC","10/25/2024","RHMA","6560","H",25.92,"12.6","34.5","1.5","33","G","Y","Y",NA,NA,NA,2024-10-25,"2024","10","25","St. Thomas",18.320665,-64.867323
"2136","Oasis Cove","Direct Input","LU & DN","11/07/2024","CC","10/25/2024","RHMA","6561","H",12.75,"10","27","0","27","G","N","Y","DECAP",NA,NA,2024-10-25,"2024","10","25","St. Thomas",18.320665,-64.867323
"2137","Oasis Cove","DN","IEKHS MIC Field Trip","11/06/2024","CC","10/25/2024","RHMA","6517","H",26.19,NA,"34.5",NA,"34.5",NA,NA,NA,"IEKHS MIC Field Trip","C","Cruz",2024-10-25,"2024","10","25","St. Thomas",18.320665,-64.867323
"2138","Oasis Cove","Direct Input","LU & DN","11/07/2024","CC","10/25/2024","RHMA","6563","H",9.98,"9.1","23.4","1.5","21.9","G","Y","Y",NA,NA,NA,2024-10-25,"2024","10","25","St. Thomas",18.320665,-64.867323
"2139","Oasis Cove","LU","Sarai","9/28/24","CC","09/11/2024","RHMA","6209",NA,30.35,NA,NA,NA,"30.5",NA,NA,NA,NA,"VICM Day of Play","love",2024-09-11,"2024","09","11","St. Thomas",18.320665,-64.867323
"2140","Oasis Cove","LU","Akeo","9/28/24","CC","09/11/2024","RHMA","6210",NA,29.32,NA,NA,NA,"37.5",NA,NA,NA,NA,"VICM Day of Play","mr. tree",2024-09-11,"2024","09","11","St. Thomas",18.320665,-64.867323
"2141","Oasis Cove","DN","Wedad","9/28/24","CC","09/11/2024","RHMA","6252",NA,26.36,NA,NA,NA,"30",NA,NA,NA,NA,"VICM Day of Play","Anna",2024-09-11,"2024","09","11","St. Thomas",18.320665,-64.867323
"2142","Oasis Cove","DN","Liam","9/28/24","CC","09/11/2024","RHMA","6253",NA,26.4,NA,NA,NA,"35",NA,NA,NA,NA,"VICM Day of Play","Mango",2024-09-11,"2024","09","11","St. Thomas",18.320665,-64.867323
"2143","Oasis Cove","DN","Millie","9/28/24","CC","09/11/2024","RHMA","6254",NA,21.25,NA,NA,NA,"32.5",NA,NA,NA,NA,"VICM Day of Play","Banana",2024-09-11,"2024","09","11","St. Thomas",18.320665,-64.867323
"2144","Oasis Cove","DN","D~~~n","9/28/24","CC","09/11/2024","RHMA","6255",NA,18.46,NA,NA,NA,"27.5",NA,NA,NA,NA,"VICM Day of Play","Abd",2024-09-11,"2024","09","11","St. Thomas",18.320665,-64.867323
"2145","Oasis Cove","ST","AND, AH, KWG","05/11/2021","N/A","4/16/2021","RHMA","85","S",8,"8.44","22.2","1.4","20.7","OlGr","Y","Y",NA,"N",NA,2021-04-16,"2021","04","16","St. Thomas",18.320665,-64.867323
"2146","Oasis Cove","MA","MA","10/04/2023","3"" TP","9/28/2023","RHMA","4733","H",15.07,"10.9","26.5","1.5","25","G","Y","N",NA,"N",NA,2023-09-28,"2023","09","28","St. Thomas",18.320665,-64.867323
"2147","Oasis Cove","MA","MA","10/04/2023","3"" TP","9/28/2023","RHMA","4734","H",19.81,"11","31.4","1.4","30","G","Y","Y",NA,"N",NA,2023-09-28,"2023","09","28","St. Thomas",18.320665,-64.867323
"2148","Oasis Cove","MA","MA","10/04/2023","3"" TP","9/28/2023","RHMA","4735","H",16.11,"10.9","28.8","1.6","27.2","G","N","N",NA,"N",NA,2023-09-28,"2023","09","28","St. Thomas",18.320665,-64.867323
"2149","Oasis Cove","Direct Input","LU & DN","11/07/2024","CC","10/25/2024","RHMA","6574","H",13.1,"11.5","22.1","0","22.1","G","Y","Y","DECAP",NA,NA,2024-10-25,"2024","10","25","St. Thomas",18.320665,-64.867323
"2150","Oasis Cove","Direct Input","LU & DN","11/07/2024","CC","10/25/2024","RHMA","6575","H",23.2,"13.2","28","1.5","26.5","G","Y","Y",NA,NA,NA,2024-10-25,"2024","10","25","St. Thomas",18.320665,-64.867323
"2151","Oasis Cove","Direct Input","LU & DN","11/07/2024","CC","10/25/2024","RHMA","6576","H",17.81,"12.6","23","1.8","21.2","G","N","N",NA,NA,NA,2024-10-25,"2024","10","25","St. Thomas",18.320665,-64.867323
"2152","Oasis Cove","Direct Input","LU & DN","11/07/2024","CC","10/25/2024","RHMA","6577","H",15.74,"11.6","25","1.5","23.5","G","Y","F",NA,NA,NA,2024-10-25,"2024","10","25","St. Thomas",18.320665,-64.867323
"2153","Oasis Cove","Direct Input","LU & DN","11/07/2024","CC","10/25/2024","RHMA","6578","H",13.59,"11.1","23.4","1.5","21.9","G","Y","F",NA,NA,NA,2024-10-25,"2024","10","25","St. Thomas",18.320665,-64.867323
"2154","Oasis Cove","DN","DN,TB","11/05/2024","CC","10/25/2024","RHMA","3730B","H",27.29,"13.1","35.6","0.6","35","G","Y","N","duplicate numbers added B to tags",NA,NA,2024-10-25,"2024","10","25","St. Thomas",18.320665,-64.867323
"2155","Oasis Cove","LU","Kailani","9/28/24","CC","09/11/2024","RHMA","6225",NA,20.04,NA,NA,NA,"32",NA,NA,NA,NA,"VICM Day of Play","Jasmine",2024-09-11,"2024","09","11","St. Thomas",18.320665,-64.867323
"2156","Oasis Cove","DN","DN,TB","11/05/2024","CC","10/25/2024","RHMA","3732B","H",14.94,"8.3","33.1","1.5","31.6","G","Y","N","duplicate numbers added B to tags",NA,NA,2024-10-25,"2024","10","25","St. Thomas",18.320665,-64.867323
"2157","Oasis Cove","ST,SF,SC","ST,SF,SC","1/22/2024","4""TP","1/19/24","RHMA","3816","H",15.18,"10.9","28.3","1.4","26.9","G","N","N",NA,"N",NA,2024-01-19,"2024","01","19","St. Thomas",18.320665,-64.867323
"2158","Oasis Cove","ST,SF,SC","ST,SF,SC","1/22/2024","4""TP","1/19/24","RHMA","3817","H",10.81,"10.1","21.2","1.5","19.7","G","N","N",NA,"N",NA,2024-01-19,"2024","01","19","St. Thomas",18.320665,-64.867323
"2159","Oasis Cove","ST,SF,SC","ST,SF,SC","1/22/2024","4""TP","1/19/24","RHMA","3818","H",10.4,"9.8","22.5","1.2","21.3","G","N","N",NA,"N",NA,2024-01-19,"2024","01","19","St. Thomas",18.320665,-64.867323
"2160","Oasis Cove","ST,SF,SC","ST,SF,SC","1/22/2024","4""TP","1/19/24","RHMA","3819","H",15.04,"10.8","26.4","1.4","25","G","N","Y",NA,"N",NA,2024-01-19,"2024","01","19","St. Thomas",18.320665,-64.867323
"2161","Oasis Cove","ST,SF,SC","ST,SF,SC","1/22/2024","4""TP","1/19/24","RHMA","3820","H",21.36,"12.4","30.3","1.5","28.8","G","N","N",NA,"N",NA,2024-01-19,"2024","01","19","St. Thomas",18.320665,-64.867323
"2162","Oasis Cove","ST,SF,SC","ST,SF,SC","1/22/2024","4""TP","1/19/24","RHMA","3821","H",25.35,"12.9","30","1.3","28.7","G","Y","N",NA,"N",NA,2024-01-19,"2024","01","19","St. Thomas",18.320665,-64.867323
"2163","Oasis Cove","ST,SF,SC","ST,SF,SC","1/22/2024","4""TP","1/19/24","RHMA","3822","H",17.84,"10.6","30.8","1.6","29.2","G","Y","N",NA,"N",NA,2024-01-19,"2024","01","19","St. Thomas",18.320665,-64.867323
"2164","Oasis Cove","DN","IEKHS MIC Field Trip","11/06/2024","CC","10/25/2024","RHMA","6504","H",25.25,NA,"34.8",NA,"34.8",NA,NA,NA,"IEKHS MIC Field Trip","C","Sativa",2024-10-25,"2024","10","25","St. Thomas",18.320665,-64.867323
"2165","Oasis Cove","DN","IEKHS MIC Field Trip","11/06/2024","CC","10/25/2024","RHMA","6505","H",28.04,NA,"37.1",NA,"37.1",NA,NA,NA,"IEKHS MIC Field Trip","C","Neme",2024-10-25,"2024","10","25","St. Thomas",18.320665,-64.867323
"2166","Oasis Cove","DN","DN,TB","11/05/2024","CC","10/25/2024","RHMA","3729B","H",24.5,"12.4","32.7","1.5","31.2","G","N","N","duplicate numbers added B to tags",NA,NA,2024-10-25,"2024","10","25","St. Thomas",18.320665,-64.867323
"2167","Oasis Cove","DN","Naiyir","9/28/24","CC","09/11/2024","RHMA","6250",NA,26.96,NA,NA,NA,"35.3",NA,NA,NA,NA,"VICM Day of Play","Naiyir",2024-09-11,"2024","09","11","St. Thomas",18.320665,-64.867323
"2168","Oasis Cove","DN","DN,TB","11/05/2024","CC","10/25/2024","RHMA","3731B","H",28.37,"14.6","36","2","34","G","Y","N","duplicate numbers added B to tags",NA,NA,2024-10-25,"2024","10","25","St. Thomas",18.320665,-64.867323
"2169","Oasis Cove","LU","Brielli","9/28/24","CC","09/11/2024","RHMA","6212",NA,10.36,NA,NA,NA,"25.5",NA,NA,NA,NA,"VICM Day of Play","Gei",2024-09-11,"2024","09","11","St. Thomas",18.320665,-64.867323
"2170","Oasis Cove","DN","DN,TB","11/05/2024","CC","10/25/2024","RHMA","3733B","H",27.95,"10.9","40.1","2.1","38","G","Y","N","predation on hypocotyl,duplicate numbers added B to tags",NA,NA,2024-10-25,"2024","10","25","St. Thomas",18.320665,-64.867323
"2171","Oasis Cove","DN","DN,TB","11/05/2024","CC","10/25/2024","RHMA","3734B","H",35.52,"13.7","41.5","2.2","39.3","G","Y","N","duplicate numbers added B to tags",NA,NA,2024-10-25,"2024","10","25","St. Thomas",18.320665,-64.867323
"2172","Oasis Cove","DN","DN,TB","11/05/2024","CC","10/25/2024","RHMA","3735B","H",26.38,"11.9","30.8","1.4","29.4","G","N","N","duplicate numbers added B to tags",NA,NA,2024-10-25,"2024","10","25","St. Thomas",18.320665,-64.867323
"2173","Oasis Cove","DN","IEKHS MIC Field Trip","11/06/2024","CC","10/25/2024","RHMA","6513","H",31.66,NA,"35.1",NA,"35.1",NA,NA,NA,"IEKHS MIC Field Trip","C","Fabianna",2024-10-25,"2024","10","25","St. Thomas",18.320665,-64.867323
"2174","Oasis Cove","DN","IEKHS MIC Field Trip","11/06/2024","CC","10/25/2024","RHMA","6514","H",21.85,NA,"31",NA,"31",NA,NA,NA,"IEKHS MIC Field Trip","C","Fatty",2024-10-25,"2024","10","25","St. Thomas",18.320665,-64.867323
"2175","Oasis Cove","DN","IEKHS MIC Field Trip","11/06/2024","CC","10/25/2024","RHMA","6515","H",17.57,NA,"24",NA,"24",NA,NA,NA,"IEKHS MIC Field Trip","C","Airpods",2024-10-25,"2024","10","25","St. Thomas",18.320665,-64.867323
"2176","Oasis Cove","DN","IEKHS MIC Field Trip","11/06/2024","CC","10/25/2024","RHMA","6516","H",16.46,NA,"26",NA,"26",NA,NA,NA,"IEKHS MIC Field Trip","C","Lightskin",2024-10-25,"2024","10","25","St. Thomas",18.320665,-64.867323
"2177","Oasis Cove","DN","Kurtis","9/28/24","CC","09/11/2024","RHMA","6247",NA,18.04,NA,NA,NA,"24.5",NA,NA,NA,NA,"VICM Day of Play","Kurtis",2024-09-11,"2024","09","11","St. Thomas",18.320665,-64.867323
"2178","Oasis Cove","DN","IEKHS MIC Field Trip","11/06/2024","CC","10/25/2024","RHMA","6518","H",16.72,NA,"23.8",NA,"23.8",NA,NA,NA,"IEKHS MIC Field Trip","C","Dreads",2024-10-25,"2024","10","25","St. Thomas",18.320665,-64.867323
"2179","Oasis Cove","DN","Si' Naiya","9/28/24","CC","09/11/2024","RHMA","6249",NA,20,NA,NA,NA,"34.2",NA,NA,NA,NA,"VICM Day of Play","Si' Naiya",2024-09-11,"2024","09","11","St. Thomas",18.320665,-64.867323
"2180","Oasis Cove","LU","Emelie","9/28/24","CC","09/11/2024","RHMA","6223",NA,40.83,NA,NA,NA,"43",NA,NA,NA,NA,"VICM Day of Play","Lilly",2024-09-11,"2024","09","11","St. Thomas",18.320665,-64.867323
"2181","Oasis Cove","LU","zyon","9/28/24","CC","09/11/2024","RHMA","6211",NA,23.26,NA,NA,NA,"33",NA,NA,NA,NA,"VICM Day of Play","Among Us",2024-09-11,"2024","09","11","St. Thomas",18.320665,-64.867323
"2182","Oasis Cove","DN","IEKHS MIC Field Trip","11/06/2024","CC","10/25/2024","RHMA","6508","H",15.85,NA,"26",NA,"26",NA,NA,NA,"IEKHS MIC Field Trip","C","Dre",2024-10-25,"2024","10","25","St. Thomas",18.320665,-64.867323
"2183","Oasis Cove","LU","Brielli","9/28/24","CC","09/11/2024","RHMA","6213",NA,27.34,NA,NA,NA,"35",NA,NA,NA,NA,"VICM Day of Play","soleil",2024-09-11,"2024","09","11","St. Thomas",18.320665,-64.867323
"2184","Oasis Cove","DN","Rock","9/28/24","CC","09/11/2024","RHMA","6214",NA,16.3,NA,NA,NA,"29",NA,NA,NA,NA,"VICM Day of Play","River",2024-09-11,"2024","09","11","St. Thomas",18.320665,-64.867323
"2185","Oasis Cove","DN","Then","9/28/24","CC","09/11/2024","RHMA","6215",NA,13.91,NA,NA,NA,"31.1",NA,NA,NA,NA,"VICM Day of Play","Fluffy",2024-09-11,"2024","09","11","St. Thomas",18.320665,-64.867323
"2186","Oasis Cove","LU","Jazmin","9/28/24","CC","09/11/2024","RHMA","6216",NA,14.5,NA,NA,NA,"29.5",NA,NA,NA,NA,"VICM Day of Play","princess (peso)",2024-09-11,"2024","09","11","St. Thomas",18.320665,-64.867323
"2187","Oasis Cove","LU","Finley","9/28/24","CC","09/11/2024","RHMA","6217",NA,36.21,NA,NA,NA,"37.5",NA,NA,NA,NA,"VICM Day of Play","Ava",2024-09-11,"2024","09","11","St. Thomas",18.320665,-64.867323
"2188","Oasis Cove","LU","Gianna Jeana","9/28/24","CC","09/11/2024","RHMA","6218",NA,23.25,NA,NA,NA,"34",NA,NA,NA,NA,"VICM Day of Play","Lila",2024-09-11,"2024","09","11","St. Thomas",18.320665,-64.867323
"2189","Oasis Cove","ST,SF,SC","ST,SF,SC","1/22/2024","4""TP","1/19/24","RHMA","3807","H",16.86,"11","27.8","1.2","26.3","G","N","N",NA,"N",NA,2024-01-19,"2024","01","19","St. Thomas",18.320665,-64.867323
"2190","Oasis Cove","DN","Penn","9/28/24","CC","09/11/2024","RHMA","6220",NA,24.7,NA,NA,NA,"32",NA,NA,NA,NA,"VICM Day of Play","The Green Nothing",2024-09-11,"2024","09","11","St. Thomas",18.320665,-64.867323
"2191","Oasis Cove","DN","Jessa","9/28/24","CC","09/11/2024","RHMA","6221",NA,24,NA,NA,NA,"36",NA,NA,NA,NA,"VICM Day of Play","Flower",2024-09-11,"2024","09","11","St. Thomas",18.320665,-64.867323
"2192","Oasis Cove","DN","Perry","9/28/24","CC","09/11/2024","RHMA","6222",NA,17.79,NA,NA,NA,"27",NA,NA,NA,NA,"VICM Day of Play","Kiwi",2024-09-11,"2024","09","11","St. Thomas",18.320665,-64.867323
"2193","Oasis Cove","DN","IEKHS MIC Field Trip","11/06/2024","CC","10/25/2024","RHMA","6506","H",19.92,NA,"30",NA,"30",NA,NA,NA,"IEKHS MIC Field Trip","C","CoCo",2024-10-25,"2024","10","25","St. Thomas",18.320665,-64.867323
"2194","Oasis Cove","DN","IEKHS MIC Field Trip","11/06/2024","CC","10/25/2024","RHMA","6507","H",18.31,NA,"29.5",NA,"29.5",NA,NA,NA,"IEKHS MIC Field Trip","C","Yari",2024-10-25,"2024","10","25","St. Thomas",18.320665,-64.867323
"2195","Oasis Cove","DN","Shep","9/28/24","CC","09/11/2024","RHMA","6251",NA,32.88,NA,NA,NA,"40.2",NA,NA,NA,NA,"VICM Day of Play","Cutiepie",2024-09-11,"2024","09","11","St. Thomas",18.320665,-64.867323
"2196","Oasis Cove","DN","IEKHS MIC Field Trip","11/06/2024","CC","10/25/2024","RHMA","6509","H",38.1,NA,"42.6",NA,"42.6",NA,NA,NA,"IEKHS MIC Field Trip","C","Sally 1",2024-10-25,"2024","10","25","St. Thomas",18.320665,-64.867323
"2197","Oasis Cove","DN","IEKHS MIC Field Trip","11/06/2024","CC","10/25/2024","RHMA","6510","H",27.88,NA,"31.4",NA,"31.4",NA,NA,NA,"IEKHS MIC Field Trip","C","Sally 2",2024-10-25,"2024","10","25","St. Thomas",18.320665,-64.867323
"2198","Oasis Cove","DN","IEKHS MIC Field Trip","11/06/2024","CC","10/25/2024","RHMA","6511","H",34.79,NA,"38.8",NA,"38.8",NA,NA,NA,"IEKHS MIC Field Trip","C","Sam 1",2024-10-25,"2024","10","25","St. Thomas",18.320665,-64.867323
"2199","Oasis Cove","DN","IEKHS MIC Field Trip","11/06/2024","CC","10/25/2024","RHMA","6512","H",22.16,NA,"28.4",NA,"28.4",NA,NA,NA,"IEKHS MIC Field Trip","C","Sam 2",2024-10-25,"2024","10","25","St. Thomas",18.320665,-64.867323
"2200","Oasis Cove","DIRECT UPLOAD","AND, DG","7/20/2023","3""TP","6/19/2023","RHMA","4253","H",15.55,"11.8","27.3","5","22.3","G","Y","Y","lcp, WENT ON NOAA ELP WORKSHOP FIELDTRIP TO BOULDER, CO AND BACK","N",NA,2023-06-19,"2023","06","19","St. Thomas",18.320665,-64.867323
"2201","Oasis Cove","LU","Kaysiah","9/28/24","CC","09/11/2024","RHMA","6244",NA,28.94,NA,NA,NA,"37.1",NA,NA,NA,NA,"VICM Day of Play","kaysiah",2024-09-11,"2024","09","11","St. Thomas",18.320665,-64.867323
"2202","Oasis Cove","LU","Aria","9/28/24","CC","09/11/2024","RHMA","6245",NA,27.07,NA,NA,NA,"36.6",NA,NA,NA,NA,"VICM Day of Play","aria",2024-09-11,"2024","09","11","St. Thomas",18.320665,-64.867323
"2203","Oasis Cove","DN","Cirae","9/28/24","CC","09/11/2024","RHMA","6246",NA,25.31,NA,NA,NA,"30.5",NA,NA,NA,NA,"VICM Day of Play","Cirae",2024-09-11,"2024","09","11","St. Thomas",18.320665,-64.867323
"2204","Oasis Cove","DIRECT UPLOAD","AND, DG","7/20/2023","3""TP","6/19/2023","RHMA","4257","H",22.28,"12.7","33.7","5.1","28.6","G","Y","Y","WENT ON NOAA ELP WORKSHOP FIELDTRIP TO BOULDER, CO AND BACK","N",NA,2023-06-19,"2023","06","19","St. Thomas",18.320665,-64.867323
"2205","Oasis Cove","ST,SF,SC","ST,SF,SC","1/22/2024","4""TP","1/19/24","RHMA","3823","H",9.9,"10.2","22.5","1.1","21.4","G","N","Y",NA,"N",NA,2024-01-19,"2024","01","19","St. Thomas",18.320665,-64.867323
"2206","Oasis Cove","LU","LU","9/28/24","CC","09/11/2024","RHMA","6208",NA,25.27,NA,NA,NA,"22",NA,NA,NA,NA,"VICM Day of Play","na",2024-09-11,"2024","09","11","St. Thomas",18.320665,-64.867323
"2207","Oasis Cove","ST,SF,SC","ST,SF,SC","1/22/2024","4""TP","1/19/24","RHMA","3824","H",18.89,"11.8","27.4","1.1","26.3","G","Y","N",NA,"N",NA,2024-01-19,"2024","01","19","St. Thomas",18.320665,-64.867323
"2208","Oasis Cove","ST,SF,SC","ST,SF,SC","1/22/2024","4""TP","1/19/24","RHMA","3825","H",11.1,"10.6","20.2","1","19.2","G","N","N",NA,"N",NA,2024-01-19,"2024","01","19","St. Thomas",18.320665,-64.867323
"2209","Oasis Cove","ST,SF,SC","ST,SF,SC","1/22/2024","4""TP","1/19/24","RHMA","3826","H",10.51,"10.4","19.9","1.3","18.6","G","N","N",NA,"N",NA,2024-01-19,"2024","01","19","St. Thomas",18.320665,-64.867323
"2210","Oasis Cove","DIRECT UPLOAD","AND, DG","7/20/2023","3""TP","6/19/2023","RHMA","4249","H",18,"11.5","29","4.4","24.6","G","Y","Y","WENT ON NOAA ELP WORKSHOP FIELDTRIP TO BOULDER, CO AND BACK","N",NA,2023-06-19,"2023","06","19","St. Thomas",18.320665,-64.867323
"2211","Oasis Cove","DIRECT UPLOAD","AND, DG","7/20/2023","3""TP","6/19/2023","RHMA","4250","H",21.65,"12.9","31.1","4.8","26.3","G","Y","Y","WENT ON NOAA ELP WORKSHOP FIELDTRIP TO BOULDER, CO AND BACK","N",NA,2023-06-19,"2023","06","19","St. Thomas",18.320665,-64.867323
"2212","Oasis Cove","DIRECT UPLOAD","AND, DG","7/20/2023","3""TP","6/19/2023","RHMA","4251","H",18.41,"11.7","29.3","2.5","26.8","G","Y","Y","WENT ON NOAA ELP WORKSHOP FIELDTRIP TO BOULDER, CO AND BACK","N",NA,2023-06-19,"2023","06","19","St. Thomas",18.320665,-64.867323
"2213","Oasis Cove","DIRECT UPLOAD","AND, DG","7/20/2023","3""TP","6/19/2023","RHMA","4252","H",12.24,"10","21.5","0.9","20.6","G","Y","Y","WENT ON NOAA ELP WORKSHOP FIELDTRIP TO BOULDER, CO AND BACK","N",NA,2023-06-19,"2023","06","19","St. Thomas",18.320665,-64.867323
"2214","Oasis Cove","MA","MA","10/04/2023","3"" TP","9/28/2023","RHMA","4732","H",21.7,"11.6","33.7","1.7","32","G","Y","Y",NA,"N",NA,2023-09-28,"2023","09","28","St. Thomas",18.320665,-64.867323
"2215","Oasis Cove","ST,SF,SC","ST,SF,SC","1/22/2024","4""TP","1/19/24","RHMA","3805","H",14,"12.5","32.5","1.5","31","G","Y","Y",NA,"N",NA,2024-01-19,"2024","01","19","St. Thomas",18.320665,-64.867323
"2216","Oasis Cove","DN","Grayson","9/28/24","CC","09/11/2024","RHMA","6219",NA,20.11,NA,NA,NA,"25",NA,NA,NA,NA,"VICM Day of Play","Occania",2024-09-11,"2024","09","11","St. Thomas",18.320665,-64.867323
"2217","Oasis Cove","DIRECT UPLOAD","AND, DG","7/20/2023","3""TP","6/19/2023","RHMA","4256","H",19.64,"12.7","29.1","4.6","24.5","G","Y","Y","lcp, WENT ON NOAA ELP WORKSHOP FIELDTRIP TO BOULDER, CO AND BACK","N",NA,2023-06-19,"2023","06","19","St. Thomas",18.320665,-64.867323
"2218","Oasis Cove","DN","Jy'Sai","9/28/24","CC","09/11/2024","RHMA","6248",NA,12.72,NA,NA,NA,"22.5",NA,NA,NA,NA,"VICM Day of Play","Jy'Sai",2024-09-11,"2024","09","11","St. Thomas",18.320665,-64.867323
"2219","Oasis Cove","DIRECT UPLOAD","AND, DG","7/20/2023","3""TP","6/19/2023","RHMA","4258","H",23.78,"14","29.8","4.8","25","G","Y","Y","WENT ON NOAA ELP WORKSHOP FIELDTRIP TO BOULDER, CO AND BACK","N",NA,2023-06-19,"2023","06","19","St. Thomas",18.320665,-64.867323
"2220","Oasis Cove","LU","Asani","9/28/24","CC","09/11/2024","RHMA","6207",NA,35.52,NA,NA,NA,"37",NA,NA,NA,NA,"VICM Day of Play","karmo",2024-09-11,"2024","09","11","St. Thomas",18.320665,-64.867323
"2221","Oasis Cove","ST,SF,SC","ST,SF,SC","1/22/2024","4""TP","1/19/24","RHMA","3812`","H",17.12,"11.9","27.4","1.7","26.2","G","N","N",NA,"N",NA,2024-01-19,"2024","01","19","St. Thomas",18.320665,-64.867323
"2222","Oasis Cove","DN","Amelia","9/28/24","CC","09/11/2024","RHMA","6199",NA,16.65,NA,NA,NA,"33",NA,NA,NA,NA,"VICM Day of Play","TrreeTree",2024-09-11,"2024","09","11","St. Thomas",18.320665,-64.867323
"2223","Oasis Cove","DN",NA,"9/28/24","CC","09/11/2024","RHMA","6196",NA,20.77,NA,NA,NA,"33.5",NA,NA,NA,NA,"VICM Day of Play","Windgrove",2024-09-11,"2024","09","11","St. Thomas",18.320665,-64.867323
"2224","Oasis Cove","DN",NA,"9/28/24","CC","09/11/2024","RHMA","6197",NA,35.33,NA,NA,NA,"34",NA,NA,NA,NA,"VICM Day of Play","Chloe",2024-09-11,"2024","09","11","St. Thomas",18.320665,-64.867323
"2225","Oasis Cove","DN",NA,"9/28/24","CC","09/11/2024","RHMA","6198",NA,28.13,NA,NA,NA,"35",NA,NA,NA,NA,"VICM Day of Play","Stella",2024-09-11,"2024","09","11","St. Thomas",18.320665,-64.867323
"2226","Oasis Cove","ST,SF,SC","ST,SF,SC","1/22/2024","3""TP","1/19/24","RHMA","3806","H",1.45,"12.1","38.5","1.8","37","G","Y","Y",NA,"N",NA,2024-01-19,"2024","01","19","St. Thomas",18.320665,-64.867323
"2227","Oasis Cove","LU","Nalissa","9/28/24","CC","09/11/2024","RHMA","6201",NA,23.42,NA,NA,NA,"35.5",NA,NA,NA,NA,"VICM Day of Play","Jem JeJa",2024-09-11,"2024","09","11","St. Thomas",18.320665,-64.867323
"2228","Oasis Cove","DIRECT UPLOAD","AND, DG","7/20/2023","3""TP","6/19/2023","RHMA","4254","H",22.89,"12.5","33.7","4.9","28.8","G","Y","Y","lcp, WENT ON NOAA ELP WORKSHOP FIELDTRIP TO BOULDER, CO AND BACK","N",NA,2023-06-19,"2023","06","19","St. Thomas",18.320665,-64.867323
"2229","Oasis Cove","DIRECT UPLOAD","AND, DG","7/20/2023","3""TP","6/19/2023","RHMA","4255","H",18.26,"11.7","28.6","3.7","24.9","G","Y","Y","lcp, WENT ON NOAA ELP WORKSHOP FIELDTRIP TO BOULDER, CO AND BACK","N",NA,2023-06-19,"2023","06","19","St. Thomas",18.320665,-64.867323
"2230","Oasis Cove","ST,SF,SC","ST,SF,SC","1/22/2024","4""TP","1/19/24","RHMA","3833","H",7.41,"8.6","17.8","1","16.8","G","N","N",NA,"N",NA,2024-01-19,"2024","01","19","St. Thomas",18.320665,-64.867323
"2231","Oasis Cove","LU","Rainbow","9/28/24","CC","09/11/2024","RHMA","6205",NA,24.23,NA,NA,NA,"33.5",NA,NA,NA,NA,"VICM Day of Play","rainbow",2024-09-11,"2024","09","11","St. Thomas",18.320665,-64.867323
"2232","Oasis Cove","ST,SF,SC","ST,SF,SC","1/22/2024","4""TP","1/19/24","RHMA","3832","H",12.91,"10.5","24.3","1.5","22.8","G","N","N",NA,"N",NA,2024-01-19,"2024","01","19","St. Thomas",18.320665,-64.867323
"2233","Oasis Cove","LU","Leo","9/28/24","CC","09/11/2024","RHMA","6206",NA,21.36,NA,NA,NA,"23.5",NA,NA,NA,NA,"VICM Day of Play","flatball",2024-09-11,"2024","09","11","St. Thomas",18.320665,-64.867323
"2234","Oasis Cove","LU","Annalise","9/28/24","CC","09/11/2024","RHMA","6202",NA,28.42,NA,NA,NA,"28",NA,NA,NA,NA,"VICM Day of Play","Lilly",2024-09-11,"2024","09","11","St. Thomas",18.320665,-64.867323
"2235","Oasis Cove","DN",NA,"9/28/24","CC","09/11/2024","RHMA","6203",NA,28.34,NA,NA,NA,"34.6",NA,NA,NA,NA,"VICM Day of Play","Cahmai",2024-09-11,"2024","09","11","St. Thomas",18.320665,-64.867323
"2236","Oasis Cove","DN",NA,"9/28/24","CC","09/11/2024","RHMA","6200",NA,15.4,NA,NA,NA,"29.5",NA,NA,NA,NA,"VICM Day of Play","Tye Dye Brain",2024-09-11,"2024","09","11","St. Thomas",18.320665,-64.867323
"2237","Oasis Cove","ST,SF,SC","ST,SF,SC","1/22/2024","4""TP","1/19/24","RHMA","3828","H",21.04,"12.1","30.5","1.5","29","G","Y","N",NA,"N",NA,2024-01-19,"2024","01","19","St. Thomas",18.320665,-64.867323
"2238","Oasis Cove","ST,SF,SC","ST,SF,SC","1/22/2024","4""TP","1/19/24","RHMA","3827","H",6.76,"7.3","25.6","1.1","24.5","G","N","N",NA,"N",NA,2024-01-19,"2024","01","19","St. Thomas",18.320665,-64.867323
"2239","Oasis Cove","DN","Malachi","9/28/24","CC","09/11/2024","RHMA","6204",NA,28.63,NA,NA,NA,"45.5",NA,NA,NA,NA,"VICM Day of Play","Jackson",2024-09-11,"2024","09","11","St. Thomas",18.320665,-64.867323
"2240","Oasis Cove","ST,SF,SC","ST,SF,SC","1/22/2024","4""TP","1/19/24","RHMA","3831","H",12.78,"8.8","29.8","1.3","28.5","G","N","Y",NA,"N",NA,2024-01-19,"2024","01","19","St. Thomas",18.320665,-64.867323
"2241","Oasis Cove","ST,SF,SC","ST,SF,SC","1/22/2024","4""TP","1/19/24","RHMA","3829","H",15.11,"10.9","25.3","1.7","23.6","B","N","N",NA,"N",NA,2024-01-19,"2024","01","19","St. Thomas",18.320665,-64.867323
"2242","Oasis Cove","ST,SF,SC","ST,SF,SC","1/22/2024","4""TP","1/19/24","RHMA","3830","H",10.66,"9.4","23.8","1.2","22.6","G","N","Y",NA,"N",NA,2024-01-19,"2024","01","19","St. Thomas",18.320665,-64.867323
"2243","Perseverance Bay","JS","JS","9/26/2023","3"" TP","9/15/2023","RHMA","4691","H",14.3,"10","23.5","1","22.5","G","Y","Y",NA,"N",NA,2023-09-15,"2023","09","15","St. Thomas",18.35087,-64.99782
"2244","Perseverance Bay","JS","JS","9/26/2023","3"" TP","9/15/2023","RHMA","4693","H",16.47,"10","24.5","1.3","23","G","Y","Y",NA,"N",NA,2023-09-15,"2023","09","15","St. Thomas",18.35087,-64.99782
"2245","Perseverance Bay","JS","JS","9/26/2023","3"" TP","9/15/2023","RHMA","4694","H",19.17,"8","27.5","1.2","26.5","G","Y","Y",NA,"N",NA,2023-09-15,"2023","09","15","St. Thomas",18.35087,-64.99782
"2246","Perseverance Bay","AR","AR,SH,ET","9/21/2023","3"" TP","9/15/2023","RHMA","4652","H",26.77,"14.4","28.1","1","27.1","G","Y","N",NA,"N",NA,2023-09-15,"2023","09","15","St. Thomas",18.35087,-64.99782
"2247","Perseverance Bay","AR","AR,SH,ET","9/21/2023","3"" TP","9/15/2023","RHMA","4650","H",13.87,"12","22","1","21","G","Y","N",NA,"N",NA,2023-09-15,"2023","09","15","St. Thomas",18.35087,-64.99782
"2248","Perseverance Bay","DIRECT INPUT","DG, AJH","06/22/2023","4''TP","06/11/2023","RHMA","3704-A","H",9.72,"8.7","22.8","1","21.8","G","Y","Y",NA,"N",NA,2023-06-11,"2023","06","11","St. Thomas",18.35087,-64.99782
"2249","Perseverance Bay","JS","JS","9/26/2023","3"" TP","9/15/2023","RHMA","4715","H",18.82,"5","26.5","1.5","25","G","N","Y",NA,"N",NA,2023-09-15,"2023","09","15","St. Thomas",18.35087,-64.99782
"2250","Perseverance Bay","SH","SH,LG","9/22/2023","3'' TP","9/15/2023","RHMA","4688","H",12.21,"11.5","17.8","1.2","16.6","G","N","Y",NA,"N",NA,2023-09-15,"2023","09","15","St. Thomas",18.35087,-64.99782
"2251","Perseverance Bay","JS","JS","9/26/2023","3"" TP","9/15/2023","RHMA","4692","H",12.49,"7","22","1.1","20.5","G","N","Y",NA,"N",NA,2023-09-15,"2023","09","15","St. Thomas",18.35087,-64.99782
"2252","Perseverance Bay","SH","SH,LG","9/22/2023","3'' TP","9/15/2023","RHMA","4690","H",11.68,"11.1","22.4","1.3","21.1","G","N","N",NA,"N",NA,2023-09-15,"2023","09","15","St. Thomas",18.35087,-64.99782
"2253","Perseverance Bay","AR","AR,SH,ET","9/21/2023","3"" TP","9/15/2023","RHMA","4649","H",21.21,"13.2","42.4","1.2","29.2","G","Y","N",NA,"N",NA,2023-09-15,"2023","09","15","St. Thomas",18.35087,-64.99782
"2254","Perseverance Bay","AR","AR,SH,ET","9/21/2023","3"" TP","9/15/2023","RHMA","4653","H",24.61,"12.8","31.7","1.4","30.3","G","Y","Y",NA,"N",NA,2023-09-15,"2023","09","15","St. Thomas",18.35087,-64.99782
"2255","Perseverance Bay","SH","SH,LG","9/22/2023","3'' TP","9/15/2023","RHMA","4689","H",16.51,"13.9","20.4","1.2","19.2","G","N","Y",NA,"N",NA,2023-09-15,"2023","09","15","St. Thomas",18.35087,-64.99782
"2256","Perseverance Bay","DIRECT INPUT","DG, AJH","06/20/2023","4""TP","06/11/2023","RHMA","3687","H",25.19,"14.4","28.4","1.3","27.1","G","Y","Y",NA,"E",NA,2023-06-11,"2023","06","11","St. Thomas",18.35087,-64.99782
"2257","Perseverance Bay","DIRECT INPUT","DG, AJH","06/20/2023","4""TP","06/11/2023","RHMA","3683","H",15.65,"11.5","23.4","1","22.4","G","Y","Y",NA,"E",NA,2023-06-11,"2023","06","11","St. Thomas",18.35087,-64.99782
"2258","Perseverance Bay","SH","SH,LG","9/22/2023","3'' TP","9/15/2023","RHMA","4687","H",18.34,"13","23.9","1.3","22.6","G","N","Y",NA,"N",NA,2023-09-15,"2023","09","15","St. Thomas",18.35087,-64.99782
"2259","Perseverance Bay","KT","KT,SH","9/22/2023","3'' TP","9/15/2023","RHMA","4661","H",19.6,"13.2","28.1","1.2","26.9","G","Y","Y",NA,"N",NA,2023-09-15,"2023","09","15","St. Thomas",18.35087,-64.99782
"2260","Perseverance Bay","DIRECT INPUT","DG, AJH","06/22/2023","4''TP","06/11/2023","RHMA","3703-A","H",19.31,"13.4","26.5","1.3","25.2","G","Y","Y",NA,"N",NA,2023-06-11,"2023","06","11","St. Thomas",18.35087,-64.99782
"2261","Perseverance Bay","SH","SH,LG","9/22/2023","3'' TP","9/15/2023","RHMA","4686","H",4.48,"0.7","21","1.2","19.8","G","N","Y",NA,"N",NA,2023-09-15,"2023","09","15","St. Thomas",18.35087,-64.99782
"2262","Perseverance Bay","AR","AR,SH,ET","9/21/2023","3"" TP","9/15/2023","RHMA","4651","H",33,"15.7","33.7","1.7","32","G","Y","Y",NA,"N",NA,2023-09-15,"2023","09","15","St. Thomas",18.35087,-64.99782
"2263","Perseverance Bay","DIRECT INPUT","DG, AJH","06/20/2023","4""TP","06/11/2023","RHMA","3685","H",16.91,"11.7","23.7","0.9","22.8","G","Y","Y",NA,"E",NA,2023-06-11,"2023","06","11","St. Thomas",18.35087,-64.99782
"2264","Perseverance Bay","KT","KT,SH","9/22/2023","3'' TP","9/15/2023","RHMA","4662","H",25.74,"14.9","30.9","1.7","29.2","G","Y","Y",NA,"N",NA,2023-09-15,"2023","09","15","St. Thomas",18.35087,-64.99782
"2265","Perseverance Bay","KT","KT,SH","9/22/2023","3'' TP","9/15/2023","RHMA","4663","H",27.24,"14","33","1.5","31.5","G","Y","N",NA,"N",NA,2023-09-15,"2023","09","15","St. Thomas",18.35087,-64.99782
"2266","Perseverance Bay","DIRECT INPUT","DG, AJH","06/20/2023","4""TP","06/11/2023","RHMA","3688","H",22.42,"12.9","27.7","1.4","26.3","G","Y","Y",NA,"E",NA,2023-06-11,"2023","06","11","St. Thomas",18.35087,-64.99782
"2267","Perseverance Bay","DIRECT INPUT","DG, AJH","06/20/2023","4""TP","06/11/2023","RHMA","3689","H",30.7,"13.9","31.1","1.4","29.7","G","Y","Y",NA,"E",NA,2023-06-11,"2023","06","11","St. Thomas",18.35087,-64.99782
"2268","Perseverance Bay","DIRECT INPUT","DG, AJH","06/20/2023","4""TP","06/11/2023","RHMA","3686","H",19.97,"13.6","25.8","1.3","24.5","G","Y","Y",NA,"E",NA,2023-06-11,"2023","06","11","St. Thomas",18.35087,-64.99782
"2269","Perseverance Bay","AR","AR,SH,ET","9/21/2023","3"" TP","9/15/2023","RHMA","4654","H",25.69,"13.8","29.8","1.3","28.5","G","Y","N",NA,"N",NA,2023-09-15,"2023","09","15","St. Thomas",18.35087,-64.99782
"2270","Perseverance Bay","JS","JS","9/26/2023","3"" TP","9/15/2023","RHMA","4713","H",22.07,"5","25.3","0.9","24","G","Y","Y",NA,"N",NA,2023-09-15,"2023","09","15","St. Thomas",18.35087,-64.99782
"2271","Perseverance Bay","JS","JS","9/26/2023","3"" TP","9/15/2023","RHMA","4714","H",15.72,"9","20.8","1.3","19.5","G","N","Y",NA,"N",NA,2023-09-15,"2023","09","15","St. Thomas",18.35087,-64.99782
"2272","Perseverance Bay","JS","JS","9/26/2023","3"" TP","9/15/2023","RHMA","4716","H",17.76,"10","23.6","1.1","22.6","GB","N","Y",NA,"N",NA,2023-09-15,"2023","09","15","St. Thomas",18.35087,-64.99782
"2273","Perseverance Bay","JS","JS","9/26/2023","3"" TP","9/15/2023","RHMA","4712","H",17.73,"10","20.7","1.1","19.6","G","N","Y",NA,"N",NA,2023-09-15,"2023","09","15","St. Thomas",18.35087,-64.99782
"2274","Perseverance Bay","JS","JS","9/26/2023","3"" TP","9/15/2023","RHMA","4718","H",21.67,"10","27.2","1","26.2","GB","N","Y",NA,"N",NA,2023-09-15,"2023","09","15","St. Thomas",18.35087,-64.99782
"2275","Perseverance Bay","KT","KT,SH","9/22/2023","3'' TP","9/15/2023","RHMA","4664","H",19.33,"14.2","23.5","1.4","22.1","G","Y","Y",NA,"N",NA,2023-09-15,"2023","09","15","St. Thomas",18.35087,-64.99782
"2276","Perseverance Bay","AND","AND","8/21/2023","3"" TP","8/16/2023","RHMA","4550","H",20.1,"13.3","28.6","1.4","27.2","G","Y","Y",NA,"N",NA,2023-08-16,"2023","08","16","St. Thomas",18.35087,-64.99782
"2277","Perseverance Bay","JS","JS","9/26/2023","3"" TP","9/15/2023","RHMA","4717","H",12.83,"4","19","1.2","17.5","G","N","Y",NA,"N",NA,2023-09-15,"2023","09","15","St. Thomas",18.35087,-64.99782
"2278","Perseverance Bay","JS","JS","9/26/2023","3"" TP","9/15/2023","RHMA","4708","H",15.66,"9","21","1","19.8","G","N","Y",NA,"N",NA,2023-09-15,"2023","09","15","St. Thomas",18.35087,-64.99782
"2279","Perseverance Bay","JS","JS","9/26/2023","3"" TP","9/15/2023","RHMA","4709","H",21.35,"8","26","1.4","24.5","G","Y","Y",NA,"N",NA,2023-09-15,"2023","09","15","St. Thomas",18.35087,-64.99782
"2280","Perseverance Bay","JS","JS","9/26/2023","3"" TP","9/15/2023","RHMA","4710","H",12.84,"9","20.7","1.1","19.5","GB","N","Y",NA,"N",NA,2023-09-15,"2023","09","15","St. Thomas",18.35087,-64.99782
"2281","Perseverance Bay","AND","AND","8/21/2023","3"" TP","8/16/2023","RHMA","4551","H",21,"14.5","26.8","1.4","25.4","G","Y","Y",NA,"N",NA,2023-08-16,"2023","08","16","St. Thomas",18.35087,-64.99782
"2282","Perseverance Bay","SH","SH,LG","9/22/2023","3'' TP","9/15/2023","RHMA","4684","H",14.57,"12.6","22.9","1.4","21.5","G","N","Y",NA,"N",NA,2023-09-15,"2023","09","15","St. Thomas",18.35087,-64.99782
"2283","Perseverance Bay","SH","SH,LG","9/22/2023","3'' TP","9/15/2023","RHMA","4685","H",23.39,"13.9","26.3","1.3","25","G","N","Y",NA,"N",NA,2023-09-15,"2023","09","15","St. Thomas",18.35087,-64.99782
"2284","Perseverance Bay","DIRECT UPLOAD","AJH","08/07/2023","3""TP","7/24/2022","RHMA","4463","H",37.91,"13.9","40.5","2","38.5","G","Y","N",NA,"N",NA,2022-07-24,"2022","07","24","St. Thomas",18.35087,-64.99782
"2285","Perseverance Bay","DIRECT UPLOAD","AJH","08/07/2023","3""TP","7/24/2022","RHMA","4464","H",23.27,"11.4","37.2","1.8","35.4","G","Y","N",NA,"N",NA,2022-07-24,"2022","07","24","St. Thomas",18.35087,-64.99782
"2286","Perseverance Bay","DIRECT UPLOAD","AJH","08/07/2023","3""TP","7/24/2022","RHMA","4465","H",23.15,"11.7","36.2","1.7","34.5","G","Y","N",NA,"N",NA,2022-07-24,"2022","07","24","St. Thomas",18.35087,-64.99782
"2287","Perseverance Bay","DIRECT UPLOAD","AJH","08/07/2023","3""TP","7/24/2022","RHMA","4466","H",26.58,"12.1","36.3","1.5","34.8","G","Y","N",NA,"N",NA,2022-07-24,"2022","07","24","St. Thomas",18.35087,-64.99782
"2288","Perseverance Bay","DIRECT UPLOAD","AJH","08/07/2023","3""TP","7/24/2022","RHMA","4467","H",22.56,"12.9","31.6","1.4","30.2","G","Y","N",NA,"N",NA,2022-07-24,"2022","07","24","St. Thomas",18.35087,-64.99782
"2289","Perseverance Bay","KT","KT,SH","9/22/2023","3'' TP","9/15/2023","RHMA","4665","H",26.05,"14","33","1.5","31.5","G","Y","N",NA,"N",NA,2023-09-15,"2023","09","15","St. Thomas",18.35087,-64.99782
"2290","Perseverance Bay","DIRECT INPUT","DG, AJH","06/20/2023","4""TP","06/11/2023","RHMA","3684","H",13.58,"11.4","21.3","1.3","20","G","Y","Y",NA,"E",NA,2023-06-11,"2023","06","11","St. Thomas",18.35087,-64.99782
"2291","Perseverance Bay","DIRECT UPLOAD","AJH","08/07/2023","3""TP","7/24/2022","RHMA","4470","H",10.76,"10","21.9","0.9","21","G","Y","N",NA,"N",NA,2022-07-24,"2022","07","24","St. Thomas",18.35087,-64.99782
"2292","Perseverance Bay","AND","AND","8/21/2023","3"" TP","8/16/2023","RHMA","4552","H",19.7,"13.4","29.1","1.6","27.5","G","N","Y",NA,"N",NA,2023-08-16,"2023","08","16","St. Thomas",18.35087,-64.99782
"2293","Perseverance Bay","AR","AR,SH,ET","9/21/2023","3"" TP","9/15/2023","RHMA","4655","H",20.15,"13.5","25.2","1.4","23.8","G","Y","N",NA,"N",NA,2023-09-15,"2023","09","15","St. Thomas",18.35087,-64.99782
"2294","Perseverance Bay","JS","JS","9/26/2023","3"" TP","9/15/2023","RHMA","4711","H",16.96,"5","23","1.4","21.7","G","N","Y",NA,"N",NA,2023-09-15,"2023","09","15","St. Thomas",18.35087,-64.99782
"2295","Perseverance Bay","AR","AR,SH,ET","9/21/2023","3"" TP","9/15/2023","RHMA","4657","H",14.88,"12.5","19.5","1","18.5","G","Y","N",NA,"N",NA,2023-09-15,"2023","09","15","St. Thomas",18.35087,-64.99782
"2296","Perseverance Bay","AR","AR,SH,ET","9/21/2023","3"" TP","9/15/2023","RHMA","4658","H",14.3,"12","22.9","1.4","21.5","G","Y","Y",NA,"N",NA,2023-09-15,"2023","09","15","St. Thomas",18.35087,-64.99782
"2297","Perseverance Bay","KT","KT,SH","9/22/2023","3'' TP","9/15/2023","RHMA","4659","H",23.89,"13.5","30.1","1.1","29","G","Y","N",NA,"N",NA,2023-09-15,"2023","09","15","St. Thomas",18.35087,-64.99782
"2298","Perseverance Bay","KT","KT,SH","9/22/2023","3'' TP","9/15/2023","RHMA","4660","H",24.05,"14","29.9","1.7","28.2","G","Y","Y",NA,"N",NA,2023-09-15,"2023","09","15","St. Thomas",18.35087,-64.99782
"2299","Perseverance Bay","JS","JS","9/26/2023","3"" TP","9/15/2023","RHMA","4701","H",11.17,"7","18","1.2","16.6","G","N","Y",NA,"N",NA,2023-09-15,"2023","09","15","St. Thomas",18.35087,-64.99782
"2300","Perseverance Bay","JS","JS","9/26/2023","3"" TP","9/15/2023","RHMA","4702","H",18.13,"6","27","1.6","26","G","N","Y",NA,"N",NA,2023-09-15,"2023","09","15","St. Thomas",18.35087,-64.99782
"2301","Perseverance Bay","JS","JS","9/26/2023","3"" TP","9/15/2023","RHMA","4703","H",18.2,"7","24","1.3","23","G","Y","Y",NA,"N",NA,2023-09-15,"2023","09","15","St. Thomas",18.35087,-64.99782
"2302","Perseverance Bay","AND","AND","8/21/2023","3"" TP","8/16/2023","RHMA","4549","H",24.63,"13.4","32.8","1.6","31.2","G","Y","Y",NA,"N",NA,2023-08-16,"2023","08","16","St. Thomas",18.35087,-64.99782
"2303","Perseverance Bay","DIRECT UPLOAD","AJH","08/07/2023","3""TP","7/24/2022","RHMA","4469","H",22.97,"12.4","33.3","1.6","31.7","G","Y","N",NA,"N",NA,2022-07-24,"2022","07","24","St. Thomas",18.35087,-64.99782
"2304","Perseverance Bay","KT","KT,SH","9/22/2023","3'' TP","9/15/2023","RHMA","4666","H",20.6,"12.6","30.3","1.5","28.8","G","Y","Y",NA,"N",NA,2023-09-15,"2023","09","15","St. Thomas",18.35087,-64.99782
"2305","Perseverance Bay","KT","KT,SH","9/22/2023","3'' TP","9/15/2023","RHMA","4667","H",19.25,"15.1","21.1","1.6","19.5","G","N","Y",NA,"N",NA,2023-09-15,"2023","09","15","St. Thomas",18.35087,-64.99782
"2306","Perseverance Bay","AND","AND","8/21/2023","3"" TP","8/16/2023","RHMA","4566","H",35.57,"15.5","38.1","1.6","36.5","G","Y","Y",NA,"N",NA,2023-08-16,"2023","08","16","St. Thomas",18.35087,-64.99782
"2307","Perseverance Bay","AR","AR,SH,ET","9/21/2023","3"" TP","9/15/2023","RHMA","4656","H",28.53,"14.5","33.9","1.7","32.2","G","Y","Y",NA,"N",NA,2023-09-15,"2023","09","15","St. Thomas",18.35087,-64.99782
"2308","Perseverance Bay","AND","AND","8/21/2023","3"" TP","8/16/2023","RHMA","4568","H",25.67,"14.3","34.6","1.8","32.8","G","N","Y",NA,"N",NA,2023-08-16,"2023","08","16","St. Thomas",18.35087,-64.99782
"2309","Perseverance Bay","AND","AND","8/21/2023","3"" TP","8/16/2023","RHMA","4569","H",27.35,"13.9","37.1","1.8","35.3","G","Y","Y",NA,"N",NA,2023-08-16,"2023","08","16","St. Thomas",18.35087,-64.99782
"2310","Perseverance Bay","AND","AND","8/21/2023","3"" TP","8/16/2023","RHMA","4570","H",24,"12.4","39.3","2","37.3","G","Y","Y",NA,"N",NA,2023-08-16,"2023","08","16","St. Thomas",18.35087,-64.99782
"2311","Perseverance Bay","AND","AND","8/21/2023","3"" TP","8/16/2023","RHMA","4571","H",30.84,"13.7","41.1","1.8","39.3","G","Y","Y",NA,"N",NA,2023-08-16,"2023","08","16","St. Thomas",18.35087,-64.99782
"2312","Perseverance Bay","KT","KT,AR,SH,HH","10/06/2023","4""TP","9/15/2023","RHMA","4837","H",21.07,"11.3","28.8","1.5","27.3","G","Y","Y",NA,"N",NA,2023-09-15,"2023","09","15","St. Thomas",18.35087,-64.99782
"2313","Perseverance Bay","KT","KT,AR,SH,HH","10/06/2023","4""TP","9/15/2023","RHMA","4838","H",22.17,"12.7","28.8","1.3","27.5","G","Y","Y",NA,"N",NA,2023-09-15,"2023","09","15","St. Thomas",18.35087,-64.99782
"2314","Perseverance Bay","KT","KT,AR,SH,HH","10/06/2023","4""TP","9/15/2023","RHMA","4839","H",23.52,"12.6","28","1.5","26.5","G","Y","Y",NA,"N",NA,2023-09-15,"2023","09","15","St. Thomas",18.35087,-64.99782
"2315","Perseverance Bay","JS","JS","9/26/2023","3"" TP","9/15/2023","RHMA","4704","H",20.36,"8","25","1.3","24","G","N","Y",NA,"N",NA,2023-09-15,"2023","09","15","St. Thomas",18.35087,-64.99782
"2316","Perseverance Bay","JS","JS","9/26/2023","3"" TP","9/15/2023","RHMA","4705","H",16.12,"6","23","1.3","21.5","G","Y","Y",NA,"N",NA,2023-09-15,"2023","09","15","St. Thomas",18.35087,-64.99782
"2317","Perseverance Bay","JS","JS","9/26/2023","3"" TP","9/15/2023","RHMA","4721","H",16.57,"4","23.2","1.2","22","G","Y","N",NA,"N",NA,2023-09-15,"2023","09","15","St. Thomas",18.35087,-64.99782
"2318","Perseverance Bay","DIRECT UPLOAD","AJH","08/07/2023","3""TP","7/24/2022","RHMA","4458","H",23.08,"11.2","35.8","1.7","34.1","G","Y","Y",NA,"N",NA,2022-07-24,"2022","07","24","St. Thomas",18.35087,-64.99782
"2319","Perseverance Bay","JS","JS","9/26/2023","3"" TP","9/15/2023","RHMA","4722","H",18.7,"5","24.5","1.5","23","G","N","Y",NA,"N",NA,2023-09-15,"2023","09","15","St. Thomas",18.35087,-64.99782
"2320","Perseverance Bay","AND","AND","8/21/2023","3"" TP","8/16/2023","RHMA","4567","H",38.4,"14.3","50.6","1.9","48.7","G","Y","Y",NA,"N",NA,2023-08-16,"2023","08","16","St. Thomas",18.35087,-64.99782
"2321","Perseverance Bay","KT","KT,SH","9/22/2023","3'' TP","9/15/2023","RHMA","4683","H",18.78,"12.6","27","1.3","25.7","G","Y","N",NA,"N",NA,2023-09-15,"2023","09","15","St. Thomas",18.35087,-64.99782
"2322","Perseverance Bay","DIRECT UPLOAD","AJH","08/07/2023","3""TP","7/24/2022","RHMA","4461","H",31.43,"12.9","36.2","1.7","34.5","G","Y","N",NA,"N",NA,2022-07-24,"2022","07","24","St. Thomas",18.35087,-64.99782
"2323","Perseverance Bay","DIRECT UPLOAD","AJH","08/07/2023","3""TP","7/24/2022","RHMA","4462","H",18.75,"12.2","27.8","1.5","26.3","G","Y","N",NA,"N",NA,2022-07-24,"2022","07","24","St. Thomas",18.35087,-64.99782
"2324","Perseverance Bay","AR","AR,SH,ET","9/21/2023","3"" TP","9/15/2023","RHMA","4645","H",18.23,"13.5","23.5","1.3","22.2","G","Y","Y",NA,"N",NA,2023-09-15,"2023","09","15","St. Thomas",18.35087,-64.99782
"2325","Perseverance Bay","AR","AR,SH,ET","9/21/2023","3"" TP","9/15/2023","RHMA","4646","H",33.72,"15.4","34.5","2","32.5","G","Y","Y",NA,"N",NA,2023-09-15,"2023","09","15","St. Thomas",18.35087,-64.99782
"2326","Perseverance Bay","AR","AR,SH,ET","9/21/2023","3"" TP","9/15/2023","RHMA","4647","H",13.34,"13.3","17.4","1.2","16.2","G","Y","Y",NA,"N",NA,2023-09-15,"2023","09","15","St. Thomas",18.35087,-64.99782
"2327","Perseverance Bay","AR","AR,SH,ET","9/21/2023","3"" TP","9/15/2023","RHMA","4648","H",20.35,"13.1","25.4","1.3","24.1","G","Y","Y",NA,"N",NA,2023-09-15,"2023","09","15","St. Thomas",18.35087,-64.99782
"2328","Perseverance Bay","DIRECT INPUT","DG","06/15/2023","3""TP","06/11/2023","RHMA","E3-54","H",25.45,NA,"33",NA,"31","G","Y",NA,NA,"C",NA,2023-06-11,"2023","06","11","St. Thomas",18.35087,-64.99782
"2329","Perseverance Bay","DIRECT INPUT","DG","06/15/2023","3""TP","06/11/2023","RHMA","E3-55","H",28.09,NA,"32.7",NA,"31.5","G","Y",NA,NA,"C","Kinnae",2023-06-11,"2023","06","11","St. Thomas",18.35087,-64.99782
"2330","Perseverance Bay","DIRECT INPUT","DG","06/15/2023","3""TP","06/11/2023","RHMA","E3-56","H",29.78,NA,"35",NA,"33","G","Y",NA,NA,"C","Brooklyn",2023-06-11,"2023","06","11","St. Thomas",18.35087,-64.99782
"2331","Perseverance Bay","DIRECT INPUT","DG","06/15/2023","3""TP","06/11/2023","RHMA","E3-57","H",29.15,NA,"38",NA,"37","G","Y",NA,NA,"C","Turtle",2023-06-11,"2023","06","11","St. Thomas",18.35087,-64.99782
"2332","Perseverance Bay","DIRECT INPUT","DG","06/15/2023","3""TP","06/11/2023","RHMA","E3-58","H",26.58,NA,"33",NA,"32","G","Y",NA,NA,"C","Selena",2023-06-11,"2023","06","11","St. Thomas",18.35087,-64.99782
"2333","Perseverance Bay","JS","JS","9/26/2023","3"" TP","9/15/2023","RHMA","4695","H",21.65,"9","33","1.5","31","G","Y","Y",NA,"N",NA,2023-09-15,"2023","09","15","St. Thomas",18.35087,-64.99782
"2334","Perseverance Bay","JS","JS","9/26/2023","3"" TP","9/15/2023","RHMA","4696","H",14.67,"8","24.5","1.5","23","G","N","Y",NA,"N",NA,2023-09-15,"2023","09","15","St. Thomas",18.35087,-64.99782
"2335","Perseverance Bay","JS","JS","9/26/2023","3"" TP","9/15/2023","RHMA","4697","H",12.4,"10","19","1.4","17.7","G","N","Y",NA,"N",NA,2023-09-15,"2023","09","15","St. Thomas",18.35087,-64.99782
"2336","Perseverance Bay","JS","JS","9/26/2023","3"" TP","9/15/2023","RHMA","4698","H",23.47,"9","24","1.4","22","G","N","Y",NA,"N",NA,2023-09-15,"2023","09","15","St. Thomas",18.35087,-64.99782
"2337","Perseverance Bay","JS","JS","9/26/2023","3"" TP","9/15/2023","RHMA","4699","H",13.9,"9","21","3","19.5","G","N","Y",NA,"N",NA,2023-09-15,"2023","09","15","St. Thomas",18.35087,-64.99782
"2338","Perseverance Bay","JS","JS","9/26/2023","3"" TP","9/15/2023","RHMA","4700","H",10,"6","21.6","1.3","20","G","N","Y",NA,"N",NA,2023-09-15,"2023","09","15","St. Thomas",18.35087,-64.99782
"2339","Perseverance Bay","DIRECT INPUT","DG","06/15/2023","3""TP","06/11/2023","RHMA","E3-64","H",27.65,NA,"33",NA,"32","G","Y",NA,NA,"C","Dylan",2023-06-11,"2023","06","11","St. Thomas",18.35087,-64.99782
"2340","Perseverance Bay","DIRECT INPUT","DG","06/15/2023","3""TP","06/11/2023","RHMA","E3-65","H",31.7,NA,"36",NA,"34","G","Y",NA,NA,"C","Rihanna",2023-06-11,"2023","06","11","St. Thomas",18.35087,-64.99782
"2341","Perseverance Bay","DIRECT INPUT","DG","06/15/2023","3""TP","06/11/2023","RHMA","E3-66","H",10.8,NA,"17",NA,"16","G","Y",NA,NA,"C","Angelica",2023-06-11,"2023","06","11","St. Thomas",18.35087,-64.99782
"2342","Perseverance Bay","DIRECT INPUT","DG","06/15/2023","3""TP","06/11/2023","RHMA","E3-67","H",14.43,NA,"30",NA,"28.7","G","N",NA,NA,"C","Kizza",2023-06-11,"2023","06","11","St. Thomas",18.35087,-64.99782
"2343","Perseverance Bay","DIRECT INPUT","DG","06/15/2023","3""TP","06/11/2023","RHMA","E3-68","H",13.65,NA,"21",NA,"20","G","Y",NA,NA,"C","Taylor",2023-06-11,"2023","06","11","St. Thomas",18.35087,-64.99782
"2344","Perseverance Bay","JS","JS","9/26/2023","3"" TP","9/15/2023","RHMA","4706","H",17.73,"9","26.5","1.1","25.3","G","N","Y",NA,"N",NA,2023-09-15,"2023","09","15","St. Thomas",18.35087,-64.99782
"2345","Perseverance Bay","JS","JS","9/26/2023","3"" TP","9/15/2023","RHMA","4707","H",14.3,"7","22.5","1.2","20.8","G","Y","Y",NA,"N",NA,2023-09-15,"2023","09","15","St. Thomas",18.35087,-64.99782
"2346","Perseverance Bay","DIRECT INPUT","DG","06/15/2023","3""TP","06/11/2023","RHMA","E3-7","H",26.3,NA,"29.5",NA,"28.5","G","Y",NA,NA,"C","Loves",2023-06-11,"2023","06","11","St. Thomas",18.35087,-64.99782
"2347","Perseverance Bay","KT","KT,SH","9/22/2023","3'' TP","9/15/2023","RHMA","4668","H",15.24,"13","21.5","1.5","20","G","N","Y",NA,"N",NA,2023-09-15,"2023","09","15","St. Thomas",18.35087,-64.99782
"2348","Perseverance Bay","KT","KT,SH","9/22/2023","3'' TP","9/15/2023","RHMA","4669","H",21.75,"14.6","24.5","1.2","23.3","G","N","N",NA,"N",NA,2023-09-15,"2023","09","15","St. Thomas",18.35087,-64.99782
"2349","Perseverance Bay","KT","KT,SH","9/22/2023","3'' TP","9/15/2023","RHMA","4670","H",17.68,"13.1","27.1","1.4","25.7","G","N","Y",NA,"N",NA,2023-09-15,"2023","09","15","St. Thomas",18.35087,-64.99782
"2350","Perseverance Bay","KT","KT,SH","9/22/2023","3'' TP","9/15/2023","RHMA","4671","H",17.04,"12.8","24","1.5","22.5","G","N","N",NA,"N",NA,2023-09-15,"2023","09","15","St. Thomas",18.35087,-64.99782
"2351","Perseverance Bay","KT","KT,SH","9/22/2023","3'' TP","9/15/2023","RHMA","4672","H",13.44,"14","18.8","1.3","17.5","G","N","Y",NA,"N",NA,2023-09-15,"2023","09","15","St. Thomas",18.35087,-64.99782
"2352","Perseverance Bay","AND","AND","8/21/2023","3"" TP","8/16/2023","RHMA","4572","H",24.18,"12.6","38.4","1.8","36.6","G","Y","Y",NA,"N",NA,2023-08-16,"2023","08","16","St. Thomas",18.35087,-64.99782
"2353","Perseverance Bay","AND","AND","8/21/2023","3"" TP","8/16/2023","RHMA","4573","H",14.6,"12.4","26.7","1.5","25.2","G","N","Y",NA,"N",NA,2023-08-16,"2023","08","16","St. Thomas",18.35087,-64.99782
"2354","Perseverance Bay","AND","AND","8/21/2023","3"" TP","8/16/2023","RHMA","4574","H",13.08,"10.9","27.1","1.5","25.6","G","N","Y",NA,"N",NA,2023-08-16,"2023","08","16","St. Thomas",18.35087,-64.99782
"2355","Perseverance Bay","KT","KT,AR,SH,HH","10/06/2023","4""TP","9/15/2023","RHMA","4840","H",17.61,"13","22.7","1.3","21.4","G","Y","Y",NA,"N",NA,2023-09-15,"2023","09","15","St. Thomas",18.35087,-64.99782
"2356","Perseverance Bay","JS","JS","9/26/2023","3"" TP","9/15/2023","RHMA","4719","H",20.37,"4","27.1","1.4","26","G","N","Y",NA,"N",NA,2023-09-15,"2023","09","15","St. Thomas",18.35087,-64.99782
"2357","Perseverance Bay","JS","JS","9/26/2023","3"" TP","9/15/2023","RHMA","4720","H",20.44,"9","28.5","1.3","27","G","N","Y",NA,"N",NA,2023-09-15,"2023","09","15","St. Thomas",18.35087,-64.99782
"2358","Perseverance Bay","KT","KT,SH","9/22/2023","3'' TP","9/15/2023","RHMA","4680","H",17.04,"14","21.8","1.5","20.3","G","N","Y",NA,"N",NA,2023-09-15,"2023","09","15","St. Thomas",18.35087,-64.99782
"2359","Perseverance Bay","KT","KT,SH","9/22/2023","3'' TP","9/15/2023","RHMA","4681","H",24.5,"14.5","25.9","1.4","24.5","G","N","N",NA,"N",NA,2023-09-15,"2023","09","15","St. Thomas",18.35087,-64.99782
"2360","Perseverance Bay","KT","KT,SH","9/22/2023","3'' TP","9/15/2023","RHMA","4682","H",18.66,"13.5","24.7","1.2","23.5","G","N","Y",NA,"N",NA,2023-09-15,"2023","09","15","St. Thomas",18.35087,-64.99782
"2361","Perseverance Bay","DIRECT UPLOAD","AJH","08/07/2023","3""TP","7/24/2022","RHMA","4460","H",38.81,"15.1","37.9","1.9","36","G","Y","N",NA,"N",NA,2022-07-24,"2022","07","24","St. Thomas",18.35087,-64.99782
"2362","Perseverance Bay","DIRECT INPUT","DG","06/15/2023","3""TP","06/11/2023","RHMA","E3-85","H",22.6,NA,"30",NA,"29","G","N",NA,NA,"C","Strawberry",2023-06-11,"2023","06","11","St. Thomas",18.35087,-64.99782
"2363","Perseverance Bay","DIRECT INPUT","DG","06/15/2023","3""TP","06/11/2023","RHMA","E3-86","H",21.34,NA,"27.8",NA,"27","G","Y",NA,NA,"C","Zadin",2023-06-11,"2023","06","11","St. Thomas",18.35087,-64.99782
"2364","Perseverance Bay","DIRECT INPUT","DG","06/15/2023","3""TP","06/11/2023","RHMA","E3-87","H",24.81,NA,"31",NA,"30","GB","Y",NA,NA,"C","Queen Rainbow",2023-06-11,"2023","06","11","St. Thomas",18.35087,-64.99782
"2365","Perseverance Bay","DIRECT INPUT","DG","06/15/2023","3""TP","06/11/2023","RHMA","E3-88","H",22.13,NA,"27",NA,"25.5","G","Y",NA,NA,"C","Queen Been",2023-06-11,"2023","06","11","St. Thomas",18.35087,-64.99782
"2366","Perseverance Bay","DIRECT INPUT","DG","06/15/2023","3""TP","06/11/2023","RHMA","E3-89","H",25.26,NA,"29.5",NA,"28.5","G","N",NA,NA,"C","Cardi B",2023-06-11,"2023","06","11","St. Thomas",18.35087,-64.99782
"2367","Perseverance Bay","DIRECT INPUT","DG","06/15/2023","3""TP","06/11/2023","RHMA","E3-9","H",22.97,NA,"32.5",NA,"32.1","G","N",NA,NA,"C","Princess Lily",2023-06-11,"2023","06","11","St. Thomas",18.35087,-64.99782
"2368","Perseverance Bay","DIRECT INPUT","DG","06/15/2023","3""TP","06/11/2023","RHMA","E3-90","H",9.65,NA,"27",NA,"26","G","N",NA,NA,"C","YOYO",2023-06-11,"2023","06","11","St. Thomas",18.35087,-64.99782
"2369","Perseverance Bay","DIRECT INPUT","DG","06/15/2023","3""TP","06/11/2023","RHMA","E3-91","H",32,NA,"31.5",NA,"29.4","G","Y",NA,NA,"C",NA,2023-06-11,"2023","06","11","St. Thomas",18.35087,-64.99782
"2370","Perseverance Bay","DIRECT INPUT","DG","06/15/2023","3""TP","06/11/2023","RHMA","E3-92","H",21.25,NA,"28",NA,"27.5","G","Y",NA,NA,"C","Queen Nicky",2023-06-11,"2023","06","11","St. Thomas",18.35087,-64.99782
"2371","Perseverance Bay","DIRECT INPUT","DG","06/15/2023","3""TP","06/11/2023","RHMA","E3-93","H",25.08,NA,"26.9",NA,"27","G","Y",NA,NA,"C","Ice Spice",2023-06-11,"2023","06","11","St. Thomas",18.35087,-64.99782
"2372","Perseverance Bay","DIRECT INPUT","DG","06/15/2023","3""TP","06/11/2023","RHMA","E3-94","H",23.82,NA,"30",NA,"12.4","G","N",NA,NA,"C","Silivia",2023-06-11,"2023","06","11","St. Thomas",18.35087,-64.99782
"2373","Perseverance Bay","DIRECT INPUT","DG","06/15/2023","3""TP","06/11/2023","RHMA","E3-59","H",22.1,NA,"30",NA,"28.6","G","Y",NA,NA,"C","Anna",2023-06-11,"2023","06","11","St. Thomas",18.35087,-64.99782
"2374","Perseverance Bay","DIRECT INPUT","DG","06/15/2023","3""TP","06/11/2023","RHMA","E3-6","H",35.27,NA,"43.6",NA,"42","G","N",NA,NA,"C","Sunset Flower",2023-06-11,"2023","06","11","St. Thomas",18.35087,-64.99782
"2375","Perseverance Bay","DIRECT INPUT","DG","06/15/2023","3""TP","06/11/2023","RHMA","E3-60","H",26.2,NA,"35",NA,"34","G","Y",NA,NA,"C","Timothy III",2023-06-11,"2023","06","11","St. Thomas",18.35087,-64.99782
"2376","Perseverance Bay","DIRECT INPUT","DG","06/15/2023","3""TP","06/11/2023","RHMA","E3-61","H",18.94,NA,"31.4",NA,"30","G","N",NA,NA,"C","IBella",2023-06-11,"2023","06","11","St. Thomas",18.35087,-64.99782
"2377","Perseverance Bay","DIRECT INPUT","DG","06/15/2023","3""TP","06/11/2023","RHMA","E3-62","H",22.51,NA,"32.2",NA,"31","G","Y",NA,NA,"C","Ezio",2023-06-11,"2023","06","11","St. Thomas",18.35087,-64.99782
"2378","Perseverance Bay","DIRECT INPUT","DG","06/15/2023","3""TP","06/11/2023","RHMA","E3-63","H",26.21,NA,"32",NA,"35","G","Y",NA,NA,"C","Maliya",2023-06-11,"2023","06","11","St. Thomas",18.35087,-64.99782
"2379","Perseverance Bay","AND","AND","8/21/2023","3"" TP","8/16/2023","RHMA","4558","H",18.81,"13.7","28.2","1.5","26.7","G","N","Y",NA,"N",NA,2023-08-16,"2023","08","16","St. Thomas",18.35087,-64.99782
"2380","Perseverance Bay","AND","AND","8/21/2023","3"" TP","8/16/2023","RHMA","4559","H",48.79,"15.6","50.7","2.1","48.6","G","Y","Y",NA,"N",NA,2023-08-16,"2023","08","16","St. Thomas",18.35087,-64.99782
"2381","Perseverance Bay","AND","AND","8/21/2023","3"" TP","8/16/2023","RHMA","4560","H",45.2,"14.5","44.2","1.7","42.5","G","Y","Y",NA,"N",NA,2023-08-16,"2023","08","16","St. Thomas",18.35087,-64.99782
"2382","Perseverance Bay","AND","AND","8/21/2023","3"" TP","8/16/2023","RHMA","4561","H",24,"12.9","34.2","1.7","32.5","G","N","Y",NA,"N",NA,2023-08-16,"2023","08","16","St. Thomas",18.35087,-64.99782
"2383","Perseverance Bay","AND","AND","8/21/2023","3"" TP","8/16/2023","RHMA","4562","H",24.3,"13.6","34","1.7","32.3","G","Y","Y",NA,"N",NA,2023-08-16,"2023","08","16","St. Thomas",18.35087,-64.99782
"2384","Perseverance Bay","DIRECT INPUT","DG","06/15/2023","3""TP","06/11/2023","RHMA","E3-69","H",20.42,NA,"33",NA,"31","G","Y",NA,NA,"C","Eathan",2023-06-11,"2023","06","11","St. Thomas",18.35087,-64.99782
"2385","Perseverance Bay","DIRECT INPUT","DG","06/15/2023","3""TP","06/11/2023","RHMA","E3-7","H",25.3,NA,"36.7",NA,"35","G","N",NA,NA,"C","TA",2023-06-11,"2023","06","11","St. Thomas",18.35087,-64.99782
"2386","Perseverance Bay","AND","AND","8/21/2023","3"" TP","8/16/2023","RHMA","4565","H",17.35,"12.7","28.5","1.6","26.9","G","N","Y",NA,"N",NA,2023-08-16,"2023","08","16","St. Thomas",18.35087,-64.99782
"2387","Perseverance Bay","DIRECT INPUT","DG, AJH","06/20/2023","4""TP","06/11/2023","RHMA","3682","H",18.58,"13.2","27.1","1.4","25.7","G","Y","Y",NA,"E",NA,2023-06-11,"2023","06","11","St. Thomas",18.35087,-64.99782
"2388","Perseverance Bay","DG","HH, MF, ST, DG","1/29/2024","3""TP","1/23/2024","RHMA","3902","H",9,"10","18.2","1.4","16.8","G","N","Y",NA,"N",NA,2024-01-23,"2024","01","23","St. Thomas",18.35087,-64.99782
"2389","Perseverance Bay","DG","HH, MF, ST, DG","1/29/2024","3""TP","1/23/2024","RHMA","3903","H",12.36,"11","21.3","1.5","19.8","G","N","N",NA,"N",NA,2024-01-23,"2024","01","23","St. Thomas",18.35087,-64.99782
"2390","Perseverance Bay","DG","HH, MF, ST, DG","1/29/2024","3""TP","1/23/2024","RHMA","3904","H",10.44,"10.9","19.9","1.4","18.5","G","N","Y",NA,"N",NA,2024-01-23,"2024","01","23","St. Thomas",18.35087,-64.99782
"2391","Perseverance Bay","DG","HH, MF, ST, DG","1/29/2024","3""TP","1/23/2024","RHMA","3905","H",7.62,"10","16","1.3","14.7","G","N","N",NA,"N",NA,2024-01-23,"2024","01","23","St. Thomas",18.35087,-64.99782
"2392","Perseverance Bay","KT","KT,SH","9/22/2023","3'' TP","9/15/2023","RHMA","4673","H",13.69,"13.8","18.5","1.5","17","G","N","Y",NA,"N",NA,2023-09-15,"2023","09","15","St. Thomas",18.35087,-64.99782
"2393","Perseverance Bay","KT","KT,SH","9/22/2023","3'' TP","9/15/2023","RHMA","4674","H",21.87,"13.7","27.6","1.2","26.4","G","N","Y",NA,"N",NA,2023-09-15,"2023","09","15","St. Thomas",18.35087,-64.99782
"2394","Perseverance Bay","KT","KT,SH","9/22/2023","3'' TP","9/15/2023","RHMA","4675","H",27.34,"13.9","32.5","1.3","31.2","G","N","Y",NA,"N",NA,2023-09-15,"2023","09","15","St. Thomas",18.35087,-64.99782
"2395","Perseverance Bay","AND","AND","8/21/2023","3"" TP","8/16/2023","RHMA","4575","H",24.35,"13.4","35.5","1.8","33.7","G","Y","Y",NA,"N",NA,2023-08-16,"2023","08","16","St. Thomas",18.35087,-64.99782
"2396","Perseverance Bay","AND","AND","8/21/2023","3"" TP","8/16/2023","RHMA","4576","H",26.47,"14.4","35","1.9","33.1","G","Y","Y",NA,"N",NA,2023-08-16,"2023","08","16","St. Thomas",18.35087,-64.99782
"2397","Perseverance Bay","AND","AND","8/21/2023","3"" TP","8/16/2023","RHMA","4577","H",42.97,"15.1","45.6","2.1","43.5","G","Y","Y",NA,"N",NA,2023-08-16,"2023","08","16","St. Thomas",18.35087,-64.99782
"2398","Perseverance Bay","AND","AND","8/21/2023","3"" TP","8/16/2023","RHMA","4578","H",25.3,"14.3","33.7","1.6","32.1","G","Y","Y",NA,"N",NA,2023-08-16,"2023","08","16","St. Thomas",18.35087,-64.99782
"2399","Perseverance Bay","AND","AND","8/21/2023","3"" TP","8/16/2023","RHMA","4579","H",26.2,"14.6","33.6","1.7","31.9","G","Y","Y",NA,"N",NA,2023-08-16,"2023","08","16","St. Thomas",18.35087,-64.99782
"2400","Perseverance Bay","DIRECT UPLOAD","AJH","08/07/2023","3""TP","7/24/2022","RHMA","4459","H",27.64,"12.3","31.7","1.5","30.2","G","Y","N",NA,"N",NA,2022-07-24,"2022","07","24","St. Thomas",18.35087,-64.99782
"2401","Perseverance Bay","DIRECT INPUT","DG","06/15/2023","3""TP","06/11/2023","RHMA","E3-84","H",31.1,NA,"39",NA,"38","G","N",NA,NA,"C",NA,2023-06-11,"2023","06","11","St. Thomas",18.35087,-64.99782
"2402","Perseverance Bay","DIRECT INPUT","DG, AJH","06/22/2023","4''TP","06/11/2023","RHMA","3697-A","H",21.78,"13.3","25.9","1.3","24.6","G","Y","Y",NA,"N",NA,2023-06-11,"2023","06","11","St. Thomas",18.35087,-64.99782
"2403","Perseverance Bay","DIRECT INPUT","DG, AJH","06/22/2023","4''TP","06/11/2023","RHMA","3698-A","H",22.81,"13.6","27.6","1.4","26.2","G","Y","Y",NA,"N",NA,2023-06-11,"2023","06","11","St. Thomas",18.35087,-64.99782
"2404","Perseverance Bay","DIRECT INPUT","DG, AJH","06/22/2023","4''TP","06/11/2023","RHMA","3699-A","H",15.67,"11.5","22.8","1","21.8","G","Y","Y",NA,"N",NA,2023-06-11,"2023","06","11","St. Thomas",18.35087,-64.99782
"2405","Perseverance Bay","DIRECT INPUT","DG, AJH","06/22/2023","4''TP","06/11/2023","RHMA","3700-A","H",28.08,"14.3","30.9","1.4","29.5","G","Y","Y",NA,"N",NA,2023-06-11,"2023","06","11","St. Thomas",18.35087,-64.99782
"2406","Perseverance Bay","DIRECT INPUT","DG, AJH","06/22/2023","4''TP","06/11/2023","RHMA","3701-A","H",24.67,"13.5","26.2","1","25.2","G","Y","Y",NA,"N",NA,2023-06-11,"2023","06","11","St. Thomas",18.35087,-64.99782
"2407","Perseverance Bay","DIRECT INPUT","DG, AJH","06/22/2023","4''TP","06/11/2023","RHMA","3702-A","H",19.15,"13.2","25.9","1.2","24.7","G","Y","Y",NA,"N",NA,2023-06-11,"2023","06","11","St. Thomas",18.35087,-64.99782
"2408","Perseverance Bay","NF","NF","02/05/2023","3""TP","Jan-31","RHMA","3994","H",8.64,"11","16.5","1","15.5","G","Y","Y",NA,"N",NA,NA,NA,NA,NA,"St. Thomas",18.35087,-64.99782
"2409","Perseverance Bay","KT","KT,HH,ST,DG,NF","1/30/2024","3""TP","1/23/2024","RHMA","3923","H",18.35,"11","27.2","1.6","25.6","G","N","Y",NA,"N",NA,2024-01-23,"2024","01","23","St. Thomas",18.35087,-64.99782
"2410","Perseverance Bay","DIRECT UPLOAD","AJH","08/07/2023","3""TP","7/24/2022","RHMA","4468","H",27.67,"12.2","36.5","1.5","35","G","Y","N",NA,"N",NA,2022-07-24,"2022","07","24","St. Thomas",18.35087,-64.99782
"2411","Perseverance Bay","LG","LG, HH, ST, AND","9/20/2023","3"" TP","9/15/2023","RHMA","4590","H",19.41,"12.1","26.5","1.4","25.1","G","Y","Y",NA,"N",NA,2023-09-15,"2023","09","15","St. Thomas",18.35087,-64.99782
"2412","Perseverance Bay","LG","LG, HH, ST, AND","9/20/2023","3"" TP","9/15/2023","RHMA","4591","H",26.2,"13.1","32.8","1.8","31","G","Y","Y",NA,"N",NA,2023-09-15,"2023","09","15","St. Thomas",18.35087,-64.99782
"2413","Perseverance Bay","DIRECT INPUT","DG","06/15/2023","3""TP","06/11/2023","RHMA","E3-95","H",22.76,NA,"32",NA,"30.1","G","N",NA,NA,"C","Lily",2023-06-11,"2023","06","11","St. Thomas",18.35087,-64.99782
"2414","Perseverance Bay","AND","AND","8/21/2023","3"" TP","8/16/2023","RHMA","4553","H",20.65,"13.4","30.3","1.7","28.6","G","N","Y",NA,"N",NA,2023-08-16,"2023","08","16","St. Thomas",18.35087,-64.99782
"2415","Perseverance Bay","AND","AND","8/21/2023","3"" TP","8/16/2023","RHMA","4554","H",13.27,"11.2","28.7","1.4","27.3","G","N","Y",NA,"N",NA,2023-08-16,"2023","08","16","St. Thomas",18.35087,-64.99782
"2416","Perseverance Bay","AND","AND","8/21/2023","3"" TP","8/16/2023","RHMA","4555","H",21.53,"12.8","34.1","1.8","32.3","G","Y","Y",NA,"N",NA,2023-08-16,"2023","08","16","St. Thomas",18.35087,-64.99782
"2417","Perseverance Bay","AND","AND","8/21/2023","3"" TP","8/16/2023","RHMA","4556","H",23.4,"13.8","32.8","1.8","31","G","Y","Y",NA,"N",NA,2023-08-16,"2023","08","16","St. Thomas",18.35087,-64.99782
"2418","Perseverance Bay","AND","AND","8/21/2023","3"" TP","8/16/2023","RHMA","4557","H",26.38,"14.1","34.7","1.5","33.2","G","N","Y",NA,"N",NA,2023-08-16,"2023","08","16","St. Thomas",18.35087,-64.99782
"2419","Perseverance Bay","DIRECT INPUT","DG, AJH","06/22/2023","4''TP","06/11/2023","RHMA","3714-A","H",23.35,"13.8","29.2","1.4","27.8","G","Y","Y",NA,"N",NA,2023-06-11,"2023","06","11","St. Thomas",18.35087,-64.99782
"2420","Perseverance Bay","DIRECT INPUT","DG, AJH","06/22/2023","4''TP","06/11/2023","RHMA","3715-A","H",24.47,"13.5","28.8","1.7","27.1","G","Y","Y",NA,"N",NA,2023-06-11,"2023","06","11","St. Thomas",18.35087,-64.99782
"2421","Perseverance Bay","DIRECT INPUT","DG, AJH","06/22/2023","4''TP","06/11/2023","RHMA","3716-A","H",23.24,"12.5","29.8","1.2","28.6","G","Y","Y",NA,"N",NA,2023-06-11,"2023","06","11","St. Thomas",18.35087,-64.99782
"2422","Perseverance Bay","DIRECT INPUT","DG, AJH","06/22/2023","4''TP","06/11/2023","RHMA","3717-A","H",16.86,"11.1","29.5","1.5","28","G","Y","Y",NA,"N",NA,2023-06-11,"2023","06","11","St. Thomas",18.35087,-64.99782
"2423","Perseverance Bay","DIRECT INPUT","DG, AJH","06/22/2023","4''TP","06/11/2023","RHMA","3718-A","H",21.5,"13","28","1.4","26.6","G","Y","Y",NA,"N",NA,2023-06-11,"2023","06","11","St. Thomas",18.35087,-64.99782
"2424","Perseverance Bay","AND","AND","8/21/2023","3"" TP","8/16/2023","RHMA","4563","H",18.33,"12.3","30.8","1.5","29.3","G","N","Y",NA,"N",NA,2023-08-16,"2023","08","16","St. Thomas",18.35087,-64.99782
"2425","Perseverance Bay","AND","AND","8/21/2023","3"" TP","8/16/2023","RHMA","4564","H",22.51,"13.2","34.5","1.7","32.8","G","Y","Y",NA,"N",NA,2023-08-16,"2023","08","16","St. Thomas",18.35087,-64.99782
"2426","Perseverance Bay","AR","AR,SH,ET","9/21/2023","3"" TP","9/15/2023","RHMA","4625","H",23.6,"12.5","30.2","1.2","29","G","Y","Y",NA,"N",NA,2023-09-15,"2023","09","15","St. Thomas",18.35087,-64.99782
"2427","Perseverance Bay","AR","AR,SH,ET","9/21/2023","3"" TP","9/15/2023","RHMA","4626","H",18.4,"13.1","21.9","0.9","21","G","Y","N",NA,"N",NA,2023-09-15,"2023","09","15","St. Thomas",18.35087,-64.99782
"2428","Perseverance Bay","AR","AR,SH,ET","9/21/2023","3"" TP","9/15/2023","RHMA","4627","H",25.08,"13.3","30.3","1.2","29.1","G","Y","Y",NA,"N",NA,2023-09-15,"2023","09","15","St. Thomas",18.35087,-64.99782
"2429","Perseverance Bay","AR","AR,SH,ET","9/21/2023","3"" TP","9/15/2023","RHMA","4628","H",13.08,"11.6","20.7","1.1","19.6","G","Y","Y",NA,"N",NA,2023-09-15,"2023","09","15","St. Thomas",18.35087,-64.99782
"2430","Perseverance Bay","DIRECT INPUT","DG, AJH","06/23/2023","4''TP","06/11/2023","RHMA","4001","H",26.78,"13.2","32.3","1.5","30.8","G","Y","Y",NA,"N",NA,2023-06-11,"2023","06","11","St. Thomas",18.35087,-64.99782
"2431","Perseverance Bay","DIRECT INPUT","DG, AJH","06/23/2023","4''TP","06/11/2023","RHMA","4002","H",22,"12.9","29.3","1.3","28","G","Y","Y",NA,"N",NA,2023-06-11,"2023","06","11","St. Thomas",18.35087,-64.99782
"2432","Perseverance Bay","DG","HH, MF, ST, DG","1/29/2024","3""TP","1/23/2024","RHMA","3906","H",8,"9.5","18.6","1.3","17.3","G","Y","Y",NA,"N",NA,2024-01-23,"2024","01","23","St. Thomas",18.35087,-64.99782
"2433","Perseverance Bay","DG","HH, MF, ST, DG","1/29/2024","3""TP","1/23/2024","RHMA","3907","H",6.4,"8.5","16.1","1.1","15","G","N","Y",NA,"N",NA,2024-01-23,"2024","01","23","St. Thomas",18.35087,-64.99782
"2434","Perseverance Bay","DG","HH, MF, ST, DG","1/29/2024","3""TP","1/23/2024","RHMA","3908","H",10.31,"12","16.2","1.3","14.9","G","N","N",NA,"N",NA,2024-01-23,"2024","01","23","St. Thomas",18.35087,-64.99782
"2435","Perseverance Bay","KT","KT,SH","9/22/2023","3'' TP","9/15/2023","RHMA","4676","H",18.49,"13.4","24.5","1.5","23","G","N","Y",NA,"N",NA,2023-09-15,"2023","09","15","St. Thomas",18.35087,-64.99782
"2436","Perseverance Bay","KT","KT,SH","9/22/2023","3'' TP","9/15/2023","RHMA","4677","H",20.62,"13.1","27.9","1.3","26.6","G","N","N",NA,"N",NA,2023-09-15,"2023","09","15","St. Thomas",18.35087,-64.99782
"2437","Perseverance Bay","KT","KT,SH","9/22/2023","3'' TP","9/15/2023","RHMA","4678","H",14.91,"13.6","20.3","1.3","19","G","N","Y",NA,"N",NA,2023-09-15,"2023","09","15","St. Thomas",18.35087,-64.99782
"2438","Perseverance Bay","KT","KT,SH","9/22/2023","3'' TP","9/15/2023","RHMA","4679","H",12.77,"12.6","18.2","1","17.2","G","Y","Y",NA,"N",NA,2023-09-15,"2023","09","15","St. Thomas",18.35087,-64.99782
"2439","Perseverance Bay","DIRECT INPUT","DG","06/15/2023","3""TP","06/11/2023","RHMA","E3-82","H",31.1,NA,"39",NA,"37","G","Y",NA,NA,"C",NA,2023-06-11,"2023","06","11","St. Thomas",18.35087,-64.99782
"2440","Perseverance Bay","DIRECT INPUT","DG","06/15/2023","3""TP","06/11/2023","RHMA","E3-83","H",29.25,NA,"34",NA,"33","G","N",NA,NA,"C",NA,2023-06-11,"2023","06","11","St. Thomas",18.35087,-64.99782
"2441","Perseverance Bay","DIRECT INPUT","DG, AJH","06/22/2023","4''TP","06/11/2023","RHMA","3696-A","H",17.05,"12.3","25.6","1.2","24.4","G","Y","Y",NA,"N",NA,2023-06-11,"2023","06","11","St. Thomas",18.35087,-64.99782
"2442","Perseverance Bay","AR","AR,SH,ET","9/21/2023","3"" TP","9/15/2023","RHMA","4642","H",23.32,"13.4","26.3","1","25.3","G","Y","Y",NA,"N",NA,2023-09-15,"2023","09","15","St. Thomas",18.35087,-64.99782
"2443","Perseverance Bay","AR","AR,SH,ET","9/21/2023","3"" TP","9/15/2023","RHMA","4643","H",15.31,"12","21.4","0.9","20.5","G","Y","N",NA,"N",NA,2023-09-15,"2023","09","15","St. Thomas",18.35087,-64.99782
"2444","Perseverance Bay","AR","AR,SH,ET","9/21/2023","3"" TP","9/15/2023","RHMA","4644","H",21.18,"12.8","27.7","1.2","26.5","G","Y","Y",NA,"N",NA,2023-09-15,"2023","09","15","St. Thomas",18.35087,-64.99782
"2445","Perseverance Bay","DIRECT INPUT","DG","06/15/2023","3""TP","06/11/2023","RHMA","E3-50","H",10,NA,"18",NA,"17","G","Y",NA,NA,"C","Elizabeth",2023-06-11,"2023","06","11","St. Thomas",18.35087,-64.99782
"2446","Perseverance Bay","DIRECT INPUT","DG","06/15/2023","3""TP","06/11/2023","RHMA","E3-51","H",34.84,NA,"32.8",NA,"31","G","Y",NA,NA,"C",NA,2023-06-11,"2023","06","11","St. Thomas",18.35087,-64.99782
"2447","Perseverance Bay","DIRECT INPUT","DG","06/15/2023","3""TP","06/11/2023","RHMA","E3-52","H",22.39,NA,"34",NA,"33","G","Y",NA,NA,"C",NA,2023-06-11,"2023","06","11","St. Thomas",18.35087,-64.99782
"2448","Perseverance Bay","DIRECT INPUT","DG","06/15/2023","3""TP","06/11/2023","RHMA","E3-53","H",22.62,NA,"36",NA,"34","G","Y",NA,NA,"C",NA,2023-06-11,"2023","06","11","St. Thomas",18.35087,-64.99782
"2449","Perseverance Bay","DIRECT INPUT","DG, AJH","06/23/2023","4''TP","06/11/2023","RHMA","4020","H",24.3,"13.9","29.5","1.5","28","G","Y","Y",NA,"N",NA,2023-06-11,"2023","06","11","St. Thomas",18.35087,-64.99782
"2450","Perseverance Bay","DIRECT INPUT","DG, AJH","06/23/2023","4''TP","06/11/2023","RHMA","4021","H",24.04,"13.4","30.1","1.7","28.4","G","Y","Y",NA,"N",NA,2023-06-11,"2023","06","11","St. Thomas",18.35087,-64.99782
"2451","Perseverance Bay","DIRECT INPUT","DG, AJH","06/23/2023","4''TP","06/11/2023","RHMA","4022","H",20.74,"12.5","26.9","1.5","25.4","G","Y","Y",NA,"N",NA,2023-06-11,"2023","06","11","St. Thomas",18.35087,-64.99782
"2452","Perseverance Bay","DIRECT INPUT","DG, AJH","06/23/2023","4''TP","06/11/2023","RHMA","4023","H",23.52,"12.8","28.1","1.2","26.9","G","Y","Y",NA,"N",NA,2023-06-11,"2023","06","11","St. Thomas",18.35087,-64.99782
"2453","Perseverance Bay","DIRECT INPUT","DG, AJH","06/23/2023","4''TP","06/11/2023","RHMA","4024","H",19.57,"12.1","27.1","1.5","25.6","G","Y","Y",NA,"N",NA,2023-06-11,"2023","06","11","St. Thomas",18.35087,-64.99782
"2454","Perseverance Bay","DIRECT INPUT","DG, AJH","06/23/2023","4''TP","06/11/2023","RHMA","4025","H",22.87,"12.3","32.7","1.7","31","G","Y","Y",NA,"N",NA,2023-06-11,"2023","06","11","St. Thomas",18.35087,-64.99782
"2455","Perseverance Bay","DIRECT INPUT","DG, AJH","06/23/2023","4''TP","06/11/2023","RHMA","4026","H",23.07,"10.4","37.5","2","35.5","G","Y","Y",NA,"N",NA,2023-06-11,"2023","06","11","St. Thomas",18.35087,-64.99782
"2456","Perseverance Bay","DIRECT INPUT","DG, AJH","06/23/2023","4''TP","06/11/2023","RHMA","4027","H",18.34,"11.7","28.6","1.3","27.3","G","Y","Y",NA,"N",NA,2023-06-11,"2023","06","11","St. Thomas",18.35087,-64.99782
"2457","Perseverance Bay","DIRECT INPUT","DG, AJH","06/23/2023","4''TP","06/11/2023","RHMA","4028","H",23.25,"13.7","22.7","1","21.7","G","Y","N",NA,"N",NA,2023-06-11,"2023","06","11","St. Thomas",18.35087,-64.99782
"2458","Perseverance Bay","DIRECT INPUT","DG, AJH","06/23/2023","4''TP","06/11/2023","RHMA","4029","H",24.38,"12.6","31.4","1.2","30.2","G","Y","N",NA,"N",NA,2023-06-11,"2023","06","11","St. Thomas",18.35087,-64.99782
"2459","Perseverance Bay","DIRECT INPUT","DG, AJH","06/23/2023","4''TP","06/11/2023","RHMA","4030","H",23,"12.3","31.2","1","30.2","G","Y","N",NA,"N",NA,2023-06-11,"2023","06","11","St. Thomas",18.35087,-64.99782
"2460","Perseverance Bay","DIRECT INPUT","DG, AJH","06/23/2023","4''TP","06/11/2023","RHMA","4031","H",22.3,"12.5","30","1.4","28.6","G","Y","N",NA,"N",NA,2023-06-11,"2023","06","11","St. Thomas",18.35087,-64.99782
"2461","Perseverance Bay","DIRECT INPUT","DG, AJH","06/23/2023","4''TP","06/11/2023","RHMA","4032","H",24.87,"12.9","30.4","1.4","29","G","Y","N",NA,"N",NA,2023-06-11,"2023","06","11","St. Thomas",18.35087,-64.99782
